key	query	seed_ortholog	evalue	score	eggNOG_OGs	description	preferred_name	GOs	KEGG_ko	KEGG_pathway	brite	PFAMs
1234	MBB2175886.1	272568.GDI2982	3.56e-133	386.0	COG3741@1|root,COG3741@2|Bacteria,1MY4D@1224|Proteobacteria,2TUPZ@28211|Alphaproteobacteria,2JQS5@204441|Rhodospirillales	N-formylglutamate amidohydrolase	-	-	ko:K01458	ko00340,ko00630,map00340,map00630	ko00000,ko00001,ko01000	FGase
1234	MBB2175887.1	272568.GDI2983	3.5e-62	192.0	COG3753@1|root,COG3753@2|Bacteria,1N7FF@1224|Proteobacteria,2UFFP@28211|Alphaproteobacteria	Bacterial protein of unknown function (DUF937)	-	-	-	-	-	DUF937
1234	MBB2175888.1	272568.GDI2984	0.0	1031.0	2CCBD@1|root,2Z7PF@2|Bacteria,1R6DG@1224|Proteobacteria,2TTPF@28211|Alphaproteobacteria,2JP88@204441|Rhodospirillales	-	-	-	-	-	-	-
1234	MBB2175889.1	272568.GDI2997	9.63e-181	509.0	COG3660@1|root,COG3660@2|Bacteria,1R70U@1224|Proteobacteria,2TQWV@28211|Alphaproteobacteria,2JQEW@204441|Rhodospirillales	Mitochondrial fission ELM1	-	-	ko:K07276	-	ko00000	Mito_fiss_Elm1
1234	MBB2175890.1	272568.GDI2998	1.68e-193	546.0	COG0513@1|root,COG0513@2|Bacteria,1MU49@1224|Proteobacteria,2TR6Q@28211|Alphaproteobacteria,2JQDT@204441|Rhodospirillales	Belongs to the DEAD box helicase family	rhlE	-	ko:K11927	ko03018,map03018	ko00000,ko00001,ko01000,ko03019	DEAD,Helicase_C
1234	MBB2175891.1	272568.GDI2999	8.16e-192	539.0	COG2988@1|root,COG2988@2|Bacteria,1QW6K@1224|Proteobacteria,2TWQ0@28211|Alphaproteobacteria,2JYWE@204441|Rhodospirillales	Succinylglutamate desuccinylase / Aspartoacylase family	-	-	-	-	-	AstE_AspA
1234	MBB2175892.1	272568.GDI3012	6.12e-284	779.0	COG0112@1|root,COG0112@2|Bacteria,1MUIS@1224|Proteobacteria,2TQKT@28211|Alphaproteobacteria,2JQ46@204441|Rhodospirillales	Catalyzes the reversible interconversion of serine and glycine with tetrahydrofolate (THF) serving as the one-carbon carrier. This reaction serves as the major source of one-carbon groups required for the biosynthesis of purines, thymidylate, methionine, and other important biomolecules. Also exhibits THF- independent aldolase activity toward beta-hydroxyamino acids, producing glycine and aldehydes, via a retro-aldol mechanism	glyA	-	ko:K00600	ko00260,ko00460,ko00630,ko00670,ko00680,ko01100,ko01110,ko01120,ko01130,ko01200,ko01230,ko01523,map00260,map00460,map00630,map00670,map00680,map01100,map01110,map01120,map01130,map01200,map01230,map01523	ko00000,ko00001,ko00002,ko01000	SHMT
1234	MBB2175893.1	272568.GDI3013	4.83e-302	830.0	COG0531@1|root,COG0531@2|Bacteria,1MXNJ@1224|Proteobacteria,2TRNX@28211|Alphaproteobacteria,2JUR5@204441|Rhodospirillales	C-terminus of AA_permease	-	-	ko:K03294	-	ko00000	AA_permease_2,AA_permease_C
1234	MBB2175894.1	272568.GDI3014	9.12e-217	600.0	COG0113@1|root,COG0113@2|Bacteria,1MWMW@1224|Proteobacteria,2TS3F@28211|Alphaproteobacteria,2JQFM@204441|Rhodospirillales	Belongs to the ALAD family	hemB	-	ko:K01698	ko00860,ko01100,ko01110,ko01120,map00860,map01100,map01110,map01120	ko00000,ko00001,ko00002,ko01000,ko04147	ALAD
1234	MBB2175895.1	272568.GDI3015	1.78e-169	475.0	COG2935@1|root,COG2935@2|Bacteria,1MW62@1224|Proteobacteria,2TQY8@28211|Alphaproteobacteria,2JQF1@204441|Rhodospirillales	May conjugate Arg from its aminoacyl-tRNA to the N- termini of proteins containing an N-terminal aspartate or glutamate	ate	-	ko:K21420	-	ko00000,ko01000	ATE_C,ATE_N
1234	MBB2175896.1	272568.GDI3016	0.0	1317.0	COG0188@1|root,COG0188@2|Bacteria,1MURI@1224|Proteobacteria,2TQRQ@28211|Alphaproteobacteria,2JQSC@204441|Rhodospirillales	Topoisomerase IV is essential for chromosome segregation. It relaxes supercoiled DNA. Performs the decatenation events required during the replication of a circular DNA molecule	parC	-	ko:K02621	-	ko00000,ko01000,ko02048,ko03032,ko03036	DNA_gyraseA_C,DNA_topoisoIV
1234	MBB2175897.1	272568.GDI3017	4.37e-149	423.0	COG1381@1|root,COG1381@2|Bacteria,1MVEJ@1224|Proteobacteria,2TTYW@28211|Alphaproteobacteria,2JRN6@204441|Rhodospirillales	Involved in DNA repair and RecF pathway recombination	recO	-	ko:K03584	ko03440,map03440	ko00000,ko00001,ko03400	RecO_C,RecO_N
1234	MBB2175898.1	272568.GDI3018	9.64e-184	514.0	COG0264@1|root,COG0264@2|Bacteria,1MUS2@1224|Proteobacteria,2TQM0@28211|Alphaproteobacteria,2JQWM@204441|Rhodospirillales	Associates with the EF-Tu.GDP complex and induces the exchange of GDP to GTP. It remains bound to the aminoacyl-tRNA.EF- Tu.GTP complex up to the GTP hydrolysis stage on the ribosome	tsf	-	ko:K02357	-	ko00000,ko03012,ko03029	EF_TS
1234	MBB2175899.1	1296990.H845_1728	3.05e-166	467.0	COG0052@1|root,COG0052@2|Bacteria,1MU33@1224|Proteobacteria,2TRXE@28211|Alphaproteobacteria,2JQ5J@204441|Rhodospirillales	Belongs to the universal ribosomal protein uS2 family	rpsB	-	ko:K02967	ko03010,map03010	br01610,ko00000,ko00001,ko00002,ko03011	Ribosomal_S2
1234	MBB2175900.1	272568.GDI3021	0.0	2039.0	COG0587@1|root,COG0587@2|Bacteria,1MUIF@1224|Proteobacteria,2TSCN@28211|Alphaproteobacteria,2JP92@204441|Rhodospirillales	DNA polymerase	dnaE	-	ko:K02337	ko00230,ko00240,ko01100,ko03030,ko03430,ko03440,map00230,map00240,map01100,map03030,map03430,map03440	ko00000,ko00001,ko00002,ko01000,ko03032,ko03400	DNA_pol3_alpha,HHH_6,PHP,tRNA_anti-codon
1234	MBB2175901.1	272568.GDI3022	7.13e-132	378.0	COG1136@1|root,COG1136@2|Bacteria,1MVSQ@1224|Proteobacteria,2TSBE@28211|Alphaproteobacteria,2JQ7T@204441|Rhodospirillales	Part of the ABC transporter complex LolCDE involved in the translocation of lipoproteins, in an ATP-dependent manner	lolD	-	ko:K09810	ko02010,map02010	ko00000,ko00001,ko00002,ko01000,ko02000	ABC_tran
1234	MBB2175902.1	272568.GDI3023	9.18e-257	709.0	COG4591@1|root,COG4591@2|Bacteria,1MVV7@1224|Proteobacteria,2TRBX@28211|Alphaproteobacteria,2JPQR@204441|Rhodospirillales	COG4591 ABC-type transport system, involved in lipoprotein release, permease component	lolC	-	ko:K09808	ko02010,map02010	ko00000,ko00001,ko00002,ko02000	FtsX,MacB_PCD
1234	MBB2175903.1	272568.GDI3024	2.55e-307	840.0	COG0442@1|root,COG0442@2|Bacteria,1MU7E@1224|Proteobacteria,2TQQ4@28211|Alphaproteobacteria,2JQ5E@204441|Rhodospirillales	Catalyzes the attachment of proline to tRNA(Pro) in a two-step reaction proline is first activated by ATP to form Pro- AMP and then transferred to the acceptor end of tRNA(Pro)	proS	-	ko:K01881	ko00970,map00970	ko00000,ko00001,ko00002,ko01000,ko01007,ko03016	HGTP_anticodon,tRNA-synt_2b
1234	MBB2175904.1	272568.GDI3025	0.0	1023.0	COG0595@1|root,COG0595@2|Bacteria,1MUGV@1224|Proteobacteria,2TQTR@28211|Alphaproteobacteria,2JPH8@204441|Rhodospirillales	hydrolase of the metallo-beta-lactamase superfamily	-	-	ko:K12574	ko03018,map03018	ko00000,ko00001,ko01000,ko03019	Lactamase_B,Lactamase_B_2,RMMBL
1234	MBB2175905.1	272568.GDI3027	8.37e-131	377.0	COG0340@1|root,COG0340@2|Bacteria,1MWCC@1224|Proteobacteria,2TS82@28211|Alphaproteobacteria,2JS3Q@204441|Rhodospirillales	Biotin/lipoate A/B protein ligase family	birA	-	ko:K03524	ko00780,ko01100,map00780,map01100	ko00000,ko00001,ko01000,ko03000	BPL_C,BPL_LplA_LipB,BPL_LplA_LipB_2
1234	MBB2175906.1	272568.GDI3028	3.81e-288	793.0	COG1007@1|root,COG1007@2|Bacteria,1MV56@1224|Proteobacteria,2TQMX@28211|Alphaproteobacteria,2JQ1V@204441|Rhodospirillales	NDH-1 shuttles electrons from NADH, via FMN and iron- sulfur (Fe-S) centers, to quinones in the respiratory chain. The immediate electron acceptor for the enzyme in this species is believed to be ubiquinone. Couples the redox reaction to proton translocation (for every two electrons transferred, four hydrogen ions are translocated across the cytoplasmic membrane), and thus conserves the redox energy in a proton gradient	nuoN	-	ko:K00343	ko00190,ko01100,map00190,map01100	ko00000,ko00001,ko00002,ko01000	Proton_antipo_M
1234	MBB2175907.1	272568.GDI3029	0.0	1128.0	COG1009@1|root,COG1009@2|Bacteria,1MW2M@1224|Proteobacteria,2TQSS@28211|Alphaproteobacteria,2JPUQ@204441|Rhodospirillales	COG1009 NADH ubiquinone oxidoreductase subunit 5 (chain L) Multisubunit Na H antiporter, MnhA subunit	nuoL	-	ko:K00341	ko00190,ko01100,map00190,map01100	ko00000,ko00001,ko00002,ko01000	NADH5_C,Proton_antipo_M,Proton_antipo_N
1234	MBB2175908.1	272568.GDI3030	1.4e-60	187.0	COG0713@1|root,COG0713@2|Bacteria,1RH0S@1224|Proteobacteria,2U93P@28211|Alphaproteobacteria,2JSRV@204441|Rhodospirillales	NDH-1 shuttles electrons from NADH, via FMN and iron- sulfur (Fe-S) centers, to quinones in the respiratory chain. The immediate electron acceptor for the enzyme in this species is believed to be ubiquinone. Couples the redox reaction to proton translocation (for every two electrons transferred, four hydrogen ions are translocated across the cytoplasmic membrane), and thus conserves the redox energy in a proton gradient	nuoK	-	ko:K00340	ko00190,ko01100,map00190,map01100	ko00000,ko00001,ko00002,ko01000	Oxidored_q2
1234	MBB2175909.1	272568.GDI3031	1.16e-139	399.0	COG0839@1|root,COG0839@2|Bacteria,1MWJV@1224|Proteobacteria,2TRB2@28211|Alphaproteobacteria,2JRQI@204441|Rhodospirillales	Belongs to the complex I subunit 6 family	nuoJ	-	ko:K00339	ko00190,ko01100,map00190,map01100	ko00000,ko00001,ko00002,ko01000	Oxidored_q3
1234	MBB2175910.1	272568.GDI3032	1.43e-86	257.0	COG1143@1|root,COG1143@2|Bacteria,1MV90@1224|Proteobacteria,2TRFE@28211|Alphaproteobacteria,2JPHK@204441|Rhodospirillales	NDH-1 shuttles electrons from NADH, via FMN and iron- sulfur (Fe-S) centers, to quinones in the respiratory chain. The immediate electron acceptor for the enzyme in this species is believed to be ubiquinone. Couples the redox reaction to proton translocation (for every two electrons transferred, four hydrogen ions are translocated across the cytoplasmic membrane), and thus conserves the redox energy in a proton gradient	nuoI	-	ko:K00338	ko00190,ko01100,map00190,map01100	ko00000,ko00001,ko00002,ko01000	Fer4
1234	MBB2175911.1	272568.GDI3033	3.18e-238	655.0	COG1005@1|root,COG1005@2|Bacteria,1MU2R@1224|Proteobacteria,2TS09@28211|Alphaproteobacteria,2JPWU@204441|Rhodospirillales	NDH-1 shuttles electrons from NADH, via FMN and iron- sulfur (Fe-S) centers, to quinones in the respiratory chain. The immediate electron acceptor for the enzyme in this species is believed to be ubiquinone. Couples the redox reaction to proton translocation (for every two electrons transferred, four hydrogen ions are translocated across the cytoplasmic membrane), and thus conserves the redox energy in a proton gradient. This subunit may bind ubiquinone	nuoH	-	ko:K00337	ko00190,ko01100,map00190,map01100	ko00000,ko00001,ko00002,ko01000	NADHdh
1234	MBB2175912.1	272568.GDI3034	0.0	1258.0	COG1034@1|root,COG1034@2|Bacteria,1P8MN@1224|Proteobacteria,2TS97@28211|Alphaproteobacteria,2JPBH@204441|Rhodospirillales	COG1034 NADH dehydrogenase NADH ubiquinone oxidoreductase 75 kD subunit (chain G)	nuoG	-	ko:K00336	ko00190,ko01100,map00190,map01100	ko00000,ko00001,ko00002,ko01000	Fer2_4,Molybdopterin,NADH-G_4Fe-4S_3,NADH_dhqG_C
1234	MBB2175913.1	272568.GDI3035	9.43e-317	863.0	COG1894@1|root,COG1894@2|Bacteria,1MV8F@1224|Proteobacteria,2TRAH@28211|Alphaproteobacteria,2JR3A@204441|Rhodospirillales	NDH-1 shuttles electrons from NADH, via FMN and iron- sulfur (Fe-S) centers, to quinones in the respiratory chain	nuoF	-	ko:K00335	ko00190,ko01100,map00190,map01100	ko00000,ko00001,ko00002,ko01000	Complex1_51K,NADH_4Fe-4S,SLBB
1234	MBB2175914.1	272568.GDI3036	2.52e-138	392.0	COG1905@1|root,COG1905@2|Bacteria,1MWS2@1224|Proteobacteria,2TSEJ@28211|Alphaproteobacteria,2JRYM@204441|Rhodospirillales	COG1905 NADH ubiquinone oxidoreductase 24 kD subunit	nuoE	-	ko:K00334,ko:K03943	ko00190,ko01100,ko04714,ko04723,ko04932,ko05010,ko05012,ko05016,map00190,map01100,map04714,map04723,map04932,map05010,map05012,map05016	ko00000,ko00001,ko00002,ko01000	2Fe-2S_thioredx
1234	MBB2175915.1	272568.GDI3037	1.62e-301	822.0	COG0649@1|root,COG0649@2|Bacteria,1MVIN@1224|Proteobacteria,2TQZ0@28211|Alphaproteobacteria,2JPC7@204441|Rhodospirillales	NDH-1 shuttles electrons from NADH, via FMN and iron- sulfur (Fe-S) centers, to quinones in the respiratory chain. The immediate electron acceptor for the enzyme in this species is believed to be ubiquinone. Couples the redox reaction to proton translocation (for every two electrons transferred, four hydrogen ions are translocated across the cytoplasmic membrane), and thus conserves the redox energy in a proton gradient	nuoD	-	ko:K00333	ko00190,ko01100,map00190,map01100	ko00000,ko00001,ko00002,ko01000	Complex1_49kDa
1234	MBB2175916.1	272568.GDI3038	3.66e-139	394.0	COG0852@1|root,COG0852@2|Bacteria,1MX4B@1224|Proteobacteria,2TSMT@28211|Alphaproteobacteria,2JR93@204441|Rhodospirillales	NDH-1 shuttles electrons from NADH, via FMN and iron- sulfur (Fe-S) centers, to quinones in the respiratory chain. The immediate electron acceptor for the enzyme in this species is believed to be ubiquinone. Couples the redox reaction to proton translocation (for every two electrons transferred, four hydrogen ions are translocated across the cytoplasmic membrane), and thus conserves the redox energy in a proton gradient	nuoC	-	ko:K00332	ko00190,ko01100,map00190,map01100	ko00000,ko00001,ko00002,ko01000	Complex1_30kDa
1234	MBB2175917.1	272568.GDI3039	1.6e-138	391.0	COG0377@1|root,COG0377@2|Bacteria,1MUI2@1224|Proteobacteria,2TQK3@28211|Alphaproteobacteria,2JQ20@204441|Rhodospirillales	NDH-1 shuttles electrons from NADH, via FMN and iron- sulfur (Fe-S) centers, to quinones in the respiratory chain. The immediate electron acceptor for the enzyme in this species is believed to be ubiquinone. Couples the redox reaction to proton translocation (for every two electrons transferred, four hydrogen ions are translocated across the cytoplasmic membrane), and thus conserves the redox energy in a proton gradient	nuoB	-	ko:K00331	ko00190,ko01100,map00190,map01100	ko00000,ko00001,ko00002,ko01000	Oxidored_q6
1234	MBB2175918.1	272568.GDI3040	1.87e-76	228.0	COG0838@1|root,COG0838@2|Bacteria,1RGUT@1224|Proteobacteria,2U72Q@28211|Alphaproteobacteria,2JSW8@204441|Rhodospirillales	NDH-1 shuttles electrons from NADH, via FMN and iron- sulfur (Fe-S) centers, to quinones in the respiratory chain. The immediate electron acceptor for the enzyme in this species is believed to be ubiquinone. Couples the redox reaction to proton translocation (for every two electrons transferred, four hydrogen ions are translocated across the cytoplasmic membrane), and thus conserves the redox energy in a proton gradient	nuoA	-	ko:K00330	ko00190,ko01100,map00190,map01100	ko00000,ko00001,ko00002,ko01000	Oxidored_q4
1234	MBB2175919.1	272568.GDI3041	1.76e-57	178.0	COG0776@1|root,COG0776@2|Bacteria,1MZ5B@1224|Proteobacteria,2UC5G@28211|Alphaproteobacteria,2JTCN@204441|Rhodospirillales	Histone-like DNA-binding protein which is capable of wrapping DNA to stabilize it, and thus to prevent its denaturation under extreme environmental conditions	-	-	ko:K03530	-	ko00000,ko03032,ko03036,ko03400	Bac_DNA_binding
1234	MBB2175920.1	272568.GDI3042	0.0	1456.0	COG0466@1|root,COG0466@2|Bacteria,1MUV2@1224|Proteobacteria,2TR4E@28211|Alphaproteobacteria,2JQC9@204441|Rhodospirillales	ATP-dependent serine protease that mediates the selective degradation of mutant and abnormal proteins as well as certain short-lived regulatory proteins. Required for cellular homeostasis and for survival from DNA damage and developmental changes induced by stress. Degrades polypeptides processively to yield small peptide fragments that are 5 to 10 amino acids long. Binds to DNA in a double-stranded, site-specific manner	lon	-	ko:K01338	ko04112,map04112	ko00000,ko00001,ko01000,ko01002	AAA,LON_substr_bdg,Lon_C
1234	MBB2175921.1	272568.GDI3043	1.24e-295	807.0	COG1219@1|root,COG1219@2|Bacteria,1MVQK@1224|Proteobacteria,2TS3R@28211|Alphaproteobacteria,2JQFG@204441|Rhodospirillales	ATP-dependent specificity component of the Clp protease. It directs the protease to specific substrates. Can perform chaperone functions in the absence of ClpP	clpX	-	ko:K03544	ko04112,map04112	ko00000,ko00001,ko03110	AAA_2,ClpB_D2-small,zf-C4_ClpX
1234	MBB2175922.1	272568.GDI3044	2.05e-140	397.0	COG0740@1|root,COG0740@2|Bacteria,1MV46@1224|Proteobacteria,2TR5M@28211|Alphaproteobacteria,2JPC3@204441|Rhodospirillales	Cleaves peptides in various proteins in a process that requires ATP hydrolysis. Has a chymotrypsin-like activity. Plays a major role in the degradation of misfolded proteins	clpP	-	ko:K01358	ko04112,ko04212,map04112,map04212	ko00000,ko00001,ko01000,ko01002	CLP_protease
1234	MBB2175923.1	272568.GDI3045	5.15e-278	765.0	COG0544@1|root,COG0544@2|Bacteria,1MUJP@1224|Proteobacteria,2TS8W@28211|Alphaproteobacteria,2JR1Y@204441|Rhodospirillales	Involved in protein export. Acts as a chaperone by maintaining the newly synthesized protein in an open conformation. Functions as a peptidyl-prolyl cis-trans isomerase	tig	GO:0005575,GO:0005622,GO:0005623,GO:0005737,GO:0044424,GO:0044464	ko:K03545	-	ko00000	FKBP_C,Trigger_C,Trigger_N
1234	MBB2175924.1	272568.GDI3046	2.7e-269	746.0	COG0062@1|root,COG0063@1|root,COG0062@2|Bacteria,COG0063@2|Bacteria,1MU1Q@1224|Proteobacteria,2TT58@28211|Alphaproteobacteria,2JR4K@204441|Rhodospirillales	Bifunctional enzyme that catalyzes the epimerization of the S- and R-forms of NAD(P)HX and the dehydration of the S-form of NAD(P)HX at the expense of ADP, which is converted to AMP. This allows the repair of both epimers of NAD(P)HX, a damaged form of NAD(P)H that is a result of enzymatic or heat-dependent hydration	nnrD	-	-	-	-	Carb_kinase,YjeF_N
1234	MBB2175925.1	272568.GDI3047	3.05e-89	263.0	COG5615@1|root,COG5615@2|Bacteria,1N3BK@1224|Proteobacteria,2UV0A@28211|Alphaproteobacteria,2JXRC@204441|Rhodospirillales	Copper resistance protein D	-	-	-	-	-	CopD
1234	MBB2175926.1	272568.GDI3048	0.0	1146.0	COG3387@1|root,COG3387@2|Bacteria,1MV08@1224|Proteobacteria,2TRMQ@28211|Alphaproteobacteria,2JQKZ@204441|Rhodospirillales	Glycosyl hydrolases family 15	-	-	ko:K01178	ko00500,ko01100,map00500,map01100	ko00000,ko00001,ko01000	Glyco_hydro_15
1234	MBB2175927.1	634177.GLX_08850	7.38e-242	681.0	COG0513@1|root,COG0513@2|Bacteria,1MU49@1224|Proteobacteria,2TR6Q@28211|Alphaproteobacteria,2JPGM@204441|Rhodospirillales	Belongs to the DEAD box helicase family	-	-	-	-	-	DEAD,Helicase_C
1234	MBB2175928.1	272568.GDI3050	2.09e-233	650.0	COG2265@1|root,COG2265@2|Bacteria,1MV3A@1224|Proteobacteria,2TR40@28211|Alphaproteobacteria,2JQQH@204441|Rhodospirillales	Belongs to the class I-like SAM-binding methyltransferase superfamily. RNA M5U methyltransferase family	rumA	-	ko:K03215	-	ko00000,ko01000,ko03009	TRAM,tRNA_U5-meth_tr
1234	MBB2175929.1	272568.GDI3053	2.4e-70	213.0	COG0316@1|root,COG0316@2|Bacteria,1RH6T@1224|Proteobacteria,2UBWJ@28211|Alphaproteobacteria,2JSZV@204441|Rhodospirillales	Belongs to the HesB IscA family	iscA	-	ko:K13628	-	ko00000,ko03016	Fe-S_biosyn
1234	MBB2175930.1	272568.GDI3054	4.95e-67	207.0	COG2151@1|root,COG2151@2|Bacteria,1MZ9Y@1224|Proteobacteria,2U72U@28211|Alphaproteobacteria,2JT8V@204441|Rhodospirillales	Iron-sulfur cluster assembly protein	sufT	-	-	-	-	FeS_assembly_P
1234	MBB2175931.1	272568.GDI3055	3.09e-62	194.0	COG0822@1|root,COG0822@2|Bacteria,1Q35V@1224|Proteobacteria,2VA5R@28211|Alphaproteobacteria,2JU10@204441|Rhodospirillales	NifU-like N terminal domain	-	-	ko:K04488	-	ko00000	NifU_N
1234	MBB2175932.1	272568.GDI3056	4.66e-264	727.0	COG0520@1|root,COG0520@2|Bacteria,1MUPD@1224|Proteobacteria,2TRNY@28211|Alphaproteobacteria,2JPRG@204441|Rhodospirillales	Catalyzes the removal of elemental sulfur and selenium atoms from L-cysteine, L-cystine, L-selenocysteine, and L- selenocystine to produce L-alanine	sufS	-	ko:K11717	ko00450,ko01100,map00450,map01100	ko00000,ko00001,ko01000	Aminotran_5
1234	MBB2175933.1	272568.GDI3057	6.68e-220	616.0	COG0719@1|root,COG0719@2|Bacteria,1MVK0@1224|Proteobacteria,2TTK9@28211|Alphaproteobacteria,2JPFV@204441|Rhodospirillales	Uncharacterized protein family (UPF0051)	sufD	-	ko:K09015	-	ko00000	UPF0051
1234	MBB2175934.1	1432055.GLUCORHAEAF1_05925	1.41e-167	470.0	COG0396@1|root,COG0396@2|Bacteria,1MUGK@1224|Proteobacteria,2TS8T@28211|Alphaproteobacteria,2JQJW@204441|Rhodospirillales	ABC transporter	sufC	-	ko:K09013	-	ko00000,ko02000	ABC_tran
1234	MBB2175935.1	272568.GDI3059	0.0	955.0	COG0719@1|root,COG0719@2|Bacteria,1MVKY@1224|Proteobacteria,2TRU6@28211|Alphaproteobacteria,2JPXA@204441|Rhodospirillales	Uncharacterized protein family (UPF0051)	sufB	-	ko:K09014	-	ko00000	UPF0051
1234	MBB2175936.1	272568.GDI3060	8.19e-79	238.0	COG1959@1|root,COG1959@2|Bacteria,1N0E2@1224|Proteobacteria,2U9Z9@28211|Alphaproteobacteria,2JT9W@204441|Rhodospirillales	Transcriptional regulator	-	-	-	-	-	Rrf2
1234	MBB2175937.1	272568.GDI3061	5.06e-250	697.0	COG2733@1|root,COG2733@2|Bacteria,1MX3G@1224|Proteobacteria,2U15J@28211|Alphaproteobacteria,2JS5X@204441|Rhodospirillales	Protein of unknown function (DUF445)	-	-	-	-	-	DUF445
1234	MBB2175938.1	272568.GDI3062	0.0	1563.0	COG2352@1|root,COG2352@2|Bacteria,1PUWX@1224|Proteobacteria,2V6ES@28211|Alphaproteobacteria,2JQ3G@204441|Rhodospirillales	Phosphoenolpyruvate carboxylase	-	-	ko:K01595	ko00620,ko00680,ko00710,ko00720,ko01100,ko01120,ko01200,map00620,map00680,map00710,map00720,map01100,map01120,map01200	ko00000,ko00001,ko00002,ko01000	PEPcase
1234	MBB2175939.1	272568.GDI3063	3.01e-124	361.0	COG0491@1|root,COG0491@2|Bacteria,1MVC3@1224|Proteobacteria,2TUAZ@28211|Alphaproteobacteria	COG0491 Zn-dependent hydrolases, including glyoxylases	-	-	-	-	-	Lactamase_B
1234	MBB2175940.1	272568.GDI3064	0.0	936.0	COG2939@1|root,COG2939@2|Bacteria,1MW05@1224|Proteobacteria,2TS7R@28211|Alphaproteobacteria,2JVR3@204441|Rhodospirillales	Serine carboxypeptidase	-	-	-	-	-	Peptidase_S10
1234	MBB2175941.1	1211115.ALIQ01000031_gene2260	1.51e-60	203.0	COG0697@1|root,COG0697@2|Bacteria,1MW7P@1224|Proteobacteria,2U22A@28211|Alphaproteobacteria	COG0697 Permeases of the drug metabolite transporter (DMT) superfamily	-	-	-	-	-	EamA
1234	MBB2175942.1	1286170.RORB6_22955	1.07e-140	402.0	COG1028@1|root,COG1028@2|Bacteria,1MVQW@1224|Proteobacteria,1RNY1@1236|Gammaproteobacteria	COG1028 Dehydrogenases with different specificities (related to short-chain alcohol dehydrogenases)	budC	-	ko:K03366	ko00650,map00650	ko00000,ko00001,ko01000	adh_short,adh_short_C2
1234	MBB2175943.1	272568.GDI3065	0.0	1337.0	COG0480@1|root,COG0480@2|Bacteria,1MUCV@1224|Proteobacteria,2TQVI@28211|Alphaproteobacteria,2JQXC@204441|Rhodospirillales	Catalyzes the GTP-dependent ribosomal translocation step during translation elongation. During this step, the ribosome changes from the pre-translocational (PRE) to the post- translocational (POST) state as the newly formed A-site-bound peptidyl-tRNA and P-site-bound deacylated tRNA move to the P and E sites, respectively. Catalyzes the coordinated movement of the two tRNA molecules, the mRNA and conformational changes in the ribosome	fusA	-	ko:K02355	-	ko00000,ko03012,ko03029	EFG_C,EFG_II,EFG_IV,GTP_EFTU,GTP_EFTU_D2
1234	MBB2175944.1	272568.GDI3066	7.21e-62	190.0	COG0227@1|root,COG0227@2|Bacteria,1MZ57@1224|Proteobacteria,2UBQU@28211|Alphaproteobacteria,2JT8U@204441|Rhodospirillales	Belongs to the bacterial ribosomal protein bL28 family	rpmB	-	ko:K02902	ko03010,map03010	br01610,ko00000,ko00001,ko00002,ko03011	Ribosomal_L28
1234	MBB2175945.1	1121861.KB899946_gene3938	5.55e-22	88.6	2DC4E@1|root,2ZCV0@2|Bacteria,1P9SC@1224|Proteobacteria,2UW3U@28211|Alphaproteobacteria,2JY9Z@204441|Rhodospirillales	-	-	-	-	-	-	-
1234	MBB2175946.1	272568.GDI3068	0.0	1038.0	COG5265@1|root,COG5265@2|Bacteria,1NSKS@1224|Proteobacteria,2UQAG@28211|Alphaproteobacteria,2JR6D@204441|Rhodospirillales	COG5265 ABC-type transport system involved in Fe-S cluster assembly, permease and ATPase components	-	-	ko:K06147	-	ko00000,ko02000	ABC_membrane,ABC_tran
1234	MBB2175947.1	272568.GDI3069	1.3e-157	448.0	COG1051@1|root,COG1051@2|Bacteria,1QUQ0@1224|Proteobacteria,2TXKI@28211|Alphaproteobacteria,2JYWF@204441|Rhodospirillales	NUDIX domain	-	-	ko:K00949	ko00730,ko01100,map00730,map01100	ko00000,ko00001,ko01000	DUF4743,NUDIX
1234	MBB2175948.1	272568.GDI3070	5.3e-60	189.0	COG2913@1|root,COG2913@2|Bacteria,1N19B@1224|Proteobacteria,2VGNZ@28211|Alphaproteobacteria,2JYSI@204441|Rhodospirillales	Protein of unknown function (DUF3574)	-	-	-	-	-	DUF3574
1234	MBB2175949.1	272568.GDI3071	0.0	1227.0	COG1770@1|root,COG1770@2|Bacteria,1MUED@1224|Proteobacteria,2TTR0@28211|Alphaproteobacteria,2JQQX@204441|Rhodospirillales	Prolyl oligopeptidase, N-terminal beta-propeller domain	-	-	ko:K01354	ko05142,ko05143,map05142,map05143	ko00000,ko00001,ko01000,ko01002	Peptidase_S9,Peptidase_S9_N
1234	MBB2175950.1	272568.GDI3072	3.29e-205	575.0	COG0628@1|root,COG0628@2|Bacteria,1MWKB@1224|Proteobacteria,2TUMY@28211|Alphaproteobacteria	permease	-	-	-	-	-	AI-2E_transport
1234	MBB2175951.1	272568.GDI3073	4.35e-64	204.0	COG0789@1|root,COG0789@2|Bacteria,1RGYB@1224|Proteobacteria,2U9A5@28211|Alphaproteobacteria,2JT8M@204441|Rhodospirillales	transcriptional regulator, MerR	-	-	-	-	-	MerR_1
1234	MBB2175952.1	272568.GDI3074	5.14e-62	191.0	COG0776@1|root,COG0776@2|Bacteria,1RH5Z@1224|Proteobacteria,2UCDG@28211|Alphaproteobacteria,2JSQ2@204441|Rhodospirillales	This protein is one of the two subunits of integration host factor, a specific DNA-binding protein that functions in genetic recombination as well as in transcriptional and translational control	himA	-	ko:K04764	-	ko00000,ko03032,ko03036,ko03400	Bac_DNA_binding
