key	query	seed_ortholog	evalue	score	eggNOG_OGs	description	preferred_name	GOs	KEGG_ko	KEGG_pathway	brite	PFAMs
1264	OBX86750.1	1028806.GGE_0622	4.42e-111	319.0	COG1267@1|root,COG1267@2|Bacteria,1MZJA@1224|Proteobacteria,1S68A@1236|Gammaproteobacteria,1Y8NV@135625|Pasteurellales	Lipid phosphatase which dephosphorylates phosphatidylglycerophosphate (PGP) to phosphatidylglycerol (PG)	pgpA	-	ko:K01095	ko00564,ko01100,map00564,map01100	ko00000,ko00001,ko01000	PgpA
1264	OBX86751.1	1028805.GGC_0970	4.76e-222	613.0	COG0611@1|root,COG0611@2|Bacteria,1MU9X@1224|Proteobacteria,1RNHU@1236|Gammaproteobacteria,1Y9JD@135625|Pasteurellales	Catalyzes the ATP-dependent phosphorylation of thiamine- monophosphate (TMP) to form thiamine-pyrophosphate (TPP), the active form of vitamin B1	thiL	-	ko:K00946	ko00730,ko01100,map00730,map01100	ko00000,ko00001,ko00002,ko01000	AIRS,AIRS_C
1264	OBX86752.1	1028803.GG9_1003	6.3e-95	277.0	COG0781@1|root,COG0781@2|Bacteria,1RHFZ@1224|Proteobacteria,1S6AJ@1236|Gammaproteobacteria,1Y9WG@135625|Pasteurellales	Involved in transcription antitermination. Required for transcription of ribosomal RNA (rRNA) genes. Binds specifically to the boxA antiterminator sequence of the ribosomal RNA (rrn) operons	nusB	-	ko:K03625	-	ko00000,ko03009,ko03021	NusB
1264	OBX86753.1	1028803.GG9_1004	3.66e-98	286.0	COG0054@1|root,COG0054@2|Bacteria,1RD9J@1224|Proteobacteria,1S3WD@1236|Gammaproteobacteria,1Y6YF@135625|Pasteurellales	Catalyzes the formation of 6,7-dimethyl-8- ribityllumazine by condensation of 5-amino-6-(D- ribitylamino)uracil with 3,4-dihydroxy-2-butanone 4-phosphate. This is the penultimate step in the biosynthesis of riboflavin	ribH	GO:0000906,GO:0003674,GO:0003824,GO:0005575,GO:0005622,GO:0005623,GO:0005737,GO:0005829,GO:0006766,GO:0006767,GO:0006771,GO:0006807,GO:0008150,GO:0008152,GO:0009058,GO:0009110,GO:0009231,GO:0009987,GO:0016740,GO:0016765,GO:0017144,GO:0018130,GO:0034641,GO:0042364,GO:0042726,GO:0042727,GO:0044237,GO:0044249,GO:0044271,GO:0044281,GO:0044283,GO:0044424,GO:0044444,GO:0044464,GO:0046483,GO:0071704,GO:1901360,GO:1901362,GO:1901564,GO:1901566,GO:1901576	ko:K00794	ko00740,ko01100,ko01110,map00740,map01100,map01110	ko00000,ko00001,ko00002,ko01000	DMRL_synthase
1264	OBX86754.1	1028805.GGC_0281	5.76e-106	311.0	COG3110@1|root,COG3110@2|Bacteria,1RK33@1224|Proteobacteria,1RZRX@1236|Gammaproteobacteria,1Y9NG@135625|Pasteurellales	Belongs to the UPF0319 family	-	-	ko:K09909	-	ko00000	DUF2057
1264	OBX86755.1	1028803.GG9_1091	0.0	1203.0	COG1289@1|root,COG1289@2|Bacteria,1MWR1@1224|Proteobacteria,1RNIJ@1236|Gammaproteobacteria,1Y6ZG@135625|Pasteurellales	membrane	Z012_11280	-	-	-	-	FUSC-like,FUSC_2
1264	OBX86756.1	1028805.GGC_0278	4.87e-120	344.0	COG4657@1|root,COG4657@2|Bacteria,1MU8X@1224|Proteobacteria,1RQDN@1236|Gammaproteobacteria,1Y6RV@135625|Pasteurellales	Part of a membrane complex involved in electron transport	rnfA	-	ko:K03617	-	ko00000	Rnf-Nqr
1264	OBX86757.1	1028805.GGC_0277	6.67e-123	352.0	COG2878@1|root,COG2878@2|Bacteria,1MUWU@1224|Proteobacteria,1RNSJ@1236|Gammaproteobacteria,1Y7GX@135625|Pasteurellales	Part of a membrane complex involved in electron transport	rnfB	-	ko:K03616	-	ko00000	FeS,Fer4_21
1264	OBX86758.1	1028805.GGC_0276	0.0	1031.0	COG4656@1|root,COG4656@2|Bacteria,1QTUI@1224|Proteobacteria,1RMIM@1236|Gammaproteobacteria,1Y6UD@135625|Pasteurellales	Part of a membrane complex involved in electron transport	rnfC	-	ko:K03615	-	ko00000	Complex1_51K,Fer4_10,Fer4_7,RnfC_N,SLBB
1264	OBX86759.1	1028806.GGE_1552	2.6e-257	705.0	COG4658@1|root,COG4658@2|Bacteria,1MVY6@1224|Proteobacteria,1RMEU@1236|Gammaproteobacteria,1Y74F@135625|Pasteurellales	Part of a membrane complex involved in electron transport	rnfD	GO:0005575,GO:0005623,GO:0005886,GO:0016020,GO:0044464,GO:0071944	ko:K03614	-	ko00000	NQR2_RnfD_RnfE
1264	OBX86760.1	1028805.GGC_0274	4.87e-141	399.0	COG4659@1|root,COG4659@2|Bacteria,1RDEP@1224|Proteobacteria,1RPAD@1236|Gammaproteobacteria,1Y88P@135625|Pasteurellales	Part of a membrane complex involved in electron transport	rnfG	-	ko:K03612	-	ko00000	FMN_bind
1264	OBX86761.1	1028805.GGC_0273	3.11e-154	434.0	COG4660@1|root,COG4660@2|Bacteria,1MW6N@1224|Proteobacteria,1RMEH@1236|Gammaproteobacteria,1Y6TA@135625|Pasteurellales	Part of a membrane complex involved in electron transport	rnfE	GO:0005575,GO:0005623,GO:0005886,GO:0016020,GO:0044464,GO:0071944	ko:K03613	-	ko00000	Rnf-Nqr
1264	OBX86762.1	1028805.GGC_0272	8.46e-153	429.0	COG0177@1|root,COG0177@2|Bacteria,1MUYQ@1224|Proteobacteria,1RMHU@1236|Gammaproteobacteria,1Y86A@135625|Pasteurellales	DNA repair enzyme that has both DNA N-glycosylase activity and AP-lyase activity. The DNA N-glycosylase activity releases various damaged pyrimidines from DNA by cleaving the N- glycosidic bond, leaving an AP (apurinic apyrimidinic) site. The AP-lyase activity cleaves the phosphodiester bond 3' to the AP site by a beta-elimination, leaving a 3'-terminal unsaturated sugar and a product with a terminal 5'-phosphate	nth	-	ko:K10773	ko03410,map03410	ko00000,ko00001,ko01000,ko03400	EndIII_4Fe-2S,HhH-GPD
1264	OBX86763.1	1028806.GGE_1556	6.46e-315	859.0	COG0733@1|root,COG0733@2|Bacteria,1MUZJ@1224|Proteobacteria,1RPCT@1236|Gammaproteobacteria,1Y820@135625|Pasteurellales	Belongs to the sodium neurotransmitter symporter (SNF) (TC 2.A.22) family	-	GO:0005575,GO:0005623,GO:0005886,GO:0016020,GO:0044464,GO:0071944	ko:K03308	-	ko00000	SNF
1264	OBX86764.1	1028805.GGC_0376	1.15e-314	858.0	COG0642@1|root,COG0642@2|Bacteria,1QTSX@1224|Proteobacteria,1T1G3@1236|Gammaproteobacteria	Histidine kinase	qseC	GO:0005575,GO:0005623,GO:0005886,GO:0016020,GO:0044464,GO:0071944	ko:K07645	ko02020,ko02024,map02020,map02024	ko00000,ko00001,ko00002,ko01000,ko01001,ko02022	2CSK_N,HATPase_c,HisKA
1264	OBX86765.1	1028805.GGC_0377	4.32e-155	435.0	COG0745@1|root,COG0745@2|Bacteria,1N0YI@1224|Proteobacteria,1RQQ3@1236|Gammaproteobacteria,1YA12@135625|Pasteurellales	Protein involved in DNA binding, two-component response regulator activity, regulation of transcription DNA-dependent and two-component signal transduction system (phosphorelay)	qseB	-	ko:K07666	ko02020,ko02024,map02020,map02024	ko00000,ko00001,ko00002,ko02022	Response_reg,Trans_reg_C
1264	OBX86766.1	1028805.GGC_0378	9.28e-77	229.0	COG3111@1|root,COG3111@2|Bacteria,1N9HJ@1224|Proteobacteria,1SCD7@1236|Gammaproteobacteria,1Y9E5@135625|Pasteurellales	Bacterial OB fold (BOF) protein	-	-	-	-	-	BOF
1264	OBX86767.1	1028805.GGC_0379	1.05e-197	549.0	COG2837@1|root,COG2837@2|Bacteria,1MWDD@1224|Proteobacteria,1RMZJ@1236|Gammaproteobacteria,1Y7CE@135625|Pasteurellales	Dyp-type peroxidase	-	-	ko:K07223	-	ko00000	Dyp_perox
1264	OBX86768.1	1028803.GG9_1108	6.69e-129	365.0	COG3470@1|root,COG3470@2|Bacteria,1RA2Z@1224|Proteobacteria,1RS32@1236|Gammaproteobacteria,1Y82I@135625|Pasteurellales	Fe2+ transport protein	VY92_05765	-	ko:K07230	-	ko00000,ko02000	Iron_transport
1264	OBX86769.1	1028805.GGC_0382	0.0	887.0	COG3350@1|root,COG4393@1|root,COG3350@2|Bacteria,COG4393@2|Bacteria,1R507@1224|Proteobacteria,1RQ63@1236|Gammaproteobacteria,1Y6WR@135625|Pasteurellales	Predicted membrane protein (DUF2318)	-	-	-	-	-	DUF2318,YHS
1264	OBX86770.1	1028803.GG9_1110	2.78e-308	842.0	COG0577@1|root,COG0577@2|Bacteria,1PU2M@1224|Proteobacteria,1RSJG@1236|Gammaproteobacteria,1Y885@135625|Pasteurellales	Lipoprotein release ABC superfamily ATP binding cassette transporter, permease	Z012_06710	-	ko:K02004	-	ko00000,ko00002,ko02000	FtsX,MacB_PCD
1264	OBX86771.1	1028805.GGC_0384	1.09e-253	698.0	COG0577@1|root,COG0577@2|Bacteria,1R75G@1224|Proteobacteria,1S0QT@1236|Gammaproteobacteria,1Y7H0@135625|Pasteurellales	MacB-like periplasmic core domain	Z012_06715	-	ko:K02004	-	ko00000,ko00002,ko02000	FtsX,MacB_PCD
1264	OBX86772.1	1028805.GGC_0385	9.06e-159	445.0	COG1136@1|root,COG1136@2|Bacteria,1Q3QX@1224|Proteobacteria,1RQIZ@1236|Gammaproteobacteria,1Y849@135625|Pasteurellales	transporter subunit ATP-binding component of ABC superfamily	Z012_06720	-	ko:K02003	-	ko00000,ko00002,ko02000	ABC_tran
1264	OBX86773.1	1028806.GGE_1567	1.22e-102	298.0	COG0526@1|root,COG0526@2|Bacteria,1RCTX@1224|Proteobacteria,1S4XW@1236|Gammaproteobacteria,1Y8QX@135625|Pasteurellales	Protein involved in antioxidant activity, electron carrier activity, oxidoreductase activity, protein disulfide oxidoreductase activity, cell redox homeostasis and glycerol ether metabolic process	-	-	-	-	-	AhpC-TSA
1264	OBX86774.1	1028805.GGC_0387	2.02e-36	126.0	COG2863@1|root,COG2863@2|Bacteria,1NBPD@1224|Proteobacteria,1SDQ2@1236|Gammaproteobacteria	Cytochrome C oxidase, cbb3-type, subunit III	VY92_07920	-	-	-	-	Cytochrom_C,Cytochrome_CBB3
1264	OBX86775.1	862965.PARA_18030	1.04e-213	598.0	COG0477@1|root,COG2814@2|Bacteria,1MW19@1224|Proteobacteria,1RRES@1236|Gammaproteobacteria,1Y7UC@135625|Pasteurellales	Sugar (and other) transporter	-	-	ko:K07552	-	ko00000,ko02000	MFS_1
1264	OBX86776.1	1028803.GG9_1450	6.38e-314	856.0	COG2256@1|root,COG2256@2|Bacteria,1MUVS@1224|Proteobacteria,1RPBY@1236|Gammaproteobacteria,1Y7Z9@135625|Pasteurellales	ATPase related to the helicase subunit of the Holliday junction resolvase	rarA	-	ko:K07478	-	ko00000	AAA,AAA_assoc_2,MgsA_C,RuvB_N
1264	OBX86777.1	1028805.GGC_1103	6.38e-136	385.0	COG2834@1|root,COG2834@2|Bacteria,1PXDV@1224|Proteobacteria,1S9FW@1236|Gammaproteobacteria,1Y7RI@135625|Pasteurellales	Participates in the translocation of lipoproteins from the inner membrane to the outer membrane. Only forms a complex with a lipoprotein if the residue after the N-terminal Cys is not an aspartate (The Asp acts as a targeting signal to indicate that the lipoprotein should stay in the inner membrane)	lolA	-	ko:K03634	-	ko00000	LolA
1264	OBX86778.1	1028806.GGE_1198	0.0	1375.0	COG1674@1|root,COG1674@2|Bacteria,1MVPI@1224|Proteobacteria,1RM9A@1236|Gammaproteobacteria,1Y6U4@135625|Pasteurellales	Protein involved in ATP binding, DNA binding, nucleotide binding, cell cycle, cell division and chromosome segregation	ftsK	-	ko:K03466	-	ko00000,ko03036	FtsK_4TM,FtsK_SpoIIIE,Ftsk_gamma
1264	OBX86779.1	1028806.GGE_1199	7.1e-106	306.0	COG1522@1|root,COG1522@2|Bacteria,1MX7R@1224|Proteobacteria,1RPGA@1236|Gammaproteobacteria,1Y7FE@135625|Pasteurellales	Leucine-responsive regulatory protein	lrp	GO:0001101,GO:0003674,GO:0003676,GO:0003677,GO:0003700,GO:0005488,GO:0005575,GO:0005622,GO:0005623,GO:0005737,GO:0005829,GO:0006082,GO:0006355,GO:0006520,GO:0006522,GO:0006524,GO:0006807,GO:0008150,GO:0008152,GO:0009056,GO:0009063,GO:0009078,GO:0009080,GO:0009889,GO:0009987,GO:0010033,GO:0010243,GO:0010468,GO:0010556,GO:0016054,GO:0019219,GO:0019222,GO:0019752,GO:0031323,GO:0031326,GO:0042221,GO:0043200,GO:0043201,GO:0043436,GO:0043565,GO:0044237,GO:0044238,GO:0044248,GO:0044281,GO:0044282,GO:0044424,GO:0044444,GO:0044464,GO:0046395,GO:0050789,GO:0050794,GO:0050896,GO:0051171,GO:0051252,GO:0060255,GO:0065007,GO:0071704,GO:0080090,GO:0097159,GO:0140110,GO:1901363,GO:1901564,GO:1901565,GO:1901575,GO:1901605,GO:1901606,GO:1901698,GO:1901700,GO:1903506,GO:2000112,GO:2001141	ko:K03719	-	ko00000,ko03000,ko03036	AsnC_trans_reg,HTH_24
1264	OBX86780.1	1028805.GGC_1106	0.0	890.0	COG1066@1|root,COG1066@2|Bacteria,1MUJQ@1224|Proteobacteria,1RN2E@1236|Gammaproteobacteria,1Y6QU@135625|Pasteurellales	DNA-dependent ATPase involved in processing of recombination intermediates, plays a role in repairing DNA breaks. Stimulates the branch migration of RecA-mediated strand transfer reactions, allowing the 3' invading strand to extend heteroduplex DNA faster. Binds ssDNA in the presence of ADP but not other nucleotides, has ATPase activity that is stimulated by ssDNA and various branched DNA structures, but inhibited by SSB. Does not have RecA's homology-searching function	radA	-	ko:K04485	-	ko00000,ko03400	ATPase,ChlI
1264	OBX86781.1	1028806.GGE_1201	2.51e-237	654.0	COG3025@1|root,COG3025@2|Bacteria,1MY43@1224|Proteobacteria,1RMP4@1236|Gammaproteobacteria,1Y897@135625|Pasteurellales	Protein involved in adenylate cyclase activity and cAMP biosynthetic process	Z012_09295	GO:0003674,GO:0003824,GO:0005488,GO:0016462,GO:0016787,GO:0016817,GO:0016818,GO:0043167,GO:0043169,GO:0046872,GO:0050355	ko:K18446	-	ko00000,ko01000	CYTH
1264	OBX86782.1	1028805.GGC_1108	4.65e-168	469.0	COG3219@1|root,COG3219@2|Bacteria,1RKMJ@1224|Proteobacteria,1TFFH@1236|Gammaproteobacteria,1Y8J5@135625|Pasteurellales	Putative DNA-binding domain	-	-	ko:K09929	-	ko00000	DUF2063
1264	OBX86783.1	1095743.HMPREF1054_1534	2.15e-12	64.7	COG3767@1|root,COG3767@2|Bacteria,1QEMS@1224|Proteobacteria,1SCMV@1236|Gammaproteobacteria	-	-	-	-	-	-	-
1264	OBX86784.1	1095743.HMPREF1054_1533	1.35e-106	307.0	COG2259@1|root,COG2259@2|Bacteria,1RKEE@1224|Proteobacteria,1T0D4@1236|Gammaproteobacteria,1Y8QQ@135625|Pasteurellales	TQO small subunit DoxD	-	-	ko:K15977	-	ko00000	DoxX
1264	OBX86785.1	1028805.GGC_1112	4.13e-156	438.0	COG1392@1|root,COG1392@2|Bacteria,1MXY9@1224|Proteobacteria,1RQHT@1236|Gammaproteobacteria,1Y72W@135625|Pasteurellales	Phosphate transport regulator (distant homolog of PhoU)	VY92_08315	-	ko:K07220	-	ko00000	PhoU_div
1264	OBX86786.1	1028805.GGC_1113	4.1e-290	793.0	COG0306@1|root,COG0306@2|Bacteria,1MVXK@1224|Proteobacteria,1RP0Q@1236|Gammaproteobacteria,1Y80U@135625|Pasteurellales	Phosphate	VY92_08320	GO:0003674,GO:0005215,GO:0005315,GO:0005575,GO:0005623,GO:0005886,GO:0005887,GO:0006810,GO:0006811,GO:0006817,GO:0006820,GO:0008150,GO:0015291,GO:0015318,GO:0015698,GO:0016020,GO:0016021,GO:0022804,GO:0022857,GO:0031224,GO:0031226,GO:0034220,GO:0035435,GO:0044425,GO:0044459,GO:0044464,GO:0051179,GO:0051234,GO:0055085,GO:0071944,GO:0098656,GO:0098660,GO:0098661	ko:K03306	-	ko00000	PHO4
1264	OBX86787.1	1028806.GGE_1208	6.67e-137	388.0	COG3103@1|root,COG4991@2|Bacteria,1MX7M@1224|Proteobacteria,1RS74@1236|Gammaproteobacteria,1Y7PX@135625|Pasteurellales	SH3 domain protein	-	-	ko:K07184	-	ko00000	SH3_3
1264	OBX86788.1	1028805.GGC_1115	1.11e-297	812.0	COG0617@1|root,COG0617@2|Bacteria,1MU2X@1224|Proteobacteria,1RPFJ@1236|Gammaproteobacteria,1Y7J7@135625|Pasteurellales	Catalyzes the addition and repair of the essential 3'- terminal CCA sequence in tRNAs without using a nucleic acid template. Adds these three nucleotides in the order of C, C, and A to the tRNA nucleotide-73, using CTP and ATP as substrates and producing inorganic pyrophosphate. Also shows phosphatase, 2'- nucleotidase and 2',3'-cyclic phosphodiesterase activities. These phosphohydrolase activities are probably involved in the repair of the tRNA 3'-CCA terminus degraded by intracellular RNases	cca	-	ko:K00974	ko03013,map03013	ko00000,ko00001,ko01000,ko03016	HD,PolyA_pol,PolyA_pol_RNAbd
1264	OBX86789.1	1028805.GGC_1116	3.42e-148	417.0	COG3017@1|root,COG3017@2|Bacteria,1N02T@1224|Proteobacteria,1S91E@1236|Gammaproteobacteria,1Y8EW@135625|Pasteurellales	Plays a critical role in the incorporation of lipoproteins in the outer membrane after they are released by the LolA protein	lolB	-	ko:K02494	-	ko00000	LolB
1264	OBX86790.1	1028805.GGC_1118	1.64e-211	586.0	COG0462@1|root,COG0462@2|Bacteria,1MW21@1224|Proteobacteria,1RMUC@1236|Gammaproteobacteria,1YA19@135625|Pasteurellales	Involved in the biosynthesis of the central metabolite phospho-alpha-D-ribosyl-1-pyrophosphate (PRPP) via the transfer of pyrophosphoryl group from ATP to 1-hydroxyl of ribose-5-phosphate (Rib-5-P)	prs	-	ko:K00948	ko00030,ko00230,ko01100,ko01110,ko01120,ko01130,ko01200,ko01230,map00030,map00230,map01100,map01110,map01120,map01130,map01200,map01230	ko00000,ko00001,ko00002,ko01000	Pribosyl_synth,Pribosyltran_N
1264	OBX86791.1	1028803.GG9_1124	1.07e-99	290.0	COG0680@1|root,COG0680@2|Bacteria,1R3V7@1224|Proteobacteria,1S0IE@1236|Gammaproteobacteria,1Y8QG@135625|Pasteurellales	Hydrogenase 3 maturation protease	hycI	-	ko:K08315	-	ko00000,ko01000,ko01002	HycI
1264	OBX86792.1	1028803.GG9_1125	2.26e-95	277.0	2DM97@1|root,327XJ@2|Bacteria,1QUUV@1224|Proteobacteria,1T21T@1236|Gammaproteobacteria,1YB0N@135625|Pasteurellales	Formate hydrogenlyase maturation protein HycH	-	-	ko:K12145	-	ko00000,ko01000	HycH
1264	OBX86793.1	1028803.GG9_1126	1.4e-188	523.0	COG3260@1|root,COG3260@2|Bacteria,1QUBE@1224|Proteobacteria	NADH ubiquinone oxidoreductase 20 kDa subunit	hycG	GO:0003674,GO:0003824,GO:0003954,GO:0008137,GO:0008150,GO:0008152,GO:0016491,GO:0016651,GO:0016655,GO:0050136,GO:0055114	ko:K12144,ko:K15832	-	ko00000,ko01000	Oxidored_q6
1264	OBX86794.1	1028803.GG9_1127	2.84e-123	352.0	COG1143@1|root,COG1143@2|Bacteria,1R9YT@1224|Proteobacteria,1RQB1@1236|Gammaproteobacteria	the formate hydrogenlyase complex comprises of a formate dehydrogenase, unidentified electron carriers and hydrogenase-3	hycF	-	ko:K12143,ko:K15831	-	ko00000	Fer4,Fer4_7
1264	OBX86795.1	1028805.GGC_0506	0.0	1166.0	COG3261@1|root,COG3262@1|root,COG3261@2|Bacteria,COG3262@2|Bacteria,1QUBF@1224|Proteobacteria,1RSJ4@1236|Gammaproteobacteria	HycBCDEFG is part of the formate hydrogenlyase system which is involved in the cleaving of formate to dihydrogen and carbon dioxide	hycE	GO:0003674,GO:0005488,GO:0016151,GO:0043167,GO:0043169,GO:0046872,GO:0046914	ko:K12142,ko:K14090,ko:K15830	-	ko00000,ko01000	Complex1_30kDa,Complex1_49kDa,NiFeSe_Hases
1264	OBX86796.1	1028805.GGC_0507	0.0	967.0	COG0651@1|root,COG0651@2|Bacteria,1MVBA@1224|Proteobacteria,1RPB3@1236|Gammaproteobacteria,1YA1F@135625|Pasteurellales	Protein involved in NADH dehydrogenase (ubiquinone) activity, ATP synthesis coupled electron transport and oxidation-reduction process	-	-	ko:K12141	-	ko00000,ko01000	Proton_antipo_M,Proton_antipo_N
1264	OBX86797.1	1028805.GGC_0508	6.56e-137	389.0	COG4237@1|root,COG4237@2|Bacteria,1NAT8@1224|Proteobacteria,1RRYF@1236|Gammaproteobacteria,1Y9XG@135625|Pasteurellales	Hydrogenase 4 membrane	hyfE	-	ko:K12140	-	ko00000,ko01000	Oxidored_q2
1264	OBX86798.1	1028803.GG9_1131	0.0	917.0	COG1009@1|root,COG1009@2|Bacteria,1MW2M@1224|Proteobacteria,1RY6H@1236|Gammaproteobacteria	hydrogenase 4	hyfD	GO:0005575,GO:0005623,GO:0005886,GO:0005887,GO:0016020,GO:0016021,GO:0031224,GO:0031226,GO:0044425,GO:0044459,GO:0044464,GO:0071944	ko:K12139	-	ko00000,ko01000	Proton_antipo_M,Proton_antipo_N
1264	OBX86799.1	1028803.GG9_1132	5.42e-208	577.0	COG0650@1|root,COG0650@2|Bacteria,1MXV5@1224|Proteobacteria,1RPCY@1236|Gammaproteobacteria,1Y9H9@135625|Pasteurellales	Hydrogenase-4 component C	hycD	-	ko:K12138,ko:K12139	-	ko00000,ko01000	NADHdh
1264	OBX86800.1	1028803.GG9_1133	0.0	1268.0	COG0651@1|root,COG0651@2|Bacteria,1MXRW@1224|Proteobacteria,1RM9Q@1236|Gammaproteobacteria	formate hydrogenlyase subunit 3	hyfB	GO:0005575,GO:0005623,GO:0005886,GO:0016020,GO:0044464,GO:0071944	ko:K05568,ko:K12137	-	ko00000,ko01000,ko02000	Proton_antipo_M,Proton_antipo_N
1264	OBX86801.1	1028805.GGC_0512	6.51e-151	423.0	COG1142@1|root,COG1142@2|Bacteria,1MUHW@1224|Proteobacteria,1RQWU@1236|Gammaproteobacteria,1Y9HB@135625|Pasteurellales	Protein involved in electron carrier activity and iron-sulfur cluster binding	-	-	ko:K12136	-	ko00000,ko01000	Fer4,Fer4_3
1264	OBX86802.1	637911.AM305_07403	1.47e-252	697.0	COG1373@1|root,COG1373@2|Bacteria,1MWBT@1224|Proteobacteria,1RRXR@1236|Gammaproteobacteria,1Y8A7@135625|Pasteurellales	AAA superfamily	-	-	ko:K07133	-	ko00000	AAA_14,DUF4143
1264	OBX86803.1	1028803.GG9_1123	0.0	1262.0	COG0068@1|root,COG0068@2|Bacteria,1MVP8@1224|Proteobacteria,1RP08@1236|Gammaproteobacteria,1Y7AU@135625|Pasteurellales	Along with HypE, it catalyzes the synthesis of the CN ligands of the active site iron of NiFe -hydrogenases using carbamoylphosphate as a substrate. It functions as a carbamoyl transferase using carbamoylphosphate as a substrate and transferring the carboxamido moiety in an ATP-dependent reaction to the thiolate of the C-terminal cysteine of HypE yielding a protein-S-carboxamide	hypF	-	ko:K04656	-	ko00000	Acylphosphatase,Sua5_yciO_yrdC,zf-HYPF
1264	OBX86804.1	1028806.GGE_1335	5.57e-197	548.0	COG0189@1|root,COG0189@2|Bacteria,1MX62@1224|Proteobacteria,1RM8B@1236|Gammaproteobacteria,1Y6US@135625|Pasteurellales	Belongs to the RimK family	rimK	GO:0003674,GO:0003824,GO:0005575,GO:0005622,GO:0005623,GO:0005737,GO:0006464,GO:0006807,GO:0006950,GO:0006974,GO:0007154,GO:0008150,GO:0008152,GO:0009432,GO:0009605,GO:0009987,GO:0009991,GO:0016874,GO:0016879,GO:0016881,GO:0018169,GO:0018410,GO:0019538,GO:0031668,GO:0033554,GO:0036211,GO:0043170,GO:0043412,GO:0043687,GO:0044237,GO:0044238,GO:0044260,GO:0044267,GO:0044424,GO:0044464,GO:0050896,GO:0051716,GO:0070739,GO:0071496,GO:0071704,GO:0140096,GO:1901564	ko:K05844	-	ko00000,ko01000,ko03009	RimK
1264	OBX86805.1	1028803.GG9_1384	1.29e-58	181.0	COG0695@1|root,COG0695@2|Bacteria,1RGZ7@1224|Proteobacteria,1S5ZP@1236|Gammaproteobacteria,1Y950@135625|Pasteurellales	Protein involved in electron carrier activity, protein disulfide oxidoreductase activity and cell redox homeostasis	grxA	-	ko:K03674	-	ko00000,ko03110	Glutaredoxin
1264	OBX86806.1	71421.HI_1533	1.26e-286	783.0	COG0304@1|root,COG0304@2|Bacteria,1MU1X@1224|Proteobacteria,1RMDE@1236|Gammaproteobacteria,1Y7HV@135625|Pasteurellales	Belongs to the beta-ketoacyl-ACP synthases family	fabB	GO:0005575,GO:0005622,GO:0005623,GO:0005737,GO:0044424,GO:0044464	ko:K00647	ko00061,ko00780,ko01100,ko01212,map00061,map00780,map01100,map01212	ko00000,ko00001,ko00002,ko01000,ko01004	Ketoacyl-synt_C,ketoacyl-synt
1264	OBX86807.1	1028803.GG9_1386	0.0	1299.0	COG0665@1|root,COG4121@1|root,COG0665@2|Bacteria,COG4121@2|Bacteria,1MZW5@1224|Proteobacteria,1RMTE@1236|Gammaproteobacteria,1Y741@135625|Pasteurellales	Catalyzes the last two steps in the biosynthesis of 5- methylaminomethyl-2-thiouridine (mnm(5)s(2)U) at the wobble position (U34) in tRNA. Catalyzes the FAD-dependent demodification of cmnm(5)s(2)U34 to nm(5)s(2)U34, followed by the transfer of a methyl group from S-adenosyl-L-methionine to nm(5)s(2)U34, to form mnm(5)s(2)U34	mnmC	GO:0001510,GO:0002097,GO:0002098,GO:0003674,GO:0003824,GO:0004808,GO:0005575,GO:0005622,GO:0005623,GO:0005737,GO:0006139,GO:0006396,GO:0006399,GO:0006400,GO:0006725,GO:0006807,GO:0008033,GO:0008150,GO:0008152,GO:0008168,GO:0008173,GO:0008175,GO:0008757,GO:0009451,GO:0009987,GO:0010467,GO:0016070,GO:0016491,GO:0016740,GO:0016741,GO:0030488,GO:0032259,GO:0034470,GO:0034641,GO:0034660,GO:0043170,GO:0043412,GO:0043414,GO:0044237,GO:0044238,GO:0044260,GO:0044424,GO:0044464,GO:0046483,GO:0055114,GO:0071704,GO:0090304,GO:0140098,GO:0140101,GO:1901360	ko:K15461	-	ko00000,ko01000,ko03016	DAO,Methyltransf_30
1264	OBX86808.1	71421.HI_1541	0.0	1018.0	COG0616@1|root,COG0616@2|Bacteria,1MUXE@1224|Proteobacteria,1RNYW@1236|Gammaproteobacteria,1Y748@135625|Pasteurellales	signal peptide peptidase	sppA	-	ko:K04773	-	ko00000,ko01000,ko01002	Peptidase_S49
1264	OBX86809.1	71421.HI_1542	4.79e-123	351.0	COG0778@1|root,COG0778@2|Bacteria,1PKUV@1224|Proteobacteria,1RNQG@1236|Gammaproteobacteria,1Y8HM@135625|Pasteurellales	nitroreductase	Z012_10645	-	-	-	-	Nitroreductase
1264	OBX86810.1	1028806.GGE_1325	2.31e-119	342.0	COG3381@1|root,COG3381@2|Bacteria,1Q3A7@1224|Proteobacteria,1RP51@1236|Gammaproteobacteria,1Y8FQ@135625|Pasteurellales	chaperone	Z012_09590	-	-	-	-	-
1264	OBX86811.1	1028805.GGC_1045	6.7e-141	398.0	COG2249@1|root,COG2249@2|Bacteria,1MUHN@1224|Proteobacteria,1S0V5@1236|Gammaproteobacteria,1Y77D@135625|Pasteurellales	Protein involved in coenzyme binding, electron carrier activity and oxidoreductase activity	Z012_09595	-	ko:K00355	ko00130,ko01110,ko05200,ko05225,ko05418,map00130,map01110,map05200,map05225,map05418	ko00000,ko00001,ko01000	Flavodoxin_2
1264	OBX86812.1	1028803.GG9_1395	6.04e-273	749.0	COG3633@1|root,COG3633@2|Bacteria,1MXE1@1224|Proteobacteria,1RP9B@1236|Gammaproteobacteria,1Y6YA@135625|Pasteurellales	Involved in the import of serine and threonine into the cell, with the concomitant import of sodium (symport system)	sstT	-	ko:K07862	-	ko00000,ko02000	SDF
1264	OBX86813.1	1028805.GGC_1047	1.48e-94	276.0	COG2932@1|root,COG2932@2|Bacteria,1QUHT@1224|Proteobacteria,1T1ZD@1236|Gammaproteobacteria,1Y8WY@135625|Pasteurellales	Peptidase S24-like	Z012_05225	GO:0006950,GO:0006974,GO:0007154,GO:0008150,GO:0009432,GO:0009605,GO:0009987,GO:0009991,GO:0031668,GO:0033554,GO:0050896,GO:0051716,GO:0071496	-	-	-	Peptidase_S24
1264	OBX86814.1	1028805.GGC_1048	3.31e-262	718.0	COG0722@1|root,COG0722@2|Bacteria,1MU5Q@1224|Proteobacteria,1RMAA@1236|Gammaproteobacteria,1Y9QV@135625|Pasteurellales	Stereospecific condensation of phosphoenolpyruvate (PEP) and D-erythrose-4-phosphate (E4P) giving rise to 3-deoxy-D- arabino-heptulosonate-7-phosphate (DAHP)	aroG	GO:0003674,GO:0003824,GO:0003849,GO:0005575,GO:0005622,GO:0005623,GO:0005737,GO:0006082,GO:0006520,GO:0006725,GO:0006807,GO:0008150,GO:0008152,GO:0008652,GO:0009058,GO:0009072,GO:0009073,GO:0009987,GO:0016053,GO:0016740,GO:0016765,GO:0019438,GO:0019752,GO:0043436,GO:0044237,GO:0044238,GO:0044249,GO:0044281,GO:0044283,GO:0044424,GO:0044464,GO:0046394,GO:0071704,GO:1901360,GO:1901362,GO:1901564,GO:1901566,GO:1901576	ko:K01626	ko00400,ko01100,ko01110,ko01130,ko01230,ko02024,map00400,map01100,map01110,map01130,map01230,map02024	ko00000,ko00001,ko00002,ko01000	DAHP_synth_1
1264	OBX86815.1	1028805.GGC_0513	0.0	2077.0	COG5295@1|root,COG5295@2|Bacteria,1N338@1224|Proteobacteria,1RPXV@1236|Gammaproteobacteria,1Y7ES@135625|Pasteurellales	autotransporter adhesin	-	-	ko:K21449	-	ko00000,ko02000	ESPR,TAA-Trp-ring,YadA_anchor,YadA_head,YadA_stalk
1264	OBX86816.1	546262.NEICINOT_03771	2.38e-129	439.0	COG5295@1|root,COG5295@2|Bacteria,1N338@1224|Proteobacteria,2VQHI@28216|Betaproteobacteria	Hep Hag repeat protein	-	-	-	-	-	ESPR,TAA-Trp-ring,YadA_anchor,YadA_head,YadA_stalk
1264	OBX86817.1	546262.NEICINOT_04577	0.0	1602.0	COG5295@1|root,COG5295@2|Bacteria,1N338@1224|Proteobacteria,2VQHI@28216|Betaproteobacteria,2KRHC@206351|Neisseriales	Hep Hag repeat protein	-	-	-	-	-	Collagen,ESPR,YadA_anchor,YadA_head,YadA_stalk
1264	OBX86818.1	1095743.HMPREF1054_1308	4.08e-97	289.0	2EK2P@1|root,33DT4@2|Bacteria	-	-	-	-	-	-	Collagen
1264	OBX86819.1	1095743.HMPREF1054_2074	0.000729	43.9	28W8V@1|root,2ZI9D@2|Bacteria,1P8Y2@1224|Proteobacteria	overlaps another CDS with the same product name	-	-	-	-	-	-
