key	query	seed_ortholog	evalue	score	eggNOG_OGs	description	preferred_name	GOs	KEGG_ko	KEGG_pathway	brite	PFAMs
1571	STX92620.1	1268635.Loa_00977	1.26e-109	320.0	COG1825@1|root,COG1825@2|Bacteria,1RDH0@1224|Proteobacteria,1S46A@1236|Gammaproteobacteria,1JCF8@118969|Legionellales	This is one of the proteins that binds to the 5S RNA in the ribosome where it forms part of the central protuberance	ctc	GO:0003674,GO:0003676,GO:0003723,GO:0005488,GO:0005575,GO:0005622,GO:0005623,GO:0005737,GO:0005829,GO:0005840,GO:0006412,GO:0006518,GO:0006807,GO:0008097,GO:0008150,GO:0008152,GO:0009058,GO:0009059,GO:0009987,GO:0010467,GO:0015934,GO:0019538,GO:0019843,GO:0022625,GO:0022626,GO:0032991,GO:0034641,GO:0034645,GO:0043043,GO:0043170,GO:0043226,GO:0043228,GO:0043229,GO:0043232,GO:0043603,GO:0043604,GO:0044237,GO:0044238,GO:0044249,GO:0044260,GO:0044267,GO:0044271,GO:0044391,GO:0044422,GO:0044424,GO:0044444,GO:0044445,GO:0044446,GO:0044464,GO:0071704,GO:0097159,GO:1901363,GO:1901564,GO:1901566,GO:1901576,GO:1990904	ko:K02897	ko03010,map03010	ko00000,ko00001,ko00002,ko03011	Ribosomal_L25p,Ribosomal_TL5_C
1571	STX92621.1	1408444.JHYC01000014_gene2327	2.2e-87	261.0	COG0193@1|root,COG0193@2|Bacteria,1MX1P@1224|Proteobacteria,1RPK3@1236|Gammaproteobacteria,1JCQK@118969|Legionellales	The natural substrate for this enzyme may be peptidyl- tRNAs which drop off the ribosome during protein synthesis	pth	GO:0003674,GO:0003824,GO:0004045,GO:0016787,GO:0016788,GO:0052689,GO:0140098,GO:0140101	ko:K01056	-	ko00000,ko01000,ko03012	Pept_tRNA_hydro
1571	STX92622.1	297246.lpp2707	6.07e-222	616.0	COG0012@1|root,COG0012@2|Bacteria,1MVM4@1224|Proteobacteria,1RMBI@1236|Gammaproteobacteria,1JDCG@118969|Legionellales	ATPase that binds to both the 70S ribosome and the 50S ribosomal subunit in a nucleotide-independent manner	ychF	-	ko:K06942	-	ko00000,ko03009	MMR_HSR1,YchF-GTPase_C
1571	STX92623.1	1408444.JHYC01000004_gene680	1.88e-263	741.0	COG1123@1|root,COG4172@2|Bacteria,1MU09@1224|Proteobacteria,1RMEI@1236|Gammaproteobacteria,1JD6V@118969|Legionellales	Oligopeptide/dipeptide transporter, C-terminal region	gsiA	-	ko:K02031,ko:K02032	ko02024,map02024	ko00000,ko00001,ko00002,ko02000	ABC_tran,oligo_HPY
1571	STX92624.1	1034943.BN1094_01389	5.89e-09	67.4	2APKA@1|root,31EPG@2|Bacteria,1QBZV@1224|Proteobacteria,1T7M6@1236|Gammaproteobacteria,1JFII@118969|Legionellales	-	-	-	-	-	-	-
1571	STX92625.1	1268635.Loa_00987	2.92e-316	872.0	COG0442@1|root,COG0442@2|Bacteria,1MU7E@1224|Proteobacteria,1RN5R@1236|Gammaproteobacteria,1JDQP@118969|Legionellales	Catalyzes the attachment of proline to tRNA(Pro) in a two-step reaction proline is first activated by ATP to form Pro- AMP and then transferred to the acceptor end of tRNA(Pro). As ProRS can inadvertently accommodate and process non-cognate amino acids such as alanine and cysteine, to avoid such errors it has two additional distinct editing activities against alanine. One activity is designated as 'pretransfer' editing and involves the tRNA(Pro)-independent hydrolysis of activated Ala-AMP. The other activity is designated 'posttransfer' editing and involves deacylation of mischarged Ala-tRNA(Pro). The misacylated Cys- tRNA(Pro) is not edited by ProRS	proS	-	ko:K01881	ko00970,map00970	ko00000,ko00001,ko00002,ko01000,ko01007,ko03016	HGTP_anticodon,tRNA-synt_2b,tRNA_edit
1571	STX92626.1	1268635.Loa_00988	0.0	1147.0	COG0288@1|root,COG0659@1|root,COG0288@2|Bacteria,COG0659@2|Bacteria,1MX8F@1224|Proteobacteria,1RRCQ@1236|Gammaproteobacteria,1JCIV@118969|Legionellales	Sulfate permease family	-	-	ko:K01673	ko00910,map00910	ko00000,ko00001,ko01000	Pro_CA,Sulfate_transp
1571	STX92627.1	1122165.AUHS01000004_gene3167	1.15e-162	460.0	COG0037@1|root,COG0037@2|Bacteria,1MW5Q@1224|Proteobacteria,1RN2H@1236|Gammaproteobacteria,1JD3Y@118969|Legionellales	Catalyzes the ATP-dependent 2-thiolation of cytidine in position 32 of tRNA, to form 2-thiocytidine (s(2)C32). The sulfur atoms are provided by the cysteine cysteine desulfurase (IscS) system	ttcA	-	ko:K14058	-	ko00000,ko03016	ATP_bind_3
1571	STX92628.1	1268635.Loa_00991	2.65e-240	672.0	COG1538@1|root,COG1538@2|Bacteria,1MWCJ@1224|Proteobacteria,1RQQV@1236|Gammaproteobacteria,1JCJQ@118969|Legionellales	Outer membrane efflux protein	tolC	-	ko:K12340	ko01501,ko01503,ko02020,ko03070,ko04626,ko05133,map01501,map01503,map02020,map03070,map04626,map05133	ko00000,ko00001,ko00002,ko01504,ko02000,ko02044	OEP
1571	STX92629.1	1268635.Loa_00992	6.85e-114	331.0	COG2518@1|root,COG2518@2|Bacteria,1RD6S@1224|Proteobacteria,1S0KH@1236|Gammaproteobacteria,1JDDN@118969|Legionellales	Ribosomal RNA adenine dimethylase	pcm	-	ko:K00573	-	ko00000,ko01000	PCMT
1571	STX92630.1	1122164.JHWF01000019_gene477	3.31e-228	635.0	COG0156@1|root,COG0156@2|Bacteria,1MVVH@1224|Proteobacteria,1RNS6@1236|Gammaproteobacteria,1JC78@118969|Legionellales	Catalyzes the cleavage of 2-amino-3-ketobutyrate to glycine and acetyl-CoA	kbl	-	ko:K00639	ko00260,map00260	ko00000,ko00001,ko01000,ko01007	Aminotran_1_2
1571	STX92631.1	1122164.JHWF01000019_gene478	6.12e-232	640.0	COG1063@1|root,COG1063@2|Bacteria,1MV9A@1224|Proteobacteria,1RMNY@1236|Gammaproteobacteria,1JC4K@118969|Legionellales	Catalyzes the NAD( )-dependent oxidation of L-threonine to 2-amino-3-ketobutyrate	tdh	-	ko:K00060	ko00260,map00260	ko00000,ko00001,ko01000	ADH_N,ADH_zinc_N
1571	STX92632.1	1268635.Loa_00997	0.0	972.0	COG0488@1|root,COG0488@2|Bacteria,1MU37@1224|Proteobacteria,1RPWS@1236|Gammaproteobacteria,1JC6T@118969|Legionellales	ABC transporter	yjjK	-	-	-	-	ABC_tran,ABC_tran_Xtn
1571	STX92633.1	1268635.Loa_00998	2.4e-125	358.0	COG1376@1|root,COG1376@2|Bacteria,1QJ5D@1224|Proteobacteria,1TH2W@1236|Gammaproteobacteria,1JD96@118969|Legionellales	L,D-transpeptidase catalytic domain	enhA_4	-	-	-	-	YkuD
1571	STX92634.1	1122169.AREN01000046_gene2151	2.36e-160	462.0	COG2067@1|root,COG2067@2|Bacteria,1PCME@1224|Proteobacteria,1SXQC@1236|Gammaproteobacteria,1JCP9@118969|Legionellales	Outer membrane protein transport protein (OMPP1/FadL/TodX)	-	-	ko:K06076	-	ko00000,ko02000	Toluene_X
1571	STX92635.1	1268635.Loa_00999	4.77e-68	215.0	29WYB@1|root,30IKJ@2|Bacteria,1QYAN@1224|Proteobacteria,1T3NE@1236|Gammaproteobacteria,1JDZX@118969|Legionellales	Type-IV b secretion system, inner-membrane complex component	-	-	-	-	-	T4BSS_DotI_IcmL
1571	STX92636.1	1268635.Loa_01000	2.37e-143	414.0	COG0010@1|root,COG0010@2|Bacteria,1NCRN@1224|Proteobacteria,1RNKI@1236|Gammaproteobacteria,1JDKG@118969|Legionellales	Catalyzes the conversion of N-formimidoyl-L-glutamate to L-glutamate and formamide	hutG	-	ko:K01479,ko:K01480	ko00330,ko00340,ko01100,map00330,map00340,map01100	ko00000,ko00001,ko00002,ko01000	Arginase
1571	STX92637.1	1122164.JHWF01000030_gene2322	1.71e-109	323.0	COG4221@1|root,COG4221@2|Bacteria,1QVTE@1224|Proteobacteria,1SJD1@1236|Gammaproteobacteria,1JDFX@118969|Legionellales	Belongs to the short-chain dehydrogenases reductases (SDR) family	yueD	-	-	-	-	adh_short
1571	STX92638.1	1268635.Loa_01010	1.52e-187	533.0	COG1228@1|root,COG1228@2|Bacteria,1MUYR@1224|Proteobacteria,1RMI9@1236|Gammaproteobacteria,1JD4G@118969|Legionellales	hydrolase activity, acting on carbon-nitrogen (but not peptide) bonds, in cyclic amides	hutI	-	ko:K01468	ko00340,ko01100,map00340,map01100	ko00000,ko00001,ko00002,ko01000	Amidohydro_1
1571	STX92639.1	297246.lpp0768	0.0	921.0	COG1297@1|root,COG1297@2|Bacteria,1N7SK@1224|Proteobacteria,1RNC8@1236|Gammaproteobacteria,1JC4C@118969|Legionellales	OPT oligopeptide transporter protein	-	-	-	-	-	OPT
1571	STX92640.1	1268635.Loa_01015	0.0	1530.0	COG0525@1|root,COG0525@2|Bacteria,1MV7B@1224|Proteobacteria,1RNEB@1236|Gammaproteobacteria,1JCS5@118969|Legionellales	amino acids such as threonine, to avoid such errors, it has a posttransfer editing activity that hydrolyzes mischarged Thr-tRNA(Val) in a tRNA-dependent manner	valS	GO:0003674,GO:0003824,GO:0004812,GO:0004832,GO:0006082,GO:0006139,GO:0006399,GO:0006412,GO:0006418,GO:0006438,GO:0006518,GO:0006520,GO:0006725,GO:0006807,GO:0008150,GO:0008152,GO:0009058,GO:0009059,GO:0009987,GO:0010467,GO:0016070,GO:0016874,GO:0016875,GO:0019538,GO:0019752,GO:0034641,GO:0034645,GO:0034660,GO:0043038,GO:0043039,GO:0043043,GO:0043170,GO:0043436,GO:0043603,GO:0043604,GO:0044237,GO:0044238,GO:0044249,GO:0044260,GO:0044267,GO:0044271,GO:0044281,GO:0046483,GO:0071704,GO:0090304,GO:0140098,GO:0140101,GO:1901360,GO:1901564,GO:1901566,GO:1901576	ko:K01873	ko00970,map00970	ko00000,ko00001,ko00002,ko01000,ko01007,ko03016	Anticodon_1,Val_tRNA-synt_C,tRNA-synt_1
1571	STX92641.1	1122164.JHWF01000030_gene2329	0.0	1584.0	COG0841@1|root,COG0841@2|Bacteria,1MU48@1224|Proteobacteria,1RMBN@1236|Gammaproteobacteria,1JCNY@118969|Legionellales	Belongs to the resistance-nodulation-cell division (RND) (TC 2.A.6) family	-	-	ko:K18138	ko01501,ko01503,map01501,map01503	ko00000,ko00001,ko00002,ko01504,ko02000	ACR_tran
1571	STX92642.1	1268635.Loa_01018	6.92e-205	578.0	COG0845@1|root,COG0845@2|Bacteria,1MUFW@1224|Proteobacteria,1RQJ9@1236|Gammaproteobacteria,1JCUI@118969|Legionellales	Belongs to the membrane fusion protein (MFP) (TC 8.A.1) family	acrA	-	ko:K03585	ko01501,ko01503,map01501,map01503	ko00000,ko00001,ko00002,ko01504,ko02000,ko03036	HlyD_D23
1571	STX92643.1	1122164.JHWF01000030_gene2331	4.86e-39	135.0	2AP1G@1|root,31E2Q@2|Bacteria,1QBC9@1224|Proteobacteria,1T6X4@1236|Gammaproteobacteria,1JEFR@118969|Legionellales	-	-	-	-	-	-	-
1571	STX92644.1	1268635.Loa_01020	3.38e-40	135.0	COG2823@1|root,COG2823@2|Bacteria,1N0SU@1224|Proteobacteria,1S926@1236|Gammaproteobacteria,1JEXE@118969|Legionellales	BON domain	-	-	-	-	-	BON
1571	STX92645.1	1268635.Loa_01021	5.54e-248	687.0	COG0112@1|root,COG0112@2|Bacteria,1MUIS@1224|Proteobacteria,1RMHQ@1236|Gammaproteobacteria,1JDKK@118969|Legionellales	Catalyzes the reversible interconversion of serine and glycine with tetrahydrofolate (THF) serving as the one-carbon carrier. This reaction serves as the major source of one-carbon groups required for the biosynthesis of purines, thymidylate, methionine, and other important biomolecules. Also exhibits THF- independent aldolase activity toward beta-hydroxyamino acids, producing glycine and aldehydes, via a retro-aldol mechanism	glyA	-	ko:K00600	ko00260,ko00460,ko00630,ko00670,ko00680,ko01100,ko01110,ko01120,ko01130,ko01200,ko01230,ko01523,map00260,map00460,map00630,map00670,map00680,map01100,map01110,map01120,map01130,map01200,map01230,map01523	ko00000,ko00001,ko00002,ko01000	SHMT
1571	STX92646.1	1268635.Loa_01022	2.3e-90	266.0	COG1327@1|root,COG1327@2|Bacteria,1RE7V@1224|Proteobacteria,1S3P9@1236|Gammaproteobacteria,1JCAZ@118969|Legionellales	Negatively regulates transcription of bacterial ribonucleotide reductase nrd genes and operons by binding to NrdR- boxes	nrdR	-	ko:K07738	-	ko00000,ko03000	ATP-cone
1571	STX92647.1	1122164.JHWF01000030_gene2336	1.09e-71	218.0	COG0781@1|root,COG0781@2|Bacteria,1RHFZ@1224|Proteobacteria,1S6AJ@1236|Gammaproteobacteria,1JEBW@118969|Legionellales	Involved in transcription antitermination. Required for transcription of ribosomal RNA (rRNA) genes. Binds specifically to the boxA antiterminator sequence of the ribosomal RNA (rrn) operons	nusB	-	ko:K03625	-	ko00000,ko03009,ko03021	NusB
1571	STX92648.1	1122164.JHWF01000030_gene2337	5.76e-139	402.0	COG0611@1|root,COG0611@2|Bacteria,1MU9X@1224|Proteobacteria,1RNHU@1236|Gammaproteobacteria,1JCN2@118969|Legionellales	Catalyzes the ATP-dependent phosphorylation of thiamine- monophosphate (TMP) to form thiamine-pyrophosphate (TPP), the active form of vitamin B1	thiL	-	ko:K00946	ko00730,ko01100,map00730,map01100	ko00000,ko00001,ko00002,ko01000	AIRS,AIRS_C
1571	STX92649.1	1268635.Loa_01027	4.13e-85	253.0	COG1267@1|root,COG1267@2|Bacteria,1MZJA@1224|Proteobacteria,1S68A@1236|Gammaproteobacteria,1JEC4@118969|Legionellales	Lipid phosphatase which dephosphorylates phosphatidylglycerophosphate (PGP) to phosphatidylglycerol (PG)	pgpA	-	ko:K01095	ko00564,ko01100,map00564,map01100	ko00000,ko00001,ko01000	PgpA
1571	STX92650.1	1268635.Loa_01028	3.69e-203	568.0	COG0628@1|root,COG0628@2|Bacteria,1MVX7@1224|Proteobacteria,1RNN1@1236|Gammaproteobacteria,1JC6U@118969|Legionellales	AI-2E family transporter	-	-	-	-	-	AI-2E_transport
1571	STX92651.1	1268635.Loa_01029	1.45e-42	140.0	2A9EA@1|root,30YJP@2|Bacteria,1QBFS@1224|Proteobacteria,1T70U@1236|Gammaproteobacteria,1JEPE@118969|Legionellales	-	-	-	-	-	-	-
1571	STX92652.1	1268635.Loa_01030	3.65e-76	238.0	COG0834@1|root,COG0834@2|Bacteria,1NT2J@1224|Proteobacteria,1S077@1236|Gammaproteobacteria,1JDYC@118969|Legionellales	Bacterial periplasmic substrate-binding proteins	-	-	ko:K09997	ko02010,map02010	ko00000,ko00001,ko00002,ko02000	SBP_bac_3
1571	STX92653.1	1094715.CM001373_gene1990	0.0	937.0	COG1391@1|root,COG1391@2|Bacteria,1MU4I@1224|Proteobacteria,1RP9N@1236|Gammaproteobacteria,1JDVE@118969|Legionellales	Involved in the regulation of glutamine synthetase GlnA, a key enzyme in the process to assimilate ammonia. When cellular nitrogen levels are high, the C-terminal adenylyl transferase (AT) inactivates GlnA by covalent transfer of an adenylyl group from ATP to specific tyrosine residue of GlnA, thus reducing its activity. Conversely, when nitrogen levels are low, the N-terminal adenylyl removase (AR) activates GlnA by removing the adenylyl group by phosphorolysis, increasing its activity. The regulatory region of GlnE binds the signal transduction protein PII (GlnB) which indicates the nitrogen status of the cell	glnE	-	ko:K00982	-	ko00000,ko01000	GlnD_UR_UTase,GlnE
1571	STX92654.1	1408444.JHYC01000004_gene743	2.8e-271	748.0	COG0621@1|root,COG0621@2|Bacteria,1MU7N@1224|Proteobacteria,1RN46@1236|Gammaproteobacteria,1JC7M@118969|Legionellales	Catalyzes the methylthiolation of an aspartic acid residue of ribosomal protein S12	rimO	-	ko:K14441	-	ko00000,ko01000,ko03009	Radical_SAM,TRAM,UPF0004
1571	STX92655.1	1268635.Loa_01034	1.88e-251	709.0	COG4232@1|root,COG4232@2|Bacteria,1MU8W@1224|Proteobacteria,1RPF7@1236|Gammaproteobacteria,1JC8Z@118969|Legionellales	Thiol disulfide interchange protein DsbD	lidC	-	ko:K04084	-	ko00000,ko01000,ko03110	DsbC,DsbD,Thioredoxin,Thioredoxin_7
1571	STX92656.1	1268635.Loa_01035	1.43e-57	179.0	COG0234@1|root,COG0234@2|Bacteria,1MZ2X@1224|Proteobacteria,1S8YR@1236|Gammaproteobacteria,1JEPU@118969|Legionellales	Binds to Cpn60 in the presence of Mg-ATP and suppresses the ATPase activity of the latter	groS	GO:0003674,GO:0005488,GO:0005515,GO:0006457,GO:0006458,GO:0006950,GO:0006986,GO:0008150,GO:0009987,GO:0010033,GO:0035966,GO:0042221,GO:0043167,GO:0043169,GO:0046872,GO:0050896,GO:0051082,GO:0051084,GO:0051085,GO:0051087,GO:0061077	ko:K04078	-	ko00000,ko03029,ko03110	Cpn10
1571	STX92657.1	1268635.Loa_01036	0.0	946.0	COG0459@1|root,COG0459@2|Bacteria,1MURR@1224|Proteobacteria,1RMTB@1236|Gammaproteobacteria,1JCJI@118969|Legionellales	Prevents misfolding and promotes the refolding and proper assembly of unfolded polypeptides generated under stress conditions	groL	GO:0003674,GO:0005488,GO:0005515,GO:0005575,GO:0005622,GO:0005623,GO:0005737,GO:0005829,GO:0006457,GO:0006458,GO:0008150,GO:0009986,GO:0009987,GO:0016465,GO:0018995,GO:0022610,GO:0030430,GO:0032991,GO:0033643,GO:0033644,GO:0033646,GO:0033647,GO:0033648,GO:0033655,GO:0043656,GO:0043657,GO:0043900,GO:0043903,GO:0044174,GO:0044175,GO:0044183,GO:0044215,GO:0044216,GO:0044217,GO:0044218,GO:0044279,GO:0044403,GO:0044406,GO:0044419,GO:0044424,GO:0044444,GO:0044445,GO:0044464,GO:0044650,GO:0044764,GO:0046812,GO:0050789,GO:0051082,GO:0051704,GO:0061077,GO:0065007,GO:0101031,GO:1990220,GO:2000535	ko:K04077	ko03018,ko04212,ko04940,ko05134,ko05152,map03018,map04212,map04940,map05134,map05152	ko00000,ko00001,ko03019,ko03029,ko03110,ko04147	Cpn60_TCP1
1571	STX92658.1	1034943.BN1094_02828	8.29e-116	344.0	2C1VH@1|root,2Z7Z3@2|Bacteria,1MY5B@1224|Proteobacteria,1RRVD@1236|Gammaproteobacteria,1JDAR@118969|Legionellales	3-deoxy-D-manno-oct-2-ulosonic acid (Kdo) hydroxylase	-	-	-	-	-	Kdo_hydroxy
1571	STX92660.1	1268635.Loa_01039	1.57e-80	241.0	COG0783@1|root,COG0783@2|Bacteria,1RAC5@1224|Proteobacteria,1S2H7@1236|Gammaproteobacteria,1JED3@118969|Legionellales	Belongs to the Dps family	-	-	ko:K04047	-	ko00000,ko03036	Ferritin
1571	STX92662.1	1408444.JHYC01000008_gene1391	1.52e-261	745.0	COG0421@1|root,COG0421@2|Bacteria,1N1PJ@1224|Proteobacteria,1RQ09@1236|Gammaproteobacteria,1JCXS@118969|Legionellales	Catalyzes the irreversible transfer of a propylamine group from the amino donor S-adenosylmethioninamine (decarboxy- AdoMet) to putrescine (1,4-diaminobutane) to yield spermidine	-	-	-	-	-	-
1571	STX92663.1	1122165.AUHS01000005_gene1661	7.65e-132	404.0	2BQH7@1|root,32JCS@2|Bacteria,1PCXX@1224|Proteobacteria,1SY3J@1236|Gammaproteobacteria,1JD9Y@118969|Legionellales	-	-	-	-	-	-	-
1571	STX92664.1	1268635.Loa_01047	4.64e-75	246.0	2A1G9@1|root,30PPU@2|Bacteria,1QBN5@1224|Proteobacteria,1T77Z@1236|Gammaproteobacteria,1JF0Y@118969|Legionellales	-	-	-	-	-	-	-
1571	STX92665.1	297246.lpp2527	6.37e-66	209.0	2BM9N@1|root,32FTH@2|Bacteria,1QBG2@1224|Proteobacteria,1T716@1236|Gammaproteobacteria,1JEQ2@118969|Legionellales	-	-	-	-	-	-	-
1571	STX92666.1	1408444.JHYC01000004_gene768	0.0	1058.0	COG0187@1|root,COG0187@2|Bacteria,1MVH1@1224|Proteobacteria,1RMCI@1236|Gammaproteobacteria,1JCNN@118969|Legionellales	Topoisomerase IV is essential for chromosome segregation. It relaxes supercoiled DNA. Performs the decatenation events required during the replication of a circular DNA molecule	parE	-	ko:K02622	-	ko00000,ko01000,ko02048,ko03032,ko03036	DNA_gyraseB,DNA_gyraseB_C,HATPase_c,Toprim
1571	STX92667.1	1268635.Loa_01049	9.85e-175	497.0	COG0489@1|root,COG0489@2|Bacteria,1MU7R@1224|Proteobacteria,1RMJF@1236|Gammaproteobacteria,1JCBE@118969|Legionellales	Binds and transfers iron-sulfur (Fe-S) clusters to target apoproteins. Can hydrolyze ATP	mrp	-	ko:K03593	-	ko00000,ko03029,ko03036	ParA
1571	STX92668.1	1268635.Loa_01050	0.0	1193.0	COG1074@1|root,COG1074@2|Bacteria,1MUTF@1224|Proteobacteria,1RPC6@1236|Gammaproteobacteria,1JCE8@118969|Legionellales	Belongs to the helicase family. UvrD subfamily	-	-	-	-	-	PDDEXK_1,UvrD-helicase,UvrD_C
1571	STX92669.1	1268635.Loa_01051	0.0	1320.0	COG0019@1|root,COG0527@1|root,COG0019@2|Bacteria,COG0527@2|Bacteria,1MUA6@1224|Proteobacteria,1SZXB@1236|Gammaproteobacteria,1JD6X@118969|Legionellales	Belongs to the Orn Lys Arg decarboxylase class-II family	lysAC	-	ko:K12526	ko00260,ko00261,ko00270,ko00300,ko01100,ko01110,ko01120,ko01130,ko01230,map00260,map00261,map00270,map00300,map01100,map01110,map01120,map01130,map01230	ko00000,ko00001,ko00002,ko01000	AA_kinase,Orn_Arg_deC_N,Orn_DAP_Arg_deC
1571	STX92672.1	1268635.Loa_01055	6.32e-231	647.0	COG2067@1|root,COG2067@2|Bacteria,1MUU4@1224|Proteobacteria,1RQZJ@1236|Gammaproteobacteria,1JCSI@118969|Legionellales	Outer membrane protein transport protein (OMPP1/FadL/TodX)	-	-	ko:K06076	-	ko00000,ko02000	Toluene_X
1571	STX92673.1	658187.LDG_5763	3.07e-199	620.0	COG0653@1|root,COG0653@2|Bacteria,1PCWB@1224|Proteobacteria,1SY12@1236|Gammaproteobacteria,1JD7F@118969|Legionellales	SecA DEAD-like domain	-	-	-	-	-	SecA_DEAD
1571	STX92674.1	1122169.AREN01000003_gene1229	1.2e-47	156.0	2AP62@1|root,31E7S@2|Bacteria,1QBHB@1224|Proteobacteria,1T72H@1236|Gammaproteobacteria,1JES7@118969|Legionellales	-	-	-	-	-	-	-
1571	STX92675.1	1034943.BN1094_01376	4.22e-172	488.0	COG0809@1|root,COG0809@2|Bacteria,1MUH3@1224|Proteobacteria,1RMKW@1236|Gammaproteobacteria,1JCUW@118969|Legionellales	Transfers and isomerizes the ribose moiety from AdoMet to the 7-aminomethyl group of 7-deazaguanine (preQ1-tRNA) to give epoxyqueuosine (oQ-tRNA)	queA	GO:0002097,GO:0002099,GO:0003674,GO:0003824,GO:0006139,GO:0006396,GO:0006399,GO:0006400,GO:0006725,GO:0006807,GO:0008033,GO:0008150,GO:0008152,GO:0008616,GO:0009058,GO:0009116,GO:0009119,GO:0009163,GO:0009451,GO:0009987,GO:0010467,GO:0016070,GO:0016740,GO:0016853,GO:0018130,GO:0019438,GO:0034404,GO:0034470,GO:0034641,GO:0034654,GO:0034660,GO:0042455,GO:0043170,GO:0043412,GO:0044237,GO:0044238,GO:0044249,GO:0044271,GO:0044281,GO:0044283,GO:0046116,GO:0046483,GO:0051075,GO:0055086,GO:0071704,GO:0090304,GO:0140098,GO:0140101,GO:1901135,GO:1901137,GO:1901360,GO:1901362,GO:1901564,GO:1901566,GO:1901576,GO:1901657,GO:1901659	ko:K07568	-	ko00000,ko01000,ko03016	Queuosine_synth
1571	STX92676.1	1268635.Loa_01058	2.1e-73	233.0	COG0343@1|root,COG0343@2|Bacteria,1QB0A@1224|Proteobacteria,1T6H7@1236|Gammaproteobacteria,1JDKR@118969|Legionellales	Queuine tRNA-ribosyltransferase	tgt_1	-	ko:K00773	-	ko00000,ko01000,ko03016	TGT
1571	STX92677.1	1268635.Loa_01059	2.56e-58	182.0	COG1862@1|root,COG1862@2|Bacteria,1MZT2@1224|Proteobacteria,1S9NV@1236|Gammaproteobacteria,1JEPK@118969|Legionellales	Preprotein translocase subunit	yajC	-	ko:K03210	ko02024,ko03060,ko03070,map02024,map03060,map03070	ko00000,ko00001,ko00002,ko02044	YajC
1571	STX92678.1	1268635.Loa_01060	0.0	989.0	COG0342@1|root,COG0342@2|Bacteria,1MV5U@1224|Proteobacteria,1RMIQ@1236|Gammaproteobacteria,1JD93@118969|Legionellales	Part of the Sec protein translocase complex. Interacts with the SecYEG preprotein conducting channel. SecDF uses the proton motive force (PMF) to complete protein translocation after the ATP-dependent function of SecA	secD	-	ko:K03072	ko03060,ko03070,map03060,map03070	ko00000,ko00001,ko00002,ko02044	SecD-TM1,SecD_SecF,Sec_GG
1571	STX92679.1	1268635.Loa_01061	4.09e-184	516.0	COG0341@1|root,COG0341@2|Bacteria,1MU74@1224|Proteobacteria,1RNTY@1236|Gammaproteobacteria,1JDHW@118969|Legionellales	Part of the Sec protein translocase complex. Interacts with the SecYEG preprotein conducting channel. SecDF uses the proton motive force (PMF) to complete protein translocation after the ATP-dependent function of SecA	secF	-	ko:K03074	ko03060,ko03070,map03060,map03070	ko00000,ko00001,ko00002,ko02044	SecD_SecF,Sec_GG
1571	STX92680.1	1122165.AUHS01000013_gene31	1.08e-60	188.0	COG2154@1|root,COG2154@2|Bacteria,1RH99@1224|Proteobacteria,1SAUS@1236|Gammaproteobacteria,1JEIT@118969|Legionellales	4-alpha-hydroxytetrahydrobiopterin dehydratase activity	phs	-	ko:K01724	ko00790,map00790	ko00000,ko00001,ko01000,ko04147	Pterin_4a
1571	STX92681.1	1268635.Loa_01063	7.88e-172	490.0	COG0079@1|root,COG0079@2|Bacteria,1MW7I@1224|Proteobacteria,1RP4T@1236|Gammaproteobacteria,1JC98@118969|Legionellales	Belongs to the class-II pyridoxal-phosphate-dependent aminotransferase family. Histidinol-phosphate aminotransferase subfamily	hisC-2	-	ko:K00817	ko00340,ko00350,ko00360,ko00400,ko00401,ko00960,ko01100,ko01110,ko01130,ko01230,map00340,map00350,map00360,map00400,map00401,map00960,map01100,map01110,map01130,map01230	ko00000,ko00001,ko00002,ko01000,ko01007	Aminotran_1_2
1571	STX92682.1	658187.LDG_7615	1.78e-07	52.8	COG4967@1|root,COG4967@2|Bacteria,1QBUM@1224|Proteobacteria,1T7F5@1236|Gammaproteobacteria,1JFAV@118969|Legionellales	Prokaryotic N-terminal methylation motif	-	-	-	-	-	N_methyl
1571	STX92683.1	1268635.Loa_01065	1.41e-62	203.0	COG4966@1|root,COG4966@2|Bacteria,1QB9V@1224|Proteobacteria,1T6UD@1236|Gammaproteobacteria,1JE9K@118969|Legionellales	pilus assembly protein PilW	-	-	-	-	-	N_methyl
1571	STX92684.1	272624.lpg1995	9.11e-22	94.4	2AP4Q@1|root,31E6B@2|Bacteria,1QBFV@1224|Proteobacteria,1T70Y@1236|Gammaproteobacteria,1JEPM@118969|Legionellales	-	-	-	-	-	-	-
1571	STX92685.1	658187.LDG_6250	4.32e-96	299.0	COG2839@1|root,COG2839@2|Bacteria,1QB27@1224|Proteobacteria,1T6JE@1236|Gammaproteobacteria,1JDRH@118969|Legionellales	Protein conserved in bacteria	-	-	-	-	-	-
1571	STX92686.1	1094715.CM001373_gene3098	6.53e-73	269.0	2ANYA@1|root,31DZ9@2|Bacteria,1QB99@1224|Proteobacteria,1T6TN@1236|Gammaproteobacteria,1JE89@118969|Legionellales	-	-	-	-	-	-	Ank_2
1571	STX92688.1	1122164.JHWF01000053_gene1421	1.64e-190	542.0	COG0334@1|root,COG0334@2|Bacteria,1MUMF@1224|Proteobacteria,1RPUZ@1236|Gammaproteobacteria,1JDV0@118969|Legionellales	Glutamate/Leucine/Phenylalanine/Valine dehydrogenase	rocG	-	ko:K00262	ko00220,ko00250,ko00910,ko01100,map00220,map00250,map00910,map01100	ko00000,ko00001,ko01000	ELFV_dehydrog,ELFV_dehydrog_N
1571	STX92690.1	658187.LDG_8953	1.22e-27	104.0	2ECSH@1|root,336Q2@2|Bacteria,1QBQ8@1224|Proteobacteria,1T7A9@1236|Gammaproteobacteria,1JF4B@118969|Legionellales	-	-	-	-	-	-	-
1571	STX92692.1	658187.LDG_6592	0.0	1226.0	COG0653@1|root,COG0653@2|Bacteria,1PBW7@1224|Proteobacteria,1SWMF@1236|Gammaproteobacteria,1JD3B@118969|Legionellales	protein targeting	-	-	-	-	-	-
1571	STX92693.1	1122169.AREN01000023_gene1632	4.19e-186	522.0	COG0543@1|root,COG1018@1|root,COG0543@2|Bacteria,COG1018@2|Bacteria,1R8HS@1224|Proteobacteria,1S3SS@1236|Gammaproteobacteria,1JCTY@118969|Legionellales	2Fe-2S iron-sulfur cluster binding domain	-	-	-	-	-	FAD_binding_6,Fer2,NAD_binding_1
1571	STX92694.1	1122169.AREN01000023_gene1633	9.72e-75	224.0	COG2346@1|root,COG2346@2|Bacteria,1QBDD@1224|Proteobacteria,1S8K7@1236|Gammaproteobacteria,1JEI5@118969|Legionellales	Bacterial-like globin	-	-	ko:K06886	-	ko00000	Bac_globin
1571	STX92695.1	1122169.AREN01000023_gene1634	3.6e-86	255.0	COG1959@1|root,COG1959@2|Bacteria,1N05H@1224|Proteobacteria,1S8SJ@1236|Gammaproteobacteria,1JEA6@118969|Legionellales	Transcriptional regulator	-	-	ko:K13771	ko05132,map05132	ko00000,ko00001,ko03000	Rrf2
1571	STX92696.1	1122169.AREN01000023_gene1636	1.06e-163	464.0	COG0500@1|root,COG3615@1|root,COG2226@2|Bacteria,COG3615@2|Bacteria,1QUE9@1224|Proteobacteria,1T1VU@1236|Gammaproteobacteria,1JCRT@118969|Legionellales	Domain of unknown function (DUF1971)	-	-	ko:K16868	-	ko00000,ko01000	DUF1971,TehB
1571	STX92697.1	297246.lpp1521	5.41e-116	338.0	COG1814@1|root,COG1814@2|Bacteria,1MUZE@1224|Proteobacteria,1RS3D@1236|Gammaproteobacteria,1JGIA@118969|Legionellales	VIT family	-	-	-	-	-	VIT1
1571	STX92698.1	1123514.KB905900_gene2162	1.1e-312	872.0	COG2217@1|root,COG2217@2|Bacteria,1MU08@1224|Proteobacteria,1RN2C@1236|Gammaproteobacteria,45ZPW@72273|Thiotrichales	heavy metal translocating P-type ATPase	-	-	ko:K01533	-	ko00000,ko01000	E1-E2_ATPase,Hydrolase
