key	query	seed_ortholog	evalue	score	eggNOG_OGs	description	preferred_name	GOs	KEGG_ko	KEGG_pathway	brite	PFAMs
1647	EDX41490.1	349123.Lreu23DRAFT_3001	3.29e-185	514.0	COG0020@1|root,COG0020@2|Bacteria,1TQTS@1239|Firmicutes,4HA37@91061|Bacilli,3F42M@33958|Lactobacillaceae	Catalyzes the condensation of isopentenyl diphosphate (IPP) with allylic pyrophosphates generating different type of terpenoids	uppS	GO:0002094,GO:0003674,GO:0003824,GO:0004659,GO:0005575,GO:0005622,GO:0005623,GO:0005737,GO:0005829,GO:0006066,GO:0006629,GO:0006720,GO:0008150,GO:0008152,GO:0008299,GO:0008610,GO:0009058,GO:0009987,GO:0016093,GO:0016094,GO:0016740,GO:0016765,GO:0044237,GO:0044238,GO:0044249,GO:0044255,GO:0044281,GO:0044283,GO:0044424,GO:0044444,GO:0044464,GO:0046165,GO:0071704,GO:1901576,GO:1901615,GO:1901617	ko:K00806	ko00900,ko01110,map00900,map01110	ko00000,ko00001,ko01000,ko01006	Prenyltransf
1647	EDX41491.1	349123.Lreu23DRAFT_3002	6.08e-180	501.0	COG0575@1|root,COG0575@2|Bacteria,1UPNB@1239|Firmicutes,4IV81@91061|Bacilli,3F4AF@33958|Lactobacillaceae	Belongs to the CDS family	cdsA	-	ko:K00981	ko00564,ko01100,ko01110,ko04070,map00564,map01100,map01110,map04070	ko00000,ko00001,ko00002,ko01000	CTP_transf_1
1647	EDX41492.1	349123.Lreu23DRAFT_3003	8.1e-299	816.0	COG0750@1|root,COG0750@2|Bacteria,1TPMC@1239|Firmicutes,4HAQ5@91061|Bacilli,3F3TM@33958|Lactobacillaceae	zinc metalloprotease	rseP	-	ko:K11749	ko02024,ko04112,map02024,map04112	ko00000,ko00001,ko01000,ko01002	PDZ_2,Peptidase_M50
1647	EDX41493.1	349123.Lreu23DRAFT_3004	0.0	1126.0	COG0442@1|root,COG0442@2|Bacteria,1TRBV@1239|Firmicutes,4H9NN@91061|Bacilli,3F44A@33958|Lactobacillaceae	Catalyzes the attachment of proline to tRNA(Pro) in a two-step reaction proline is first activated by ATP to form Pro- AMP and then transferred to the acceptor end of tRNA(Pro). As ProRS can inadvertently accommodate and process non-cognate amino acids such as alanine and cysteine, to avoid such errors it has two additional distinct editing activities against alanine. One activity is designated as 'pretransfer' editing and involves the tRNA(Pro)-independent hydrolysis of activated Ala-AMP. The other activity is designated 'posttransfer' editing and involves deacylation of mischarged Ala-tRNA(Pro). The misacylated Cys- tRNA(Pro) is not edited by ProRS	proS	-	ko:K01881	ko00970,map00970	ko00000,ko00001,ko00002,ko01000,ko01007,ko03016	HGTP_anticodon,tRNA-synt_2b,tRNA_edit
1647	EDX41494.1	349123.Lreu23DRAFT_3005	0.0	2871.0	COG2176@1|root,COG2176@2|Bacteria,1TPAG@1239|Firmicutes,4H9RF@91061|Bacilli,3F4AN@33958|Lactobacillaceae	Required for replicative DNA synthesis. This DNA polymerase also exhibits 3' to 5' exonuclease activity	polC	GO:0005575,GO:0005622,GO:0005623,GO:0005737,GO:0044424,GO:0044464	ko:K03763	ko00230,ko00240,ko01100,ko03030,ko03430,ko03440,map00230,map00240,map01100,map03030,map03430,map03440	ko00000,ko00001,ko00002,ko01000,ko03032,ko03400	DNA_pol3_a_NI,DNA_pol3_a_NII,DNA_pol3_alpha,HHH_6,PHP,RNase_T,tRNA_anti-codon
1647	EDX41495.1	349123.Lreu23DRAFT_3006	7.73e-109	313.0	COG0779@1|root,COG0779@2|Bacteria,1V6KT@1239|Firmicutes,4HH88@91061|Bacilli,3F6GZ@33958|Lactobacillaceae	Required for maturation of 30S ribosomal subunits	rimP	GO:0000028,GO:0005575,GO:0005622,GO:0005623,GO:0005737,GO:0005829,GO:0006412,GO:0006518,GO:0006807,GO:0006996,GO:0008150,GO:0008152,GO:0009058,GO:0009059,GO:0009987,GO:0010467,GO:0016043,GO:0019538,GO:0022607,GO:0022613,GO:0022618,GO:0034622,GO:0034641,GO:0034645,GO:0042254,GO:0042255,GO:0042274,GO:0043043,GO:0043170,GO:0043603,GO:0043604,GO:0043933,GO:0044085,GO:0044237,GO:0044238,GO:0044249,GO:0044260,GO:0044267,GO:0044271,GO:0044424,GO:0044444,GO:0044464,GO:0065003,GO:0070925,GO:0071704,GO:0071826,GO:0071840,GO:1901564,GO:1901566,GO:1901576	ko:K09748	-	ko00000,ko03009	DUF150,DUF150_C
1647	EDX41496.1	349123.Lreu23DRAFT_3007	5.85e-274	750.0	COG0195@1|root,COG0195@2|Bacteria,1TPB3@1239|Firmicutes,4HA7F@91061|Bacilli,3F3KZ@33958|Lactobacillaceae	Participates in both transcription termination and antitermination	nusA	GO:0005575,GO:0005622,GO:0005623,GO:0005737,GO:0005829,GO:0006355,GO:0008150,GO:0009889,GO:0010468,GO:0010556,GO:0019219,GO:0019222,GO:0031323,GO:0031326,GO:0031554,GO:0031564,GO:0043244,GO:0044424,GO:0044444,GO:0044464,GO:0050789,GO:0050794,GO:0051128,GO:0051171,GO:0051252,GO:0060255,GO:0065007,GO:0080090,GO:1903506,GO:2000112,GO:2001141	ko:K02600	-	ko00000,ko03009,ko03021	KH_5,NusA_N,S1
1647	EDX41497.1	349123.Lreu23DRAFT_3008	1.4e-58	181.0	COG2740@1|root,COG2740@2|Bacteria,1VEJS@1239|Firmicutes,4HKBY@91061|Bacilli,3F7E2@33958|Lactobacillaceae	Protein of unknown function (DUF448)	ylxR	-	ko:K07742	-	ko00000	DUF448
1647	EDX41498.1	349123.Lreu23DRAFT_3009	2.29e-64	196.0	COG1358@1|root,COG1358@2|Bacteria,1VEYG@1239|Firmicutes,4HNY7@91061|Bacilli,3F7ZK@33958|Lactobacillaceae	ribosomal protein	ylxQ	-	-	-	-	Ribosomal_L7Ae
1647	EDX41499.1	349123.Lreu23DRAFT_3010	0.0	1364.0	COG0532@1|root,COG0532@2|Bacteria,1TPAI@1239|Firmicutes,4HA8S@91061|Bacilli,3F3JV@33958|Lactobacillaceae	One of the essential components for the initiation of protein synthesis. Protects formylmethionyl-tRNA from spontaneous hydrolysis and promotes its binding to the 30S ribosomal subunits. Also involved in the hydrolysis of GTP during the formation of the 70S ribosomal complex	infB	GO:0005575,GO:0005622,GO:0005623,GO:0005737,GO:0044424,GO:0044464	ko:K02519	-	ko00000,ko03012,ko03029	GTP_EFTU,IF-2,IF2_N
1647	EDX41500.1	349123.Lreu23DRAFT_3011	2.79e-77	230.0	COG0858@1|root,COG0858@2|Bacteria,1VA0P@1239|Firmicutes,4HII1@91061|Bacilli,3F6WZ@33958|Lactobacillaceae	One of several proteins that assist in the late maturation steps of the functional core of the 30S ribosomal subunit. Associates with free 30S ribosomal subunits (but not with 30S subunits that are part of 70S ribosomes or polysomes). Required for efficient processing of 16S rRNA. May interact with the 5'-terminal helix region of 16S rRNA	rbfA	-	ko:K02834	-	ko00000,ko03009	RBFA
1647	EDX41501.1	349123.Lreu23DRAFT_3012	9.98e-215	593.0	COG0130@1|root,COG0130@2|Bacteria,1TP9Y@1239|Firmicutes,4HA9X@91061|Bacilli,3F3NX@33958|Lactobacillaceae	Responsible for synthesis of pseudouridine from uracil- 55 in the psi GC loop of transfer RNAs	truB	GO:0001522,GO:0003674,GO:0003824,GO:0006139,GO:0006396,GO:0006399,GO:0006400,GO:0006725,GO:0006807,GO:0008033,GO:0008150,GO:0008152,GO:0009451,GO:0009982,GO:0009987,GO:0010467,GO:0016070,GO:0016071,GO:0016556,GO:0016853,GO:0016866,GO:0034470,GO:0034641,GO:0034660,GO:0043170,GO:0043412,GO:0044237,GO:0044238,GO:0046483,GO:0071704,GO:0090304,GO:1901360,GO:1990481	ko:K03177,ko:K03483	-	ko00000,ko01000,ko03000,ko03016	TruB-C_2,TruB_C_2,TruB_N
1647	EDX41502.1	349123.Lreu23DRAFT_3013	4.84e-229	630.0	COG0196@1|root,COG0196@2|Bacteria,1TPKS@1239|Firmicutes,4H9KE@91061|Bacilli,3F3TG@33958|Lactobacillaceae	Belongs to the ribF family	ribF	-	ko:K11753	ko00740,ko01100,ko01110,map00740,map01100,map01110	ko00000,ko00001,ko00002,ko01000	FAD_syn,Flavokinase
1647	EDX41503.1	349123.Lreu23DRAFT_3014	8.85e-85	249.0	2A5X0@1|root,30UP0@2|Bacteria,1U6DW@1239|Firmicutes,4IG5K@91061|Bacilli,3F7P8@33958|Lactobacillaceae	-	-	-	-	-	-	-
1647	EDX41504.1	349123.Lreu23DRAFT_3015	3.23e-247	679.0	COG1420@1|root,COG1420@2|Bacteria,1TQP7@1239|Firmicutes,4HAX5@91061|Bacilli,3F3ST@33958|Lactobacillaceae	Negative regulator of class I heat shock genes (grpE- dnaK-dnaJ and groELS operons). Prevents heat-shock induction of these operons	hrcA	GO:0006355,GO:0008150,GO:0009889,GO:0009890,GO:0009892,GO:0010468,GO:0010556,GO:0010558,GO:0010605,GO:0010629,GO:0019219,GO:0019222,GO:0031323,GO:0031324,GO:0031326,GO:0031327,GO:0045892,GO:0045934,GO:0048519,GO:0048523,GO:0050789,GO:0050794,GO:0051171,GO:0051172,GO:0051252,GO:0051253,GO:0060255,GO:0065007,GO:0080090,GO:1902679,GO:1903506,GO:1903507,GO:2000112,GO:2000113,GO:2001141	ko:K03705	-	ko00000,ko03000	HrcA,HrcA_DNA-bdg
1647	EDX41505.1	349123.Lreu23DRAFT_3016	1.1e-115	333.0	COG0576@1|root,COG0576@2|Bacteria,1V6G2@1239|Firmicutes,4HIRK@91061|Bacilli,3F4DY@33958|Lactobacillaceae	Participates actively in the response to hyperosmotic and heat shock by preventing the aggregation of stress-denatured proteins, in association with DnaK and GrpE. It is the nucleotide exchange factor for DnaK and may function as a thermosensor. Unfolded proteins bind initially to DnaJ	grpE	GO:0000166,GO:0000774,GO:0001871,GO:0003674,GO:0005488,GO:0005515,GO:0005575,GO:0005623,GO:0008150,GO:0009986,GO:0017076,GO:0030234,GO:0030246,GO:0030247,GO:0030554,GO:0036094,GO:0044464,GO:0050790,GO:0051082,GO:0060589,GO:0060590,GO:0065007,GO:0065009,GO:0097159,GO:0098772,GO:1901265,GO:1901363,GO:2001065	ko:K03687	-	ko00000,ko03029,ko03110	GrpE
1647	EDX41506.1	349123.Lreu23DRAFT_3017	0.0	1160.0	COG0443@1|root,COG0443@2|Bacteria,1TP1J@1239|Firmicutes,4HA9S@91061|Bacilli,3F48C@33958|Lactobacillaceae	Heat shock 70 kDa protein	dnaK	GO:0001871,GO:0003674,GO:0005488,GO:0005575,GO:0005623,GO:0008150,GO:0009986,GO:0030246,GO:0030247,GO:0044464,GO:0051704,GO:0098630,GO:0098743,GO:2001065	ko:K04043	ko03018,ko04212,ko05152,map03018,map04212,map05152	ko00000,ko00001,ko03019,ko03029,ko03110,ko04147	HSP70
1647	EDX41507.1	349123.Lreu23DRAFT_3018	5.41e-274	749.0	COG0484@1|root,COG0484@2|Bacteria,1TP00@1239|Firmicutes,4H9KA@91061|Bacilli,3F490@33958|Lactobacillaceae	ATP binding to DnaK triggers the release of the substrate protein, thus completing the reaction cycle. Several rounds of ATP-dependent interactions between DnaJ, DnaK and GrpE are required for fully efficient folding. Also involved, together with DnaK and GrpE, in the DNA replication of plasmids through activation of initiation proteins	dnaJ	-	ko:K03686	-	ko00000,ko03029,ko03110	DnaJ,DnaJ_C,DnaJ_CXXCXGXG
1647	EDX41508.1	349123.Lreu23DRAFT_3019	0.0	1187.0	COG0481@1|root,COG0481@2|Bacteria,1TP0G@1239|Firmicutes,4HASA@91061|Bacilli,3F3Z1@33958|Lactobacillaceae	Required for accurate and efficient protein synthesis under certain stress conditions. May act as a fidelity factor of the translation reaction, by catalyzing a one-codon backward translocation of tRNAs on improperly translocated ribosomes. Back- translocation proceeds from a post-translocation (POST) complex to a pre-translocation (PRE) complex, thus giving elongation factor G a second chance to translocate the tRNAs correctly. Binds to ribosomes in a GTP-dependent manner	lepA	-	ko:K03596	ko05134,map05134	ko00000,ko00001	EFG_C,EFG_II,GTP_EFTU,GTP_EFTU_D2,LepA_C
1647	EDX41509.1	349123.Lreu23DRAFT_3020	0.0	959.0	COG4690@1|root,COG4690@2|Bacteria,1TQ0F@1239|Firmicutes,4HC3G@91061|Bacilli,3F3M4@33958|Lactobacillaceae	Dipeptidase	pepD3	-	ko:K08659	-	ko00000,ko01000,ko01002	Peptidase_C69
1647	EDX41510.1	349123.Lreu23DRAFT_3021	7.44e-257	704.0	COG2055@1|root,COG2055@2|Bacteria,1TR0Z@1239|Firmicutes,4HB6X@91061|Bacilli,3F4JZ@33958|Lactobacillaceae	Belongs to the LDH2 MDH2 oxidoreductase family	-	-	-	-	-	Ldh_2
1647	EDX41511.1	349123.Lreu23DRAFT_3022	4.58e-220	608.0	COG0039@1|root,COG0039@2|Bacteria,1TPSY@1239|Firmicutes,4HB0Z@91061|Bacilli,3F3RM@33958|Lactobacillaceae	Belongs to the LDH MDH superfamily. LDH family	ldh	-	ko:K00016	ko00010,ko00270,ko00620,ko00640,ko01100,ko01110,ko01120,ko01130,ko04922,map00010,map00270,map00620,map00640,map01100,map01110,map01120,map01130,map04922	ko00000,ko00001,ko01000,ko04147	Ldh_1_C,Ldh_1_N
1647	EDX41512.1	349123.Lreu23DRAFT_3023	5.58e-76	226.0	2FCQV@1|root,344U2@2|Bacteria,1W026@1239|Firmicutes,4HZ7F@91061|Bacilli,3F7FM@33958|Lactobacillaceae	-	-	-	-	-	-	-
1647	EDX41513.1	349123.Lreu23DRAFT_3024	3.98e-230	633.0	COG2264@1|root,COG2264@2|Bacteria,1TPKI@1239|Firmicutes,4HAMF@91061|Bacilli,3F47Z@33958|Lactobacillaceae	Ribosomal protein L11 methyltransferase	prmA	-	ko:K02687	-	ko00000,ko01000,ko03009	PrmA
1647	EDX41514.1	349123.Lreu23DRAFT_3025	3e-168	471.0	COG1385@1|root,COG1385@2|Bacteria,1V1CT@1239|Firmicutes,4HH8P@91061|Bacilli,3F64Z@33958|Lactobacillaceae	Specifically methylates the N3 position of the uracil ring of uridine 1498 (m3U1498) in 16S rRNA. Acts on the fully assembled 30S ribosomal subunit	rsmE	GO:0000154,GO:0001510,GO:0003674,GO:0003824,GO:0006139,GO:0006364,GO:0006396,GO:0006725,GO:0006807,GO:0008150,GO:0008152,GO:0008168,GO:0008170,GO:0008173,GO:0008649,GO:0008757,GO:0009451,GO:0009987,GO:0010467,GO:0016070,GO:0016072,GO:0016436,GO:0016740,GO:0016741,GO:0022613,GO:0031167,GO:0032259,GO:0034470,GO:0034641,GO:0034660,GO:0042254,GO:0043170,GO:0043412,GO:0043414,GO:0044085,GO:0044237,GO:0044238,GO:0044260,GO:0046483,GO:0070042,GO:0070475,GO:0071704,GO:0071840,GO:0090304,GO:0140098,GO:0140102,GO:1901360	ko:K09761	-	ko00000,ko01000,ko03009	Methyltrans_RNA
1647	EDX41515.1	349123.Lreu23DRAFT_3026	2.89e-73	219.0	2C2I6@1|root,30AJ5@2|Bacteria,1U6RR@1239|Firmicutes,4IGJ7@91061|Bacilli,3F8DM@33958|Lactobacillaceae	-	-	-	-	-	-	-
1647	EDX41516.1	349123.Lreu23DRAFT_3027	0.0	1467.0	COG0317@1|root,COG0317@2|Bacteria,1TNYZ@1239|Firmicutes,4HBX7@91061|Bacilli,3F44F@33958|Lactobacillaceae	In eubacteria ppGpp (guanosine 3'-diphosphate 5-' diphosphate) is a mediator of the stringent response that coordinates a variety of cellular activities in response to changes in nutritional abundance	relA	GO:0003674,GO:0003824,GO:0005575,GO:0005618,GO:0005623,GO:0005886,GO:0006139,GO:0006163,GO:0006725,GO:0006753,GO:0006793,GO:0006796,GO:0006807,GO:0006950,GO:0008150,GO:0008152,GO:0008728,GO:0008893,GO:0009116,GO:0009117,GO:0009119,GO:0009150,GO:0009259,GO:0009605,GO:0009987,GO:0009991,GO:0015969,GO:0016020,GO:0016740,GO:0016772,GO:0016778,GO:0016787,GO:0016788,GO:0016794,GO:0019637,GO:0019693,GO:0030312,GO:0031667,GO:0033865,GO:0033875,GO:0034032,GO:0034035,GO:0034641,GO:0042278,GO:0042578,GO:0042594,GO:0044237,GO:0044238,GO:0044281,GO:0044464,GO:0046128,GO:0046483,GO:0050896,GO:0055086,GO:0071704,GO:0071944,GO:0072521,GO:1901068,GO:1901135,GO:1901360,GO:1901564,GO:1901657	ko:K00951	ko00230,map00230	ko00000,ko00001,ko01000	ACT_4,HD_4,RelA_SpoT,TGS
1647	EDX41517.1	349123.Lreu23DRAFT_3028	6.54e-102	295.0	COG1490@1|root,COG1490@2|Bacteria,1V6GH@1239|Firmicutes,4HINN@91061|Bacilli,3F6GK@33958|Lactobacillaceae	rejects L-amino acids rather than detecting D-amino acids in the active site. By recycling D-aminoacyl-tRNA to D-amino acids and free tRNA molecules, this enzyme counteracts the toxicity associated with the formation of D-aminoacyl-tRNA entities in vivo and helps enforce protein L-homochirality	dtd	GO:0002161,GO:0003674,GO:0003824,GO:0005575,GO:0005622,GO:0005623,GO:0005737,GO:0006139,GO:0006399,GO:0006450,GO:0006725,GO:0006807,GO:0008150,GO:0008152,GO:0009987,GO:0016070,GO:0016787,GO:0016788,GO:0034641,GO:0034660,GO:0043170,GO:0044237,GO:0044238,GO:0044424,GO:0044464,GO:0046483,GO:0051499,GO:0051500,GO:0052689,GO:0065007,GO:0065008,GO:0071704,GO:0090304,GO:0106074,GO:0140098,GO:0140101,GO:1901360	ko:K07560	-	ko00000,ko01000,ko03016	Tyr_Deacylase
1647	EDX41518.1	349123.Lreu23DRAFT_3029	0.0	1063.0	COG4166@1|root,COG4166@2|Bacteria,1TNYQ@1239|Firmicutes,4HAMK@91061|Bacilli,3F3JE@33958|Lactobacillaceae	ABC transporter, substratebinding protein	oppA	-	ko:K02035,ko:K15580	ko01501,ko02010,ko02024,map01501,map02010,map02024	ko00000,ko00001,ko00002,ko02000	SBP_bac_5
1647	EDX41519.1	349123.Lreu23DRAFT_3030	5.06e-208	577.0	COG0601@1|root,COG0601@2|Bacteria,1TP1S@1239|Firmicutes,4HA2S@91061|Bacilli,3F42T@33958|Lactobacillaceae	ABC-type dipeptide oligopeptide nickel transport systems, permease components	oppB	-	ko:K15581	ko01501,ko02010,ko02024,map01501,map02010,map02024	ko00000,ko00001,ko00002,ko02000	BPD_transp_1
1647	EDX41520.1	349123.Lreu23DRAFT_3031	1.71e-211	585.0	COG1173@1|root,COG1173@2|Bacteria,1TP4R@1239|Firmicutes,4H9PZ@91061|Bacilli,3F3W3@33958|Lactobacillaceae	ABC-type dipeptide oligopeptide nickel transport systems, permease components	oppC	-	ko:K15582	ko01501,ko02010,ko02024,map01501,map02010,map02024	ko00000,ko00001,ko00002,ko02000	BPD_transp_1,OppC_N
1647	EDX41521.1	349123.Lreu23DRAFT_3032	9.33e-252	691.0	COG0444@1|root,COG0444@2|Bacteria,1TP6E@1239|Firmicutes,4HA4E@91061|Bacilli,3F41T@33958|Lactobacillaceae	Belongs to the ABC transporter superfamily	oppD	-	ko:K15583	ko01501,ko02010,ko02024,map01501,map02010,map02024	ko00000,ko00001,ko00002,ko02000	ABC_tran,oligo_HPY
1647	EDX41522.1	349123.Lreu23DRAFT_3033	4.38e-210	580.0	COG4608@1|root,COG4608@2|Bacteria,1V36J@1239|Firmicutes,4H9YB@91061|Bacilli,3F4GM@33958|Lactobacillaceae	Belongs to the ABC transporter superfamily	oppF	-	ko:K10823	ko01501,ko02010,ko02024,map01501,map02010,map02024	ko00000,ko00001,ko00002,ko02000	ABC_tran,oligo_HPY
1647	EDX41523.1	349123.Lreu23DRAFT_3034	8.24e-290	791.0	COG1228@1|root,COG1228@2|Bacteria,1TQQ0@1239|Firmicutes,4HDKW@91061|Bacilli,3F4D3@33958|Lactobacillaceae	Imidazolonepropionase and related amidohydrolases	-	-	-	-	-	Amidohydro_1
1647	EDX41524.1	349123.Lreu23DRAFT_3035	0.0	1311.0	COG1506@1|root,COG1506@2|Bacteria,1TR2N@1239|Firmicutes,4H9RR@91061|Bacilli,3F59I@33958|Lactobacillaceae	Prolyl oligopeptidase family	yuxL	-	ko:K01303	-	ko00000,ko01000,ko01002	PD40,Peptidase_S9
1647	EDX41525.1	349123.Lreu23DRAFT_3036	3.02e-296	807.0	COG1228@1|root,COG1228@2|Bacteria,1TQQ0@1239|Firmicutes,4HDKW@91061|Bacilli,3F4D3@33958|Lactobacillaceae	Imidazolonepropionase and related amidohydrolases	-	-	-	-	-	Amidohydro_1
1647	EDX41526.1	349123.Lreu23DRAFT_3037	0.0	910.0	COG0624@1|root,COG0624@2|Bacteria,1TP2D@1239|Firmicutes,4HB9G@91061|Bacilli,3F541@33958|Lactobacillaceae	Peptidase dimerisation domain	dapE	-	ko:K01439	ko00300,ko01100,ko01120,ko01230,map00300,map01100,map01120,map01230	ko00000,ko00001,ko00002,ko01000	M20_dimer,Peptidase_M20
1647	EDX41527.1	349123.Lreu23DRAFT_3038	0.0	881.0	COG3666@1|root,COG3666@2|Bacteria,1TQQ9@1239|Firmicutes,4H9KK@91061|Bacilli,3F4M8@33958|Lactobacillaceae	Transposase	-	-	-	-	-	DDE_Tnp_1,DDE_Tnp_1_6,DUF772
1647	EDX41528.1	349123.Lreu23DRAFT_3039	8.25e-218	599.0	COG3001@1|root,COG3001@2|Bacteria,1U79A@1239|Firmicutes,4HAZS@91061|Bacilli,3F3RK@33958|Lactobacillaceae	Phosphotransferase enzyme family	-	-	-	-	-	Fructosamin_kin
1647	EDX41529.1	349123.Lreu23DRAFT_3040	0.0	1202.0	COG0173@1|root,COG0173@2|Bacteria,1TPCN@1239|Firmicutes,4HACD@91061|Bacilli,3F4PE@33958|Lactobacillaceae	Catalyzes the attachment of L-aspartate to tRNA(Asp) in a two-step reaction L-aspartate is first activated by ATP to form Asp-AMP and then transferred to the acceptor end of tRNA(Asp)	aspS	-	ko:K01876	ko00970,map00970	ko00000,ko00001,ko00002,ko01000,ko01007,ko03016,ko03029	GAD,tRNA-synt_2,tRNA_anti-codon
1647	EDX41530.1	349123.Lreu23DRAFT_3041	4.64e-172	480.0	COG1126@1|root,COG1126@2|Bacteria,1TNYD@1239|Firmicutes,4H9WY@91061|Bacilli,3F3QQ@33958|Lactobacillaceae	ABC transporter, ATP-binding protein	glnQ	-	ko:K02028	-	ko00000,ko00002,ko01000,ko02000	ABC_tran
1647	EDX41531.1	349123.Lreu23DRAFT_3042	0.0	936.0	COG0765@1|root,COG0834@1|root,COG0765@2|Bacteria,COG0834@2|Bacteria,1TPM3@1239|Firmicutes,4HAS2@91061|Bacilli,3F48Y@33958|Lactobacillaceae	ABC transporter permease	glnPH2	-	ko:K02029,ko:K02030	-	ko00000,ko00002,ko02000	BPD_transp_1,SBP_bac_3
1647	EDX41532.1	349123.Lreu23DRAFT_3043	4.96e-32	112.0	COG0828@1|root,COG0828@2|Bacteria,1VEHU@1239|Firmicutes,4HNPV@91061|Bacilli,3F81Y@33958|Lactobacillaceae	Belongs to the bacterial ribosomal protein bS21 family	rpsU	GO:0005575,GO:0005622,GO:0005623,GO:0005737,GO:0005840,GO:0032991,GO:0043226,GO:0043228,GO:0043229,GO:0043232,GO:0044391,GO:0044422,GO:0044424,GO:0044444,GO:0044446,GO:0044464,GO:1990904	ko:K02970	ko03010,map03010	br01610,ko00000,ko00001,ko00002,ko03011	Ribosomal_S21
1647	EDX41533.1	349123.Lreu23DRAFT_3044	7.84e-91	267.0	COG1610@1|root,COG1610@2|Bacteria,1V6F2@1239|Firmicutes,4HIQP@91061|Bacilli,3F6I0@33958|Lactobacillaceae	YqeY-like protein	yqeY	-	ko:K09117	-	ko00000	YqeY
1647	EDX41534.1	349123.Lreu23DRAFT_3045	1.19e-300	819.0	COG3547@1|root,COG3547@2|Bacteria,1TR6E@1239|Firmicutes,4HCAZ@91061|Bacilli,3FBCW@33958|Lactobacillaceae	transposase IS116 IS110 IS902 family protein	-	-	-	-	-	DEDD_Tnp_IS110,Nop,Transposase_20
1647	EDX41535.1	349123.Lreu23DRAFT_3046	2.25e-239	657.0	COG3049@1|root,COG3049@2|Bacteria,1TPZS@1239|Firmicutes,4HC4Y@91061|Bacilli,3F4NH@33958|Lactobacillaceae	Linear amide C-N hydrolase, choloylglycine hydrolase family protein	cbh	-	ko:K01442	ko00120,ko00121,ko01100,map00120,map00121,map01100	ko00000,ko00001,ko01000	CBAH
1647	EDX41536.1	349123.Lreu23DRAFT_3047	1.2e-302	824.0	COG0137@1|root,COG0137@2|Bacteria,1TP3X@1239|Firmicutes,4HA1E@91061|Bacilli,3F46X@33958|Lactobacillaceae	Belongs to the argininosuccinate synthase family. Type 1 subfamily	argG	GO:0000050,GO:0000053,GO:0003674,GO:0003824,GO:0004055,GO:0005575,GO:0005622,GO:0005623,GO:0005737,GO:0006082,GO:0006520,GO:0006525,GO:0006526,GO:0006575,GO:0006807,GO:0008150,GO:0008152,GO:0008652,GO:0009058,GO:0009064,GO:0009084,GO:0009987,GO:0016053,GO:0016874,GO:0016879,GO:0019627,GO:0019752,GO:0034641,GO:0043436,GO:0043603,GO:0043604,GO:0044237,GO:0044238,GO:0044249,GO:0044271,GO:0044281,GO:0044283,GO:0044424,GO:0044464,GO:0046394,GO:0071704,GO:0071941,GO:0072350,GO:1901564,GO:1901566,GO:1901576,GO:1901605,GO:1901607	ko:K01940	ko00220,ko00250,ko01100,ko01110,ko01130,ko01230,ko05418,map00220,map00250,map01100,map01110,map01130,map01230,map05418	ko00000,ko00001,ko00002,ko01000,ko04147	Arginosuc_synth
1647	EDX41537.1	349123.Lreu23DRAFT_3048	0.0	914.0	COG0165@1|root,COG0165@2|Bacteria,1TNZ6@1239|Firmicutes,4HB24@91061|Bacilli,3F4PF@33958|Lactobacillaceae	argininosuccinate lyase	argH	GO:0003674,GO:0003824,GO:0004056,GO:0005575,GO:0005622,GO:0005623,GO:0005737,GO:0006082,GO:0006520,GO:0006525,GO:0006526,GO:0006591,GO:0006807,GO:0008150,GO:0008152,GO:0008652,GO:0009058,GO:0009064,GO:0009084,GO:0009987,GO:0016053,GO:0016829,GO:0016840,GO:0016842,GO:0019752,GO:0042450,GO:0043436,GO:0044237,GO:0044238,GO:0044249,GO:0044281,GO:0044283,GO:0044424,GO:0044464,GO:0046394,GO:0071704,GO:1901564,GO:1901566,GO:1901576,GO:1901605,GO:1901607	ko:K01755	ko00220,ko00250,ko01100,ko01110,ko01130,ko01230,map00220,map00250,map01100,map01110,map01130,map01230	ko00000,ko00001,ko00002,ko01000,ko04147	ASL_C2,Lyase_1
1647	EDX41538.1	349123.Lreu23DRAFT_3049	7.24e-121	346.0	COG1268@1|root,COG1268@2|Bacteria,1VAAD@1239|Firmicutes,4HI8T@91061|Bacilli,3F6YG@33958|Lactobacillaceae	BioY family	bioY	GO:0005575,GO:0005623,GO:0005886,GO:0016020,GO:0044464,GO:0071944	ko:K03523	ko02010,map02010	ko00000,ko00001,ko00002,ko02000	BioY
1647	EDX41539.1	349123.Lreu23DRAFT_3050	1.39e-232	640.0	COG0340@1|root,COG1654@1|root,COG0340@2|Bacteria,COG1654@2|Bacteria,1TQCU@1239|Firmicutes,4HB60@91061|Bacilli,3F5HY@33958|Lactobacillaceae	Acts both as a biotin-- acetyl-CoA-carboxylase ligase and a repressor	birA	-	ko:K03524	ko00780,ko01100,map00780,map01100	ko00000,ko00001,ko01000,ko03000	BPL_C,BPL_LplA_LipB,HTH_11
1647	EDX41540.1	349123.Lreu23DRAFT_3051	3.54e-232	640.0	COG1702@1|root,COG1702@2|Bacteria,1TP35@1239|Firmicutes,4HBD5@91061|Bacilli,3F4E7@33958|Lactobacillaceae	phosphate starvation-inducible protein PhoH	phoH	-	ko:K06217	-	ko00000	PhoH
1647	EDX41541.1	349123.Lreu23DRAFT_3052	1.49e-107	310.0	COG0319@1|root,COG0319@2|Bacteria,1V6BU@1239|Firmicutes,4HIIE@91061|Bacilli,3F516@33958|Lactobacillaceae	Single strand-specific metallo-endoribonuclease involved in late-stage 70S ribosome quality control and in maturation of the 3' terminus of the 16S rRNA	ybeY	-	ko:K07042	-	ko00000,ko03009	UPF0054
1647	EDX41542.1	349123.Lreu23DRAFT_3053	3.64e-81	241.0	COG0818@1|root,COG0818@2|Bacteria,1VEGR@1239|Firmicutes,4HNKN@91061|Bacilli,3F7DC@33958|Lactobacillaceae	Diacylglycerol kinase	dgkA	-	ko:K00887,ko:K00901	ko00550,ko00561,ko00564,ko01100,ko01110,ko04070,ko04072,ko05231,map00550,map00561,map00564,map01100,map01110,map04070,map04072,map05231	ko00000,ko00001,ko01000	DAGK_prokar
1647	EDX41543.1	349123.Lreu23DRAFT_3054	2.19e-218	602.0	COG1159@1|root,COG1159@2|Bacteria,1TP3R@1239|Firmicutes,4H9WF@91061|Bacilli,3F3WQ@33958|Lactobacillaceae	An essential GTPase that binds both GDP and GTP, with rapid nucleotide exchange. Plays a role in 16S rRNA processing and 30S ribosomal subunit biogenesis and possibly also in cell cycle regulation and energy metabolism	era	GO:0000166,GO:0001882,GO:0001883,GO:0003674,GO:0003824,GO:0003924,GO:0005488,GO:0005525,GO:0005575,GO:0005622,GO:0005623,GO:0005737,GO:0005886,GO:0006275,GO:0008150,GO:0008156,GO:0009889,GO:0009890,GO:0009892,GO:0010556,GO:0010558,GO:0010605,GO:0016020,GO:0016462,GO:0016787,GO:0016817,GO:0016818,GO:0017076,GO:0017111,GO:0019001,GO:0019003,GO:0019219,GO:0019222,GO:0030174,GO:0031323,GO:0031324,GO:0031326,GO:0031327,GO:0032297,GO:0032549,GO:0032550,GO:0032553,GO:0032555,GO:0032561,GO:0035639,GO:0036094,GO:0043167,GO:0043168,GO:0044424,GO:0044464,GO:0045934,GO:0048518,GO:0048519,GO:0048522,GO:0048523,GO:0050789,GO:0050794,GO:0051052,GO:0051053,GO:0051171,GO:0051172,GO:0051302,GO:0051781,GO:0060255,GO:0065007,GO:0071944,GO:0080090,GO:0090329,GO:0097159,GO:0097367,GO:1901265,GO:1901363,GO:2000104,GO:2000112,GO:2000113	ko:K03595	-	ko00000,ko03009,ko03029	KH_2,MMR_HSR1
1647	EDX41544.1	349123.Lreu23DRAFT_3055	7.18e-188	521.0	COG1381@1|root,COG1381@2|Bacteria,1UZ19@1239|Firmicutes,4HAHI@91061|Bacilli,3F56P@33958|Lactobacillaceae	Involved in DNA repair and RecF pathway recombination	recO	GO:0005575,GO:0005622,GO:0005623,GO:0006139,GO:0006259,GO:0006281,GO:0006302,GO:0006725,GO:0006807,GO:0006950,GO:0006974,GO:0008150,GO:0008152,GO:0009295,GO:0009987,GO:0033554,GO:0034641,GO:0043170,GO:0043226,GO:0043228,GO:0043229,GO:0043232,GO:0043590,GO:0044237,GO:0044238,GO:0044260,GO:0044424,GO:0044464,GO:0046483,GO:0050896,GO:0051716,GO:0071704,GO:0090304,GO:1901360	ko:K03584	ko03440,map03440	ko00000,ko00001,ko03400	RecO_C,RecO_N
1647	EDX41545.1	349123.Lreu23DRAFT_3056	1.76e-233	642.0	COG0752@1|root,COG0752@2|Bacteria,1TPW8@1239|Firmicutes,4HBCF@91061|Bacilli,3F3T8@33958|Lactobacillaceae	glycyl-tRNA synthetase alpha subunit	glyQ	-	ko:K01878	ko00970,map00970	ko00000,ko00001,ko00002,ko01000,ko01007,ko03016	tRNA-synt_2e
