key	query	seed_ortholog	evalue	score	eggNOG_OGs	description	preferred_name	GOs	KEGG_ko	KEGG_pathway	brite	PFAMs
1829	TDQ56092.1	221988.MS0857	5.22e-260	721.0	COG3106@1|root,COG3106@2|Bacteria,1MX6E@1224|Proteobacteria,1RQ05@1236|Gammaproteobacteria,1Y6SN@135625|Pasteurellales	YcjX-like family, DUF463	Z012_08340	-	ko:K06918	-	ko00000	DUF463
1829	TDQ56093.1	221988.MS0856	2.59e-300	832.0	COG4166@1|root,COG4166@2|Bacteria,1P91R@1224|Proteobacteria,1T1RS@1236|Gammaproteobacteria,1Y7S4@135625|Pasteurellales	Peptide transport periplasmic protein	sapA	GO:0005575,GO:0005623,GO:0030288,GO:0030313,GO:0031975,GO:0042597,GO:0044464	ko:K19226	ko01503,ko02010,map01503,map02010	ko00000,ko00001,ko00002,ko02000	SBP_bac_5
1829	TDQ56094.1	221988.MS0855	7.34e-165	468.0	COG4168@1|root,COG4168@2|Bacteria,1QUAU@1224|Proteobacteria,1T1RR@1236|Gammaproteobacteria,1Y6WY@135625|Pasteurellales	peptide transport system, permease	sapB	-	ko:K19227	ko01503,ko02010,map01503,map02010	ko00000,ko00001,ko00002,ko02000	BPD_transp_1
1829	TDQ56095.1	339671.Asuc_1756	9.03e-120	352.0	COG4171@1|root,COG4171@2|Bacteria,1QUAT@1224|Proteobacteria,1T1RQ@1236|Gammaproteobacteria,1Y7T7@135625|Pasteurellales	peptide transport system, permease	sapC	-	ko:K19228	ko01503,ko02010,map01503,map02010	ko00000,ko00001,ko00002,ko02000	BPD_transp_1,OppC_N
1829	TDQ56096.1	221988.MS0853	4.71e-212	590.0	COG1123@1|root,COG4172@2|Bacteria,1MU09@1224|Proteobacteria,1RMEI@1236|Gammaproteobacteria,1Y73R@135625|Pasteurellales	Belongs to the ABC transporter superfamily	sapD	-	ko:K19229	ko01503,ko02010,map01503,map02010	ko00000,ko00001,ko00002,ko02000	ABC_tran,oligo_HPY
1829	TDQ56097.1	747.DR93_1757	1.43e-139	400.0	COG1123@1|root,COG4172@2|Bacteria,1MU09@1224|Proteobacteria,1RMEI@1236|Gammaproteobacteria,1Y85S@135625|Pasteurellales	Peptide transport system ATP-binding protein SapF	sapF	-	ko:K19230	ko01503,ko02010,map01503,map02010	ko00000,ko00001,ko00002,ko02000	ABC_tran
1829	TDQ56098.1	637911.AM305_08299	1.58e-120	347.0	COG0625@1|root,COG0625@2|Bacteria,1RHSK@1224|Proteobacteria,1RR26@1236|Gammaproteobacteria,1Y8J3@135625|Pasteurellales	Glutathione S-transferase	Z012_07295	-	-	-	-	GST_C,GST_N_3
1829	TDQ56141.1	694569.D7S_01635	1.01e-100	293.0	COG0219@1|root,COG0219@2|Bacteria,1RCY4@1224|Proteobacteria,1S3PI@1236|Gammaproteobacteria,1Y80H@135625|Pasteurellales	Methylates the ribose at the nucleotide 34 wobble position in the two leucyl isoacceptors tRNA(Leu)(CmAA) and tRNA(Leu)(cmnm5UmAA). Catalyzes the methyl transfer from S- adenosyl-L-methionine to the 2'-OH of the wobble nucleotide	trmL	GO:0003674,GO:0005488,GO:0005515,GO:0042802	ko:K03216	-	ko00000,ko01000,ko03016	SpoU_methylase
1829	TDQ56142.1	1089447.RHAA1_00335	4.09e-135	390.0	COG2990@1|root,COG2990@2|Bacteria,1NTXF@1224|Proteobacteria,1RPKK@1236|Gammaproteobacteria,1Y6X0@135625|Pasteurellales	protein conserved in bacteria	Z012_06620	-	ko:K09824	-	ko00000	DUF535
1829	TDQ56143.1	1028803.GG9_1646	2.74e-121	348.0	COG0218@1|root,COG0218@2|Bacteria,1MY3Z@1224|Proteobacteria,1RNJP@1236|Gammaproteobacteria,1Y83I@135625|Pasteurellales	Necessary for normal cell division and for the maintenance of normal septation	engB	GO:0005575,GO:0005622,GO:0005623,GO:0005737,GO:0005829,GO:0044424,GO:0044444,GO:0044464	ko:K03978	-	ko00000,ko03036	MMR_HSR1
1829	TDQ56144.1	694569.D7S_01632	6.94e-284	785.0	COG0606@1|root,COG0606@2|Bacteria,1MU4R@1224|Proteobacteria,1RMB9@1236|Gammaproteobacteria,1Y83J@135625|Pasteurellales	Competence protein comM	comM	-	ko:K07391	-	ko00000	ChlI,Mg_chelatase,Mg_chelatase_C
1829	TDQ56145.1	339671.Asuc_0247	1.73e-115	334.0	COG0259@1|root,COG0259@2|Bacteria,1NZUU@1224|Proteobacteria,1RMQ2@1236|Gammaproteobacteria,1Y77J@135625|Pasteurellales	Catalyzes the oxidation of either pyridoxine 5'- phosphate (PNP) or pyridoxamine 5'-phosphate (PMP) into pyridoxal 5'-phosphate (PLP)	pdxH	GO:0003674,GO:0003824,GO:0004733,GO:0006081,GO:0006725,GO:0006732,GO:0006766,GO:0006767,GO:0006793,GO:0006796,GO:0006807,GO:0008150,GO:0008152,GO:0009058,GO:0009108,GO:0009110,GO:0009987,GO:0016491,GO:0016638,GO:0016641,GO:0017144,GO:0018130,GO:0019438,GO:0019637,GO:0034641,GO:0042364,GO:0042816,GO:0042819,GO:0042822,GO:0042823,GO:0044237,GO:0044249,GO:0044271,GO:0044281,GO:0044283,GO:0046184,GO:0046483,GO:0051186,GO:0051188,GO:0055114,GO:0071704,GO:0072524,GO:0072525,GO:0090407,GO:1901360,GO:1901362,GO:1901564,GO:1901566,GO:1901576,GO:1901615,GO:1901617	ko:K00275	ko00750,ko01100,ko01120,map00750,map01100,map01120	ko00000,ko00001,ko00002,ko01000	PNP_phzG_C,Putative_PNPOx
1829	TDQ56146.1	1035839.AFNK01000035_gene1096	3.83e-175	495.0	COG0225@1|root,COG0229@1|root,COG0225@2|Bacteria,COG0229@2|Bacteria,1RGWC@1224|Proteobacteria,1RNVK@1236|Gammaproteobacteria,1Y7WH@135625|Pasteurellales	Has an important function as a repair enzyme for proteins that have been inactivated by oxidation. Catalyzes the reversible oxidation-reduction of methionine sulfoxide in proteins to methionine	msrA	-	ko:K12267	-	ko00000,ko01000	PMSR,SelR
1829	TDQ56147.1	1461579.CCNK01000041_gene1961	3.04e-33	115.0	COG1278@1|root,COG1278@2|Bacteria,1N6Q5@1224|Proteobacteria,1SCA7@1236|Gammaproteobacteria,1Y9A5@135625|Pasteurellales	Cold shock proteins	cspC	-	ko:K03704	-	ko00000,ko03000	CSD
1829	TDQ56148.1	758.BBIX01000006_gene469	9.75e-192	538.0	COG1494@1|root,COG1494@2|Bacteria,1MUB1@1224|Proteobacteria,1RR0E@1236|Gammaproteobacteria,1Y7Q6@135625|Pasteurellales	fructose-1,6-bisphosphatase	glpX	GO:0003674,GO:0003824,GO:0005575,GO:0005622,GO:0005623,GO:0005737,GO:0005829,GO:0005975,GO:0005996,GO:0006006,GO:0006094,GO:0006793,GO:0006796,GO:0008150,GO:0008152,GO:0009058,GO:0009987,GO:0016051,GO:0016311,GO:0016787,GO:0016788,GO:0016791,GO:0019203,GO:0019318,GO:0019319,GO:0019637,GO:0030388,GO:0042132,GO:0042578,GO:0044237,GO:0044238,GO:0044281,GO:0044283,GO:0044424,GO:0044444,GO:0044464,GO:0046364,GO:0050308,GO:0071704,GO:1901135,GO:1901576	ko:K02446	ko00010,ko00030,ko00051,ko00680,ko00710,ko01100,ko01110,ko01120,ko01130,ko01200,map00010,map00030,map00051,map00680,map00710,map01100,map01110,map01120,map01130,map01200	ko00000,ko00001,ko00002,ko01000	FBPase_glpX
1829	TDQ56149.1	221988.MS2253	7.29e-29	104.0	COG3074@1|root,COG3074@2|Bacteria,1MZJE@1224|Proteobacteria,1S8TG@1236|Gammaproteobacteria,1Y98M@135625|Pasteurellales	Non-essential, abundant cell division factor that is required for proper Z-ring formation. It is recruited early to the divisome by direct interaction with FtsZ, stimulating Z-ring assembly and thereby promoting cell division earlier in the cell cycle. Its recruitment to the Z-ring requires functional FtsA or ZipA	zapB	GO:0005575,GO:0005622,GO:0005623,GO:0005737,GO:0044424,GO:0044464	ko:K09892	-	ko00000,ko03036	ZapB
1829	TDQ56150.1	205914.HS_1656	1.26e-101	295.0	COG3013@1|root,COG3013@2|Bacteria,1QWV8@1224|Proteobacteria,1RME1@1236|Gammaproteobacteria,1Y7MC@135625|Pasteurellales	Belongs to the UPF0304 family	Z012_06585	-	ko:K09161	-	ko00000	YfbU
1829	TDQ56151.1	1461579.CCNK01000019_gene418	3.71e-137	392.0	COG2853@1|root,COG2853@2|Bacteria,1MVX0@1224|Proteobacteria,1RNPS@1236|Gammaproteobacteria,1Y6Z2@135625|Pasteurellales	lipoprotein	vacJ	-	ko:K04754	-	ko00000	MlaA
1829	TDQ56152.1	1461579.CCNK01000045_gene2231	1.94e-135	390.0	COG2885@1|root,COG2913@1|root,COG2885@2|Bacteria,COG2913@2|Bacteria,1N6EM@1224|Proteobacteria,1RMJ7@1236|Gammaproteobacteria,1Y7R0@135625|Pasteurellales	Belongs to the ompA family	Z012_12045	-	-	-	-	OmpA,SmpA_OmlA
1829	TDQ56153.1	758.BBIX01000006_gene170	2.95e-39	168.0	COG5295@1|root,COG5295@2|Bacteria,1N338@1224|Proteobacteria,1RPXV@1236|Gammaproteobacteria,1Y7ES@135625|Pasteurellales	autotransporter adhesin	-	-	ko:K21449	-	ko00000,ko02000	ESPR,YadA_anchor,YadA_head,YadA_stalk
1829	TDQ56201.1	339671.Asuc_1980	4.73e-287	788.0	COG1252@1|root,COG1252@2|Bacteria,1MX96@1224|Proteobacteria,1RM9I@1236|Gammaproteobacteria,1Y7U9@135625|Pasteurellales	NADH dehydrogenase	ndh	-	ko:K03885	ko00190,map00190	ko00000,ko00001,ko01000	Pyr_redox_2
1829	TDQ56202.1	1461579.CCNK01000019_gene399	2.79e-139	399.0	COG2816@1|root,COG2816@2|Bacteria,1QGCX@1224|Proteobacteria,1RP0Y@1236|Gammaproteobacteria,1Y81M@135625|Pasteurellales	NADH pyrophosphatase	nudC	-	ko:K03426	ko00760,ko01100,ko04146,map00760,map01100,map04146	ko00000,ko00001,ko01000	NUDIX,zf-NADH-PPase
1829	TDQ56203.1	1035839.AFNK01000079_gene67	2.65e-228	632.0	COG0407@1|root,COG0407@2|Bacteria,1MUG1@1224|Proteobacteria,1RMDH@1236|Gammaproteobacteria,1Y7KP@135625|Pasteurellales	Catalyzes the decarboxylation of four acetate groups of uroporphyrinogen-III to yield coproporphyrinogen-III	hemE	-	ko:K01599	ko00860,ko01100,ko01110,map00860,map01100,map01110	ko00000,ko00001,ko00002,ko01000	URO-D
1829	TDQ56204.1	696748.ASU2_06560	5.18e-102	299.0	COG3068@1|root,COG3068@2|Bacteria,1MWSN@1224|Proteobacteria,1RQDG@1236|Gammaproteobacteria,1Y7YY@135625|Pasteurellales	protein conserved in bacteria	Z012_10420	-	ko:K09891	-	ko00000	DUF416
1829	TDQ56205.1	221988.MS0185	7.62e-53	166.0	COG0776@1|root,COG0776@2|Bacteria,1MZ5B@1224|Proteobacteria,1S8VH@1236|Gammaproteobacteria,1Y8Y3@135625|Pasteurellales	Histone-like DNA-binding protein which is capable of wrapping DNA to stabilize it, and thus to prevent its denaturation under extreme environmental conditions	hup	GO:0003674,GO:0003676,GO:0003677,GO:0005488,GO:0005575,GO:0005622,GO:0005623,GO:0005737,GO:0005829,GO:0008150,GO:0009889,GO:0010556,GO:0019219,GO:0019222,GO:0031323,GO:0031326,GO:0044424,GO:0044444,GO:0044464,GO:0050789,GO:0050794,GO:0051171,GO:0051252,GO:0060255,GO:0065007,GO:0080090,GO:0097159,GO:1901363,GO:1903506,GO:2001141	ko:K05787	-	ko00000,ko03032,ko03036,ko03400	Bac_DNA_binding
1829	TDQ56206.1	221988.MS0187	1.72e-141	404.0	COG1349@1|root,COG1349@2|Bacteria,1MUJG@1224|Proteobacteria,1RNW4@1236|Gammaproteobacteria,1Y6R6@135625|Pasteurellales	Transcriptional regulators of sugar metabolism	Z012_10410	-	-	-	-	DeoRC,HTH_DeoR
1829	TDQ56207.1	339671.Asuc_0749	0.0	1068.0	COG0449@1|root,COG0449@2|Bacteria,1MW4K@1224|Proteobacteria,1RMVN@1236|Gammaproteobacteria,1Y7FV@135625|Pasteurellales	Catalyzes the first step in hexosamine metabolism, converting fructose-6P into glucosamine-6P using glutamine as a nitrogen source	glmS	GO:0003674,GO:0003824,GO:0004360,GO:0005575,GO:0005622,GO:0005623,GO:0005737,GO:0005829,GO:0006002,GO:0006040,GO:0006047,GO:0006139,GO:0006464,GO:0006486,GO:0006487,GO:0006725,GO:0006793,GO:0006796,GO:0006807,GO:0008150,GO:0008152,GO:0008483,GO:0009058,GO:0009059,GO:0009100,GO:0009101,GO:0009225,GO:0009987,GO:0016740,GO:0016769,GO:0019538,GO:0019637,GO:0034641,GO:0034645,GO:0036211,GO:0043170,GO:0043412,GO:0043413,GO:0044237,GO:0044238,GO:0044249,GO:0044260,GO:0044267,GO:0044281,GO:0044424,GO:0044444,GO:0044464,GO:0046483,GO:0055086,GO:0070085,GO:0070548,GO:0071704,GO:1901135,GO:1901137,GO:1901360,GO:1901564,GO:1901566,GO:1901576	ko:K00820	ko00250,ko00520,ko01100,ko01130,ko04931,map00250,map00520,map01100,map01130,map04931	ko00000,ko00001,ko01000,ko01002	GATase_6,SIS
1829	TDQ56208.1	1028803.GG9_0797	4.32e-122	352.0	COG3201@1|root,COG3201@2|Bacteria,1QHPZ@1224|Proteobacteria,1TFDP@1236|Gammaproteobacteria,1Y6XH@135625|Pasteurellales	nicotinamide mononucleotide transporter	pnuC	-	ko:K03811	-	ko00000,ko02000	NMN_transporter
1829	TDQ56209.1	221988.MS0195	0.0	1250.0	COG0553@1|root,COG0553@2|Bacteria,1MX6H@1224|Proteobacteria,1RNRZ@1236|Gammaproteobacteria,1Y75H@135625|Pasteurellales	Transcription regulator that activates transcription by stimulating RNA polymerase (RNAP) recycling in case of stress conditions such as supercoiled DNA or high salt concentrations. Probably acts by releasing the RNAP, when it is trapped or immobilized on tightly supercoiled DNA. Does not activate transcription on linear DNA. Probably not involved in DNA repair	rapA	-	ko:K03580	-	ko00000,ko01000,ko03021	Helicase_C,RapA_C,SNF2_N
1829	TDQ56210.1	1461579.CCNK01000024_gene663	6.46e-288	790.0	COG0334@1|root,COG0334@2|Bacteria,1MUMF@1224|Proteobacteria,1RPUZ@1236|Gammaproteobacteria,1Y756@135625|Pasteurellales	Belongs to the Glu Leu Phe Val dehydrogenases family	gdhA	GO:0003674,GO:0003824,GO:0004353,GO:0004354,GO:0005575,GO:0005622,GO:0005623,GO:0005737,GO:0005829,GO:0006082,GO:0006520,GO:0006536,GO:0006537,GO:0006807,GO:0008150,GO:0008152,GO:0008652,GO:0009058,GO:0009064,GO:0009084,GO:0009987,GO:0016053,GO:0016491,GO:0016638,GO:0016639,GO:0019752,GO:0043436,GO:0043648,GO:0043650,GO:0044237,GO:0044238,GO:0044249,GO:0044281,GO:0044283,GO:0044424,GO:0044444,GO:0044464,GO:0046394,GO:0055114,GO:0071704,GO:1901564,GO:1901566,GO:1901576,GO:1901605,GO:1901607	ko:K00262	ko00220,ko00250,ko00910,ko01100,map00220,map00250,map00910,map01100	ko00000,ko00001,ko01000	ELFV_dehydrog,ELFV_dehydrog_N
1829	TDQ56211.1	1461579.CCNK01000007_gene146	1.04e-303	831.0	COG0015@1|root,COG0015@2|Bacteria,1MV4B@1224|Proteobacteria,1RN93@1236|Gammaproteobacteria,1Y6XR@135625|Pasteurellales	Belongs to the lyase 1 family. Adenylosuccinate lyase subfamily	purB	-	ko:K01756	ko00230,ko00250,ko01100,ko01110,ko01130,map00230,map00250,map01100,map01110,map01130	ko00000,ko00001,ko00002,ko01000	ASL_C,Lyase_1
1829	TDQ56212.1	221988.MS0298	1.36e-98	291.0	COG2915@1|root,COG2915@2|Bacteria,1RI8B@1224|Proteobacteria,1RPCC@1236|Gammaproteobacteria,1Y7WY@135625|Pasteurellales	High frequency lysogenization protein HflD	hflD	-	ko:K07153	-	ko00000	DUF489
1829	TDQ56213.1	272556.CF65_01104	3.79e-34	124.0	COG2847@1|root,COG2847@2|Bacteria,1NI8R@1224|Proteobacteria,1TFIH@1236|Gammaproteobacteria,1Y94F@135625|Pasteurellales	Copper chaperone PCu(A)C	VY92_09940	-	ko:K09796	-	ko00000,ko03110	PCuAC
1829	TDQ56214.1	221988.MS0300	9.98e-63	195.0	COG0454@1|root,COG0456@2|Bacteria,1QI1J@1224|Proteobacteria,1TFUF@1236|Gammaproteobacteria,1YA88@135625|Pasteurellales	Acetyltransferase (GNAT) domain	-	-	-	-	-	Acetyltransf_1
1829	TDQ56215.1	1461579.CCNK01000007_gene142	2.41e-245	677.0	COG0482@1|root,COG0482@2|Bacteria,1MUT1@1224|Proteobacteria,1RMAK@1236|Gammaproteobacteria,1Y84K@135625|Pasteurellales	Catalyzes the 2-thiolation of uridine at the wobble position (U34) of tRNA, leading to the formation of s(2)U34	mnmA	GO:0002097,GO:0002098,GO:0002143,GO:0006139,GO:0006396,GO:0006399,GO:0006400,GO:0006725,GO:0006807,GO:0008033,GO:0008150,GO:0008152,GO:0009451,GO:0009987,GO:0010467,GO:0016070,GO:0034227,GO:0034470,GO:0034641,GO:0034660,GO:0043170,GO:0043412,GO:0044237,GO:0044238,GO:0046483,GO:0071704,GO:0090304,GO:1901360	ko:K00566	ko04122,map04122	ko00000,ko00001,ko01000,ko03016	tRNA_Me_trans
1829	TDQ56216.1	489653.NLA_7980	7.45e-34	117.0	COG1942@1|root,COG1942@2|Bacteria,1N6WW@1224|Proteobacteria,2VVTU@28216|Betaproteobacteria,2KS30@206351|Neisseriales	4-oxalocrotonate tautomerase family	dmpI	-	ko:K01821	ko00362,ko00621,ko00622,ko01100,ko01120,ko01220,map00362,map00621,map00622,map01100,map01120,map01220	ko00000,ko00001,ko00002,ko01000	Tautomerase
1829	TDQ56217.1	1461579.CCNK01000007_gene140	1.52e-39	132.0	COG2991@1|root,COG2991@2|Bacteria,1NI0R@1224|Proteobacteria,1SGJF@1236|Gammaproteobacteria,1Y993@135625|Pasteurellales	(Na+)-NQR maturation NqrM	Z012_07620	-	ko:K05952	-	ko00000	NqrM
1829	TDQ56218.1	221988.MS0303	1.13e-187	528.0	COG1477@1|root,COG1477@2|Bacteria,1MW6K@1224|Proteobacteria,1RNMZ@1236|Gammaproteobacteria,1Y7W7@135625|Pasteurellales	Flavin transferase that catalyzes the transfer of the FMN moiety of FAD and its covalent binding to the hydroxyl group of a threonine residue in a target flavoprotein	apbE	-	ko:K03734	-	ko00000,ko01000	ApbE
1829	TDQ56219.1	1461579.CCNK01000007_gene137	2.26e-285	780.0	COG2871@1|root,COG2871@2|Bacteria,1QTUV@1224|Proteobacteria,1RPG5@1236|Gammaproteobacteria,1Y7ED@135625|Pasteurellales	NQR complex catalyzes the reduction of ubiquinone-1 to ubiquinol by two successive reactions, coupled with the transport of Na( ) ions from the cytoplasm to the periplasm. The first step is catalyzed by NqrF, which accepts electrons from NADH and reduces ubiquinone-1 to ubisemiquinone by a one-electron transfer pathway	nqrF	-	ko:K00351	-	ko00000,ko01000	FAD_binding_6,Fer2,NAD_binding_1
1829	TDQ56220.1	747.DR93_582	3.55e-125	358.0	COG2209@1|root,COG2209@2|Bacteria,1R33S@1224|Proteobacteria,1RMWV@1236|Gammaproteobacteria,1Y7P4@135625|Pasteurellales	NQR complex catalyzes the reduction of ubiquinone-1 to ubiquinol by two successive reactions, coupled with the transport of Na( ) ions from the cytoplasm to the periplasm. NqrA to NqrE are probably involved in the second step, the conversion of ubisemiquinone to ubiquinol	nqrE	-	ko:K00350	-	ko00000,ko01000	Rnf-Nqr
1829	TDQ56221.1	1461579.CCNK01000007_gene135	1.32e-127	365.0	COG1347@1|root,COG1347@2|Bacteria,1MUZR@1224|Proteobacteria,1RNFE@1236|Gammaproteobacteria,1Y75R@135625|Pasteurellales	NQR complex catalyzes the reduction of ubiquinone-1 to ubiquinol by two successive reactions, coupled with the transport of Na( ) ions from the cytoplasm to the periplasm. NqrA to NqrE are probably involved in the second step, the conversion of ubisemiquinone to ubiquinol	nqrD	GO:0005575,GO:0005623,GO:0005886,GO:0016020,GO:0044464,GO:0071944	ko:K00349	-	ko00000,ko01000	Rnf-Nqr
1829	TDQ56222.1	1461579.CCNK01000007_gene134	5.2e-145	413.0	COG2869@1|root,COG2869@2|Bacteria,1MVDI@1224|Proteobacteria,1RR85@1236|Gammaproteobacteria,1Y7FI@135625|Pasteurellales	NQR complex catalyzes the reduction of ubiquinone-1 to ubiquinol by two successive reactions, coupled with the transport of Na( ) ions from the cytoplasm to the periplasm. NqrA to NqrE are probably involved in the second step, the conversion of ubisemiquinone to ubiquinol	nqrC	-	ko:K00348	-	ko00000,ko01000	FMN_bind
1829	TDQ56223.1	339671.Asuc_0600	5.16e-258	711.0	COG1805@1|root,COG1805@2|Bacteria,1QTUU@1224|Proteobacteria,1RMGH@1236|Gammaproteobacteria,1Y7Q8@135625|Pasteurellales	NQR complex catalyzes the reduction of ubiquinone-1 to ubiquinol by two successive reactions, coupled with the transport of Na( ) ions from the cytoplasm to the periplasm. NqrA to NqrE are probably involved in the second step, the conversion of ubisemiquinone to ubiquinol	nqrB	GO:0005575,GO:0005623,GO:0005886,GO:0016020,GO:0044464,GO:0071944	ko:K00347	-	ko00000,ko01000	NQR2_RnfD_RnfE
1829	TDQ56224.1	1278971.AOGF01000008_gene150	2.6e-272	751.0	COG1726@1|root,COG1726@2|Bacteria,1MU36@1224|Proteobacteria,1RPU1@1236|Gammaproteobacteria,1Y79N@135625|Pasteurellales	NQR complex catalyzes the reduction of ubiquinone-1 to ubiquinol by two successive reactions, coupled with the transport of Na( ) ions from the cytoplasm to the periplasm. NqrA to NqrE are probably involved in the second step, the conversion of ubisemiquinone to ubiquinol	nqrA	-	ko:K00346	-	ko00000,ko01000	NQRA,NQRA_SLBB
1829	TDQ56225.1	1461579.CCNK01000007_gene131	4.57e-46	150.0	COG0271@1|root,COG0271@2|Bacteria,1MZG5@1224|Proteobacteria,1S91G@1236|Gammaproteobacteria,1Y938@135625|Pasteurellales	Belongs to the BolA IbaG family	bolA	-	ko:K05527	-	ko00000,ko03000	BolA
1829	TDQ56226.1	1095749.HMPREF1052_1069	2.3e-72	224.0	COG3056@1|root,COG3056@2|Bacteria,1MZ1N@1224|Proteobacteria,1RPG1@1236|Gammaproteobacteria,1Y8XV@135625|Pasteurellales	Uncharacterized lipoprotein	Z012_07575	-	ko:K07286	-	ko00000	Lipoprotein_16
1829	TDQ56227.1	1095743.HMPREF1054_0180	8.3e-126	363.0	COG1496@1|root,COG1496@2|Bacteria,1MW2H@1224|Proteobacteria,1RNV4@1236|Gammaproteobacteria,1Y70S@135625|Pasteurellales	Belongs to the multicopper oxidase YfiH RL5 family	Z012_06640	GO:0003674,GO:0005488,GO:0005507,GO:0043167,GO:0043169,GO:0046872,GO:0046914	ko:K05810	-	ko00000,ko01000	Cu-oxidase_4
1829	TDQ56228.1	221988.MS1821	3.47e-193	540.0	COG0564@1|root,COG0564@2|Bacteria,1MUBN@1224|Proteobacteria,1RN7F@1236|Gammaproteobacteria,1Y7I3@135625|Pasteurellales	Responsible for synthesis of pseudouridine from uracil	rluD	-	ko:K06180	-	ko00000,ko01000,ko03009	PseudoU_synth_2,S4
1829	TDQ56229.1	221988.MS1820	2.91e-140	403.0	COG4105@1|root,COG4105@2|Bacteria,1MVS5@1224|Proteobacteria,1RSE6@1236|Gammaproteobacteria,1Y7A6@135625|Pasteurellales	Part of the outer membrane protein assembly complex, which is involved in assembly and insertion of beta-barrel proteins into the outer membrane	bamD	GO:0005575,GO:0005623,GO:0008104,GO:0008150,GO:0009279,GO:0009987,GO:0016020,GO:0016043,GO:0019867,GO:0030312,GO:0030313,GO:0031224,GO:0031230,GO:0031241,GO:0031246,GO:0031975,GO:0032991,GO:0033036,GO:0034613,GO:0043163,GO:0044425,GO:0044462,GO:0044464,GO:0045184,GO:0045229,GO:0051179,GO:0051205,GO:0051234,GO:0051641,GO:0061024,GO:0070727,GO:0071840,GO:0071944,GO:0072657,GO:0090150,GO:0098552,GO:0098796,GO:1990063	ko:K05807	-	ko00000,ko02000	YfiO
1829	TDQ56290.1	747.DR93_627	6.29e-101	295.0	COG0241@1|root,COG0241@2|Bacteria,1RDGR@1224|Proteobacteria,1S3UD@1236|Gammaproteobacteria,1Y7P8@135625|Pasteurellales	D,D-heptose 1,7-bisphosphate phosphatase	gmhB	GO:0000287,GO:0003674,GO:0003824,GO:0005488,GO:0006793,GO:0006796,GO:0008150,GO:0008152,GO:0008270,GO:0009987,GO:0016311,GO:0016787,GO:0016788,GO:0016791,GO:0034200,GO:0042578,GO:0043167,GO:0043169,GO:0044237,GO:0046872,GO:0046914	ko:K03273	ko00540,ko01100,map00540,map01100	ko00000,ko00001,ko00002,ko01000,ko01005	HAD_2,Hydrolase_like
1829	TDQ56291.1	948565.AFFP02000024_gene132	1.95e-202	565.0	COG1135@1|root,COG1135@2|Bacteria,1QTTK@1224|Proteobacteria,1RMQD@1236|Gammaproteobacteria,1Y6W3@135625|Pasteurellales	Part of the ABC transporter complex MetNIQ involved in methionine import. Responsible for energy coupling to the transport system	metN	-	ko:K02071	ko02010,map02010	ko00000,ko00001,ko00002,ko02000	ABC_tran,NIL
1829	TDQ56292.1	1461579.CCNK01000011_gene309	8.32e-137	390.0	COG2011@1|root,COG2011@2|Bacteria,1MW8E@1224|Proteobacteria,1RQ6I@1236|Gammaproteobacteria,1Y6T3@135625|Pasteurellales	ABC-type metal ion transport system, permease component	metI	-	ko:K02072	ko02010,map02010	ko00000,ko00001,ko00002,ko02000	BPD_transp_1
1829	TDQ56293.1	1278971.AOGF01000010_gene2508	1.04e-167	472.0	COG1464@1|root,COG1464@2|Bacteria,1MUVY@1224|Proteobacteria,1RS3R@1236|Gammaproteobacteria,1Y7C4@135625|Pasteurellales	Belongs to the nlpA lipoprotein family	metQ	-	ko:K02073	ko02010,map02010	ko00000,ko00001,ko00002,ko02000	Lipoprotein_9
1829	TDQ56294.1	339671.Asuc_1976	4.07e-268	741.0	COG0486@1|root,COG0486@2|Bacteria,1MUCQ@1224|Proteobacteria,1RN5S@1236|Gammaproteobacteria,1Y7M6@135625|Pasteurellales	Exhibits a very high intrinsic GTPase hydrolysis rate. Involved in the addition of a carboxymethylaminomethyl (cmnm) group at the wobble position (U34) of certain tRNAs, forming tRNA- cmnm(5)s(2)U34	mnmE	-	ko:K03650	-	ko00000,ko01000,ko03016	MMR_HSR1,MnmE_helical,TrmE_N
1829	TDQ56295.1	221988.MS0481	1.98e-314	865.0	COG0706@1|root,COG0706@2|Bacteria,1MV5M@1224|Proteobacteria,1RMH1@1236|Gammaproteobacteria,1Y845@135625|Pasteurellales	Required for the insertion and or proper folding and or complex formation of integral membrane proteins into the membrane. Involved in integration of membrane proteins that insert both dependently and independently of the Sec translocase complex, as well as at least some lipoproteins. Aids folding of multispanning membrane proteins	yidC	-	ko:K03217	ko02024,ko03060,ko03070,map02024,map03060,map03070	ko00000,ko00001,ko00002,ko02044,ko03029	60KD_IMP,YidC_periplas
1829	TDQ56296.1	221988.MS0483	3.3e-63	195.0	COG0594@1|root,COG0594@2|Bacteria,1MZQE@1224|Proteobacteria,1S90M@1236|Gammaproteobacteria,1Y8T1@135625|Pasteurellales	RNaseP catalyzes the removal of the 5'-leader sequence from pre-tRNA to produce the mature 5'-terminus. It can also cleave other RNA substrates such as 4.5S RNA. The protein component plays an auxiliary but essential role in vivo by binding to the 5'-leader sequence and broadening the substrate specificity of the ribozyme	rnpA	-	ko:K03536	-	ko00000,ko01000,ko03016	Ribonuclease_P
1829	TDQ56297.1	1028803.GG9_0825	1.33e-19	79.3	COG0230@1|root,COG0230@2|Bacteria,1NGGS@1224|Proteobacteria,1SGDJ@1236|Gammaproteobacteria	Belongs to the bacterial ribosomal protein bL34 family	rpmH	GO:0003674,GO:0003735,GO:0005198,GO:0005575,GO:0005622,GO:0005623,GO:0005737,GO:0005829,GO:0005840,GO:0006412,GO:0006518,GO:0006807,GO:0008150,GO:0008152,GO:0009058,GO:0009059,GO:0009987,GO:0010467,GO:0015934,GO:0019538,GO:0022625,GO:0022626,GO:0032991,GO:0034641,GO:0034645,GO:0043043,GO:0043170,GO:0043226,GO:0043228,GO:0043229,GO:0043232,GO:0043603,GO:0043604,GO:0044237,GO:0044238,GO:0044249,GO:0044260,GO:0044267,GO:0044271,GO:0044391,GO:0044422,GO:0044424,GO:0044444,GO:0044445,GO:0044446,GO:0044464,GO:0071704,GO:1901564,GO:1901566,GO:1901576,GO:1990904	ko:K02914	ko03010,map03010	br01610,ko00000,ko00001,ko00002,ko03011	Ribosomal_L34
1829	TDQ56298.1	221988.MS0485	6.79e-282	776.0	COG0593@1|root,COG0593@2|Bacteria,1MU5H@1224|Proteobacteria,1RNHP@1236|Gammaproteobacteria,1Y7W8@135625|Pasteurellales	it binds specifically double-stranded DNA at a 9 bp consensus (dnaA box) 5'-TTATC CA A CA A-3'. DnaA binds to ATP and to acidic phospholipids	dnaA	GO:0003674,GO:0003676,GO:0003677,GO:0003688,GO:0003690,GO:0005488,GO:0005575,GO:0005622,GO:0005623,GO:0005737,GO:0005886,GO:0006139,GO:0006259,GO:0006260,GO:0006261,GO:0006270,GO:0006725,GO:0006807,GO:0008150,GO:0008152,GO:0009058,GO:0009059,GO:0009987,GO:0016020,GO:0034641,GO:0034645,GO:0043170,GO:0043565,GO:0044237,GO:0044238,GO:0044249,GO:0044260,GO:0044424,GO:0044464,GO:0046483,GO:0071704,GO:0071944,GO:0090304,GO:0097159,GO:1901360,GO:1901363,GO:1901576,GO:1990837	ko:K02313	ko02020,ko04112,map02020,map04112	ko00000,ko00001,ko03032,ko03036	Bac_DnaA,Bac_DnaA_C,DnaA_N
