key	query	seed_ortholog	evalue	score	eggNOG_OGs	description	preferred_name	GOs	KEGG_ko	KEGG_pathway	brite	PFAMs
1963	PRR71419.1	264732.Moth_1150	2.75e-233	645.0	COG3581@1|root,COG3581@2|Bacteria,1TPPP@1239|Firmicutes,249C8@186801|Clostridia,42FAE@68295|Thermoanaerobacterales	PFAM CoA enzyme activase uncharacterised domain (DUF2229)	-	-	-	-	-	DUF2229,HGD-D
1963	PRR71420.1	264732.Moth_1149	5.54e-201	560.0	COG1924@1|root,COG1924@2|Bacteria,1TPU5@1239|Firmicutes,2481F@186801|Clostridia,42FAJ@68295|Thermoanaerobacterales	ATPase BadF BadG BcrA BcrD type	-	-	-	-	-	BcrAD_BadFG
1963	PRR71421.1	264732.Moth_1148	1.71e-134	392.0	COG5621@1|root,COG5621@2|Bacteria	spheroidene biosynthetic process	crtC	GO:0003674,GO:0003824,GO:0006629,GO:0006720,GO:0006721,GO:0008150,GO:0008152,GO:0008299,GO:0008610,GO:0009058,GO:0009987,GO:0016108,GO:0016109,GO:0016114,GO:0016116,GO:0016117,GO:0016122,GO:0016123,GO:0016829,GO:0016835,GO:0016836,GO:0018904,GO:0042440,GO:0044237,GO:0044238,GO:0044249,GO:0044255,GO:0044281,GO:0046148,GO:0071704,GO:1901178,GO:1901180,GO:1901503,GO:1901576	ko:K09844	ko00906,ko01100,map00906,map01100	ko00000,ko00001,ko01000	CrtC
1963	PRR71422.1	264732.Moth_1147	7.99e-89	263.0	COG0735@1|root,COG0735@2|Bacteria,1V7F0@1239|Firmicutes,24JQE@186801|Clostridia,42G3F@68295|Thermoanaerobacterales	Ferric uptake regulator, Fur family	fur	-	ko:K03711	-	ko00000,ko03000	FUR
1963	PRR71423.1	264732.Moth_1146	7.64e-13	75.9	COG0457@1|root,COG0457@2|Bacteria,1V6SR@1239|Firmicutes,24KI3@186801|Clostridia,42H2J@68295|Thermoanaerobacterales	Tetratricopeptide repeat	-	-	-	-	-	TPR_1,TPR_10,TPR_12,TPR_16,TPR_2,TPR_8
1963	PRR71424.1	643648.Slip_1210	8.29e-14	65.5	2EIIH@1|root,326NV@2|Bacteria,1USJ6@1239|Firmicutes,25AJI@186801|Clostridia,42KUT@68298|Syntrophomonadaceae	Protein of unknown function (DUF4264)	-	-	-	-	-	DUF4264
1963	PRR71425.1	264732.Moth_1144	8.5e-143	407.0	COG0496@1|root,COG0496@2|Bacteria,1TS2T@1239|Firmicutes,24BI5@186801|Clostridia,42G1B@68295|Thermoanaerobacterales	Nucleotidase that shows phosphatase activity on nucleoside 5'-monophosphates	surE	-	ko:K03787	ko00230,ko00240,ko00760,ko01100,ko01110,map00230,map00240,map00760,map01100,map01110	ko00000,ko00001,ko01000	SurE
1963	PRR71426.1	264732.Moth_1143	9.41e-253	707.0	COG2244@1|root,COG2244@2|Bacteria,1TNYX@1239|Firmicutes,2485G@186801|Clostridia,42FSJ@68295|Thermoanaerobacterales	PFAM Polysaccharide biosynthesis protein	-	-	ko:K06409	-	ko00000,ko02000	Polysacc_synt,Polysacc_synt_3,Polysacc_synt_C
1963	PRR71427.1	264732.Moth_1142	0.0	1180.0	COG0480@1|root,COG0480@2|Bacteria,1TPWN@1239|Firmicutes,247N4@186801|Clostridia,42FPS@68295|Thermoanaerobacterales	TIGRFAM Translation elongation factor	fusA2	-	ko:K02355	-	ko00000,ko03012,ko03029	EFG_C,EFG_II,EFG_IV,GTP_EFTU,GTP_EFTU_D2
1963	PRR71428.1	264732.Moth_1141	5.91e-144	412.0	COG0613@1|root,COG0613@2|Bacteria,1TPI5@1239|Firmicutes,248H2@186801|Clostridia,42GGH@68295|Thermoanaerobacterales	SMART phosphoesterase PHP domain protein	-	-	ko:K07053,ko:K20859	ko00440,map00440	ko00000,ko00001,ko01000	PHP
1963	PRR71429.1	264732.Moth_1140	8e-177	498.0	COG1181@1|root,COG1181@2|Bacteria,1TP2Y@1239|Firmicutes,248CR@186801|Clostridia,42EYR@68295|Thermoanaerobacterales	Belongs to the D-alanine--D-alanine ligase family	ddl	-	ko:K01921	ko00473,ko00550,ko01100,ko01502,map00473,map00550,map01100,map01502	ko00000,ko00001,ko01000,ko01011	Dala_Dala_lig_C,Dala_Dala_lig_N
1963	PRR71430.1	264732.Moth_1139	0.0	1449.0	COG1615@1|root,COG1615@2|Bacteria,1TQHM@1239|Firmicutes,248PM@186801|Clostridia,42FMF@68295|Thermoanaerobacterales	PFAM Uncharacterised protein family (UPF0182)	-	-	ko:K09118	-	ko00000	UPF0182
1963	PRR71431.1	264732.Moth_1138	1.65e-134	384.0	COG4191@1|root,COG4191@2|Bacteria,1VCNJ@1239|Firmicutes,25ETK@186801|Clostridia,42GS1@68295|Thermoanaerobacterales	Histidine kinase	-	-	ko:K07710	ko02020,map02020	ko00000,ko00001,ko00002,ko01000,ko01001,ko02022	HATPase_c,HisKA,PAS,PAS_4
1963	PRR71432.1	264732.Moth_1137	0.0	1333.0	COG0209@1|root,COG0209@2|Bacteria,1TPFH@1239|Firmicutes,249EN@186801|Clostridia,42F6G@68295|Thermoanaerobacterales	Catalyzes the reduction of ribonucleotides to deoxyribonucleotides. May function to provide a pool of deoxyribonucleotide precursors for DNA repair during oxygen limitation and or for immediate growth after restoration of oxygen	nrdJ	-	ko:K00525	ko00230,ko00240,ko01100,map00230,map00240,map01100	ko00000,ko00001,ko00002,ko01000,ko03400	Intein_splicing,LAGLIDADG_3,Ribonuc_red_2_N,Ribonuc_red_lgC,Ribonuc_red_lgN,TSCPD
1963	PRR71433.1	264732.Moth_1136	2.85e-132	377.0	COG0517@1|root,COG0517@2|Bacteria,1V0XU@1239|Firmicutes,24I2P@186801|Clostridia,42GMX@68295|Thermoanaerobacterales	Domain in cystathionine beta-synthase and other proteins.	acuB	-	ko:K04767	-	ko00000	ACT,CBS
1963	PRR71434.1	264732.Moth_1135	1.54e-73	224.0	COG4087@1|root,COG4087@2|Bacteria,1VA72@1239|Firmicutes,24N3C@186801|Clostridia,42GKJ@68295|Thermoanaerobacterales	Soluble P-type ATPase	-	-	-	-	-	Hydrolase,Hydrolase_3
1963	PRR71435.1	264732.Moth_1134	6.94e-75	227.0	COG0517@1|root,COG0517@2|Bacteria,1VA1X@1239|Firmicutes,24MNT@186801|Clostridia	PFAM CBS domain	-	-	-	-	-	CBS
1963	PRR71436.1	264732.Moth_1133	3.65e-200	562.0	COG0438@1|root,COG0438@2|Bacteria,1TPTA@1239|Firmicutes,24ANI@186801|Clostridia,42FW0@68295|Thermoanaerobacterales	glycosyl transferase group 1	-	-	-	-	-	Glyco_transf_4,Glycos_transf_1
1963	PRR71437.1	264732.Moth_1132	0.0	880.0	COG0008@1|root,COG0008@2|Bacteria,1TPJC@1239|Firmicutes,2482P@186801|Clostridia,42ETH@68295|Thermoanaerobacterales	Catalyzes the attachment of glutamate to tRNA(Glu) in a two-step reaction glutamate is first activated by ATP to form Glu-AMP and then transferred to the acceptor end of tRNA(Glu)	gltX	-	ko:K01885	ko00860,ko00970,ko01100,ko01110,ko01120,map00860,map00970,map01100,map01110,map01120	ko00000,ko00001,ko00002,ko01000,ko01007,ko02048,ko03016	tRNA-synt_1c
1963	PRR71438.1	264732.Moth_1131	3.59e-141	400.0	COG0745@1|root,COG0745@2|Bacteria,1TS81@1239|Firmicutes,248XH@186801|Clostridia,42EYI@68295|Thermoanaerobacterales	Response regulator receiver	-	-	ko:K02483,ko:K07669	ko02020,map02020	ko00000,ko00001,ko00002,ko02022	Response_reg,Trans_reg_C
1963	PRR71439.1	264732.Moth_1130	7.36e-223	627.0	COG0642@1|root,COG5000@1|root,COG2205@2|Bacteria,COG5000@2|Bacteria,1UHQC@1239|Firmicutes,25EVD@186801|Clostridia,42JG9@68295|Thermoanaerobacterales	His Kinase A (phosphoacceptor) domain	-	-	-	-	-	HAMP,HATPase_c,HisKA
1963	PRR71440.1	264732.Moth_1128	8.14e-155	436.0	COG1126@1|root,COG1126@2|Bacteria,1TNYD@1239|Firmicutes,247QZ@186801|Clostridia,42EP4@68295|Thermoanaerobacterales	PFAM ABC transporter related	glnQ	-	ko:K02028,ko:K10041,ko:K17076	ko02010,map02010	ko00000,ko00001,ko00002,ko01000,ko02000	ABC_tran
1963	PRR71441.1	264732.Moth_1127	4.67e-147	416.0	COG0765@1|root,COG0765@2|Bacteria,1TPM3@1239|Firmicutes,248UY@186801|Clostridia,42ESU@68295|Thermoanaerobacterales	PFAM binding-protein-dependent transport systems inner membrane component	glnP	-	ko:K02029,ko:K02030,ko:K10040	ko02010,map02010	ko00000,ko00001,ko00002,ko02000	BPD_transp_1
1963	PRR71442.1	264732.Moth_1126	1.71e-168	474.0	COG0834@1|root,COG0834@2|Bacteria,1TQUG@1239|Firmicutes,25C2V@186801|Clostridia,42J43@68295|Thermoanaerobacterales	Ligated ion channel L-glutamate- and glycine-binding site	glnH	-	ko:K02030	-	ko00000,ko00002,ko02000	SBP_bac_3
1963	PRR71443.1	246194.CHY_1857	6.05e-70	228.0	COG2984@1|root,COG2984@2|Bacteria,1TPB0@1239|Firmicutes,248X3@186801|Clostridia,42G7T@68295|Thermoanaerobacterales	ABC transporter substrate binding protein	-	-	ko:K01989	-	ko00000,ko00002,ko02000	ABC_sub_bind
1963	PRR71444.1	246194.CHY_1856	1.81e-108	346.0	COG4191@1|root,COG4191@2|Bacteria,1VCNJ@1239|Firmicutes,24EIY@186801|Clostridia,42GKN@68295|Thermoanaerobacterales	His Kinase A (phosphoacceptor) domain	-	-	ko:K02482	-	ko00000,ko01000,ko01001,ko02022	HATPase_c,HisKA
1963	PRR71445.1	246194.CHY_1855	1.7e-167	485.0	COG2204@1|root,COG2204@2|Bacteria,1VSKG@1239|Firmicutes,24ZP4@186801|Clostridia,42J66@68295|Thermoanaerobacterales	PFAM sigma-54 factor interaction domain-containing protein	-	-	ko:K02481,ko:K07714	ko02020,map02020	ko00000,ko00001,ko00002,ko02022	HTH_8,Response_reg,Sigma54_activat
1963	PRR71446.1	246194.CHY_1854	1.47e-128	368.0	COG0437@1|root,COG0437@2|Bacteria,1TT2E@1239|Firmicutes,24FTX@186801|Clostridia	4Fe-4S dicluster domain	-	-	ko:K00184	-	ko00000	Fer4_11
1963	PRR71447.1	246194.CHY_1853	1.23e-155	452.0	COG5557@1|root,COG5557@2|Bacteria,1V4C0@1239|Firmicutes,24NSE@186801|Clostridia	Formate-dependent nitrite reductase, membrane component	-	-	ko:K00185	-	ko00000	NrfD
1963	PRR71448.1	246194.CHY_1852	0.0	1405.0	COG0243@1|root,COG0243@2|Bacteria,1UYJX@1239|Firmicutes,24DD4@186801|Clostridia	Belongs to the prokaryotic molybdopterin-containing oxidoreductase family	-	-	ko:K08357	ko00920,ko01120,ko02020,map00920,map01120,map02020	ko00000,ko00001,ko02000	Molybdop_Fe4S4,Molybdopterin,Molydop_binding
1963	PRR71449.1	264732.Moth_1124	1.95e-165	467.0	COG0648@1|root,COG0648@2|Bacteria,1TP1D@1239|Firmicutes,2499E@186801|Clostridia,42GGT@68295|Thermoanaerobacterales	Endonuclease IV plays a role in DNA repair. It cleaves phosphodiester bonds at apurinic or apyrimidinic sites (AP sites) to produce new 5'-ends that are base-free deoxyribose 5-phosphate residues. It preferentially attacks modified AP sites created by bleomycin and neocarzinostatin	nfo	-	ko:K01151	ko03410,map03410	ko00000,ko00001,ko01000,ko03400	AP_endonuc_2
1963	PRR71451.1	264732.Moth_1121	6.95e-63	195.0	COG2906@1|root,COG2906@2|Bacteria,1VH6B@1239|Firmicutes,24TF5@186801|Clostridia	BFD-like [2Fe-2S] binding domain	-	-	-	-	-	Fer2_BFD
1963	PRR71452.1	264732.Moth_1120	2.18e-109	318.0	COG1974@1|root,COG1974@2|Bacteria,1TQ3H@1239|Firmicutes,24AXJ@186801|Clostridia,42G7Y@68295|Thermoanaerobacterales	Represses a number of genes involved in the response to DNA damage (SOS response), including recA and lexA. In the presence of single-stranded DNA, RecA interacts with LexA causing an autocatalytic cleavage which disrupts the DNA-binding part of LexA, leading to derepression of the SOS regulon and eventually DNA repair	lexA	-	ko:K01356	-	ko00000,ko00002,ko01000,ko01002,ko03400	LexA_DNA_bind,Peptidase_S24
1963	PRR71453.1	264732.Moth_1119	3.19e-242	673.0	COG4100@1|root,COG4100@2|Bacteria,1TQ88@1239|Firmicutes,247Y4@186801|Clostridia,42FHI@68295|Thermoanaerobacterales	PFAM Aluminium resistance family protein	ynbB	-	-	-	-	Met_gamma_lyase
1963	PRR71454.1	264732.Moth_1118	4.36e-183	515.0	COG0464@1|root,COG0464@2|Bacteria,1TPQZ@1239|Firmicutes,24BQK@186801|Clostridia,42FBM@68295|Thermoanaerobacterales	PFAM AAA ATPase central domain protein	spoVK	-	ko:K06413	-	ko00000	AAA
1963	PRR71455.1	264732.Moth_1117	7.15e-91	265.0	2DMXJ@1|root,32U9H@2|Bacteria,1VAAG@1239|Firmicutes,24PK1@186801|Clostridia,42IW6@68295|Thermoanaerobacterales	Domain of Unknown Function (DUF1540)	-	-	-	-	-	DUF1540
1963	PRR71456.1	264732.Moth_1116	3.22e-50	159.0	COG1923@1|root,COG1923@2|Bacteria,1VEGI@1239|Firmicutes,24QIM@186801|Clostridia,42GUT@68295|Thermoanaerobacterales	RNA chaperone that binds small regulatory RNA (sRNAs) and mRNAs to facilitate mRNA translational regulation in response to envelope stress, environmental stress and changes in metabolite concentrations. Also binds with high specificity to tRNAs	hfq	-	ko:K03666	ko02024,ko03018,ko05111,map02024,map03018,map05111	ko00000,ko00001,ko03019,ko03036	Hfq
1963	PRR71457.1	264732.Moth_1115	1.05e-174	493.0	COG0324@1|root,COG0324@2|Bacteria,1TPSC@1239|Firmicutes,248HB@186801|Clostridia,42EX3@68295|Thermoanaerobacterales	Catalyzes the transfer of a dimethylallyl group onto the adenine at position 37 in tRNAs that read codons beginning with uridine, leading to the formation of N6-(dimethylallyl)adenosine (i(6)A)	miaA	-	ko:K00791	ko00908,ko01100,ko01110,map00908,map01100,map01110	ko00000,ko00001,ko01000,ko01006,ko03016	IPPT
1963	PRR71458.1	264732.Moth_1114	6.48e-294	819.0	COG0323@1|root,COG0323@2|Bacteria,1TPGK@1239|Firmicutes,24902@186801|Clostridia,42ENI@68295|Thermoanaerobacterales	This protein is involved in the repair of mismatches in DNA. It is required for dam-dependent methyl-directed DNA mismatch repair. May act as a molecular matchmaker , a protein that promotes the formation of a stable complex between two or more DNA-binding proteins in an ATP-dependent manner without itself being part of a final effector complex	mutL	-	ko:K03572	ko03430,map03430	ko00000,ko00001,ko03400	DNA_mis_repair,HATPase_c_3,MutL_C
1963	PRR71459.1	264732.Moth_1113	0.0	1329.0	COG0249@1|root,COG0249@2|Bacteria,1TPRJ@1239|Firmicutes,248GI@186801|Clostridia,42FAG@68295|Thermoanaerobacterales	that it carries out the mismatch recognition step. This protein has a weak ATPase activity	mutS	-	ko:K03555	ko03430,map03430	ko00000,ko00001,ko03400	MutS_I,MutS_II,MutS_III,MutS_IV,MutS_V
1963	PRR71460.1	264732.Moth_1112	3e-279	768.0	COG0621@1|root,COG0621@2|Bacteria,1TNYN@1239|Firmicutes,2482Y@186801|Clostridia,42FC8@68295|Thermoanaerobacterales	Catalyzes the methylthiolation of N6- (dimethylallyl)adenosine (i(6)A), leading to the formation of 2- methylthio-N6-(dimethylallyl)adenosine (ms(2)i(6)A) at position 37 in tRNAs that read codons beginning with uridine	miaB	-	ko:K06168	-	ko00000,ko01000,ko03016	Radical_SAM,TRAM,UPF0004
1963	PRR71461.1	264732.Moth_1111	1.79e-95	280.0	COG1259@1|root,COG1259@2|Bacteria,1VCY4@1239|Firmicutes,24JJK@186801|Clostridia,42GWT@68295|Thermoanaerobacterales	Bifunctional nuclease	-	-	ko:K08999	-	ko00000	DNase-RNase
1963	PRR71462.1	264732.Moth_1110	1.3e-84	251.0	COG1661@1|root,COG1661@2|Bacteria,1VBWE@1239|Firmicutes,24HQ2@186801|Clostridia,42G85@68295|Thermoanaerobacterales	Domain of unknown function (DUF296)	-	-	ko:K06934	-	ko00000	DUF296
1963	PRR71463.1	264732.Moth_1109	7.75e-226	626.0	COG2768@1|root,COG2768@2|Bacteria,1TQAW@1239|Firmicutes,247IS@186801|Clostridia,42ETU@68295|Thermoanaerobacterales	4Fe-4S ferredoxin iron-sulfur binding domain protein	-	-	ko:K07138	-	ko00000	DUF362,Fer4,Fer4_4,Fer4_6
1963	PRR71464.1	264732.Moth_1108	4.71e-315	862.0	COG0516@1|root,COG0517@1|root,COG0516@2|Bacteria,COG0517@2|Bacteria,1TNZ1@1239|Firmicutes,247PS@186801|Clostridia,42EYV@68295|Thermoanaerobacterales	Catalyzes the conversion of inosine 5'-phosphate (IMP) to xanthosine 5'-phosphate (XMP), the first committed and rate- limiting step in the de novo synthesis of guanine nucleotides, and therefore plays an important role in the regulation of cell growth	guaB	-	ko:K00088	ko00230,ko00983,ko01100,ko01110,map00230,map00983,map01100,map01110	ko00000,ko00001,ko00002,ko01000,ko04147	CBS,IMPDH,NMO
1963	PRR71465.1	264732.Moth_1106	5.79e-43	140.0	COG3415@1|root,COG3415@2|Bacteria,1VHYZ@1239|Firmicutes,24QWY@186801|Clostridia,42HH5@68295|Thermoanaerobacterales	Transposase	-	-	-	-	-	-
1963	PRR71466.1	264732.Moth_1105	3.63e-119	344.0	COG0406@1|root,COG0406@2|Bacteria,1V6ES@1239|Firmicutes,24JDV@186801|Clostridia,42G0T@68295|Thermoanaerobacterales	PFAM Phosphoglycerate mutase	pspA	-	ko:K02226,ko:K22305	ko00260,ko00680,ko00860,ko01100,ko01120,ko01130,map00260,map00680,map00860,map01100,map01120,map01130	ko00000,ko00001,ko00002,ko01000	His_Phos_1
1963	PRR71467.1	264732.Moth_1104	9.73e-171	488.0	COG0079@1|root,COG0079@2|Bacteria,1TP5D@1239|Firmicutes,248Q0@186801|Clostridia,42G1Q@68295|Thermoanaerobacterales	PFAM aminotransferase, class I	cobD2	-	ko:K04720	ko00860,map00860	ko00000,ko00001,ko01000	Aminotran_1_2
1963	PRR71468.1	264732.Moth_1103	1.04e-141	408.0	COG4542@1|root,COG4542@2|Bacteria,1TSJB@1239|Firmicutes,24I5S@186801|Clostridia,42GB5@68295|Thermoanaerobacterales	COGs COG4542 Protein involved in propanediol utilization and related protein (includes coumermycin biosynthetic protein)	pduX	-	ko:K16651	ko00860,map00860	ko00000,ko00001,ko01000	GHMP_kinases_C,GHMP_kinases_N
1963	PRR71469.1	264732.Moth_1102	4.36e-109	322.0	COG0368@1|root,COG0368@2|Bacteria,1V1QB@1239|Firmicutes,24I0D@186801|Clostridia,42G37@68295|Thermoanaerobacterales	Joins adenosylcobinamide-GDP and alpha-ribazole to generate adenosylcobalamin (Ado-cobalamin). Also synthesizes adenosylcobalamin 5'-phosphate from adenosylcobinamide-GDP and alpha-ribazole 5'-phosphate	cobS	-	ko:K02233	ko00860,ko01100,map00860,map01100	ko00000,ko00001,ko00002,ko01000	CobS
1963	PRR71470.1	264732.Moth_1101	1.82e-179	506.0	COG2038@1|root,COG2038@2|Bacteria,1TPC1@1239|Firmicutes,25DH5@186801|Clostridia,42EKS@68295|Thermoanaerobacterales	Catalyzes the synthesis of alpha-ribazole-5'-phosphate from nicotinate mononucleotide (NAMN) and 5,6- dimethylbenzimidazole (DMB)	cobT	-	ko:K00768	ko00860,ko01100,map00860,map01100	ko00000,ko00001,ko00002,ko01000	DBI_PRT
1963	PRR71471.1	264732.Moth_1100	8.31e-233	652.0	COG1797@1|root,COG1797@2|Bacteria,1TNY2@1239|Firmicutes,247PU@186801|Clostridia,42FA3@68295|Thermoanaerobacterales	Catalyzes the ATP-dependent amidation of the two carboxylate groups at positions a and c of cobyrinate, using either L-glutamine or ammonia as the nitrogen source	cbiA	-	ko:K02224	ko00860,ko01100,ko01120,map00860,map01100,map01120	ko00000,ko00001,ko01000	AAA_26,CbiA,GATase_3
1963	PRR71472.1	264732.Moth_1099	1.83e-148	427.0	COG1270@1|root,COG1270@2|Bacteria,1TQ3X@1239|Firmicutes,247PR@186801|Clostridia,42EN7@68295|Thermoanaerobacterales	Converts cobyric acid to cobinamide by the addition of aminopropanol on the F carboxylic group	cobD	-	ko:K02227	ko00860,ko01100,map00860,map01100	ko00000,ko00001,ko00002,ko01000	CobD_Cbib
1963	PRR71473.1	264732.Moth_1098	1.09e-290	803.0	COG1492@1|root,COG1492@2|Bacteria,1TP5E@1239|Firmicutes,248XW@186801|Clostridia,42EQ4@68295|Thermoanaerobacterales	Catalyzes amidations at positions B, D, E, and G on adenosylcobyrinic A,C-diamide. NH(2) groups are provided by glutamine, and one molecule of ATP is hydrogenolyzed for each amidation	cobQ	-	ko:K02232	ko00860,ko01100,map00860,map01100	ko00000,ko00001,ko00002,ko01000	AAA_26,CbiA,GATase_3
1963	PRR71474.1	264732.Moth_1097	4.45e-107	313.0	COG2082@1|root,COG2082@2|Bacteria,1V1SX@1239|Firmicutes,24B9Z@186801|Clostridia,42G8W@68295|Thermoanaerobacterales	Precorrin-8X methylmutase CbiC CobH	cobH	-	ko:K06042	ko00860,ko01100,map00860,map01100	ko00000,ko00001,ko01000	CbiC
1963	PRR71475.1	264732.Moth_1096	7.41e-70	212.0	COG2138@1|root,COG2138@2|Bacteria,1TRDV@1239|Firmicutes,24QUN@186801|Clostridia,42H3X@68295|Thermoanaerobacterales	PFAM cobalamin (vitamin B12) biosynthesis CbiX protein	cbiX	-	ko:K03794,ko:K03795	ko00860,ko01100,ko01110,ko01120,map00860,map01100,map01110,map01120	ko00000,ko00001,ko00002,ko01000	CbiX
1963	PRR71476.1	264732.Moth_1095	2.66e-117	342.0	COG2099@1|root,COG2099@2|Bacteria,1UHWY@1239|Firmicutes,24GIQ@186801|Clostridia,42GIS@68295|Thermoanaerobacterales	PFAM Precorrin-6x reductase CbiJ CobK	cobK	-	ko:K02304,ko:K05895	ko00860,ko01100,ko01110,ko01120,map00860,map01100,map01110,map01120	ko00000,ko00001,ko00002,ko01000	CbiJ,NAD_binding_7
1963	PRR71477.1	264732.Moth_1094	2.62e-146	416.0	COG1010@1|root,COG1010@2|Bacteria,1TPJ7@1239|Firmicutes,247QS@186801|Clostridia,42G3M@68295|Thermoanaerobacterales	PFAM Uroporphyrin-III C tetrapyrrole (Corrin Porphyrin) methyltransferase	cobJ	-	ko:K05934,ko:K21479	ko00860,ko01100,map00860,map01100	ko00000,ko00001,ko01000	TP_methylase
1963	PRR71478.1	264732.Moth_1093	5.58e-160	459.0	COG2073@1|root,COG2073@2|Bacteria,1TPYM@1239|Firmicutes,247JW@186801|Clostridia,42GDK@68295|Thermoanaerobacterales	PFAM cobalamin (vitamin B12) biosynthesis CbiG	cbiG	-	ko:K02189	ko00860,ko01100,map00860,map01100	ko00000,ko00001,ko01000	CbiG_C,CbiG_N,CbiG_mid
1963	PRR71479.1	264732.Moth_1092	1.69e-144	411.0	COG2875@1|root,COG2875@2|Bacteria,1TP6J@1239|Firmicutes,248IZ@186801|Clostridia,42FDU@68295|Thermoanaerobacterales	Belongs to the precorrin methyltransferase family	cobM	-	ko:K05936	ko00860,ko01100,map00860,map01100	ko00000,ko00001,ko01000	TP_methylase
1963	PRR71480.1	264732.Moth_1091	5.47e-133	381.0	COG2243@1|root,COG2243@2|Bacteria,1TP87@1239|Firmicutes,249DM@186801|Clostridia,42G6S@68295|Thermoanaerobacterales	PFAM Uroporphyrin-III C tetrapyrrole (Corrin Porphyrin) methyltransferase	cobI	-	ko:K03394	ko00860,ko01100,map00860,map01100	ko00000,ko00001,ko01000	TP_methylase
1963	PRR71481.1	264732.Moth_1090	5.03e-96	284.0	COG2242@1|root,COG2242@2|Bacteria,1TS3H@1239|Firmicutes,2483G@186801|Clostridia,42GIX@68295|Thermoanaerobacterales	Precorrin-6Y C5,15-methyltransferase (Decarboxylating), CbiT subunit	cbiT	-	ko:K00595,ko:K02191	ko00860,ko01100,map00860,map01100	ko00000,ko00001,ko01000	CbiJ,Cons_hypoth95,MTS,Met_10,Methyltransf_31,Methyltransf_4,PCMT,TP_methylase
1963	PRR71482.1	264732.Moth_1089	1.36e-101	300.0	COG2241@1|root,COG2241@2|Bacteria,1V832@1239|Firmicutes,24JES@186801|Clostridia,42GYH@68295|Thermoanaerobacterales	Tetrapyrrole (Corrin/Porphyrin) Methylases	cbiE	-	ko:K00595,ko:K03399	ko00860,ko01100,map00860,map01100	ko00000,ko00001,ko01000	TP_methylase
1963	PRR71483.1	264732.Moth_1088	7.33e-194	545.0	COG1903@1|root,COG1903@2|Bacteria,1TQ3M@1239|Firmicutes,248AK@186801|Clostridia,42FC5@68295|Thermoanaerobacterales	Catalyzes the methylation of C-1 in cobalt-precorrin-5B to form cobalt-precorrin-6A	cbiD	-	ko:K02188	ko00860,ko01100,map00860,map01100	ko00000,ko00001,ko01000	CbiD
1963	PRR71484.1	264732.Moth_1087	5.16e-75	231.0	COG2087@1|root,COG2087@2|Bacteria,1V6F8@1239|Firmicutes,24JEN@186801|Clostridia,42J32@68295|Thermoanaerobacterales	Cobinamide kinase / cobinamide phosphate guanyltransferase	cobU	-	ko:K02231	ko00860,ko01100,map00860,map01100	ko00000,ko00001,ko00002,ko01000	CobU
1963	PRR71485.1	429009.Adeg_1470	3.35e-15	71.2	2EEA4@1|root,3384K@2|Bacteria,1VGQN@1239|Firmicutes,24QPZ@186801|Clostridia,42IZY@68295|Thermoanaerobacterales	-	-	-	-	-	-	-
1963	PRR71486.1	264732.Moth_1085	3.09e-127	370.0	COG0613@1|root,COG0613@2|Bacteria,1TPI5@1239|Firmicutes,248H2@186801|Clostridia,42GGH@68295|Thermoanaerobacterales	SMART phosphoesterase PHP domain protein	-	-	ko:K07053	-	ko00000,ko01000	PHP
1963	PRR71487.1	264732.Moth_1083	1.38e-160	452.0	COG1692@1|root,COG1692@2|Bacteria,1TR9P@1239|Firmicutes,24967@186801|Clostridia,42EQD@68295|Thermoanaerobacterales	PFAM Metallophosphoesterase	-	-	ko:K09769	-	ko00000	YmdB
1963	PRR71488.1	264732.Moth_1082	1.46e-93	276.0	2ATKN@1|root,31J4X@2|Bacteria,1V5JB@1239|Firmicutes,24KI6@186801|Clostridia,42H7B@68295|Thermoanaerobacterales	-	-	-	-	-	-	-
1963	PRR71489.1	264732.Moth_1081	9.47e-230	647.0	COG1418@1|root,COG1418@2|Bacteria,1TP48@1239|Firmicutes,248G8@186801|Clostridia,42F5Q@68295|Thermoanaerobacterales	Endoribonuclease that initiates mRNA decay	rny	-	ko:K18682	ko03018,map03018	ko00000,ko00001,ko01000,ko03019	DUF3552,HD,KH_1
1963	PRR71490.1	264732.Moth_1080	1.61e-56	182.0	COG2137@1|root,COG2137@2|Bacteria	regulation of DNA repair	recX	-	ko:K03565	-	ko00000,ko03400	RecX
1963	PRR71491.1	264732.Moth_1079	3.19e-211	588.0	COG0468@1|root,COG0468@2|Bacteria,1TPD5@1239|Firmicutes,247SF@186801|Clostridia,42F99@68295|Thermoanaerobacterales	Can catalyze the hydrolysis of ATP in the presence of single-stranded DNA, the ATP-dependent uptake of single-stranded DNA by duplex DNA, and the ATP-dependent hybridization of homologous single-stranded DNAs. It interacts with LexA causing its activation and leading to its autocatalytic cleavage	recA	-	ko:K03553	ko03440,map03440	ko00000,ko00001,ko00002,ko03400	RecA
1963	PRR71492.1	264732.Moth_1078	2.71e-94	279.0	COG1514@1|root,COG1514@2|Bacteria,1VEU2@1239|Firmicutes,24MTR@186801|Clostridia,42GPA@68295|Thermoanaerobacterales	Hydrolyzes RNA 2',3'-cyclic phosphodiester to an RNA 2'- phosphomonoester	ligT	-	ko:K01975	-	ko00000,ko01000,ko03016	LigT_PEase
1963	PRR71493.1	264732.Moth_1077	8.12e-287	791.0	COG0465@1|root,COG0465@2|Bacteria,1TRA6@1239|Firmicutes,248I4@186801|Clostridia,42ERH@68295|Thermoanaerobacterales	AAA ATPase, central domain protein	-	-	ko:K06027	ko04138,ko04721,ko04727,ko04962,map04138,map04721,map04727,map04962	ko00000,ko00001,ko01000,ko04131	AAA,Peptidase_M41
1963	PRR71494.1	264732.Moth_1076	1.2e-68	213.0	2AQSV@1|root,31G0S@2|Bacteria,1V8RB@1239|Firmicutes,24MC3@186801|Clostridia,42GPF@68295|Thermoanaerobacterales	-	-	-	-	-	-	-
1963	PRR71495.1	264732.Moth_1075	5e-78	236.0	COG0558@1|root,COG0558@2|Bacteria,1V6PJ@1239|Firmicutes,24J7Y@186801|Clostridia,42GIN@68295|Thermoanaerobacterales	Belongs to the CDP-alcohol phosphatidyltransferase class-I family	pgsA	-	ko:K00995,ko:K08744	ko00564,ko01100,map00564,map01100	ko00000,ko00001,ko01000	CDP-OH_P_transf
1963	PRR71496.1	264732.Moth_1074	5.7e-234	652.0	COG0621@1|root,COG0621@2|Bacteria,1TP2W@1239|Firmicutes,2487D@186801|Clostridia,42EU2@68295|Thermoanaerobacterales	Catalyzes the methylthiolation of an aspartic acid residue of ribosomal protein S12	rimO	-	ko:K14441	-	ko00000,ko01000,ko03009	Radical_SAM,TRAM,UPF0004
1963	PRR71497.1	264732.Moth_1073	2.44e-102	304.0	COG1426@1|root,COG1426@2|Bacteria,1V1N7@1239|Firmicutes,24M2Q@186801|Clostridia,42J4X@68295|Thermoanaerobacterales	Domain of unknown function (DUF4115)	-	-	-	-	-	DUF4115,HTH_25
1963	PRR71498.1	264732.Moth_1072	0.0	1196.0	COG1674@1|root,COG1674@2|Bacteria,1TPJR@1239|Firmicutes,247KM@186801|Clostridia,42EM0@68295|Thermoanaerobacterales	PFAM cell divisionFtsK SpoIIIE	ftsK	-	ko:K03466	-	ko00000,ko03036	FtsK_4TM,FtsK_SpoIIIE,Ftsk_gamma
1963	PRR71499.1	264732.Moth_1071	1.35e-150	427.0	COG0740@1|root,COG0740@2|Bacteria,1TPX2@1239|Firmicutes,249QX@186801|Clostridia,42EXE@68295|Thermoanaerobacterales	ATP-dependent Clp protease, proteolytic subunit	tepA	-	ko:K01358	ko04112,ko04212,map04112,map04212	ko00000,ko00001,ko01000,ko01002	CLP_protease
1963	PRR71500.1	1122915.AUGY01000027_gene3486	8.17e-15	69.7	2DR6C@1|root,33ACS@2|Bacteria,1VM75@1239|Firmicutes,4HR6M@91061|Bacilli,2709F@186822|Paenibacillaceae	YlzJ-like protein	-	-	-	-	-	YlzJ
1963	PRR71501.1	1121472.AQWN01000007_gene1060	6.35e-68	214.0	2BNRQ@1|root,32HF7@2|Bacteria,1V8BV@1239|Firmicutes,24KMG@186801|Clostridia	Nucleotidyl transferase AbiEii toxin, Type IV TA system	-	-	-	-	-	AbiEii
