key	query	seed_ortholog	evalue	score	eggNOG_OGs	description	preferred_name	GOs	KEGG_ko	KEGG_pathway	brite	PFAMs
2058	SQF82997.1	546262.NEICINOT_04664	9.69e-104	300.0	COG3439@1|root,COG3439@2|Bacteria,1MZ38@1224|Proteobacteria,2VVUF@28216|Betaproteobacteria,2KRAM@206351|Neisseriales	Domain of unknown function DUF302	-	-	-	-	-	DUF302
2058	SQF82998.1	546262.NEICINOT_04665	6.59e-76	227.0	COG0607@1|root,COG0607@2|Bacteria,1NGN9@1224|Proteobacteria,2VUUZ@28216|Betaproteobacteria,2KRW2@206351|Neisseriales	Rhodanese Homology Domain	-	-	ko:K03972	-	ko00000	Rhodanese
2058	SQF82999.1	546262.NEICINOT_04666	0.0	2249.0	COG1074@1|root,COG1074@2|Bacteria,1MUTF@1224|Proteobacteria,2VI92@28216|Betaproteobacteria,2KPJ2@206351|Neisseriales	A helicase nuclease that prepares dsDNA breaks (DSB) for recombinational DNA repair. Binds to DSBs and unwinds DNA via a highly rapid and processive ATP-dependent bidirectional helicase activity. Unwinds dsDNA until it encounters a Chi (crossover hotspot instigator) sequence from the 3' direction. Cuts ssDNA a few nucleotides 3' to the Chi site. The properties and activities of the enzyme are changed at Chi. The Chi-altered holoenzyme produces a long 3'-ssDNA overhang and facilitates RecA-binding to the ssDNA for homologous DNA recombination and repair. Holoenzyme degrades any linearized DNA that is unable to undergo homologous recombination. In the holoenzyme this subunit contributes ATPase, 3'-5' helicase, exonuclease activity and loads RecA onto ssDNA	recB	-	ko:K03582	ko03440,map03440	ko00000,ko00001,ko01000,ko03400	PDDEXK_1,UvrD-helicase,UvrD_C
2058	SQF83000.1	546262.NEICINOT_04667	1.64e-215	595.0	COG2837@1|root,COG2837@2|Bacteria,1MWDD@1224|Proteobacteria,2VMMG@28216|Betaproteobacteria,2KQK9@206351|Neisseriales	Dyp-type peroxidase family protein	yfeX	-	ko:K07223	-	ko00000	Dyp_perox
2058	SQF83001.1	546262.NEICINOT_04668	2.79e-187	521.0	COG0834@1|root,COG0834@2|Bacteria,1MXME@1224|Proteobacteria,2VHH1@28216|Betaproteobacteria,2KPUW@206351|Neisseriales	Belongs to the bacterial solute-binding protein 3 family	-	-	ko:K02424	ko02010,map02010	ko00000,ko00001,ko00002,ko02000,ko02035	SBP_bac_3
2058	SQF83002.1	596320.NEIFL0001_1003	1.6e-159	448.0	COG0765@1|root,COG0765@2|Bacteria,1QN80@1224|Proteobacteria,2VI1W@28216|Betaproteobacteria,2KQJ5@206351|Neisseriales	Psort location CytoplasmicMembrane, score 10.00	-	-	ko:K10009	ko02010,map02010	ko00000,ko00001,ko00002,ko02000	BPD_transp_1
2058	SQF83003.1	546267.NEIPOLOT_00714	8.65e-175	488.0	COG1126@1|root,COG1126@2|Bacteria,1MU9Q@1224|Proteobacteria,2VHIC@28216|Betaproteobacteria,2KQJD@206351|Neisseriales	ABC transporter, ATP-binding protein	-	-	ko:K10010	ko02010,map02010	ko00000,ko00001,ko00002,ko01000,ko02000	ABC_tran
2058	SQF83004.1	596320.NEIFL0001_0844	0.0	887.0	COG1109@1|root,COG1109@2|Bacteria,1MUA5@1224|Proteobacteria,2VJ29@28216|Betaproteobacteria,2KQDD@206351|Neisseriales	Phosphoglucomutase phosphomannomutase, alpha beta alpha domain II	algC	-	ko:K01835,ko:K15778	ko00010,ko00030,ko00051,ko00052,ko00230,ko00500,ko00520,ko00521,ko01100,ko01110,ko01120,ko01130,map00010,map00030,map00051,map00052,map00230,map00500,map00520,map00521,map01100,map01110,map01120,map01130	ko00000,ko00001,ko00002,ko01000	PGM_PMM_I,PGM_PMM_II,PGM_PMM_III,PGM_PMM_IV
2058	SQF83005.1	546262.NEICINOT_04673	4.07e-121	346.0	COG0652@1|root,COG0652@2|Bacteria,1R9ZQ@1224|Proteobacteria,2VQ3Z@28216|Betaproteobacteria,2KQS1@206351|Neisseriales	PPIases accelerate the folding of proteins. It catalyzes the cis-trans isomerization of proline imidic peptide bonds in oligopeptides	ppiB	-	ko:K03768	-	ko00000,ko01000,ko03110	Pro_isomerase
2058	SQF83006.1	546262.NEICINOT_04674	1.81e-78	233.0	COG5652@1|root,COG5652@2|Bacteria,1NCWS@1224|Proteobacteria,2WFTI@28216|Betaproteobacteria,2KTWD@206351|Neisseriales	VanZ like family	-	-	-	-	-	VanZ
2058	SQF83007.1	546262.NEICINOT_04675	4.4e-41	135.0	2EHA2@1|root,33B1Y@2|Bacteria,1NGD4@1224|Proteobacteria,2VY8T@28216|Betaproteobacteria,2KS99@206351|Neisseriales	Psort location Cytoplasmic, score 8.96	-	-	-	-	-	-
2058	SQF83008.1	546262.NEICINOT_04676	1.04e-141	399.0	COG0193@1|root,COG0193@2|Bacteria,1MX1P@1224|Proteobacteria,2VKKJ@28216|Betaproteobacteria,2KPV0@206351|Neisseriales	The natural substrate for this enzyme may be peptidyl- tRNAs which drop off the ribosome during protein synthesis	pth	-	ko:K01056	-	ko00000,ko01000,ko03012	Pept_tRNA_hydro
2058	SQF83009.1	546262.NEICINOT_04677	7.27e-56	174.0	COG2914@1|root,COG2914@2|Bacteria,1MZCH@1224|Proteobacteria,2VVNX@28216|Betaproteobacteria,2KRX3@206351|Neisseriales	Belongs to the UPF0125 (RnfH) family	-	-	ko:K09801	-	ko00000	Ub-RnfH
2058	SQF83010.1	546262.NEICINOT_04678	1.33e-100	291.0	COG2867@1|root,COG2867@2|Bacteria,1RGUH@1224|Proteobacteria,2VR4X@28216|Betaproteobacteria,2KR5A@206351|Neisseriales	Psort location Cytoplasmic, score 8.96	-	-	-	-	-	Polyketide_cyc
2058	SQF83011.1	546262.NEICINOT_04679	0.0	1264.0	COG0465@1|root,COG0465@2|Bacteria,1MU6J@1224|Proteobacteria,2VHEV@28216|Betaproteobacteria,2KPHG@206351|Neisseriales	Acts as a processive, ATP-dependent zinc metallopeptidase for both cytoplasmic and membrane proteins. Plays a role in the quality control of integral membrane proteins	hflB	-	ko:K03798	-	ko00000,ko00002,ko01000,ko01002,ko03110	AAA,FtsH_ext,Peptidase_M41
2058	SQF83012.1	546262.NEICINOT_04680	9.49e-143	403.0	COG0293@1|root,COG0293@2|Bacteria,1MW1C@1224|Proteobacteria,2VIU9@28216|Betaproteobacteria,2KPGI@206351|Neisseriales	Specifically methylates the uridine in position 2552 of 23S rRNA at the 2'-O position of the ribose in the fully assembled 50S ribosomal subunit	ftsJ	-	ko:K02427	-	ko00000,ko01000,ko03009	FtsJ
2058	SQF83013.1	546262.NEICINOT_04681	1.9e-61	188.0	COG1534@1|root,COG1534@2|Bacteria,1N8K5@1224|Proteobacteria,2VVP0@28216|Betaproteobacteria,2KRJV@206351|Neisseriales	RNA-binding protein, YhbY family	-	-	ko:K07574	-	ko00000,ko03009	CRS1_YhbY
2058	SQF83014.1	546262.NEICINOT_04683	2.85e-37	125.0	2A5CU@1|root,34857@2|Bacteria,1P2QN@1224|Proteobacteria	-	-	-	-	-	-	-
2058	SQF83015.1	546262.NEICINOT_04684	1.63e-173	483.0	COG0542@1|root,COG0542@2|Bacteria,1R0UI@1224|Proteobacteria,2WHX1@28216|Betaproteobacteria	Zeta toxin	-	-	-	-	-	Zeta_toxin
2058	SQF83016.1	489653.NLA_14280	6.32e-231	637.0	COG0113@1|root,COG0113@2|Bacteria,1MWMW@1224|Proteobacteria,2VHC6@28216|Betaproteobacteria,2KPG9@206351|Neisseriales	Belongs to the ALAD family	hemB	-	ko:K01698	ko00860,ko01100,ko01110,ko01120,map00860,map01100,map01110,map01120	ko00000,ko00001,ko00002,ko01000,ko04147	ALAD
2058	SQF83017.1	546262.NEICINOT_04686	6.5e-284	776.0	COG0626@1|root,COG0626@2|Bacteria,1MU57@1224|Proteobacteria,2VHAC@28216|Betaproteobacteria,2KQFQ@206351|Neisseriales	Cys Met metabolism PLP-dependent enzyme	metC	-	ko:K01739,ko:K01758,ko:K01760	ko00260,ko00270,ko00450,ko00920,ko01100,ko01110,ko01130,ko01230,map00260,map00270,map00450,map00920,map01100,map01110,map01130,map01230	ko00000,ko00001,ko00002,ko01000,ko04147	Cys_Met_Meta_PP
2058	SQF83018.1	546262.NEICINOT_04687	6.5e-214	590.0	COG1469@1|root,COG1469@2|Bacteria,1MV1B@1224|Proteobacteria,2VIC9@28216|Betaproteobacteria,2KQBB@206351|Neisseriales	Converts GTP to 7,8-dihydroneopterin triphosphate	folE2	-	ko:K09007	ko00790,ko01100,map00790,map01100	ko00000,ko00001,ko00002,ko01000	GCHY-1
2058	SQF83019.1	546262.NEICINOT_04688	8.06e-156	437.0	COG0778@1|root,COG0778@2|Bacteria,1R9AV@1224|Proteobacteria,2WF2D@28216|Betaproteobacteria,2KU2Q@206351|Neisseriales	Nitroreductase family	-	-	-	-	-	Nitroreductase
2058	SQF83020.1	546262.NEICINOT_04689	2.17e-164	461.0	COG1187@1|root,COG1187@2|Bacteria,1MXQE@1224|Proteobacteria,2VI7P@28216|Betaproteobacteria,2KPWX@206351|Neisseriales	Belongs to the pseudouridine synthase RsuA family	rluF	-	ko:K06182	-	ko00000,ko01000,ko03009	PseudoU_synth_2,S4
2058	SQF83021.1	546262.NEICINOT_04690	3.35e-215	593.0	COG0061@1|root,COG0061@2|Bacteria,1MUBC@1224|Proteobacteria,2VIV0@28216|Betaproteobacteria,2KPFX@206351|Neisseriales	Involved in the regulation of the intracellular balance of NAD and NADP, and is a key enzyme in the biosynthesis of NADP. Catalyzes specifically the phosphorylation on 2'-hydroxyl of the adenosine moiety of NAD to yield NADP	nadK	-	ko:K00858	ko00760,ko01100,map00760,map01100	ko00000,ko00001,ko01000	NAD_kinase
2058	SQF83022.1	596320.NEIFL0001_1272	1.11e-92	275.0	COG3165@1|root,COG3165@2|Bacteria,1NBAZ@1224|Proteobacteria,2VX59@28216|Betaproteobacteria,2KS32@206351|Neisseriales	ubiquinone biosynthetic process from chorismate	-	-	ko:K03690	-	ko00000	-
2058	SQF83023.1	546262.NEICINOT_04693	9.06e-190	527.0	COG0451@1|root,COG0451@2|Bacteria,1PKHW@1224|Proteobacteria,2W8UC@28216|Betaproteobacteria,2KR8S@206351|Neisseriales	ADP-glyceromanno-heptose 6-epimerase activity	-	-	-	-	-	Epimerase,RmlD_sub_bind
2058	SQF83024.1	546262.NEICINOT_04694	1.44e-146	413.0	COG1309@1|root,COG1309@2|Bacteria,1R52P@1224|Proteobacteria,2VIDN@28216|Betaproteobacteria,2KQ9S@206351|Neisseriales	transcriptional regulator, TetR family	-	-	-	-	-	TetR,TetR_N
2058	SQF83025.1	546262.NEICINOT_04695	1.22e-249	685.0	COG0812@1|root,COG0812@2|Bacteria,1MXDH@1224|Proteobacteria,2VI7I@28216|Betaproteobacteria,2KQ5F@206351|Neisseriales	Cell wall formation	murB	-	ko:K00075	ko00520,ko00550,ko01100,map00520,map00550,map01100	ko00000,ko00001,ko01000,ko01011	FAD_binding_4,MurB_C
2058	SQF83026.1	546267.NEIPOLOT_01032	0.0	876.0	COG0534@1|root,COG0534@2|Bacteria,1MUAM@1224|Proteobacteria,2VH2B@28216|Betaproteobacteria,2KPH6@206351|Neisseriales	Psort location CytoplasmicMembrane, score 10.00	norM	-	ko:K03327	-	ko00000,ko02000	MatE
2058	SQF83027.1	546262.NEICINOT_04699	8.66e-316	859.0	COG0104@1|root,COG0104@2|Bacteria,1MU5B@1224|Proteobacteria,2VHBR@28216|Betaproteobacteria,2KPT5@206351|Neisseriales	Plays an important role in the de novo pathway of purine nucleotide biosynthesis. Catalyzes the first committed step in the biosynthesis of AMP from IMP	purA	-	ko:K01939	ko00230,ko00250,ko01100,map00230,map00250,map01100	ko00000,ko00001,ko00002,ko01000	Adenylsucc_synt
2058	SQF83028.1	546262.NEICINOT_04702	4.76e-185	517.0	COG0501@1|root,COG0501@2|Bacteria,1MUV4@1224|Proteobacteria,2VIVB@28216|Betaproteobacteria,2KQA6@206351|Neisseriales	Belongs to the peptidase M48B family	htpX	-	ko:K03799	-	ko00000,ko00002,ko01000,ko01002	Peptidase_M48
2058	SQF83029.1	546262.NEICINOT_04701	7.61e-145	410.0	COG0563@1|root,COG0563@2|Bacteria,1MXCZ@1224|Proteobacteria,2VH1C@28216|Betaproteobacteria,2KQ2Q@206351|Neisseriales	Catalyzes the reversible transfer of the terminal phosphate group between ATP and AMP. Plays an important role in cellular energy homeostasis and in adenine nucleotide metabolism	adk	-	ko:K00939	ko00230,ko00730,ko01100,ko01110,ko01130,map00230,map00730,map01100,map01110,map01130	ko00000,ko00001,ko00002,ko01000,ko04147	ADK,ADK_lid
2058	SQF83030.1	546262.NEICINOT_04703	4.26e-168	470.0	COG0284@1|root,COG0284@2|Bacteria,1MW2C@1224|Proteobacteria,2VJRD@28216|Betaproteobacteria,2KPCA@206351|Neisseriales	Catalyzes the decarboxylation of orotidine 5'- monophosphate (OMP) to uridine 5'-monophosphate (UMP)	pyrF	-	ko:K01591	ko00240,ko01100,map00240,map01100	ko00000,ko00001,ko00002,ko01000	OMPdecase
2058	SQF83031.1	546262.NEICINOT_04704	6.45e-216	597.0	COG2870@1|root,COG2870@2|Bacteria,1MV3Z@1224|Proteobacteria,2VHNS@28216|Betaproteobacteria,2KQ0K@206351|Neisseriales	Bifunctional protein RfaE, domain I	rfaE	-	ko:K21344	ko00540,map00540	ko00000,ko00001,ko00002,ko01000	PfkB
2058	SQF83032.1	546262.NEICINOT_04705	2.65e-247	678.0	COG0451@1|root,COG0451@2|Bacteria,1MVE4@1224|Proteobacteria,2VH69@28216|Betaproteobacteria,2KQFM@206351|Neisseriales	Catalyzes the interconversion between ADP-D-glycero- beta-D-manno-heptose and ADP-L-glycero-beta-D-manno-heptose via an epimerization at carbon 6 of the heptose	rfaD	-	ko:K03274	ko00540,ko01100,map00540,map01100	ko00000,ko00001,ko00002,ko01000,ko01005	Epimerase
2058	SQF83033.1	546274.EIKCOROL_00251	0.0	950.0	COG0286@1|root,COG0286@2|Bacteria,1MW3A@1224|Proteobacteria,2VHBK@28216|Betaproteobacteria,2KQIK@206351|Neisseriales	N-6 DNA Methylase	hsdM	-	ko:K03427	-	ko00000,ko01000,ko02048	HsdM_N,N6_Mtase
2058	SQF83034.1	1347393.HG726023_gene3227	4.08e-60	199.0	COG0732@1|root,COG0732@2|Bacteria,4NKMB@976|Bacteroidetes,2FTE7@200643|Bacteroidia,4ARQZ@815|Bacteroidaceae	Type I restriction modification DNA specificity domain	-	-	ko:K01154	-	ko00000,ko01000,ko02048	Methylase_S
2058	SQF83035.1	1028803.GG9_0395	5.2e-61	200.0	COG0732@1|root,COG0732@2|Bacteria,1R7I5@1224|Proteobacteria,1S8B0@1236|Gammaproteobacteria,1Y8WD@135625|Pasteurellales	Type I restriction modification DNA specificity domain	-	-	-	-	-	Methylase_S
2058	SQF83036.1	546267.NEIPOLOT_02577	0.0	1969.0	COG0610@1|root,COG0610@2|Bacteria,1MU96@1224|Proteobacteria,2VHIR@28216|Betaproteobacteria,2KQXE@206351|Neisseriales	Subunit R is required for both nuclease and ATPase activities, but not for modification	hsdR	-	ko:K01153	-	ko00000,ko01000,ko02048	EcoR124_C,HSDR_N,ResIII
2058	SQF83037.1	546262.NEICINOT_03002	0.0	1437.0	COG0542@1|root,COG0542@2|Bacteria,1MV8B@1224|Proteobacteria,2VH1K@28216|Betaproteobacteria,2KQ01@206351|Neisseriales	ATP-dependent Clp protease ATP-binding subunit	clpA	-	ko:K03694	-	ko00000,ko03110	AAA,AAA_2,ClpB_D2-small,Clp_N
2058	SQF83038.1	546267.NEIPOLOT_02579	3.05e-63	193.0	COG2127@1|root,COG2127@2|Bacteria,1MZU8@1224|Proteobacteria,2VSCU@28216|Betaproteobacteria,2KRR5@206351|Neisseriales	Involved in the modulation of the specificity of the ClpAP-mediated ATP-dependent protein degradation	clpS	-	ko:K06891	-	ko00000	ClpS
2058	SQF83039.1	546262.NEICINOT_03008	3.81e-309	843.0	COG0312@1|root,COG0312@2|Bacteria,1MUVW@1224|Proteobacteria,2VHJ4@28216|Betaproteobacteria,2KPRN@206351|Neisseriales	TldD PmbA family protein	pmbA	-	ko:K03592	-	ko00000,ko01002	PmbA_TldD
2058	SQF83040.1	546262.NEICINOT_03009	1.16e-114	329.0	COG3028@1|root,COG3028@2|Bacteria,1MZ4R@1224|Proteobacteria,2VSGZ@28216|Betaproteobacteria,2KR2F@206351|Neisseriales	Belongs to the UPF0307 family	-	-	ko:K09889	-	ko00000,ko03009	DUF615
2058	SQF83041.1	546268.NEISUBOT_03722	4.52e-94	282.0	2DJ7F@1|root,32UCH@2|Bacteria,1MZAG@1224|Proteobacteria,2VVJY@28216|Betaproteobacteria,2KRU7@206351|Neisseriales	-	-	-	-	-	-	-
2058	SQF83042.1	546262.NEICINOT_03011	0.0	1115.0	COG0608@1|root,COG0608@2|Bacteria,1MU1M@1224|Proteobacteria,2VIGF@28216|Betaproteobacteria,2KPE9@206351|Neisseriales	Psort location Cytoplasmic, score 8.96	recJ	-	ko:K07462	ko03410,ko03430,ko03440,map03410,map03430,map03440	ko00000,ko00001,ko01000,ko03400	DHH,DHHA1
2058	SQF83043.1	546262.NEICINOT_03012	3.91e-215	594.0	COG0697@1|root,COG0697@2|Bacteria,1PGSE@1224|Proteobacteria	Permeases of the drug metabolite transporter (DMT) superfamily	yhbE	GO:0005575,GO:0005623,GO:0005886,GO:0016020,GO:0044464,GO:0071944	-	-	-	EamA
2058	SQF83044.1	546267.NEIPOLOT_01176	0.0	905.0	COG0114@1|root,COG0114@2|Bacteria,1MUQI@1224|Proteobacteria,2VHA5@28216|Betaproteobacteria,2KQHH@206351|Neisseriales	Involved in the TCA cycle. Catalyzes the stereospecific interconversion of fumarate to L-malate	fumC	-	ko:K01679	ko00020,ko00620,ko00720,ko01100,ko01110,ko01120,ko01130,ko01200,ko04934,ko05200,ko05211,map00020,map00620,map00720,map01100,map01110,map01120,map01130,map01200,map04934,map05200,map05211	ko00000,ko00001,ko00002,ko01000	FumaraseC_C,Lyase_1
2058	SQF83045.1	546262.NEICINOT_03014	0.0	1288.0	COG0021@1|root,COG0021@2|Bacteria,1MUEY@1224|Proteobacteria,2VHNX@28216|Betaproteobacteria,2KPGW@206351|Neisseriales	Catalyzes the transfer of a two-carbon ketol group from a ketose donor to an aldose acceptor, via a covalent intermediate with the cofactor thiamine pyrophosphate	tkt	-	ko:K00615	ko00030,ko00710,ko01051,ko01100,ko01110,ko01120,ko01130,ko01200,ko01230,map00030,map00710,map01051,map01100,map01110,map01120,map01130,map01200,map01230	ko00000,ko00001,ko00002,ko01000	Transket_pyr,Transketolase_C,Transketolase_N
2058	SQF83046.1	546262.NEICINOT_03017	0.0	977.0	COG0348@1|root,COG0348@2|Bacteria,1MVFY@1224|Proteobacteria,2VHRH@28216|Betaproteobacteria,2KPSJ@206351|Neisseriales	Cytochrome c oxidase accessory protein CcoG	ccoG	-	-	-	-	Fer4_18,Fer4_5,FixG_C
2058	SQF83047.1	489653.NLA_8730	2.04e-123	352.0	COG3198@1|root,COG3198@2|Bacteria,1N75J@1224|Proteobacteria,2VTYE@28216|Betaproteobacteria,2KRAU@206351|Neisseriales	FixH	-	-	ko:K09926	-	ko00000	FixH
2058	SQF83048.1	489653.NLA_8740	2.22e-277	759.0	COG2070@1|root,COG2070@2|Bacteria,1N52W@1224|Proteobacteria,2VJ45@28216|Betaproteobacteria,2KPG5@206351|Neisseriales	2-nitropropane dioxygenase	-	-	ko:K00459	ko00910,map00910	ko00000,ko00001,ko01000	NMO
2058	SQF83050.1	546262.NEICINOT_03023	0.0	937.0	COG0847@1|root,COG0847@2|Bacteria,1MV8Z@1224|Proteobacteria,2WHUS@28216|Betaproteobacteria,2KTZW@206351|Neisseriales	Exonuclease	-	-	ko:K02342	ko00230,ko00240,ko01100,ko03030,ko03430,ko03440,map00230,map00240,map01100,map03030,map03430,map03440	ko00000,ko00001,ko00002,ko01000,ko03032,ko03400	RNase_T
2058	SQF83051.1	546262.NEICINOT_03025	6.36e-188	522.0	COG1018@1|root,COG1018@2|Bacteria,1MW37@1224|Proteobacteria,2WGQC@28216|Betaproteobacteria,2KQ83@206351|Neisseriales	Oxidoreductase NAD-binding domain protein	-	-	ko:K00528	-	ko00000,ko01000	FAD_binding_6,NAD_binding_1
2058	SQF83052.1	546262.NEICINOT_03026	0.0	2066.0	COG4773@1|root,COG4773@2|Bacteria,1MW5E@1224|Proteobacteria,2VHUH@28216|Betaproteobacteria	COG1629 Outer membrane receptor proteins, mostly Fe transport	-	-	-	-	-	Plug,TonB_dep_Rec
2058	SQF83053.1	546262.NEICINOT_03028	2.03e-251	690.0	COG0389@1|root,COG0389@2|Bacteria,1MUUH@1224|Proteobacteria,2VJNS@28216|Betaproteobacteria,2KQ0C@206351|Neisseriales	Poorly processive, error-prone DNA polymerase involved in untargeted mutagenesis. Copies undamaged DNA at stalled replication forks, which arise in vivo from mismatched or misaligned primer ends. These misaligned primers can be extended by PolIV. Exhibits no 3'-5' exonuclease (proofreading) activity. May be involved in translesional synthesis, in conjunction with the beta clamp from PolIII	dinB	-	ko:K02346	-	ko00000,ko01000,ko03400	IMS,IMS_C,IMS_HHH
2058	SQF83054.1	546262.NEICINOT_03030	0.0	1314.0	COG0210@1|root,COG0210@2|Bacteria,1MU0G@1224|Proteobacteria,2VJFM@28216|Betaproteobacteria,2KQDG@206351|Neisseriales	it can initiate unwinding at a nick in the DNA. It binds to the single-stranded DNA and acts in a progressive fashion along the DNA in the 3' to 5' direction	rep	-	ko:K03656	-	ko00000,ko01000,ko03400	UvrD-helicase,UvrD_C
2058	SQF83055.1	489653.NLA_12620	2.18e-163	459.0	COG0710@1|root,COG0710@2|Bacteria,1NG0G@1224|Proteobacteria,2VP6P@28216|Betaproteobacteria	Involved in the third step of the chorismate pathway, which leads to the biosynthesis of aromatic amino acids. Catalyzes the cis-dehydration of 3-dehydroquinate (DHQ) and introduces the first double bond of the aromatic ring to yield 3- dehydroshikimate	aroD	-	ko:K03785	ko00400,ko01100,ko01110,ko01130,ko01230,map00400,map01100,map01110,map01130,map01230	ko00000,ko00001,ko00002,ko01000	DHquinase_I
2058	SQF83056.1	546262.NEICINOT_03033	4.78e-248	681.0	COG0468@1|root,COG0468@2|Bacteria,1MU3C@1224|Proteobacteria,2VHNA@28216|Betaproteobacteria,2KQ25@206351|Neisseriales	Can catalyze the hydrolysis of ATP in the presence of single-stranded DNA, the ATP-dependent uptake of single-stranded DNA by duplex DNA, and the ATP-dependent hybridization of homologous single-stranded DNAs. It interacts with LexA causing its activation and leading to its autocatalytic cleavage	recA	-	ko:K03553	ko03440,map03440	ko00000,ko00001,ko00002,ko03400	RecA
2058	SQF83057.1	546262.NEICINOT_03034	2.37e-220	607.0	COG0697@1|root,COG0697@2|Bacteria,1PIE1@1224|Proteobacteria,2VHHE@28216|Betaproteobacteria	of the drug metabolite transporter (DMT) superfamily	yddG	-	-	-	-	EamA
2058	SQF83058.1	546267.NEIPOLOT_01151	2.38e-68	208.0	COG0718@1|root,COG0718@2|Bacteria,1RGZD@1224|Proteobacteria,2VSJ2@28216|Betaproteobacteria,2KRFE@206351|Neisseriales	Binds to DNA and alters its conformation. May be involved in regulation of gene expression, nucleoid organization and DNA protection	ybaB	-	ko:K09747	-	ko00000	YbaB_DNA_bd
2058	SQF83059.1	546267.NEIPOLOT_01150	0.0	1303.0	COG2812@1|root,COG2812@2|Bacteria,1MVCK@1224|Proteobacteria,2VIE0@28216|Betaproteobacteria,2KPX5@206351|Neisseriales	DNA polymerase III is a complex, multichain enzyme responsible for most of the replicative synthesis in bacteria. This DNA polymerase also exhibits 3' to 5' exonuclease activity	dnaX	-	ko:K02343	ko00230,ko00240,ko01100,ko03030,ko03430,ko03440,map00230,map00240,map01100,map03030,map03430,map03440	ko00000,ko00001,ko00002,ko01000,ko03032,ko03400	DNA_pol3_delta2,DNA_pol3_gamma3,DNA_pol3_tau_5
2058	SQF83060.1	546262.NEICINOT_03037	0.0	1239.0	COG0323@1|root,COG0323@2|Bacteria,1MV61@1224|Proteobacteria,2VIBW@28216|Betaproteobacteria,2KQ4F@206351|Neisseriales	This protein is involved in the repair of mismatches in DNA. It is required for dam-dependent methyl-directed DNA mismatch repair. May act as a molecular matchmaker , a protein that promotes the formation of a stable complex between two or more DNA-binding proteins in an ATP-dependent manner without itself being part of a final effector complex	mutL	-	ko:K03572	ko03430,map03430	ko00000,ko00001,ko03400	DNA_mis_repair,HATPase_c_3,MutL_C
2058	SQF83061.1	546267.NEIPOLOT_01148	1.38e-37	125.0	2AF8S@1|root,3157W@2|Bacteria,1PV91@1224|Proteobacteria,2WB5V@28216|Betaproteobacteria,2KRWK@206351|Neisseriales	Protein of unknown function (DUF3460)	-	-	-	-	-	DUF3460
2058	SQF83062.1	546262.NEICINOT_03039	2.14e-156	439.0	COG4122@1|root,COG4122@2|Bacteria,1RB34@1224|Proteobacteria,2VMSE@28216|Betaproteobacteria,2KQG0@206351|Neisseriales	O-methyltransferase	-	-	-	-	-	Methyltransf_3
2058	SQF83063.1	546262.NEICINOT_03040	6.34e-166	464.0	COG1729@1|root,COG1729@2|Bacteria,1N07E@1224|Proteobacteria,2VURE@28216|Betaproteobacteria,2KRQE@206351|Neisseriales	Tetratricopeptide repeat	-	-	-	-	-	TPR_6
2058	SQF83064.1	546262.NEICINOT_03041	9.26e-103	298.0	COG0041@1|root,COG0041@2|Bacteria,1RCWJ@1224|Proteobacteria,2VQ1I@28216|Betaproteobacteria,2KQAS@206351|Neisseriales	Catalyzes the conversion of N5-carboxyaminoimidazole ribonucleotide (N5-CAIR) to 4-carboxy-5-aminoimidazole ribonucleotide (CAIR)	purE	-	ko:K01588	ko00230,ko01100,ko01110,ko01130,map00230,map01100,map01110,map01130	ko00000,ko00001,ko00002,ko01000	AIRC
2058	SQF83065.1	546266.NEIMUCOT_04845	1.99e-295	812.0	COG0128@1|root,COG0128@2|Bacteria,1MWMK@1224|Proteobacteria,2VGZF@28216|Betaproteobacteria,2KPZS@206351|Neisseriales	Catalyzes the transfer of the enolpyruvyl moiety of phosphoenolpyruvate (PEP) to the 5-hydroxyl of shikimate-3- phosphate (S3P) to produce enolpyruvyl shikimate-3-phosphate and inorganic phosphate	aroA	-	ko:K00800	ko00400,ko01100,ko01110,ko01130,ko01230,map00400,map01100,map01110,map01130,map01230	ko00000,ko00001,ko00002,ko01000	EPSP_synthase
2058	SQF83066.1	489653.NLA_12430	4.45e-104	301.0	COG0782@1|root,COG0782@2|Bacteria,1RCXW@1224|Proteobacteria,2VQ16@28216|Betaproteobacteria,2KQY9@206351|Neisseriales	Necessary for efficient RNA polymerase transcription elongation past template-encoded arresting sites. The arresting sites in DNA have the property of trapping a certain fraction of elongating RNA polymerases that pass through, resulting in locked ternary complexes. Cleavage of the nascent transcript by cleavage factors such as GreA or GreB allows the resumption of elongation from the new 3'terminus. GreA releases sequences of 2 to 3 nucleotides	greA	-	ko:K03624	-	ko00000,ko03021	GreA_GreB,GreA_GreB_N
2058	SQF83069.1	546262.NEICINOT_03048	8.06e-238	654.0	COG0042@1|root,COG0042@2|Bacteria,1MUSM@1224|Proteobacteria,2VHWD@28216|Betaproteobacteria,2KQ32@206351|Neisseriales	Catalyzes the synthesis of 5,6-dihydrouridine (D), a modified base found in the D-loop of most tRNAs, via the reduction of the C5-C6 double bond in target uridines. Specifically modifies U16 in tRNAs	dusC	-	ko:K05541	-	ko00000,ko01000,ko03016	Dus
2058	SQF83070.1	546264.NEIFLAOT_01778	6.39e-279	763.0	COG0582@1|root,COG0582@2|Bacteria,1NWGS@1224|Proteobacteria,2VKWM@28216|Betaproteobacteria,2KPVU@206351|Neisseriales	Belongs to the 'phage' integrase family	-	-	-	-	-	Phage_integrase
2058	SQF83071.1	469610.HMPREF0189_01157	2.5e-12	68.6	2975H@1|root,33E5F@2|Bacteria,1NIMH@1224|Proteobacteria,2W614@28216|Betaproteobacteria	Domain of unknown function (DUF4760)	-	-	-	-	-	DUF4760
2058	SQF83072.1	546264.NEIFLAOT_01777	6.03e-56	174.0	2AISZ@1|root,3199W@2|Bacteria,1Q25A@1224|Proteobacteria,2VYXE@28216|Betaproteobacteria,2KSBB@206351|Neisseriales	Pyocin activator protein PrtN	-	-	-	-	-	PyocinActivator
2058	SQF83073.1	1028806.GGE_1944	8.78e-133	386.0	2CE4Z@1|root,2ZC72@2|Bacteria,1NSIU@1224|Proteobacteria	-	-	-	-	-	-	N6_Mtase
2058	SQF83074.1	1278971.AOGF01000022_gene334	4.84e-16	72.8	2AUQC@1|root,31KDB@2|Bacteria,1QI83@1224|Proteobacteria,1TG25@1236|Gammaproteobacteria,1YAN4@135625|Pasteurellales	-	-	-	-	-	-	-
2058	SQF83081.1	641149.HMPREF9016_01188	4.48e-94	282.0	COG2932@1|root,COG2932@2|Bacteria,1NF6W@1224|Proteobacteria,2VWIP@28216|Betaproteobacteria,2KSAT@206351|Neisseriales	Transcriptional regulator	-	-	-	-	-	Peptidase_S24
2058	SQF83082.1	1562701.BBOF01000011_gene33	1.57e-22	89.0	COG4197@1|root,COG4197@2|Bacteria,1NHMT@1224|Proteobacteria,2WDYM@28216|Betaproteobacteria,1KB9E@119060|Burkholderiaceae	Putative antitoxin of bacterial toxin-antitoxin system, YdaS/YdaT	-	-	-	-	-	YdaS_antitoxin
2058	SQF83085.1	546264.NEIFLAOT_01760	0.0	1735.0	COG3378@1|root,COG5545@1|root,COG3378@2|Bacteria,COG5545@2|Bacteria,1MVGK@1224|Proteobacteria,2WHX5@28216|Betaproteobacteria,2KQHI@206351|Neisseriales	virulence-associated E family protein	-	-	-	-	-	-
2058	SQF83088.1	546264.NEIFLAOT_01753	2.63e-55	179.0	COG3728@1|root,COG3728@2|Bacteria,1NAVD@1224|Proteobacteria,2VWAJ@28216|Betaproteobacteria,2KRK2@206351|Neisseriales	Terminase small subunit	-	-	-	-	-	Terminase_2
2058	SQF83089.1	546264.NEIFLAOT_01751	0.0	1019.0	COG4626@1|root,COG4626@2|Bacteria,1MW7K@1224|Proteobacteria,2VJKE@28216|Betaproteobacteria,2KQ0H@206351|Neisseriales	Phage Terminase	-	-	-	-	-	Terminase_1
