key	query	seed_ortholog	evalue	score	eggNOG_OGs	description	preferred_name	GOs	KEGG_ko	KEGG_pathway	brite	PFAMs
2058	SQF83845.1	546267.NEIPOLOT_00180	1.09e-272	746.0	COG0505@1|root,COG0505@2|Bacteria,1MUB9@1224|Proteobacteria,2VH9Q@28216|Betaproteobacteria,2KQDB@206351|Neisseriales	Belongs to the CarA family	carA	-	ko:K01956	ko00240,ko00250,ko01100,map00240,map00250,map01100	ko00000,ko00001,ko00002,ko01000	CPSase_sm_chain,GATase
2058	SQF83846.1	546264.NEIFLAOT_00785	7.29e-55	171.0	COG4095@1|root,COG4095@2|Bacteria,1N17C@1224|Proteobacteria,2VUVJ@28216|Betaproteobacteria,2KRQA@206351|Neisseriales	Psort location CytoplasmicMembrane, score	-	-	-	-	-	MtN3_slv
2058	SQF83847.1	592316.Pat9b_3437	7.96e-20	94.4	2DPCB@1|root,331HJ@2|Bacteria,1NED4@1224|Proteobacteria,1SGZF@1236|Gammaproteobacteria	Putative phage abortive infection protein	-	-	-	-	-	putAbiC
2058	SQF83848.1	546267.NEIPOLOT_00045	0.0	2091.0	COG0458@1|root,COG0458@2|Bacteria,1MUDZ@1224|Proteobacteria,2VI4A@28216|Betaproteobacteria,2KPNP@206351|Neisseriales	Belongs to the CarB family	carB	-	ko:K01955	ko00240,ko00250,ko01100,map00240,map00250,map01100	ko00000,ko00001,ko00002,ko01000	CPSase_L_D2,CPSase_L_D3,MGS
2058	SQF83849.1	546262.NEICINOT_04275	8.31e-253	694.0	COG0809@1|root,COG0809@2|Bacteria,1MUH3@1224|Proteobacteria,2VHJF@28216|Betaproteobacteria,2KPW1@206351|Neisseriales	Transfers and isomerizes the ribose moiety from AdoMet to the 7-aminomethyl group of 7-deazaguanine (preQ1-tRNA) to give epoxyqueuosine (oQ-tRNA)	queA	-	ko:K07568	-	ko00000,ko01000,ko03016	Queuosine_synth
2058	SQF83850.1	546264.NEIFLAOT_01170	9.65e-77	231.0	COG0511@1|root,COG0511@2|Bacteria,1RCXA@1224|Proteobacteria,2VR5S@28216|Betaproteobacteria,2KR4E@206351|Neisseriales	first, biotin carboxylase catalyzes the carboxylation of the carrier protein and then the transcarboxylase transfers the carboxyl group to form malonyl-CoA	accB	-	ko:K02160	ko00061,ko00620,ko00640,ko00720,ko01100,ko01110,ko01120,ko01130,ko01200,ko01212,map00061,map00620,map00640,map00720,map01100,map01110,map01120,map01130,map01200,map01212	ko00000,ko00001,ko00002	Biotin_lipoyl
2058	SQF83851.1	546264.NEIFLAOT_01171	3.31e-39	130.0	COG0401@1|root,COG0401@2|Bacteria,1N9JZ@1224|Proteobacteria,2VVTC@28216|Betaproteobacteria,2KRXM@206351|Neisseriales	Proteolipid membrane potential modulator	-	-	-	-	-	Pmp3
2058	SQF83852.1	546262.NEICINOT_04277	0.0	909.0	COG0439@1|root,COG0439@2|Bacteria,1MU4H@1224|Proteobacteria,2VISB@28216|Betaproteobacteria,2KQ65@206351|Neisseriales	acetyl-CoA carboxylase, biotin carboxylase	accC	-	ko:K01961	ko00061,ko00620,ko00640,ko00720,ko01100,ko01110,ko01120,ko01130,ko01200,ko01212,map00061,map00620,map00640,map00720,map01100,map01110,map01120,map01130,map01200,map01212	ko00000,ko00001,ko00002,ko01000	Biotin_carb_C,Biotin_carb_N,CPSase_L_D2
2058	SQF83853.1	546267.NEIPOLOT_01274	2.87e-211	585.0	COG2264@1|root,COG2264@2|Bacteria,1MUPC@1224|Proteobacteria,2VH76@28216|Betaproteobacteria,2KPSR@206351|Neisseriales	Ribosomal protein L11 methyltransferase	prmA	-	ko:K02687	-	ko00000,ko01000,ko03009	PrmA
2058	SQF83854.1	546262.NEICINOT_04280	7.64e-133	376.0	COG1949@1|root,COG1949@2|Bacteria,1R9WX@1224|Proteobacteria,2VIA2@28216|Betaproteobacteria,2KPCE@206351|Neisseriales	3'-to-5' exoribonuclease specific for small oligoribonucleotides	orn	-	ko:K13288	ko03008,map03008	ko00000,ko00001,ko01000,ko03009,ko03019	RNase_T
2058	SQF83855.1	546262.NEICINOT_04281	1.66e-304	830.0	COG0001@1|root,COG0001@2|Bacteria,1MUY5@1224|Proteobacteria,2VHK9@28216|Betaproteobacteria,2KQKD@206351|Neisseriales	intramolecular transferase activity, transferring amino groups	hemL	-	ko:K01845	ko00860,ko01100,ko01110,ko01120,map00860,map01100,map01110,map01120	ko00000,ko00001,ko00002,ko01000,ko01007	Aminotran_3
2058	SQF83856.1	1122244.AUGF01000017_gene2278	2.03e-05	48.9	COG2913@1|root,COG2913@2|Bacteria,1N76Z@1224|Proteobacteria,1SFG6@1236|Gammaproteobacteria	Part of the outer membrane protein assembly complex, which is involved in assembly and insertion of beta-barrel proteins into the outer membrane	-	-	-	-	-	-
2058	SQF83857.1	546262.NEICINOT_04282	0.0	882.0	COG0621@1|root,COG0621@2|Bacteria,1MURS@1224|Proteobacteria,2VHQM@28216|Betaproteobacteria,2KPME@206351|Neisseriales	Catalyzes the methylthiolation of N6- (dimethylallyl)adenosine (i(6)A), leading to the formation of 2- methylthio-N6-(dimethylallyl)adenosine (ms(2)i(6)A) at position 37 in tRNAs that read codons beginning with uridine	miaB	-	ko:K06168	-	ko00000,ko01000,ko03016	Radical_SAM,TRAM,UPF0004
2058	SQF83858.1	546262.NEICINOT_04284	2.95e-91	279.0	COG4206@1|root,COG4206@2|Bacteria,1QUHX@1224|Proteobacteria,2WHWZ@28216|Betaproteobacteria,2KTX9@206351|Neisseriales	Protein of unknown function (DUF560)	-	-	-	-	-	DUF560
2058	SQF83859.1	546262.NEICINOT_04284	7.69e-229	637.0	COG4206@1|root,COG4206@2|Bacteria,1QUHX@1224|Proteobacteria,2WHWZ@28216|Betaproteobacteria,2KTX9@206351|Neisseriales	Protein of unknown function (DUF560)	-	-	-	-	-	DUF560
2058	SQF83860.1	435832.HMPREF0604_01812	5.39e-20	83.2	2E9K6@1|root,333T0@2|Bacteria,1N8N2@1224|Proteobacteria,2VXBW@28216|Betaproteobacteria,2KRYZ@206351|Neisseriales	-	-	-	-	-	-	-
2058	SQF83861.1	546262.NEICINOT_04286	1.1e-98	286.0	COG1981@1|root,COG1981@2|Bacteria,1RHGS@1224|Proteobacteria,2VR5Y@28216|Betaproteobacteria,2KRAN@206351|Neisseriales	Psort location CytoplasmicMembrane, score	-	-	ko:K08973	-	ko00000	UPF0093
2058	SQF83862.1	546262.NEICINOT_04287	8.4e-112	320.0	COG2954@1|root,COG2954@2|Bacteria,1RI38@1224|Proteobacteria,2VRB9@28216|Betaproteobacteria,2KR2X@206351|Neisseriales	Adenylate cyclase	-	-	-	-	-	CYTH
2058	SQF83863.1	546262.NEICINOT_04288	8.93e-110	317.0	COG0262@1|root,COG0262@2|Bacteria,1RH0P@1224|Proteobacteria,2VSH8@28216|Betaproteobacteria,2KR5B@206351|Neisseriales	Key enzyme in folate metabolism. Catalyzes an essential reaction for de novo glycine and purine synthesis, and for DNA precursor synthesis	folA	-	ko:K00287	ko00670,ko00790,ko01100,ko01523,map00670,map00790,map01100,map01523	ko00000,ko00001,ko00002,ko01000	DHFR_1
2058	SQF83864.1	546262.NEICINOT_04289	1.75e-256	702.0	COG0722@1|root,COG0722@2|Bacteria,1MU5Q@1224|Proteobacteria,2VH4W@28216|Betaproteobacteria,2KQ6V@206351|Neisseriales	Stereospecific condensation of phosphoenolpyruvate (PEP) and D-erythrose-4-phosphate (E4P) giving rise to 3-deoxy-D- arabino-heptulosonate-7-phosphate (DAHP)	aroG	-	ko:K01626	ko00400,ko01100,ko01110,ko01130,ko01230,ko02024,map00400,map01100,map01110,map01130,map01230,map02024	ko00000,ko00001,ko00002,ko01000	DAHP_synth_1
2058	SQF83866.1	546262.NEICINOT_04293	1.78e-57	179.0	COG1555@1|root,COG1555@2|Bacteria,1N6Q3@1224|Proteobacteria,2VVT0@28216|Betaproteobacteria,2KRXT@206351|Neisseriales	Psort location CytoplasmicMembrane, score	-	-	ko:K02237	-	ko00000,ko00002,ko02044	HHH_3
2058	SQF83867.1	546262.NEICINOT_04524	5.57e-151	425.0	COG0564@1|root,COG0564@2|Bacteria,1RDAG@1224|Proteobacteria,2VR7J@28216|Betaproteobacteria,2KR6S@206351|Neisseriales	Pseudouridine synthase	-	-	ko:K06177	-	ko00000,ko01000,ko03009,ko03016	PseudoU_synth_2
2058	SQF83868.1	546262.NEICINOT_04523	3.25e-120	343.0	COG0669@1|root,COG0669@2|Bacteria,1RD9F@1224|Proteobacteria,2VMQQ@28216|Betaproteobacteria,2KQV2@206351|Neisseriales	Reversibly transfers an adenylyl group from ATP to 4'- phosphopantetheine, yielding dephospho-CoA (dPCoA) and pyrophosphate	coaD	-	ko:K00954	ko00770,ko01100,map00770,map01100	ko00000,ko00001,ko00002,ko01000	CTP_transf_like
2058	SQF83869.1	546262.NEICINOT_04522	3.61e-146	413.0	COG0670@1|root,COG0670@2|Bacteria,1MU69@1224|Proteobacteria,2VKZV@28216|Betaproteobacteria,2KQYD@206351|Neisseriales	Belongs to the BI1 family	-	-	ko:K19416	-	ko00000,ko00002,ko02000	Bax1-I
2058	SQF83870.1	489653.NLA_3560	3.4e-59	182.0	COG2924@1|root,COG2924@2|Bacteria,1MZ2V@1224|Proteobacteria,2VTYU@28216|Betaproteobacteria,2KRC9@206351|Neisseriales	Could be a mediator in iron transactions between iron acquisition and iron-requiring processes, such as synthesis and or repair of Fe-S clusters in biosynthetic enzymes	-	-	-	-	-	Iron_traffic
2058	SQF83871.1	546262.NEICINOT_04520	7.05e-105	303.0	COG1576@1|root,COG1576@2|Bacteria,1R9Z2@1224|Proteobacteria,2VQ2M@28216|Betaproteobacteria,2KR0M@206351|Neisseriales	Specifically methylates the pseudouridine at position 1915 (m3Psi1915) in 23S rRNA	rlmH	-	ko:K00783	-	ko00000,ko01000,ko03009	SPOUT_MTase
2058	SQF83872.1	489653.NLA_3540	3.28e-87	256.0	COG0799@1|root,COG0799@2|Bacteria,1MZEF@1224|Proteobacteria,2VRRV@28216|Betaproteobacteria,2KRDZ@206351|Neisseriales	Functions as a ribosomal silencing factor. Interacts with ribosomal protein L14 (rplN), blocking formation of intersubunit bridge B8. Prevents association of the 30S and 50S ribosomal subunits and the formation of functional ribosomes, thus repressing translation	rsfS	-	ko:K09710	-	ko00000,ko03009	RsfS
2058	SQF83873.1	546262.NEICINOT_04518	6.96e-138	390.0	COG1057@1|root,COG1057@2|Bacteria,1RD0J@1224|Proteobacteria,2VSQ7@28216|Betaproteobacteria,2KQXV@206351|Neisseriales	Catalyzes the reversible adenylation of nicotinate mononucleotide (NaMN) to nicotinic acid adenine dinucleotide (NaAD)	nadD	-	ko:K00969	ko00760,ko01100,map00760,map01100	ko00000,ko00001,ko00002,ko01000	CTP_transf_like
2058	SQF83874.1	546262.NEICINOT_04517	3.08e-140	396.0	COG0288@1|root,COG0288@2|Bacteria,1R3SC@1224|Proteobacteria,2VN5J@28216|Betaproteobacteria,2KQB2@206351|Neisseriales	Reversible hydration of carbon dioxide	cah	-	ko:K01673	ko00910,map00910	ko00000,ko00001,ko01000	Pro_CA
2058	SQF83875.1	546262.NEICINOT_04516	0.0	985.0	COG1178@1|root,COG1178@2|Bacteria,1MWCF@1224|Proteobacteria,2VIQQ@28216|Betaproteobacteria,2KQJB@206351|Neisseriales	Psort location CytoplasmicMembrane, score 10.00	-	-	ko:K02063	ko02010,map02010	ko00000,ko00001,ko00002,ko02000	BPD_transp_1
2058	SQF83876.1	546267.NEIPOLOT_01914	4.12e-225	619.0	COG2334@1|root,COG2334@2|Bacteria,1MUKJ@1224|Proteobacteria,2VH2I@28216|Betaproteobacteria,2KPVK@206351|Neisseriales	Belongs to the pseudomonas-type ThrB family	thrB	-	ko:K02204	ko00260,ko01100,ko01110,ko01120,ko01230,map00260,map01100,map01110,map01120,map01230	ko00000,ko00001,ko00002,ko01000	APH
2058	SQF83877.1	546267.NEIPOLOT_01915	8.96e-174	484.0	COG2227@1|root,COG2227@2|Bacteria,1MU89@1224|Proteobacteria,2VHGP@28216|Betaproteobacteria,2KPPD@206351|Neisseriales	O-methyltransferase that catalyzes the 2 O-methylation steps in the ubiquinone biosynthetic pathway	ubiG	-	ko:K00568	ko00130,ko01100,ko01110,map00130,map01100,map01110	ko00000,ko00001,ko00002,ko01000	Methyltransf_23
2058	SQF83878.1	546262.NEICINOT_04512	4e-298	813.0	COG0814@1|root,COG0814@2|Bacteria,1MWGI@1224|Proteobacteria,2VJHZ@28216|Betaproteobacteria,2KPXG@206351|Neisseriales	aromatic amino acid transport protein	-	-	ko:K03835	-	ko00000,ko02000	Trp_Tyr_perm
2058	SQF83879.1	546262.NEICINOT_04511	0.0	1114.0	COG1368@1|root,COG1368@2|Bacteria,1MXT1@1224|Proteobacteria,2WF2Z@28216|Betaproteobacteria	Sulfatase	-	-	-	-	-	Sulfatase
2058	SQF83880.1	546262.NEICINOT_04510	5.4e-135	382.0	COG0241@1|root,COG0241@2|Bacteria,1RDGR@1224|Proteobacteria,2VQ49@28216|Betaproteobacteria,2KQEH@206351|Neisseriales	D,D-heptose 1,7-bisphosphate phosphatase	gmhB	-	ko:K03273	ko00540,ko01100,map00540,map01100	ko00000,ko00001,ko00002,ko01000,ko01005	Hydrolase_like
2058	SQF83881.1	546262.NEICINOT_04509	4.33e-182	506.0	COG0204@1|root,COG0204@2|Bacteria,1MY51@1224|Proteobacteria,2VNAX@28216|Betaproteobacteria,2KPTB@206351|Neisseriales	Acyltransferase	-	-	ko:K00655	ko00561,ko00564,ko01100,ko01110,map00561,map00564,map01100,map01110	ko00000,ko00001,ko00002,ko01000,ko01004	Acyltransferase
2058	SQF83882.1	546262.NEICINOT_04508	6.39e-166	463.0	COG1451@1|root,COG1451@2|Bacteria,1MXZU@1224|Proteobacteria,2VNC5@28216|Betaproteobacteria,2KRM1@206351|Neisseriales	Protein of unknown function DUF45	-	-	ko:K07043	-	ko00000	DUF45
2058	SQF83883.1	319224.Sputcn32_0804	5.64e-33	117.0	2ES93@1|root,33JTT@2|Bacteria,1NHKJ@1224|Proteobacteria,1SJA5@1236|Gammaproteobacteria,2QE21@267890|Shewanellaceae	-	-	-	-	-	-	-
2058	SQF83884.1	546266.NEIMUCOT_05963	0.0	1279.0	COG0422@1|root,COG0422@2|Bacteria,1MUVV@1224|Proteobacteria,2VHS3@28216|Betaproteobacteria,2KQ7W@206351|Neisseriales	Catalyzes the synthesis of the hydroxymethylpyrimidine phosphate (HMP-P) moiety of thiamine from aminoimidazole ribotide (AIR) in a radical S-adenosyl-L-methionine (SAM)-dependent reaction	thiC	-	ko:K03147	ko00730,ko01100,map00730,map01100	ko00000,ko00001,ko00002,ko01000	ThiC-associated,ThiC_Rad_SAM
2058	SQF83885.1	547045.NEISICOT_03125	0.0	1020.0	COG3419@1|root,COG3419@2|Bacteria,1NUAV@1224|Proteobacteria,2VHY8@28216|Betaproteobacteria,2KQFG@206351|Neisseriales	Neisseria PilC beta-propeller domain	-	-	ko:K02674	-	ko00000,ko02035,ko02044	Neisseria_PilC,VWA_2
2058	SQF83886.1	546262.NEICINOT_04502	1.17e-217	599.0	COG0494@1|root,COG0494@2|Bacteria,1RDH9@1224|Proteobacteria,2VRUH@28216|Betaproteobacteria	PFAM NUDIX hydrolase	-	-	-	-	-	DUF4743,NUDIX
2058	SQF83887.1	546262.NEICINOT_04501	2.12e-226	623.0	COG3842@1|root,COG3842@2|Bacteria,1R4T6@1224|Proteobacteria,2VP4U@28216|Betaproteobacteria,2KQD6@206351|Neisseriales	ABC transporter, ATP-binding protein	potA	-	-	-	-	ABC_tran
2058	SQF83888.1	546262.NEICINOT_04500	0.0	1135.0	COG1080@1|root,COG1080@2|Bacteria,1MUT8@1224|Proteobacteria,2VH9N@28216|Betaproteobacteria,2KPP5@206351|Neisseriales	General (non sugar-specific) component of the phosphoenolpyruvate-dependent sugar phosphotransferase system (sugar PTS). This major carbohydrate active-transport system catalyzes the phosphorylation of incoming sugar substrates concomitantly with their translocation across the cell membrane. Enzyme I transfers the phosphoryl group from phosphoenolpyruvate (PEP) to the phosphoryl carrier protein (HPr)	ptsP	-	ko:K08483	ko02060,map02060	ko00000,ko00001,ko01000,ko02000	PEP-utilisers_N,PEP-utilizers,PEP-utilizers_C
2058	SQF83889.1	546262.NEICINOT_04499	3.39e-55	172.0	COG1925@1|root,COG1925@2|Bacteria,1N6RM@1224|Proteobacteria,2VU8W@28216|Betaproteobacteria,2KRI7@206351|Neisseriales	phosphocarrier protein HPR	ptsH	-	ko:K11189	-	ko00000,ko02000	PTS-HPr
2058	SQF83890.1	546262.NEICINOT_04498	4.26e-98	285.0	COG2893@1|root,COG2893@2|Bacteria,1PSXI@1224|Proteobacteria,2VUF1@28216|Betaproteobacteria,2KRMX@206351|Neisseriales	Psort location Cytoplasmic, score 8.96	-	-	ko:K02821	ko00053,ko01100,ko01120,ko02060,map00053,map01100,map01120,map02060	ko00000,ko00001,ko00002,ko01000,ko02000	EIIA-man
2058	SQF83891.1	546262.NEICINOT_04497	1.95e-133	378.0	COG0634@1|root,COG0634@2|Bacteria,1NRT8@1224|Proteobacteria,2VRM9@28216|Betaproteobacteria,2KQWS@206351|Neisseriales	Psort location Cytoplasmic, score 9.97	hpt	-	ko:K00760	ko00230,ko00983,ko01100,ko01110,map00230,map00983,map01100,map01110	ko00000,ko00001,ko01000	Pribosyltran
2058	SQF83892.1	546262.NEICINOT_04496	3.58e-199	551.0	COG1793@1|root,COG1793@2|Bacteria,1MUW3@1224|Proteobacteria,2VI3P@28216|Betaproteobacteria,2KQ2T@206351|Neisseriales	ATP-dependent DNA ligase domain protein	-	-	ko:K10747	ko03030,ko03410,ko03420,ko03430,map03030,map03410,map03420,map03430	ko00000,ko00001,ko01000,ko03032,ko03400	DNA_ligase_A_M,DNA_ligase_OB_2
2058	SQF83893.1	546262.NEICINOT_04495	1.92e-153	430.0	COG0491@1|root,COG0491@2|Bacteria,1MUDN@1224|Proteobacteria,2VHMC@28216|Betaproteobacteria,2KQT7@206351|Neisseriales	Metallo-beta-lactamase domain protein	-	-	-	-	-	Lactamase_B
2058	SQF83894.1	546262.NEICINOT_04493	0.0	1071.0	COG1322@1|root,COG1322@2|Bacteria,1MWHV@1224|Proteobacteria,2VJVZ@28216|Betaproteobacteria,2KQ75@206351|Neisseriales	RmuC domain protein	rmuC	-	ko:K09760	-	ko00000	RmuC
2058	SQF83895.1	546262.NEICINOT_04492	1.75e-39	130.0	28WNJ@1|root,2ZINB@2|Bacteria,1P57Z@1224|Proteobacteria	-	-	-	-	-	-	-
2058	SQF83896.1	546262.NEICINOT_04489	9.41e-197	544.0	COG2857@1|root,COG2857@2|Bacteria,1QFU2@1224|Proteobacteria,2VIR6@28216|Betaproteobacteria,2KPTF@206351|Neisseriales	Cytochrome C1	petC	-	ko:K00413	ko00190,ko01100,ko02020,ko04260,ko04714,ko04932,ko05010,ko05012,ko05016,map00190,map01100,map02020,map04260,map04714,map04932,map05010,map05012,map05016	ko00000,ko00001,ko00002	Cytochrom_C1
2058	SQF83897.1	546262.NEICINOT_04488	0.0	903.0	COG1290@1|root,COG1290@2|Bacteria,1MV97@1224|Proteobacteria,2VHP5@28216|Betaproteobacteria,2KQHP@206351|Neisseriales	Component of the ubiquinol-cytochrome c reductase complex (complex III or cytochrome b-c1 complex), which is a respiratory chain that generates an electrochemical potential coupled to ATP synthesis	petB	-	ko:K00412	ko00190,ko01100,ko02020,ko04260,ko04714,ko04932,ko05010,ko05012,ko05016,map00190,map01100,map02020,map04260,map04714,map04932,map05010,map05012,map05016	ko00000,ko00001,ko00002,ko03029	Cytochrom_B_C,Cytochrome_B
2058	SQF83898.1	546262.NEICINOT_04487	3.77e-138	390.0	COG0723@1|root,COG0723@2|Bacteria,1RAA2@1224|Proteobacteria,2VK46@28216|Betaproteobacteria,2KQG3@206351|Neisseriales	Component of the ubiquinol-cytochrome c reductase complex (complex III or cytochrome b-c1 complex), which is a respiratory chain that generates an electrochemical potential coupled to ATP synthesis	petA	-	ko:K00411	ko00190,ko01100,ko02020,ko04260,ko04714,ko04932,ko05010,ko05012,ko05016,map00190,map01100,map02020,map04260,map04714,map04932,map05010,map05012,map05016	ko00000,ko00001,ko00002,ko01000	Rieske,UCR_Fe-S_N
2058	SQF83899.1	546262.NEICINOT_04485	3.71e-173	484.0	COG0327@1|root,COG0327@2|Bacteria,1MVUN@1224|Proteobacteria,2VIX1@28216|Betaproteobacteria,2KPXD@206351|Neisseriales	Dinuclear metal center protein, YbgI family	-	-	-	-	-	NIF3
2058	SQF83900.1	546262.NEICINOT_04484	6.57e-224	617.0	COG0583@1|root,COG0583@2|Bacteria,1MUIX@1224|Proteobacteria,2VI6K@28216|Betaproteobacteria,2KPQQ@206351|Neisseriales	LysR substrate binding domain protein	metR	-	ko:K03576	-	ko00000,ko03000	HTH_1,LysR_substrate
2058	SQF83901.1	546262.NEICINOT_04483	7.39e-85	250.0	COG0103@1|root,COG0103@2|Bacteria,1RD4A@1224|Proteobacteria,2VR5R@28216|Betaproteobacteria,2KQVX@206351|Neisseriales	Belongs to the universal ribosomal protein uS9 family	rpsI	-	ko:K02996	ko03010,map03010	br01610,ko00000,ko00001,ko00002,ko03011	Ribosomal_S9
2058	SQF83902.1	546262.NEICINOT_04482	4.63e-101	292.0	COG0102@1|root,COG0102@2|Bacteria,1RA11@1224|Proteobacteria,2VQ07@28216|Betaproteobacteria,2KQX3@206351|Neisseriales	This protein is one of the early assembly proteins of the 50S ribosomal subunit, although it is not seen to bind rRNA by itself. It is important during the early stages of 50S assembly	rplM	-	ko:K02871	ko03010,map03010	br01610,ko00000,ko00001,ko00002,ko03011	Ribosomal_L13
2058	SQF83903.1	546262.NEICINOT_04480	4.18e-61	188.0	COG3027@1|root,COG3027@2|Bacteria,1N6YN@1224|Proteobacteria,2VUY2@28216|Betaproteobacteria,2KRSP@206351|Neisseriales	Activator of cell division through the inhibition of FtsZ GTPase activity, therefore promoting FtsZ assembly into bundles of protofilaments necessary for the formation of the division Z ring. It is recruited early at mid-cell but it is not essential for cell division	-	-	ko:K09888	-	ko00000,ko03036	ZapA
2058	SQF83904.1	546262.NEICINOT_04479	1.17e-60	188.0	28UWJ@1|root,2ZH0H@2|Bacteria,1P690@1224|Proteobacteria,2W5GY@28216|Betaproteobacteria,2KTPN@206351|Neisseriales	-	-	-	-	-	-	-
2058	SQF83905.1	546262.NEICINOT_04478	1.01e-228	630.0	COG0240@1|root,COG0240@2|Bacteria,1MUU3@1224|Proteobacteria,2VJ91@28216|Betaproteobacteria,2KQ8E@206351|Neisseriales	Psort location Cytoplasmic, score 8.96	gpsA	-	ko:K00057	ko00564,ko01110,map00564,map01110	ko00000,ko00001,ko01000	NAD_Gly3P_dh_C,NAD_Gly3P_dh_N
2058	SQF83906.1	546262.NEICINOT_04475	0.0	1740.0	COG2352@1|root,COG2352@2|Bacteria,1MUD5@1224|Proteobacteria,2VI9F@28216|Betaproteobacteria,2KQE3@206351|Neisseriales	Forms oxaloacetate, a four-carbon dicarboxylic acid source for the tricarboxylic acid cycle	ppc	-	ko:K01595	ko00620,ko00680,ko00710,ko00720,ko01100,ko01120,ko01200,map00620,map00680,map00710,map00720,map01100,map01120,map01200	ko00000,ko00001,ko00002,ko01000	PEPcase
2058	SQF83907.1	546262.NEICINOT_04474	5.87e-180	501.0	COG0476@1|root,COG0476@2|Bacteria,1MW7H@1224|Proteobacteria,2VI1U@28216|Betaproteobacteria,2KQ7A@206351|Neisseriales	ThiF family	moeB	-	ko:K21029	ko04122,map04122	ko00000,ko00001,ko01000	ThiF
2058	SQF83908.1	546262.NEICINOT_04472	3.8e-43	140.0	COG2900@1|root,COG2900@2|Bacteria	Belongs to the SlyX family	slyX	-	ko:K03745	-	ko00000	SlyX
2058	SQF83909.1	546262.NEICINOT_04471	1.6e-306	838.0	COG2056@1|root,COG2056@2|Bacteria,1N8U2@1224|Proteobacteria,2VI31@28216|Betaproteobacteria,2KQKK@206351|Neisseriales	Psort location CytoplasmicMembrane, score 10.00	-	-	ko:K07084	-	ko00000,ko02000	Na_H_antiport_2,Na_H_antiporter
2058	SQF83910.1	546262.NEICINOT_04470	1.57e-197	547.0	COG2890@1|root,COG2890@2|Bacteria,1MXCQ@1224|Proteobacteria,2VP72@28216|Betaproteobacteria,2KPF5@206351|Neisseriales	Methylates the class 1 translation termination release factors RF1 PrfA and RF2 PrfB on the glutamine residue of the universally conserved GGQ motif	prmC	-	ko:K02493	-	ko00000,ko01000,ko03012	MTS,Methyltransf_31
2058	SQF83911.1	596320.NEIFL0001_2080	0.0	917.0	COG0312@1|root,COG0312@2|Bacteria,1MUSK@1224|Proteobacteria,2VHJ9@28216|Betaproteobacteria,2KPJ1@206351|Neisseriales	TldD PmbA family protein	tldD	-	ko:K03568	-	ko00000,ko01002	PmbA_TldD
2058	SQF83912.1	546262.NEICINOT_04467	8.08e-265	729.0	COG1457@1|root,COG1457@2|Bacteria,1PYF6@1224|Proteobacteria,2VI1F@28216|Betaproteobacteria,2KS95@206351|Neisseriales	Permease for cytosine/purines, uracil, thiamine, allantoin	cytX	-	ko:K03457	-	ko00000	Transp_cyt_pur
2058	SQF83913.1	546262.NEICINOT_04466	1.47e-266	729.0	COG0665@1|root,COG0665@2|Bacteria,1N1TN@1224|Proteobacteria,2VIIF@28216|Betaproteobacteria,2KQBV@206351|Neisseriales	thiamine biosynthesis oxidoreductase ThiO	-	-	ko:K03153	ko00730,ko01100,map00730,map01100	ko00000,ko00001,ko01000	DAO
2058	SQF83914.1	546266.NEIMUCOT_05163	4.52e-101	293.0	COG2020@1|root,COG2020@2|Bacteria,1MZ7S@1224|Proteobacteria,2VU4G@28216|Betaproteobacteria,2KS0R@206351|Neisseriales	Isoprenylcysteine carboxyl methyltransferase (ICMT) family	-	-	-	-	-	PEMT
2058	SQF83915.1	546266.NEIMUCOT_05165	1.06e-134	382.0	COG0352@1|root,COG0352@2|Bacteria,1RDSU@1224|Proteobacteria,2WEWD@28216|Betaproteobacteria,2KQXB@206351|Neisseriales	Condenses 4-methyl-5-(beta-hydroxyethyl)thiazole monophosphate (THZ-P) and 2-methyl-4-amino-5-hydroxymethyl pyrimidine pyrophosphate (HMP-PP) to form thiamine monophosphate (TMP)	thiE	-	ko:K00788	ko00730,ko01100,map00730,map01100	ko00000,ko00001,ko00002,ko01000	TMP-TENI
2058	SQF83916.1	546262.NEICINOT_04461	3.31e-35	120.0	COG2104@1|root,COG2104@2|Bacteria,1NG8E@1224|Proteobacteria,2VXVA@28216|Betaproteobacteria,2KS5Y@206351|Neisseriales	ThiS family	thiS	-	ko:K03154	ko04122,map04122	ko00000,ko00001	ThiS
2058	SQF83917.1	546262.NEICINOT_04460	1.06e-185	516.0	COG2022@1|root,COG2022@2|Bacteria,1N0N5@1224|Proteobacteria,2VJ8T@28216|Betaproteobacteria,2KQKW@206351|Neisseriales	Catalyzes the rearrangement of 1-deoxy-D-xylulose 5- phosphate (DXP) to produce the thiazole phosphate moiety of thiamine. Sulfur is provided by the thiocarboxylate moiety of the carrier protein ThiS. In vitro, sulfur can be provided by H(2)S	thiG	-	ko:K03149	ko00730,ko01100,map00730,map01100	ko00000,ko00001,ko01000	ThiG
2058	SQF83918.1	546262.NEICINOT_04458	1.37e-173	488.0	2DD98@1|root,32U11@2|Bacteria,1N2D3@1224|Proteobacteria,2VV35@28216|Betaproteobacteria,2KRTG@206351|Neisseriales	-	-	-	-	-	-	-
2058	SQF83919.1	546262.NEICINOT_04457	0.0	1174.0	COG0340@1|root,COG1521@1|root,COG0340@2|Bacteria,COG1521@2|Bacteria,1MUYA@1224|Proteobacteria,2VK1G@28216|Betaproteobacteria,2KQC6@206351|Neisseriales	Catalyzes the phosphorylation of pantothenate (Pan), the first step in CoA biosynthesis	coaX	-	ko:K01947,ko:K03525	ko00770,ko00780,ko01100,map00770,map00780,map01100	ko00000,ko00001,ko00002,ko01000	BPL_C,BPL_LplA_LipB,Pan_kinase
2058	SQF83920.1	546262.NEICINOT_04456	3.61e-117	335.0	COG0615@1|root,COG0615@2|Bacteria,1REW3@1224|Proteobacteria,2VR6S@28216|Betaproteobacteria,2KQV5@206351|Neisseriales	Catalyzes the ADP transfer from ATP to D-glycero-beta-D- manno-heptose 1-phosphate, yielding ADP-D-glycero-beta-D-manno- heptose	-	-	ko:K21345	ko00540,ko01100,map00540,map01100	ko00000,ko00001,ko00002,ko01000	CTP_transf_like
2058	SQF83921.1	546262.NEICINOT_04451	2.32e-200	555.0	COG0190@1|root,COG0190@2|Bacteria,1MWU4@1224|Proteobacteria,2VI8C@28216|Betaproteobacteria,2KPNN@206351|Neisseriales	Catalyzes the oxidation of 5,10- methylenetetrahydrofolate to 5,10-methenyltetrahydrofolate and then the hydrolysis of 5,10-methenyltetrahydrofolate to 10- formyltetrahydrofolate	folD	-	ko:K01491	ko00670,ko00720,ko01100,ko01120,ko01200,map00670,map00720,map01100,map01120,map01200	ko00000,ko00001,ko00002,ko01000	THF_DHG_CYH,THF_DHG_CYH_C
2058	SQF83922.1	546262.NEICINOT_04450	1.51e-124	356.0	COG1714@1|root,COG1714@2|Bacteria,1NB1Z@1224|Proteobacteria,2VW3Z@28216|Betaproteobacteria,2KRXK@206351|Neisseriales	Psort location CytoplasmicMembrane, score	-	-	-	-	-	RDD
2058	SQF83923.1	546266.NEIMUCOT_03935	2.17e-267	732.0	COG0136@1|root,COG0136@2|Bacteria,1MUHG@1224|Proteobacteria,2VH2N@28216|Betaproteobacteria,2KPMB@206351|Neisseriales	Catalyzes the NADPH-dependent formation of L-aspartate- semialdehyde (L-ASA) by the reductive dephosphorylation of L- aspartyl-4-phosphate	asd	-	ko:K00133	ko00260,ko00261,ko00270,ko00300,ko01100,ko01110,ko01120,ko01130,ko01210,ko01230,map00260,map00261,map00270,map00300,map01100,map01110,map01120,map01130,map01210,map01230	ko00000,ko00001,ko00002,ko01000	Semialdhyde_dh,Semialdhyde_dhC
2058	SQF83924.1	546262.NEICINOT_04448	2.94e-129	366.0	2ENVN@1|root,33GGQ@2|Bacteria,1NF67@1224|Proteobacteria,2VVKU@28216|Betaproteobacteria,2KRN4@206351|Neisseriales	Serine hydrolase	-	-	-	-	-	Ser_hydrolase
2058	SQF83926.1	546267.NEIPOLOT_00531	5.95e-195	539.0	COG0708@1|root,COG0708@2|Bacteria,1MVII@1224|Proteobacteria,2VI74@28216|Betaproteobacteria,2KQ1P@206351|Neisseriales	Psort location Cytoplasmic, score 9.97	exoA	-	ko:K01142	ko03410,map03410	ko00000,ko00001,ko01000,ko03400	Exo_endo_phos
