key	query	seed_ortholog	evalue	score	eggNOG_OGs	description	preferred_name	GOs	KEGG_ko	KEGG_pathway	brite	PFAMs
2070	QMT34625.1	1112217.PPL19_11407	7.96e-09	57.0	COG2059@1|root,COG2059@2|Bacteria,1MUBW@1224|Proteobacteria,1RPNP@1236|Gammaproteobacteria	Chromate	chrA	-	ko:K07240	-	ko00000,ko02000	Chromate_transp
2070	QMT34626.1	1121351.AUAP01000008_gene1427	1e-15	71.6	2DSCF@1|root,33FHP@2|Bacteria,1NMAN@1224|Proteobacteria	-	-	-	-	-	-	-
2070	QMT34627.1	1051985.l11_04180	1.74e-177	498.0	COG0777@1|root,COG0777@2|Bacteria,1MW8G@1224|Proteobacteria,2VHEQ@28216|Betaproteobacteria,2KPHB@206351|Neisseriales	Component of the acetyl coenzyme A carboxylase (ACC) complex. Biotin carboxylase (BC) catalyzes the carboxylation of biotin on its carrier protein (BCCP) and then the CO(2) group is transferred by the transcarboxylase to acetyl-CoA to form malonyl- CoA	accD	-	ko:K01963	ko00061,ko00620,ko00640,ko00720,ko01100,ko01110,ko01120,ko01130,ko01200,ko01212,map00061,map00620,map00640,map00720,map01100,map01110,map01120,map01130,map01200,map01212	ko00000,ko00001,ko00002,ko01000	Carboxyl_trans
2070	QMT34628.1	1166130.H650_14630	9.01e-07	50.4	COG0763@1|root,COG0763@2|Bacteria,1NB85@1224|Proteobacteria,1SH2U@1236|Gammaproteobacteria	Condensation of UDP-2,3-diacylglucosamine and 2,3- diacylglucosamine-1-phosphate to form lipid A disaccharide, a precursor of lipid A, a phosphorylated glycolipid that anchors the lipopolysaccharide to the outer membrane of the cell	-	-	-	-	-	-
2070	QMT34629.1	1051985.l11_04190	2.06e-132	381.0	COG0159@1|root,COG0159@2|Bacteria,1MXJV@1224|Proteobacteria,2VI78@28216|Betaproteobacteria,2KPCM@206351|Neisseriales	The alpha subunit is responsible for the aldol cleavage of indoleglycerol phosphate to indole and glyceraldehyde 3- phosphate	trpA	-	ko:K01695	ko00260,ko00400,ko01100,ko01110,ko01130,ko01230,map00260,map00400,map01100,map01110,map01130,map01230	ko00000,ko00001,ko00002,ko01000	Trp_syntA
2070	QMT34630.1	547045.NEISICOT_01868	1.67e-42	140.0	COG3830@1|root,COG3830@2|Bacteria,1N2AQ@1224|Proteobacteria,2VV1J@28216|Betaproteobacteria,2KRNY@206351|Neisseriales	Belongs to the UPF0237 family	-	-	ko:K07166	-	ko00000	ACT_6
2070	QMT34631.1	1051985.l11_10300	3.62e-163	465.0	COG1559@1|root,COG1559@2|Bacteria,1MUQF@1224|Proteobacteria,2VHD4@28216|Betaproteobacteria,2KQEC@206351|Neisseriales	Functions as a peptidoglycan terminase that cleaves nascent peptidoglycan strands endolytically to terminate their elongation	mltG	-	ko:K07082	-	ko00000	YceG
2070	QMT34632.1	546274.EIKCOROL_02348	2.59e-124	362.0	COG2267@1|root,COG2267@2|Bacteria,1QTYM@1224|Proteobacteria,2VV2B@28216|Betaproteobacteria,2KSRP@206351|Neisseriales	Thioesterase domain	-	-	-	-	-	Abhydrolase_1
2070	QMT34633.1	547045.NEISICOT_02715	8.83e-103	301.0	COG3023@1|root,COG3023@2|Bacteria,1RDHU@1224|Proteobacteria,2VR5A@28216|Betaproteobacteria,2KR20@206351|Neisseriales	N-acetylmuramoyl-L-alanine amidase	ampD	-	ko:K03806	-	ko00000,ko01000,ko01011	Acetyltransf_1,Amidase_2
2070	QMT34634.1	489653.NLA_15760	0.0	1195.0	COG0272@1|root,COG0272@2|Bacteria,1MV3R@1224|Proteobacteria,2VIDE@28216|Betaproteobacteria,2KPYU@206351|Neisseriales	DNA ligase that catalyzes the formation of phosphodiester linkages between 5'-phosphoryl and 3'-hydroxyl groups in double-stranded DNA using NAD as a coenzyme and as the energy source for the reaction. It is essential for DNA replication and repair of damaged DNA	ligA	-	ko:K01972	ko03030,ko03410,ko03420,ko03430,map03030,map03410,map03420,map03430	ko00000,ko00001,ko01000,ko03032,ko03400	BRCT,DNA_ligase_OB,DNA_ligase_ZBD,DNA_ligase_aden,HHH_2,HHH_5
2070	QMT34635.1	1051985.l11_10260	1.97e-166	470.0	COG1210@1|root,COG1210@2|Bacteria,1MV5F@1224|Proteobacteria,2VH00@28216|Betaproteobacteria,2KQ12@206351|Neisseriales	Psort location Cytoplasmic, score 8.96	galU	-	ko:K00963	ko00040,ko00052,ko00500,ko00520,ko01100,ko01130,map00040,map00052,map00500,map00520,map01100,map01130	ko00000,ko00001,ko00002,ko01000	NTP_transferase
2070	QMT34636.1	1051985.l11_04110	4.99e-90	265.0	COG1522@1|root,COG1522@2|Bacteria,1MX7R@1224|Proteobacteria,2VQBV@28216|Betaproteobacteria,2KR5G@206351|Neisseriales	Transcriptional regulator, AsnC family	-	-	ko:K03719	-	ko00000,ko03000,ko03036	AsnC_trans_reg,HTH_24
2070	QMT34637.1	1051985.l11_04100	8.98e-219	613.0	COG0665@1|root,COG0665@2|Bacteria,1MVIZ@1224|Proteobacteria,2VH1D@28216|Betaproteobacteria,2KPI8@206351|Neisseriales	Oxidative deamination of D-amino acids	dadA	-	ko:K00285	ko00360,map00360	ko00000,ko00001,ko01000	DAO
2070	QMT34638.1	1051985.l11_04160	1.21e-231	647.0	28JMK@1|root,2Z9E3@2|Bacteria,1QSC2@1224|Proteobacteria,2VKS6@28216|Betaproteobacteria,2KPYN@206351|Neisseriales	Psort location CytoplasmicMembrane, score	-	-	-	-	-	DUF2868
2070	QMT34639.1	1051985.l11_10530	1.31e-56	181.0	COG2259@1|root,COG2259@2|Bacteria,1RKEE@1224|Proteobacteria,2WAEN@28216|Betaproteobacteria,2KT0N@206351|Neisseriales	TQO small subunit DoxD	-	-	ko:K15977	-	ko00000	DoxX
2070	QMT34641.1	1051985.l11_10550	6.93e-139	399.0	COG3220@1|root,COG3220@2|Bacteria,1MURE@1224|Proteobacteria,2VKP0@28216|Betaproteobacteria,2KQE9@206351|Neisseriales	Belongs to the UPF0276 family	-	-	ko:K09930	-	ko00000	DUF692
2070	QMT34642.1	1121352.JHZP01000006_gene1173	2.1e-67	215.0	COG3219@1|root,COG3219@2|Bacteria,1RKMJ@1224|Proteobacteria,2WFKK@28216|Betaproteobacteria,2KRTV@206351|Neisseriales	Psort location Cytoplasmic, score 8.96	-	-	ko:K09929	-	ko00000	DUF2063
2070	QMT34643.1	1121352.JHZP01000006_gene1172	3.77e-69	216.0	COG1595@1|root,COG1595@2|Bacteria,1RHKM@1224|Proteobacteria,2VRMP@28216|Betaproteobacteria,2KRJ8@206351|Neisseriales	Belongs to the sigma-70 factor family. ECF subfamily	-	-	ko:K03088	-	ko00000,ko03021	Sigma70_r2,Sigma70_r4_2
2070	QMT34644.1	546266.NEIMUCOT_04750	2.95e-76	234.0	COG2854@1|root,COG2854@2|Bacteria,1MYV1@1224|Proteobacteria,2VSP0@28216|Betaproteobacteria,2KRBW@206351|Neisseriales	MlaC protein	-	-	-	-	-	MlaC
2070	QMT34645.1	1051985.l11_15240	2.06e-147	425.0	COG0681@1|root,COG0681@2|Bacteria,1MXUF@1224|Proteobacteria,2VJ9D@28216|Betaproteobacteria,2KPNG@206351|Neisseriales	Belongs to the peptidase S26 family	lepB	-	ko:K03100	ko02024,ko03060,map02024,map03060	ko00000,ko00001,ko01000,ko01002	Peptidase_S24,Peptidase_S26
2070	QMT34646.1	596320.NEIFL0001_0421	3.58e-140	401.0	COG0134@1|root,COG0134@2|Bacteria,1MW5K@1224|Proteobacteria,2VIN7@28216|Betaproteobacteria,2KPZH@206351|Neisseriales	Belongs to the TrpC family	trpC	-	ko:K01609	ko00400,ko01100,ko01110,ko01130,ko01230,map00400,map01100,map01110,map01130,map01230	ko00000,ko00001,ko00002,ko01000	IGPS
2070	QMT34647.1	1051985.l11_00930	4.8e-08	54.7	COG0671@1|root,COG0671@2|Bacteria,1NA6H@1224|Proteobacteria,2VRA5@28216|Betaproteobacteria,2KS9C@206351|Neisseriales	Psort location CytoplasmicMembrane, score 10.00	-	-	ko:K19302	ko00550,map00550	ko00000,ko00001,ko01000,ko01011	PAP2
2070	QMT34649.1	1120980.JQKH01000038_gene1976	1.81e-44	150.0	2E73W@1|root,32347@2|Bacteria,1QNF3@1224|Proteobacteria,2VTNZ@28216|Betaproteobacteria,2KRF4@206351|Neisseriales	Protein of unknown function (DUF2750)	-	-	-	-	-	DUF2750
2070	QMT34650.1	887327.HMPREF0476_0717	4.63e-80	242.0	COG3028@1|root,COG3028@2|Bacteria,1MZ4R@1224|Proteobacteria,2VSGZ@28216|Betaproteobacteria,2KR2F@206351|Neisseriales	Belongs to the UPF0307 family	-	-	ko:K09889	-	ko00000,ko03009	DUF615
2070	QMT34651.1	1051985.l11_00910	6.67e-238	663.0	COG0312@1|root,COG0312@2|Bacteria,1MUVW@1224|Proteobacteria,2VHJ4@28216|Betaproteobacteria,2KPRN@206351|Neisseriales	TldD PmbA family protein	pmbA	-	ko:K03592	-	ko00000,ko01002	PmbA_TldD
2070	QMT34652.1	546274.EIKCOROL_01121	4.07e-93	278.0	COG0132@1|root,COG0132@2|Bacteria,1RDRK@1224|Proteobacteria,2VR4C@28216|Betaproteobacteria,2KQUR@206351|Neisseriales	Catalyzes a mechanistically unusual reaction, the ATP- dependent insertion of CO2 between the N7 and N8 nitrogen atoms of 7,8-diaminopelargonic acid (DAPA) to form an ureido ring	bioD	-	ko:K01935	ko00780,ko01100,map00780,map01100	ko00000,ko00001,ko00002,ko01000	AAA_26
2070	QMT34653.1	411477.PARMER_04114	7.09e-60	196.0	COG4106@1|root,COG4106@2|Bacteria,4PKFJ@976|Bacteroidetes,2G3FE@200643|Bacteroidia,22Y6P@171551|Porphyromonadaceae	Converts the free carboxyl group of a malonyl-thioester to its methyl ester by transfer of a methyl group from S-adenosyl- L-methionine (SAM). It allows to synthesize pimeloyl-ACP via the fatty acid synthetic pathway	bioC	-	ko:K02169	ko00780,ko01100,map00780,map01100	ko00000,ko00001,ko00002,ko01000	Methyltransf_11,Methyltransf_23
2070	QMT34654.1	1051985.l11_20010	1.39e-76	233.0	COG0703@1|root,COG0703@2|Bacteria,1MUFJ@1224|Proteobacteria,2VRDN@28216|Betaproteobacteria,2KR45@206351|Neisseriales	Catalyzes the specific phosphorylation of the 3-hydroxyl group of shikimic acid using ATP as a cosubstrate	aroK	-	ko:K00891	ko00400,ko01100,ko01110,ko01130,ko01230,map00400,map01100,map01110,map01130,map01230	ko00000,ko00001,ko00002,ko01000	SKI
2070	QMT34655.1	641149.HMPREF9016_01264	2.05e-194	546.0	COG0337@1|root,COG0337@2|Bacteria,1MUBK@1224|Proteobacteria,2VHXR@28216|Betaproteobacteria,2KQ69@206351|Neisseriales	Catalyzes the conversion of 3-deoxy-D-arabino- heptulosonate 7-phosphate (DAHP) to dehydroquinate (DHQ)	aroB	-	ko:K01735	ko00400,ko01100,ko01110,ko01130,ko01230,map00400,map01100,map01110,map01130,map01230	ko00000,ko00001,ko00002,ko01000	DHQ_synthase
2070	QMT34656.1	489653.NLA_16410	5.55e-44	143.0	COG0228@1|root,COG0228@2|Bacteria,1MZCT@1224|Proteobacteria,2VTYP@28216|Betaproteobacteria,2KRJF@206351|Neisseriales	Belongs to the bacterial ribosomal protein bS16 family	rpsP	-	ko:K02959	ko03010,map03010	br01610,ko00000,ko00001,ko00002,ko03011,ko03029	Ribosomal_S16
2070	QMT34657.1	546266.NEIMUCOT_03649	1.3e-90	268.0	COG0806@1|root,COG0806@2|Bacteria,1MWQR@1224|Proteobacteria,2VQ0H@28216|Betaproteobacteria,2KR7B@206351|Neisseriales	An accessory protein needed during the final step in the assembly of 30S ribosomal subunit, possibly for assembly of the head region. Probably interacts with S19. Essential for efficient processing of 16S rRNA. May be needed both before and after RbfA during the maturation of 16S rRNA. It has affinity for free ribosomal 30S subunits but not for 70S ribosomes	rimM	-	ko:K02860	-	ko00000,ko03009	PRC,RimM
2070	QMT34658.1	641149.HMPREF9016_01456	2.92e-140	400.0	COG0336@1|root,COG0336@2|Bacteria,1MUN1@1224|Proteobacteria,2VHPY@28216|Betaproteobacteria,2KPVV@206351|Neisseriales	Belongs to the RNA methyltransferase TrmD family	trmD	-	ko:K00554	-	ko00000,ko01000,ko03016	tRNA_m1G_MT
2070	QMT34659.1	1120980.JQKH01000033_gene1109	6.49e-75	224.0	COG0335@1|root,COG0335@2|Bacteria,1RH3A@1224|Proteobacteria,2VR2S@28216|Betaproteobacteria,2KR2V@206351|Neisseriales	This protein is located at the 30S-50S ribosomal subunit interface and may play a role in the structure and function of the aminoacyl-tRNA binding site	rplS	-	ko:K02884	ko03010,map03010	br01610,ko00000,ko00001,ko00002,ko03011	Ribosomal_L19
2070	QMT34660.1	546268.NEISUBOT_05456	3.62e-138	397.0	COG0388@1|root,COG0388@2|Bacteria,1MUUB@1224|Proteobacteria,2VIR4@28216|Betaproteobacteria,2KPFR@206351|Neisseriales	Hydrolase, carbon-nitrogen family	-	-	ko:K01501,ko:K11206	ko00380,ko00460,ko00627,ko00643,ko00910,ko01120,map00380,map00460,map00627,map00643,map00910,map01120	ko00000,ko00001,ko01000	CN_hydrolase
2070	QMT34661.1	547045.NEISICOT_01210	3.77e-88	284.0	2FCQ7@1|root,344TF@2|Bacteria,1P3X2@1224|Proteobacteria,2W545@28216|Betaproteobacteria,2KTEN@206351|Neisseriales	-	-	-	-	-	-	-
2070	QMT34662.1	1051985.l11_06840	0.0	1018.0	COG4108@1|root,COG4108@2|Bacteria,1MU7X@1224|Proteobacteria,2VIV3@28216|Betaproteobacteria,2KQC1@206351|Neisseriales	Increases the formation of ribosomal termination complexes and stimulates activities of RF-1 and RF-2. It binds guanine nucleotides and has strong preference for UGA stop codons. It may interact directly with the ribosome. The stimulation of RF- 1 and RF-2 is significantly reduced by GTP and GDP, but not by GMP	prfC	-	ko:K02837	-	ko00000,ko03012	GTP_EFTU,GTP_EFTU_D2,RF3_C
2070	QMT34663.1	546266.NEIMUCOT_03697	1.2e-30	120.0	COG1335@1|root,COG1335@2|Bacteria	hydrolase activity, acting on carbon-nitrogen (but not peptide) bonds, in linear amides	-	-	ko:K08281	ko00760,ko01100,map00760,map01100	ko00000,ko00001,ko01000	Isochorismatase
2070	QMT34664.1	1051985.l11_18790	6.04e-268	743.0	COG0348@1|root,COG0348@2|Bacteria,1MVFY@1224|Proteobacteria,2VHRH@28216|Betaproteobacteria,2KPSJ@206351|Neisseriales	Cytochrome c oxidase accessory protein CcoG	ccoG	-	-	-	-	Fer4_18,Fer4_5,FixG_C
2070	QMT34665.1	1051985.l11_18800	4.1e-82	248.0	COG3198@1|root,COG3198@2|Bacteria,1N75J@1224|Proteobacteria,2VTYE@28216|Betaproteobacteria,2KRAU@206351|Neisseriales	FixH	-	-	ko:K09926	-	ko00000	FixH
2070	QMT34666.1	1051985.l11_18820	0.0	1373.0	COG0280@1|root,COG0281@1|root,COG0280@2|Bacteria,COG0281@2|Bacteria,1MU0A@1224|Proteobacteria,2VIYB@28216|Betaproteobacteria,2KQ2B@206351|Neisseriales	Malate dehydrogenase	maeB	-	ko:K00029	ko00620,ko00710,ko01100,ko01120,ko01200,map00620,map00710,map01100,map01120,map01200	ko00000,ko00001,ko00002,ko01000	Malic_M,PTA_PTB,malic
2070	QMT34667.1	1051985.l11_10110	1.27e-71	217.0	COG0537@1|root,COG0537@2|Bacteria,1MZVD@1224|Proteobacteria,2VU7S@28216|Betaproteobacteria,2KRFQ@206351|Neisseriales	Histidine triad domain protein	-	-	-	-	-	HIT
2070	QMT34668.1	641149.HMPREF9016_00972	1.37e-195	552.0	COG1619@1|root,COG1619@2|Bacteria,1MWIY@1224|Proteobacteria,2VHAS@28216|Betaproteobacteria,2KPXC@206351|Neisseriales	Tat pathway signal sequence domain protein	-	-	ko:K01297	-	ko00000,ko01000,ko01002,ko01011	Peptidase_S66
2070	QMT34669.1	546266.NEIMUCOT_06292	7.86e-166	474.0	COG0079@1|root,COG0079@2|Bacteria,1MW7I@1224|Proteobacteria,2VHX2@28216|Betaproteobacteria,2KQ7D@206351|Neisseriales	Belongs to the class-II pyridoxal-phosphate-dependent aminotransferase family. Histidinol-phosphate aminotransferase subfamily	hisC	-	ko:K00817	ko00340,ko00350,ko00360,ko00400,ko00401,ko00960,ko01100,ko01110,ko01130,ko01230,map00340,map00350,map00360,map00400,map00401,map00960,map01100,map01110,map01130,map01230	ko00000,ko00001,ko00002,ko01000,ko01007	Aminotran_1_2
2070	QMT34670.1	1051985.l11_11920	3.34e-146	420.0	COG0131@1|root,COG0131@2|Bacteria,1MWBS@1224|Proteobacteria,2VI59@28216|Betaproteobacteria,2KQ53@206351|Neisseriales	imidazoleglycerol-phosphate dehydratase	hisB	-	ko:K01693	ko00340,ko01100,ko01110,ko01230,map00340,map01100,map01110,map01230	ko00000,ko00001,ko00002,ko01000	IGPD
2070	QMT34671.1	1051985.l11_11900	5.52e-130	371.0	COG0118@1|root,COG0118@2|Bacteria,1MU4X@1224|Proteobacteria,2VJPI@28216|Betaproteobacteria,2KPS9@206351|Neisseriales	IGPS catalyzes the conversion of PRFAR and glutamine to IGP, AICAR and glutamate. The HisH subunit provides the glutamine amidotransferase activity that produces the ammonia necessary to HisF for the synthesis of IGP and AICAR	hisH	-	ko:K02501	ko00340,ko01100,ko01110,ko01230,map00340,map01100,map01110,map01230	ko00000,ko00001,ko00002,ko01000	GATase
2070	QMT34672.1	1051985.l11_11890	3.9e-146	415.0	COG0106@1|root,COG0106@2|Bacteria,1MW6S@1224|Proteobacteria,2VI38@28216|Betaproteobacteria,2KQ44@206351|Neisseriales	1-(5-phosphoribosyl)-5- (5-phosphoribosylamino)methylideneamino imidazole-4-carboxamide isomerase	hisA	-	ko:K01814	ko00340,ko01100,ko01110,ko01230,map00340,map01100,map01110,map01230	ko00000,ko00001,ko00002,ko01000	His_biosynth
2070	QMT34673.1	547045.NEISICOT_00602	4.36e-19	82.4	2CH09@1|root,32S4Z@2|Bacteria,1N1ZF@1224|Proteobacteria,2VUXE@28216|Betaproteobacteria,2KRQY@206351|Neisseriales	Psort location CytoplasmicMembrane, score 9.46	-	-	-	-	-	-
2070	QMT34674.1	1051985.l11_11870	1.87e-170	478.0	COG0107@1|root,COG0107@2|Bacteria,1MUS0@1224|Proteobacteria,2VHY0@28216|Betaproteobacteria,2KPSE@206351|Neisseriales	IGPS catalyzes the conversion of PRFAR and glutamine to IGP, AICAR and glutamate. The HisF subunit catalyzes the cyclization activity that produces IGP and AICAR from PRFAR using the ammonia provided by the HisH subunit	hisF	-	ko:K02500	ko00340,ko01100,ko01110,ko01230,map00340,map01100,map01110,map01230	ko00000,ko00001,ko00002,ko01000	His_biosynth
2070	QMT34675.1	1298593.TOL_3296	0.000442	45.8	COG0810@1|root,COG0810@2|Bacteria,1PEDH@1224|Proteobacteria,1RRNT@1236|Gammaproteobacteria,1XMCM@135619|Oceanospirillales	Interacts with outer membrane receptor proteins that carry out high-affinity binding and energy dependent uptake into the periplasmic space of specific substrates. It could act to transduce energy from the cytoplasmic membrane to specific energy- requiring processes in the outer membrane, resulting in the release into the periplasm of ligands bound by these outer membrane proteins	-	-	ko:K03832	-	ko00000,ko02000	TonB_C
2070	QMT34676.1	1051985.l11_03610	0.0	1213.0	COG2225@1|root,COG2225@2|Bacteria,1MVEV@1224|Proteobacteria,2VJMS@28216|Betaproteobacteria,2KQDJ@206351|Neisseriales	Involved in the glycolate utilization. Catalyzes the condensation and subsequent hydrolysis of acetyl-coenzyme A (acetyl-CoA) and glyoxylate to form malate and CoA	glcB	-	ko:K01638	ko00620,ko00630,ko01100,ko01110,ko01120,ko01200,map00620,map00630,map01100,map01110,map01120,map01200	ko00000,ko00001,ko00002,ko01000	Malate_synthase
2070	QMT34677.1	546266.NEIMUCOT_06022	2.91e-219	611.0	COG0116@1|root,COG0116@2|Bacteria,1MUQM@1224|Proteobacteria,2VHMY@28216|Betaproteobacteria,2KPDK@206351|Neisseriales	Belongs to the methyltransferase superfamily	-	-	ko:K07444	-	ko00000,ko01000	THUMP,UPF0020
2070	QMT34678.1	1196083.SALWKB12_0372	6.45e-134	384.0	COG1187@1|root,COG1187@2|Bacteria,1MXQE@1224|Proteobacteria,2VI7P@28216|Betaproteobacteria,2KPWX@206351|Neisseriales	Belongs to the pseudouridine synthase RsuA family	rluF	-	ko:K06182	-	ko00000,ko01000,ko03009	PseudoU_synth_2,S4
2070	QMT34679.1	546268.NEISUBOT_05112	1.65e-92	277.0	COG2999@1|root,COG2999@2|Bacteria,1N9FA@1224|Proteobacteria,2VQQV@28216|Betaproteobacteria,2KQWN@206351|Neisseriales	Psort location Cytoplasmic, score 8.96	grxB	-	ko:K03675	-	ko00000,ko03110	GST_N_3,Glutaredoxin2_C
2070	QMT34680.1	887327.HMPREF0476_0167	8.94e-60	186.0	COG2018@1|root,COG2018@2|Bacteria,1QV3M@1224|Proteobacteria,2VT08@28216|Betaproteobacteria,2KR34@206351|Neisseriales	Roadblock/LC7 domain	-	-	-	-	-	-
2070	QMT34681.1	641149.HMPREF9016_01962	0.0	1202.0	COG0317@1|root,COG0317@2|Bacteria,1MU44@1224|Proteobacteria,2VHSK@28216|Betaproteobacteria,2KPJR@206351|Neisseriales	In eubacteria ppGpp (guanosine 3'-diphosphate 5-' diphosphate) is a mediator of the stringent response that coordinates a variety of cellular activities in response to changes in nutritional abundance	relA	-	ko:K00951	ko00230,map00230	ko00000,ko00001,ko01000	ACT_4,HD_4,RelA_SpoT,TGS
2070	QMT34682.1	546266.NEIMUCOT_05321	4.63e-205	570.0	COG0492@1|root,COG0492@2|Bacteria,1MV15@1224|Proteobacteria,2VIVV@28216|Betaproteobacteria,2KPDC@206351|Neisseriales	Belongs to the class-II pyridine nucleotide-disulfide oxidoreductase family	trxB	-	ko:K00384	ko00450,map00450	ko00000,ko00001,ko01000	Pyr_redox_2
2070	QMT34683.1	546266.NEIMUCOT_05258	1.84e-44	152.0	2A5II@1|root,30U8S@2|Bacteria,1RFXX@1224|Proteobacteria,2VS2Y@28216|Betaproteobacteria,2KR9K@206351|Neisseriales	-	-	-	-	-	-	-
2070	QMT34684.1	1051985.l11_14770	0.0	1178.0	COG1217@1|root,COG1217@2|Bacteria,1MV5Q@1224|Proteobacteria,2VH2W@28216|Betaproteobacteria,2KPIG@206351|Neisseriales	GTP-binding protein TypA	typA	-	ko:K06207	-	ko00000	EFG_C,GTP_EFTU,GTP_EFTU_D2
2070	QMT34685.1	1051985.l11_14780	1.09e-93	275.0	COG2193@1|root,COG2193@2|Bacteria,1RD4Y@1224|Proteobacteria,2VQG7@28216|Betaproteobacteria,2KQXK@206351|Neisseriales	Iron-storage protein	bfrA	-	ko:K03594	ko00860,map00860	ko00000,ko00001,ko01000	Ferritin
2070	QMT34686.1	547045.NEISICOT_03017	2.65e-100	294.0	COG0778@1|root,COG0778@2|Bacteria,1PKUV@1224|Proteobacteria,2VTDH@28216|Betaproteobacteria,2KQXR@206351|Neisseriales	Nitroreductase family	-	-	-	-	-	Nitroreductase
2070	QMT34687.1	1121352.JHZP01000013_gene1687	1.43e-54	171.0	COG0254@1|root,COG0254@2|Bacteria,1MZ4D@1224|Proteobacteria,2VSQH@28216|Betaproteobacteria,2KREE@206351|Neisseriales	Ribosomal protein L31	rpmE2	-	ko:K02909	ko03010,map03010	br01610,ko00000,ko00001,ko00002,ko03011	Ribosomal_L31
2070	QMT34688.1	887327.HMPREF0476_0480	1.89e-20	81.3	COG0257@1|root,COG0257@2|Bacteria,1NGBJ@1224|Proteobacteria,2VXES@28216|Betaproteobacteria,2KS4D@206351|Neisseriales	Ribosomal protein L36	rpmJ	-	ko:K02919	ko03010,map03010	br01610,ko00000,ko00001,ko00002,ko03011	Ribosomal_L36
2070	QMT34689.1	1051985.l11_15000	0.0	1617.0	COG0542@1|root,COG0542@2|Bacteria,1MURH@1224|Proteobacteria,2VHYF@28216|Betaproteobacteria,2KPCD@206351|Neisseriales	Part of a stress-induced multi-chaperone system, it is involved in the recovery of the cell from heat-induced damage, in cooperation with DnaK, DnaJ and GrpE	clpB	-	ko:K03695	ko04213,map04213	ko00000,ko00001,ko03110	AAA,AAA_2,ClpB_D2-small,Clp_N
2070	QMT34690.1	641149.HMPREF9016_01535	0.0	2184.0	COG0286@1|root,COG4889@1|root,COG0286@2|Bacteria,COG4889@2|Bacteria	site-specific DNA-methyltransferase (adenine-specific) activity	-	-	-	-	-	Helicase_C,Mrr_cat_2,N6_Mtase,ResIII
2070	QMT34691.1	1298593.TOL_1551	1.86e-145	422.0	COG0667@1|root,COG0667@2|Bacteria,1MV2Y@1224|Proteobacteria,1RNXH@1236|Gammaproteobacteria,1XIVQ@135619|Oceanospirillales	Aldo keto reductase	tas	-	-	-	-	Aldo_ket_red
2070	QMT34692.1	1051985.l11_17410	2.74e-118	343.0	COG0846@1|root,COG0846@2|Bacteria,1MUK1@1224|Proteobacteria,2VNKF@28216|Betaproteobacteria,2KR1P@206351|Neisseriales	NAD-dependent lysine deacetylase and desuccinylase that specifically removes acetyl and succinyl groups on target proteins. Modulates the activities of several proteins which are inactive in their acylated form	npdA	-	ko:K12410	-	ko00000,ko01000	SIR2
2070	QMT34694.1	546274.EIKCOROL_01306	2.33e-75	231.0	COG3034@1|root,COG3034@2|Bacteria,1MXY6@1224|Proteobacteria,2VTUE@28216|Betaproteobacteria,2KRH5@206351|Neisseriales	L,D-transpeptidase catalytic domain	-	-	-	-	-	YkuD
2070	QMT34695.1	1121351.AUAP01000041_gene255	4.57e-90	275.0	COG0561@1|root,COG0561@2|Bacteria,1PGMI@1224|Proteobacteria,2VM3B@28216|Betaproteobacteria,2KQSD@206351|Neisseriales	Psort location Cytoplasmic, score 8.96	-	-	-	-	-	Hydrolase_3
2070	QMT34696.1	1051985.l11_00230	2.8e-126	366.0	COG1573@1|root,COG1573@2|Bacteria	deaminated base DNA N-glycosylase activity	udgB	GO:0003674,GO:0003824,GO:0004844,GO:0005488,GO:0006139,GO:0006259,GO:0006281,GO:0006284,GO:0006725,GO:0006807,GO:0006950,GO:0006974,GO:0008150,GO:0008152,GO:0009987,GO:0016787,GO:0016798,GO:0016799,GO:0019104,GO:0033554,GO:0033958,GO:0034641,GO:0043170,GO:0044237,GO:0044238,GO:0044260,GO:0046483,GO:0048037,GO:0050896,GO:0051536,GO:0051539,GO:0051540,GO:0051716,GO:0071704,GO:0090304,GO:0097506,GO:0140097,GO:1901360	ko:K21929	ko03410,map03410	ko00000,ko00001,ko01000,ko03400	DUF4130,UDG
2070	QMT34697.1	1051985.l11_00240	4.28e-276	758.0	COG4277@1|root,COG4277@2|Bacteria,1MVCV@1224|Proteobacteria,2VM80@28216|Betaproteobacteria	PFAM Radical SAM domain protein	-	-	-	-	-	Radical_SAM
2070	QMT34698.1	1051985.l11_21080	5.52e-91	267.0	COG2764@1|root,COG2764@2|Bacteria,1N0S4@1224|Proteobacteria,2VU64@28216|Betaproteobacteria,2KS1V@206351|Neisseriales	3-demethylubiquinone-9 3-methyltransferase	-	-	ko:K04750	-	ko00000	3-dmu-9_3-mt
2070	QMT34699.1	945021.TEH_23150	1.24e-44	158.0	COG2207@1|root,COG2207@2|Bacteria,1V9G1@1239|Firmicutes,4HK3K@91061|Bacilli,4B2Z7@81852|Enterococcaceae	helix_turn_helix, arabinose operon control protein	-	-	-	-	-	HTH_18,HTH_AraC
2070	QMT34700.1	421052.F945_02284	9.58e-19	84.0	2AZT1@1|root,31S2A@2|Bacteria,1QPJE@1224|Proteobacteria,1TN9W@1236|Gammaproteobacteria,3NQ88@468|Moraxellaceae	-	-	-	-	-	-	-
2070	QMT34701.1	1051985.l11_12270	0.0	1016.0	COG3540@1|root,COG3540@2|Bacteria,1MXG8@1224|Proteobacteria,2VP3C@28216|Betaproteobacteria,2KTHU@206351|Neisseriales	PhoD-like phosphatase	-	-	ko:K01113	ko00790,ko01100,ko02020,map00790,map01100,map02020	ko00000,ko00001,ko00002,ko01000	PhoD
2070	QMT34702.1	546266.NEIMUCOT_06186	4.13e-184	512.0	COG0207@1|root,COG0207@2|Bacteria,1MUBD@1224|Proteobacteria,2VIIR@28216|Betaproteobacteria,2KPIK@206351|Neisseriales	Catalyzes the reductive methylation of 2'-deoxyuridine- 5'-monophosphate (dUMP) to 2'-deoxythymidine-5'-monophosphate (dTMP) while utilizing 5,10-methylenetetrahydrofolate (mTHF) as the methyl donor and reductant in the reaction, yielding dihydrofolate (DHF) as a by-product. This enzymatic reaction provides an intracellular de novo source of dTMP, an essential precursor for DNA biosynthesis	thyA	-	ko:K00560	ko00240,ko00670,ko01100,ko01523,map00240,map00670,map01100,map01523	ko00000,ko00001,ko00002,ko01000	Thymidylat_synt
2070	QMT34703.1	155515.JP36_02340	5.49e-285	783.0	COG0334@1|root,COG0334@2|Bacteria,1MUMF@1224|Proteobacteria,1RPUZ@1236|Gammaproteobacteria,1Y756@135625|Pasteurellales	Belongs to the Glu Leu Phe Val dehydrogenases family	gdhA	GO:0003674,GO:0003824,GO:0004353,GO:0004354,GO:0005575,GO:0005622,GO:0005623,GO:0005737,GO:0005829,GO:0006082,GO:0006520,GO:0006536,GO:0006537,GO:0006807,GO:0008150,GO:0008152,GO:0008652,GO:0009058,GO:0009064,GO:0009084,GO:0009987,GO:0016053,GO:0016491,GO:0016638,GO:0016639,GO:0019752,GO:0043436,GO:0043648,GO:0043650,GO:0044237,GO:0044238,GO:0044249,GO:0044281,GO:0044283,GO:0044424,GO:0044444,GO:0044464,GO:0046394,GO:0055114,GO:0071704,GO:1901564,GO:1901566,GO:1901576,GO:1901605,GO:1901607	ko:K00262	ko00220,ko00250,ko00910,ko01100,map00220,map00250,map00910,map01100	ko00000,ko00001,ko01000	ELFV_dehydrog,ELFV_dehydrog_N
2070	QMT34704.1	1051985.l11_06780	3.78e-176	496.0	COG0341@1|root,COG0341@2|Bacteria,1MU74@1224|Proteobacteria,2VHZG@28216|Betaproteobacteria,2KQ4B@206351|Neisseriales	Part of the Sec protein translocase complex. Interacts with the SecYEG preprotein conducting channel. SecDF uses the proton motive force (PMF) to complete protein translocation after the ATP-dependent function of SecA	secF	-	ko:K03074	ko03060,ko03070,map03060,map03070	ko00000,ko00001,ko00002,ko02044	SecD_SecF,Sec_GG
