key	query	seed_ortholog	evalue	score	eggNOG_OGs	description	preferred_name	GOs	KEGG_ko	KEGG_pathway	brite	PFAMs
2070	QMT35663.1	489653.NLA_4090	1.97e-202	565.0	COG0042@1|root,COG0042@2|Bacteria,1MUY1@1224|Proteobacteria,2VHCA@28216|Betaproteobacteria,2KPE5@206351|Neisseriales	Catalyzes the synthesis of 5,6-dihydrouridine (D), a modified base found in the D-loop of most tRNAs, via the reduction of the C5-C6 double bond in target uridines. Specifically modifies U20 and U20a in tRNAs	dusA	-	ko:K05539	-	ko00000,ko01000,ko03016	Dus
2070	QMT35664.1	1120980.JQKH01000003_gene312	0.0	2241.0	COG5013@1|root,COG5013@2|Bacteria,1MW9S@1224|Proteobacteria,2VJ2F@28216|Betaproteobacteria,2KQ33@206351|Neisseriales	Belongs to the prokaryotic molybdopterin-containing oxidoreductase family	narG	-	ko:K00370	ko00910,ko01120,ko02020,map00910,map01120,map02020	ko00000,ko00001,ko00002,ko01000	Molybdopterin,Molydop_binding,Nitr_red_alph_N
2070	QMT35665.1	1051985.l11_16830	3.19e-20	82.4	COG3237@1|root,COG3237@2|Bacteria,1N6X4@1224|Proteobacteria,2VW2V@28216|Betaproteobacteria	Belongs to the UPF0337 (CsbD) family	-	-	-	-	-	CsbD
2070	QMT35666.1	641149.HMPREF9016_00136	1.58e-52	171.0	COG3585@1|root,COG3585@2|Bacteria,1QUJC@1224|Proteobacteria,2WHS5@28216|Betaproteobacteria	TOBE domain	-	-	ko:K02019	-	ko00000,ko03000	TOBE
2070	QMT35667.1	546266.NEIMUCOT_06350	3.08e-111	324.0	COG0283@1|root,COG0283@2|Bacteria,1MUUD@1224|Proteobacteria,2VQ2F@28216|Betaproteobacteria,2KPKB@206351|Neisseriales	Belongs to the cytidylate kinase family. Type 1 subfamily	cmk	-	ko:K00945	ko00240,ko01100,map00240,map01100	ko00000,ko00001,ko00002,ko01000	Cytidylate_kin
2070	QMT35668.1	547045.NEISICOT_02164	0.0	1008.0	COG0539@1|root,COG0539@2|Bacteria,1MVAV@1224|Proteobacteria,2VI12@28216|Betaproteobacteria,2KQ90@206351|Neisseriales	thus facilitating recognition of the initiation point. It is needed to translate mRNA with a short Shine-Dalgarno (SD) purine-rich sequence	rpsA	-	ko:K02945	ko03010,map03010	br01610,ko00000,ko00001,ko00002,ko03011	S1
2070	QMT35669.1	1051985.l11_15440	8.99e-60	185.0	COG0776@1|root,COG0776@2|Bacteria,1MZ7M@1224|Proteobacteria,2VSPN@28216|Betaproteobacteria,2KRA6@206351|Neisseriales	This protein is one of the two subunits of integration host factor, a specific DNA-binding protein that functions in genetic recombination as well as in transcriptional and translational control	ihfB	-	ko:K05788	-	ko00000,ko03032,ko03036,ko03400	Bac_DNA_binding
2070	QMT35670.1	1051985.l11_15140	8.47e-317	867.0	COG0147@1|root,COG0147@2|Bacteria,1MVBJ@1224|Proteobacteria,2VI2V@28216|Betaproteobacteria,2KPGJ@206351|Neisseriales	Part of a heterotetrameric complex that catalyzes the two-step biosynthesis of anthranilate, an intermediate in the biosynthesis of L-tryptophan. In the first step, the glutamine- binding beta subunit (TrpG) of anthranilate synthase (AS) provides the glutamine amidotransferase activity which generates ammonia as a substrate that, along with chorismate, is used in the second step, catalyzed by the large alpha subunit of AS (TrpE) to produce anthranilate. In the absence of TrpG, TrpE can synthesize anthranilate directly from chorismate and high concentrations of ammonia	trpE	-	ko:K01657	ko00400,ko00405,ko01100,ko01110,ko01130,ko01230,ko02024,ko02025,map00400,map00405,map01100,map01110,map01130,map01230,map02024,map02025	ko00000,ko00001,ko00002,ko01000	Anth_synt_I_N,Chorismate_bind
2070	QMT35671.1	1051985.l11_07680	7.26e-139	392.0	COG0605@1|root,COG0605@2|Bacteria,1MVW2@1224|Proteobacteria,2VI2Y@28216|Betaproteobacteria,2KPPV@206351|Neisseriales	Destroys radicals which are normally produced within the cells and which are toxic to biological systems	sodA	-	ko:K04564	ko04013,ko04068,ko04146,ko04211,ko04212,ko04213,ko05016,map04013,map04068,map04146,map04211,map04212,map04213,map05016	ko00000,ko00001,ko01000	Sod_Fe_C,Sod_Fe_N
2070	QMT35672.1	546266.NEIMUCOT_03715	1.05e-78	241.0	COG0741@1|root,COG0741@2|Bacteria,1MZ4X@1224|Proteobacteria,2VM6E@28216|Betaproteobacteria,2KTZ2@206351|Neisseriales	Transglycosylase SLT domain	-	-	-	-	-	SLT
2070	QMT35673.1	1123296.JQKE01000046_gene1856	8.63e-12	63.9	2ENMN@1|root,33G8Z@2|Bacteria,1NJF3@1224|Proteobacteria,2VYVI@28216|Betaproteobacteria,2KS9B@206351|Neisseriales	-	-	-	-	-	-	-
2070	QMT35674.1	547045.NEISICOT_02426	2.54e-50	164.0	COG3702@1|root,COG3702@2|Bacteria,1N4V8@1224|Proteobacteria,2VU29@28216|Betaproteobacteria,2KRP6@206351|Neisseriales	Type IV secretory pathway, VirB3-like protein	-	-	-	-	-	VirB3
2070	QMT35675.1	547045.NEISICOT_02425	0.0	1093.0	COG3451@1|root,COG3451@2|Bacteria,1MXH0@1224|Proteobacteria,2VKE0@28216|Betaproteobacteria,2KQK7@206351|Neisseriales	CagE, TrbE, VirB family, component of type IV transporter system	-	-	-	-	-	CagE_TrbE_VirB
2070	QMT35676.1	547045.NEISICOT_02424	1.44e-89	270.0	COG5314@1|root,COG5314@2|Bacteria,1N6IK@1224|Proteobacteria,2VUCS@28216|Betaproteobacteria,2KRTM@206351|Neisseriales	Type IV secretion system proteins	-	-	-	-	-	T4SS
2070	QMT35678.1	547045.NEISICOT_02422	9.89e-117	347.0	COG3704@1|root,COG3704@2|Bacteria,1RE1X@1224|Proteobacteria,2VRP7@28216|Betaproteobacteria,2KR99@206351|Neisseriales	TrbL/VirB6 plasmid conjugal transfer protein	-	-	-	-	-	TrbL
2070	QMT35679.1	666681.M301_0017	5.2e-116	338.0	COG1484@1|root,COG1484@2|Bacteria,1MWQX@1224|Proteobacteria,2VMBN@28216|Betaproteobacteria	PFAM IstB domain protein ATP-binding protein	-	-	-	-	-	IstB_IS21
2070	QMT35680.1	758.BBIX01000001_gene15	4.82e-171	499.0	COG4584@1|root,COG4584@2|Bacteria,1MWIV@1224|Proteobacteria,1RR7N@1236|Gammaproteobacteria	Transposase and inactivated derivatives	-	-	-	-	-	rve
2070	QMT35682.1	290398.Csal_1396	2.95e-31	121.0	2DKUP@1|root,30DH1@2|Bacteria,1RDUB@1224|Proteobacteria,1RRN1@1236|Gammaproteobacteria,1XS3G@135619|Oceanospirillales	Phage small terminase subunit	-	-	-	-	-	Phage_term_smal
2070	QMT35683.1	1316932.MHH_c18550	5.15e-80	254.0	2CCQ9@1|root,2Z7HY@2|Bacteria,1MUWR@1224|Proteobacteria,1RPKI@1236|Gammaproteobacteria,1Y800@135625|Pasteurellales	Phage major capsid protein, P2 family	-	-	-	-	-	Phage_cap_P2
2070	QMT35684.1	1453496.AT03_01075	1.82e-33	130.0	2CAV1@1|root,2ZBY8@2|Bacteria,1RAGI@1224|Proteobacteria,1RYPG@1236|Gammaproteobacteria	Capsid scaffolding	O	-	-	-	-	Phage_GPO
2070	QMT35685.1	887327.HMPREF0476_0796	4.64e-196	563.0	COG4373@1|root,COG4373@2|Bacteria,1MXYV@1224|Proteobacteria,2VJG0@28216|Betaproteobacteria,2KSFM@206351|Neisseriales	Putative ATPase subunit of terminase (gpP-like)	-	-	-	-	-	Terminase_5,Terminase_6,Terminase_6C
2070	QMT35686.1	1123487.KB892864_gene2235	4.4e-101	308.0	COG4695@1|root,COG4695@2|Bacteria,1MWA5@1224|Proteobacteria,2VNDU@28216|Betaproteobacteria	portal protein	-	-	-	-	-	Phage_portal
2070	QMT35687.1	641149.HMPREF9016_00528	8.87e-216	600.0	COG0407@1|root,COG0407@2|Bacteria,1MUG1@1224|Proteobacteria,2VHC2@28216|Betaproteobacteria,2KPF4@206351|Neisseriales	Catalyzes the decarboxylation of four acetate groups of uroporphyrinogen-III to yield coproporphyrinogen-III	hemE	-	ko:K01599	ko00860,ko01100,ko01110,map00860,map01100,map01110	ko00000,ko00001,ko00002,ko01000	URO-D
2070	QMT35688.1	435832.HMPREF0604_01013	4.93e-33	114.0	COG2879@1|root,COG2879@2|Bacteria,1PD9X@1224|Proteobacteria,2VUE1@28216|Betaproteobacteria,2KRMA@206351|Neisseriales	Selenoprotein, putative	-	-	-	-	-	Sel_put
2070	QMT35689.1	1121352.JHZP01000002_gene1296	0.0	1180.0	COG1966@1|root,COG1966@2|Bacteria,1MWF9@1224|Proteobacteria,2VK59@28216|Betaproteobacteria,2KPNF@206351|Neisseriales	carbon starvation protein	cstA	-	ko:K06200	-	ko00000	CstA,CstA_5TM
2070	QMT35690.1	546266.NEIMUCOT_05334	5.98e-115	334.0	COG0120@1|root,COG0120@2|Bacteria,1MVGR@1224|Proteobacteria,2VH27@28216|Betaproteobacteria,2KQDX@206351|Neisseriales	Catalyzes the reversible conversion of ribose-5- phosphate to ribulose 5-phosphate	rpiA	-	ko:K01807	ko00030,ko00710,ko01100,ko01110,ko01120,ko01130,ko01200,ko01230,map00030,map00710,map01100,map01110,map01120,map01130,map01200,map01230	ko00000,ko00001,ko00002,ko01000	Rib_5-P_isom_A
2070	QMT35691.1	546264.NEIFLAOT_00245	8.22e-96	280.0	COG0245@1|root,COG0245@2|Bacteria,1MVHA@1224|Proteobacteria,2VR7F@28216|Betaproteobacteria,2KQVT@206351|Neisseriales	Involved in the biosynthesis of isopentenyl diphosphate (IPP) and dimethylallyl diphosphate (DMAPP), two major building blocks of isoprenoid compounds. Catalyzes the conversion of 4- diphosphocytidyl-2-C-methyl-D-erythritol 2-phosphate (CDP-ME2P) to 2-C-methyl-D-erythritol 2,4-cyclodiphosphate (ME-CPP) with a corresponding release of cytidine 5-monophosphate (CMP)	ispF	-	ko:K01770	ko00900,ko01100,ko01110,ko01130,map00900,map01100,map01110,map01130	ko00000,ko00001,ko00002,ko01000	YgbB
2070	QMT35692.1	546264.NEIFLAOT_00244	1.29e-107	316.0	COG1211@1|root,COG1211@2|Bacteria,1MY3B@1224|Proteobacteria,2VMD6@28216|Betaproteobacteria,2KQ97@206351|Neisseriales	Catalyzes the formation of 4-diphosphocytidyl-2-C- methyl-D-erythritol from CTP and 2-C-methyl-D-erythritol 4- phosphate (MEP)	ispD	-	ko:K00991	ko00900,ko01100,ko01110,ko01130,map00900,map01100,map01110,map01130	ko00000,ko00001,ko00002,ko01000	IspD
2070	QMT35693.1	1051985.l11_03940	8.54e-108	317.0	COG0847@1|root,COG0847@2|Bacteria,1MV8Z@1224|Proteobacteria,2VH1Z@28216|Betaproteobacteria,2KPGE@206351|Neisseriales	DNA polymerase III is a complex, multichain enzyme responsible for most of the replicative synthesis in bacteria. The epsilon subunit contain the editing function and is a proofreading 3'-5' exonuclease	dnaQ	-	ko:K02342	ko00230,ko00240,ko01100,ko03030,ko03430,ko03440,map00230,map00240,map01100,map03030,map03430,map03440	ko00000,ko00001,ko00002,ko01000,ko03032,ko03400	RNase_T
2070	QMT35695.1	546264.NEIFLAOT_01651	4.57e-84	250.0	COG0589@1|root,COG0589@2|Bacteria,1MZ3K@1224|Proteobacteria,2VR37@28216|Betaproteobacteria,2KR2H@206351|Neisseriales	Universal stress protein family	-	-	-	-	-	Usp
2070	QMT35696.1	1051985.l11_10490	6.62e-147	418.0	COG1179@1|root,COG1179@2|Bacteria,1MWXR@1224|Proteobacteria,2VJPP@28216|Betaproteobacteria,2KPMI@206351|Neisseriales	Psort location Cytoplasmic, score	-	-	ko:K22132	-	ko00000,ko03016	ThiF
2070	QMT35697.1	694427.Palpr_0716	7.35e-08	54.7	2BXMB@1|root,31ZJM@2|Bacteria,4NR0I@976|Bacteroidetes,2FV5C@200643|Bacteroidia,22Z2G@171551|Porphyromonadaceae	-	-	-	-	-	-	-
2070	QMT35698.1	546264.NEIFLAOT_01648	4.71e-150	428.0	COG1354@1|root,COG1354@2|Bacteria,1MVCN@1224|Proteobacteria,2VKE7@28216|Betaproteobacteria,2KQ4N@206351|Neisseriales	Participates in chromosomal partition during cell division. May act via the formation of a condensin-like complex containing Smc and ScpB that pull DNA away from mid-cell into both cell halves	scpA	-	ko:K05896	-	ko00000,ko03036	SMC_ScpA
2070	QMT35699.1	1051985.l11_10510	6.01e-268	736.0	COG1488@1|root,COG1488@2|Bacteria,1MV8U@1224|Proteobacteria,2VGZ5@28216|Betaproteobacteria,2KQ8D@206351|Neisseriales	Catalyzes the synthesis of beta-nicotinate D- ribonucleotide from nicotinate and 5-phospho-D-ribose 1-phosphate at the expense of ATP	pncB	-	ko:K00763	ko00760,ko01100,map00760,map01100	ko00000,ko00001,ko01000	NAPRTase
2070	QMT35701.1	641149.HMPREF9016_00683	7.68e-108	314.0	COG0807@1|root,COG0807@2|Bacteria,1MWZR@1224|Proteobacteria,2VRA8@28216|Betaproteobacteria,2KPJW@206351|Neisseriales	Catalyzes the conversion of GTP to 2,5-diamino-6- ribosylamino-4(3H)-pyrimidinone 5'-phosphate (DARP), formate and pyrophosphate	ribA	-	ko:K01497	ko00740,ko00790,ko01100,ko01110,ko02024,map00740,map00790,map01100,map01110,map02024	ko00000,ko00001,ko00002,ko01000	GTP_cyclohydro2
2070	QMT35702.1	1051985.l11_03680	9.15e-73	227.0	COG1956@1|root,COG1956@2|Bacteria	GAF domain-containing protein	-	-	-	-	-	GAF,GAF_2,GGDEF
2070	QMT35703.1	1051985.l11_12340	4.74e-290	804.0	COG0706@1|root,COG0706@2|Bacteria,1MV5M@1224|Proteobacteria,2VHIA@28216|Betaproteobacteria,2KQEM@206351|Neisseriales	Required for the insertion and or proper folding and or complex formation of integral membrane proteins into the membrane. Involved in integration of membrane proteins that insert both dependently and independently of the Sec translocase complex, as well as at least some lipoproteins. Aids folding of multispanning membrane proteins	yidC	-	ko:K03217	ko02024,ko03060,ko03070,map02024,map03060,map03070	ko00000,ko00001,ko00002,ko02044,ko03029	60KD_IMP,YidC_periplas
2070	QMT35704.1	1120980.JQKH01000017_gene1885	8.02e-52	166.0	COG0594@1|root,COG0594@2|Bacteria,1PVTU@1224|Proteobacteria,2VTSA@28216|Betaproteobacteria,2KRCC@206351|Neisseriales	RNaseP catalyzes the removal of the 5'-leader sequence from pre-tRNA to produce the mature 5'-terminus. It can also cleave other RNA substrates such as 4.5S RNA. The protein component plays an auxiliary but essential role in vivo by binding to the 5'-leader sequence and broadening the substrate specificity of the ribozyme	rnpA	-	ko:K03536	-	ko00000,ko01000,ko03016	Ribonuclease_P
2070	QMT35705.1	1120980.JQKH01000017_gene1884	5.6e-21	82.8	COG0230@1|root,COG0230@2|Bacteria,1NGGS@1224|Proteobacteria,2VXTS@28216|Betaproteobacteria,2KRUJ@206351|Neisseriales	Belongs to the bacterial ribosomal protein bL34 family	rpmH	-	ko:K02914	ko03010,map03010	br01610,ko00000,ko00001,ko00002,ko03011	Ribosomal_L34
2070	QMT35706.1	1051985.l11_12280	5.37e-234	647.0	COG0592@1|root,COG0592@2|Bacteria,1MVD9@1224|Proteobacteria,2VH9B@28216|Betaproteobacteria,2KPG7@206351|Neisseriales	Confers DNA tethering and processivity to DNA polymerases and other proteins. Acts as a clamp, forming a ring around DNA (a reaction catalyzed by the clamp-loading complex) which diffuses in an ATP-independent manner freely and bidirectionally along dsDNA. Initially characterized for its ability to contact the catalytic subunit of DNA polymerase III (Pol III), a complex, multichain enzyme responsible for most of the replicative synthesis in bacteria	dnaN	-	ko:K02338	ko00230,ko00240,ko01100,ko03030,ko03430,ko03440,map00230,map00240,map01100,map03030,map03430,map03440	ko00000,ko00001,ko00002,ko01000,ko03032,ko03400	DNA_pol3_beta,DNA_pol3_beta_2,DNA_pol3_beta_3
2070	QMT35707.1	1051985.l11_08420	7.74e-257	704.0	COG0012@1|root,COG0012@2|Bacteria,1MVM4@1224|Proteobacteria,2VJ1W@28216|Betaproteobacteria,2KQ77@206351|Neisseriales	ATPase that binds to both the 70S ribosome and the 50S ribosomal subunit in a nucleotide-independent manner	ychF	-	ko:K06942	-	ko00000,ko03009	MMR_HSR1,YchF-GTPase_C
2070	QMT35708.1	1051985.l11_08440	5.06e-297	812.0	COG0162@1|root,COG0162@2|Bacteria,1MVUQ@1224|Proteobacteria,2VHF7@28216|Betaproteobacteria,2KPC7@206351|Neisseriales	Catalyzes the attachment of tyrosine to tRNA(Tyr) in a two-step reaction tyrosine is first activated by ATP to form Tyr- AMP and then transferred to the acceptor end of tRNA(Tyr)	tyrS	-	ko:K01866	ko00970,map00970	ko00000,ko00001,ko00002,ko01000,ko01007,ko03016,ko03029	S4,tRNA-synt_1b
2070	QMT35710.1	1051985.l11_12970	1.48e-64	196.0	COG1343@1|root,COG1343@2|Bacteria,1MZ9Q@1224|Proteobacteria,2VUDP@28216|Betaproteobacteria,2KRMD@206351|Neisseriales	CRISPR (clustered regularly interspaced short palindromic repeat), is an adaptive immune system that provides protection against mobile genetic elements (viruses, transposable elements and conjugative plasmids). CRISPR clusters contain sequences complementary to antecedent mobile elements and target invading nucleic acids. CRISPR clusters are transcribed and processed into CRISPR RNA (crRNA). Functions as a ssRNA-specific endoribonuclease. Involved in the integration of spacer DNA into the CRISPR cassette	cas2	-	ko:K09951	-	ko00000,ko02048	CRISPR_Cas2
2070	QMT35711.1	1051985.l11_12980	1.49e-191	535.0	COG1518@1|root,COG1518@2|Bacteria,1MUKK@1224|Proteobacteria,2VKH8@28216|Betaproteobacteria,2KPKA@206351|Neisseriales	CRISPR (clustered regularly interspaced short palindromic repeat), is an adaptive immune system that provides protection against mobile genetic elements (viruses, transposable elements and conjugative plasmids). CRISPR clusters contain spacers, sequences complementary to antecedent mobile elements, and target invading nucleic acids. CRISPR clusters are transcribed and processed into CRISPR RNA (crRNA). Acts as a dsDNA endonuclease. Involved in the integration of spacer DNA into the CRISPR cassette	cas1	-	ko:K15342	-	ko00000,ko02048,ko03400	Cas_Cas1
2070	QMT35712.1	764298.STRMA_0393	2.16e-44	159.0	2E0SD@1|root,32WAC@2|Bacteria,1VC11@1239|Firmicutes	-	-	-	-	-	-	-
2070	QMT35713.1	1263831.F543_9170	2.78e-121	349.0	COG1468@1|root,COG1468@2|Bacteria,1MX2S@1224|Proteobacteria,1S2MQ@1236|Gammaproteobacteria,1Y6TN@135625|Pasteurellales	CRISPR-associated protein Cas4	cas4	-	ko:K07464	-	ko00000,ko01000,ko02048	Cas_Cas4
2070	QMT35714.1	1051985.l11_13010	2.47e-190	530.0	COG3649@1|root,COG3649@2|Bacteria,1MV2A@1224|Proteobacteria,2VK51@28216|Betaproteobacteria,2KQUC@206351|Neisseriales	CRISPR-associated protein Cas7	-	-	ko:K19118	-	ko00000,ko02048	Cas_Cas7
2070	QMT35715.1	435832.HMPREF0604_00386	0.0	933.0	28HN3@1|root,2Z7WH@2|Bacteria,1MWH8@1224|Proteobacteria,2VHI2@28216|Betaproteobacteria,2KPK2@206351|Neisseriales	CRISPR-associated protein (Cas_Csd1)	csd1	-	ko:K19117	-	ko00000,ko02048	Cas_Csd1
2070	QMT35716.1	1028806.GGE_1754	3.41e-137	391.0	2DBAF@1|root,2Z82V@2|Bacteria,1MWRM@1224|Proteobacteria,1RWB1@1236|Gammaproteobacteria,1Y805@135625|Pasteurellales	CRISPR-associated protein (Cas_Cas5)	-	-	ko:K19119	-	ko00000,ko02048	Cas_Cas5d
2070	QMT35717.1	641149.HMPREF9016_00220	1.59e-36	124.0	2E3GE@1|root,32YF6@2|Bacteria,1N7MX@1224|Proteobacteria,2VWDH@28216|Betaproteobacteria	Uncharacterized protein conserved in bacteria (DUF2188)	-	-	-	-	-	DUF2188
2070	QMT35718.1	1051985.l11_13110	0.0	1270.0	COG1203@1|root,COG1203@2|Bacteria,1MX7A@1224|Proteobacteria,2VJQY@28216|Betaproteobacteria,2KPJ4@206351|Neisseriales	CRISPR-associated endonuclease Cas3-HD	-	-	ko:K07012	-	ko00000,ko01000,ko02048	DEAD,HD
2070	QMT35719.1	1051985.l11_07360	1.53e-36	124.0	COG2608@1|root,COG2608@2|Bacteria,1NGBD@1224|Proteobacteria,2VXV9@28216|Betaproteobacteria,2KSB6@206351|Neisseriales	Heavy metal-associated domain protein	-	-	ko:K07213	ko04978,map04978	ko00000,ko00001	HMA
2070	QMT35720.1	1051985.l11_07370	4.87e-149	420.0	COG2364@1|root,COG2364@2|Bacteria,1QZWW@1224|Proteobacteria,2VS10@28216|Betaproteobacteria,2KR80@206351|Neisseriales	membrane	-	-	ko:K07149	-	ko00000	-
2070	QMT35721.1	1051985.l11_07380	0.0	1251.0	COG2217@1|root,COG2217@2|Bacteria,1MU08@1224|Proteobacteria,2VH8J@28216|Betaproteobacteria,2KPI0@206351|Neisseriales	Psort location CytoplasmicMembrane, score	-	-	ko:K17686	ko01524,ko04016,map01524,map04016	ko00000,ko00001,ko01000	E1-E2_ATPase,HMA,Hydrolase
2070	QMT35722.1	546274.EIKCOROL_02229	2.18e-08	55.8	COG0454@1|root,COG1643@1|root,COG0456@2|Bacteria,COG1643@2|Bacteria,1MUEQ@1224|Proteobacteria,2VI3R@28216|Betaproteobacteria,2KPQG@206351|Neisseriales	ATP-dependent helicase hrpA	hrpA	-	ko:K03578	-	ko00000,ko01000	Acetyltransf_10,DEAD,DUF3418,HA2,Helicase_C,OB_NTP_bind
2070	QMT35723.1	1051985.l11_07400	1.02e-252	702.0	COG1253@1|root,COG1253@2|Bacteria,1MV3P@1224|Proteobacteria,2VHBA@28216|Betaproteobacteria,2KQBE@206351|Neisseriales	Psort location CytoplasmicMembrane, score 10.00	-	-	-	-	-	CBS,CorC_HlyC,DUF21
2070	QMT35724.1	546262.NEICINOT_04159	3.44e-37	127.0	COG3212@1|root,COG3212@2|Bacteria,1N7ZS@1224|Proteobacteria,2W4EE@28216|Betaproteobacteria,2KT90@206351|Neisseriales	Peptidase propeptide and YPEB domain	-	-	-	-	-	PepSY_2
2070	QMT35725.1	641147.HMPREF9021_00538	3.21e-36	139.0	2DPFW@1|root,331W7@2|Bacteria,1NF5C@1224|Proteobacteria,2VX5M@28216|Betaproteobacteria,2KRZE@206351|Neisseriales	-	-	-	-	-	-	-
2070	QMT35726.1	1051985.l11_12560	6.53e-64	201.0	2ENVN@1|root,33GGQ@2|Bacteria,1NF67@1224|Proteobacteria,2VVKU@28216|Betaproteobacteria,2KRN4@206351|Neisseriales	Serine hydrolase	-	-	-	-	-	Ser_hydrolase
2070	QMT35727.1	1051985.l11_12570	2.13e-36	123.0	COG5515@1|root,COG5515@2|Bacteria,1N87I@1224|Proteobacteria,2VY1S@28216|Betaproteobacteria,2KTDU@206351|Neisseriales	Domain of unknown function (DUF1737)	-	-	-	-	-	DUF1737
2070	QMT35728.1	1051985.l11_12590	3.29e-187	520.0	COG0708@1|root,COG0708@2|Bacteria,1MVII@1224|Proteobacteria,2VI74@28216|Betaproteobacteria,2KQ1P@206351|Neisseriales	Psort location Cytoplasmic, score 9.97	exoA	-	ko:K01142	ko03410,map03410	ko00000,ko00001,ko01000,ko03400	Exo_endo_phos
2070	QMT35729.1	1120983.KB894575_gene481	5.98e-10	60.1	COG2059@1|root,COG2059@2|Bacteria,1MUBW@1224|Proteobacteria,2TRXF@28211|Alphaproteobacteria,1JPDB@119043|Rhodobiaceae	Chromate transporter	chrA	-	ko:K07240	-	ko00000,ko02000	Chromate_transp
2070	QMT35730.1	1051985.l11_12600	6.79e-135	384.0	COG0461@1|root,COG0461@2|Bacteria,1MW6F@1224|Proteobacteria,2VH9U@28216|Betaproteobacteria,2KPZU@206351|Neisseriales	Catalyzes the transfer of a ribosyl phosphate group from 5-phosphoribose 1-diphosphate to orotate, leading to the formation of orotidine monophosphate (OMP)	pyrE	-	ko:K00762	ko00240,ko01100,map00240,map01100	ko00000,ko00001,ko00002,ko01000	Pribosyltran
2070	QMT35731.1	546266.NEIMUCOT_04115	3e-36	128.0	2AWM2@1|root,31NHT@2|Bacteria,1RKIG@1224|Proteobacteria	-	-	-	-	-	-	-
2070	QMT35732.1	1051985.l11_12620	5.65e-188	536.0	COG0548@1|root,COG1246@1|root,COG0548@2|Bacteria,COG1246@2|Bacteria,1MUUP@1224|Proteobacteria,2VGZC@28216|Betaproteobacteria,2KPUZ@206351|Neisseriales	Belongs to the acetyltransferase family. ArgA subfamily	argA	-	ko:K14682	ko00220,ko01100,ko01110,ko01130,ko01210,ko01230,map00220,map01100,map01110,map01130,map01210,map01230	ko00000,ko00001,ko00002,ko01000	AA_kinase,Acetyltransf_1
2070	QMT35733.1	887327.HMPREF0476_2031	3.96e-56	175.0	COG2924@1|root,COG2924@2|Bacteria,1MZ2V@1224|Proteobacteria,2VTYU@28216|Betaproteobacteria,2KRC9@206351|Neisseriales	Could be a mediator in iron transactions between iron acquisition and iron-requiring processes, such as synthesis and or repair of Fe-S clusters in biosynthetic enzymes	-	-	-	-	-	Iron_traffic
2070	QMT35735.1	1120980.JQKH01000005_gene2362	1.34e-60	192.0	COG1335@1|root,COG1335@2|Bacteria,1RDHA@1224|Proteobacteria,2VV6K@28216|Betaproteobacteria,2KS93@206351|Neisseriales	Isochorismatase family	-	-	-	-	-	Isochorismatase
2070	QMT35736.1	1051985.l11_18930	3.14e-296	812.0	COG1109@1|root,COG1109@2|Bacteria,1MUA5@1224|Proteobacteria,2VJ29@28216|Betaproteobacteria,2KQDD@206351|Neisseriales	Phosphoglucomutase phosphomannomutase, alpha beta alpha domain II	algC	-	ko:K01835,ko:K15778	ko00010,ko00030,ko00051,ko00052,ko00230,ko00500,ko00520,ko00521,ko01100,ko01110,ko01120,ko01130,map00010,map00030,map00051,map00052,map00230,map00500,map00520,map00521,map01100,map01110,map01120,map01130	ko00000,ko00001,ko00002,ko01000	PGM_PMM_I,PGM_PMM_II,PGM_PMM_III,PGM_PMM_IV
2070	QMT35737.1	1051985.l11_01890	1.86e-304	832.0	COG0826@1|root,COG0826@2|Bacteria,1MUQG@1224|Proteobacteria,2VH51@28216|Betaproteobacteria,2KPVQ@206351|Neisseriales	Peptidase, U32 family	-	-	ko:K08303	ko05120,map05120	ko00000,ko00001,ko01000,ko01002	Peptidase_U32,Peptidase_U32_C
2070	QMT35738.1	1120980.JQKH01000116_gene2005	3.59e-37	129.0	2CGJP@1|root,32WE9@2|Bacteria,1N30J@1224|Proteobacteria,2VVH9@28216|Betaproteobacteria,2KRRN@206351|Neisseriales	-	-	-	-	-	-	-
2070	QMT35739.1	1051985.l11_01820	2.57e-128	372.0	COG0688@1|root,COG0688@2|Bacteria,1MW45@1224|Proteobacteria,2VHHT@28216|Betaproteobacteria,2KPFG@206351|Neisseriales	Catalyzes the formation of phosphatidylethanolamine (PtdEtn) from phosphatidylserine (PtdSer)	psd	-	ko:K01613	ko00564,ko01100,ko01110,map00564,map01100,map01110	ko00000,ko00001,ko00002,ko01000	PS_Dcarbxylase
2070	QMT35740.1	546274.EIKCOROL_01238	6.79e-174	498.0	COG1457@1|root,COG1457@2|Bacteria,1PYF6@1224|Proteobacteria,2VI1F@28216|Betaproteobacteria,2KS95@206351|Neisseriales	Permease for cytosine/purines, uracil, thiamine, allantoin	cytX	-	ko:K03457	-	ko00000	Transp_cyt_pur
2070	QMT35741.1	1051985.l11_08190	0.0	1084.0	COG2217@1|root,COG2217@2|Bacteria,1MU08@1224|Proteobacteria,2VJSM@28216|Betaproteobacteria,2KPH3@206351|Neisseriales	Psort location CytoplasmicMembrane, score	-	-	ko:K01533	-	ko00000,ko01000	ATPase-cat_bd,E1-E2_ATPase,HMA,Hydrolase
2070	QMT35742.1	1051985.l11_15030	1.91e-89	266.0	COG3803@1|root,COG3803@2|Bacteria,1RHYI@1224|Proteobacteria,2VSHT@28216|Betaproteobacteria,2KQXJ@206351|Neisseriales	Bacterial protein of unknown function (DUF924)	-	-	-	-	-	DUF924
2070	QMT35743.1	1051985.l11_02560	4.25e-132	376.0	COG0602@1|root,COG0602@2|Bacteria,1MUJ2@1224|Proteobacteria,2VGZ7@28216|Betaproteobacteria,2KQB7@206351|Neisseriales	Catalyzes the complex heterocyclic radical-mediated conversion of 6-carboxy-5,6,7,8-tetrahydropterin (CPH4) to 7- carboxy-7-deazaguanine (CDG), a step common to the biosynthetic pathways of all 7-deazapurine-containing compounds	queE	-	ko:K10026	ko00790,ko01100,map00790,map01100	ko00000,ko00001,ko01000,ko03016	Fer4_14,Radical_SAM
2070	QMT35744.1	1051985.l11_02550	1.82e-83	248.0	COG0720@1|root,COG0720@2|Bacteria,1RETG@1224|Proteobacteria,2VRBN@28216|Betaproteobacteria,2KR0H@206351|Neisseriales	Psort location Cytoplasmic, score 8.96	queD	-	ko:K01737	ko00790,ko01100,map00790,map01100	ko00000,ko00001,ko00002,ko01000,ko03016	PTPS
2070	QMT35745.1	1121352.JHZP01000014_gene1626	1.91e-30	115.0	COG3015@1|root,COG3015@2|Bacteria,1RKTK@1224|Proteobacteria,2VXP9@28216|Betaproteobacteria,2KS5K@206351|Neisseriales	NlpE N-terminal domain	-	-	-	-	-	NlpE
2070	QMT35746.1	1051985.l11_02530	5.26e-151	425.0	COG0603@1|root,COG0603@2|Bacteria,1MU5V@1224|Proteobacteria,2VHY3@28216|Betaproteobacteria,2KQ1A@206351|Neisseriales	Catalyzes the ATP-dependent conversion of 7-carboxy-7- deazaguanine (CDG) to 7-cyano-7-deazaguanine (preQ(0))	queC	-	ko:K06920	ko00790,ko01100,map00790,map01100	ko00000,ko00001,ko01000,ko03016	QueC
2070	QMT35747.1	1432056.X781_16980	9.13e-83	253.0	COG0558@1|root,COG0558@2|Bacteria,1RHFC@1224|Proteobacteria,1S6C6@1236|Gammaproteobacteria	Phosphatidylglycerophosphate synthase	-	-	-	-	-	CDP-OH_P_transf
