key	query	seed_ortholog	evalue	score	eggNOG_OGs	description	preferred_name	GOs	KEGG_ko	KEGG_pathway	brite	PFAMs
2070	QMT36301.1	696748.ASU2_07625	3.44e-214	607.0	COG0007@1|root,COG1648@1|root,COG0007@2|Bacteria,COG1648@2|Bacteria,1MUI0@1224|Proteobacteria,1RM9V@1236|Gammaproteobacteria,1Y893@135625|Pasteurellales	Multifunctional enzyme that catalyzes the SAM-dependent methylations of uroporphyrinogen III at position C-2 and C-7 to form precorrin-2 via precorrin-1. Then it catalyzes the NAD- dependent ring dehydrogenation of precorrin-2 to yield sirohydrochlorin. Finally, it catalyzes the ferrochelation of sirohydrochlorin to yield siroheme	cysG	-	ko:K02302	ko00860,ko01100,ko01110,ko01120,map00860,map01100,map01110,map01120	ko00000,ko00001,ko00002,ko01000	CysG_dimeriser,NAD_binding_7,Sirohm_synth_M,TP_methylase
2070	QMT36302.1	1432056.X781_13390	6.84e-119	346.0	COG0175@1|root,COG0175@2|Bacteria,1MXUR@1224|Proteobacteria,1RNC5@1236|Gammaproteobacteria,1Y7ZK@135625|Pasteurellales	Reduction of activated sulfate into sulfite	-	-	ko:K00390	ko00920,ko01100,ko01120,map00920,map01100,map01120	ko00000,ko00001,ko00002,ko01000	PAPS_reduct
2070	QMT36303.1	546266.NEIMUCOT_04710	1.23e-201	560.0	COG0175@1|root,COG0175@2|Bacteria,1MUCZ@1224|Proteobacteria,2VJH9@28216|Betaproteobacteria,2KQN4@206351|Neisseriales	Sulfate adenylyltransferase	cysD	-	ko:K00957	ko00230,ko00261,ko00450,ko00920,ko01100,ko01120,ko01130,map00230,map00261,map00450,map00920,map01100,map01120,map01130	ko00000,ko00001,ko00002,ko01000	PAPS_reduct
2070	QMT36304.1	887898.HMPREF0551_0117	0.0	1036.0	COG0155@1|root,COG0155@2|Bacteria,1MVVB@1224|Proteobacteria,2VIYX@28216|Betaproteobacteria,1K1PC@119060|Burkholderiaceae	Component of the sulfite reductase complex that catalyzes the 6-electron reduction of sulfite to sulfide. This is one of several activities required for the biosynthesis of L- cysteine from sulfate	cysI	-	ko:K00381	ko00920,ko01100,ko01120,map00920,map01100,map01120	ko00000,ko00001,ko00002,ko01000	NIR_SIR,NIR_SIR_ferr
2070	QMT36305.1	547045.NEISICOT_01566	2.3e-249	692.0	COG2895@1|root,COG2895@2|Bacteria,1MUD9@1224|Proteobacteria,2VHYV@28216|Betaproteobacteria,2KQCP@206351|Neisseriales	Belongs to the TRAFAC class translation factor GTPase superfamily. Classic translation factor GTPase family. CysN NodQ subfamily	cysN	-	ko:K00956	ko00230,ko00261,ko00450,ko00920,ko01100,ko01120,ko01130,map00230,map00261,map00450,map00920,map01100,map01120,map01130	ko00000,ko00001,ko00002,ko01000	GTP_EFTU
2070	QMT36306.1	641149.HMPREF9016_00544	3.29e-279	780.0	COG0369@1|root,COG0369@2|Bacteria,1QUAH@1224|Proteobacteria,2WHAA@28216|Betaproteobacteria,2KTVZ@206351|Neisseriales	Component of the sulfite reductase complex that catalyzes the 6-electron reduction of sulfite to sulfide. This is one of several activities required for the biosynthesis of L- cysteine from sulfate. The flavoprotein component catalyzes the electron flow from NADPH - FAD - FMN to the hemoprotein component	-	-	ko:K00380	ko00920,ko01100,ko01120,map00920,map01100,map01120	ko00000,ko00001,ko00002,ko01000	FAD_binding_1,Flavodoxin_1,NAD_binding_1
2070	QMT36307.1	887327.HMPREF0476_0247	1.45e-258	723.0	COG0306@1|root,COG0306@2|Bacteria,1MVXK@1224|Proteobacteria,2VI71@28216|Betaproteobacteria,2KQ0W@206351|Neisseriales	phosphate transporter	-	-	ko:K03306	-	ko00000	PHO4
2070	QMT36308.1	546266.NEIMUCOT_05181	3.5e-96	284.0	COG2119@1|root,COG2119@2|Bacteria,1RDDV@1224|Proteobacteria,2VQ6X@28216|Betaproteobacteria,2KR4C@206351|Neisseriales	Psort location CytoplasmicMembrane, score 9.46	-	-	-	-	-	UPF0016
2070	QMT36309.1	1121352.JHZP01000004_gene1579	1.98e-227	635.0	COG1914@1|root,COG1914@2|Bacteria,1MWET@1224|Proteobacteria,2VPCA@28216|Betaproteobacteria,2KPHR@206351|Neisseriales	Psort location CytoplasmicMembrane, score 10.00	-	-	-	-	-	Nramp
2070	QMT36310.1	557598.LHK_01342	4.9e-31	116.0	COG3909@1|root,COG3909@2|Bacteria,1N1E5@1224|Proteobacteria,2VSGD@28216|Betaproteobacteria,2KRQI@206351|Neisseriales	Cytochrome C'	-	-	-	-	-	Cytochrom_C_2
2070	QMT36311.1	435832.HMPREF0604_01794	6.76e-114	332.0	COG1208@1|root,COG1208@2|Bacteria,1R9ZD@1224|Proteobacteria,2VJUN@28216|Betaproteobacteria,2KPIY@206351|Neisseriales	Nucleotidyl transferase	-	-	ko:K00992	ko00520,ko01100,map00520,map01100	ko00000,ko00001,ko01000	NTP_transferase
2070	QMT36312.1	596320.NEIFL0001_2100	8.74e-194	556.0	COG4783@1|root,COG4783@2|Bacteria,1QUI6@1224|Proteobacteria,2VP8S@28216|Betaproteobacteria,2KQAI@206351|Neisseriales	Protein of unknown function (DUF560)	-	-	-	-	-	DUF560
2070	QMT36313.1	1051985.l11_15780	6.48e-52	167.0	COG1733@1|root,COG1733@2|Bacteria,1MZ6G@1224|Proteobacteria,2VUCU@28216|Betaproteobacteria,2KRRH@206351|Neisseriales	HxlR-like helix-turn-helix	-	-	-	-	-	HxlR
2070	QMT36314.1	546266.NEIMUCOT_05247	1.84e-170	480.0	COG1741@1|root,COG1741@2|Bacteria,1MWIP@1224|Proteobacteria,2VHGK@28216|Betaproteobacteria,2KQT9@206351|Neisseriales	Belongs to the pirin family	-	-	ko:K06911	-	ko00000	Pirin,Pirin_C
2070	QMT36315.1	546266.NEIMUCOT_05088	4.44e-126	367.0	COG3315@1|root,COG3315@2|Bacteria,1RAX6@1224|Proteobacteria,2VRYR@28216|Betaproteobacteria	O-methyltransferase domain protein	-	-	-	-	-	LCM
2070	QMT36316.1	641149.HMPREF9016_01252	4.98e-34	121.0	2EAIT@1|root,334MS@2|Bacteria,1N86S@1224|Proteobacteria,2VX24@28216|Betaproteobacteria,2KS4C@206351|Neisseriales	protein of Mannheimia haemolytica UniRef RepID A7JTV9_PASHA	-	-	-	-	-	-
2070	QMT36317.1	887327.HMPREF0476_0357	7.86e-252	701.0	COG2056@1|root,COG2056@2|Bacteria,1N8U2@1224|Proteobacteria,2VI31@28216|Betaproteobacteria,2KQKK@206351|Neisseriales	Psort location CytoplasmicMembrane, score 10.00	-	-	ko:K07084	-	ko00000,ko02000	Na_H_antiport_2,Na_H_antiporter
2070	QMT36318.1	641149.HMPREF9016_00420	1.5e-69	219.0	2BXI0@1|root,2Z9A2@2|Bacteria,1MZF7@1224|Proteobacteria,2VSVG@28216|Betaproteobacteria,2KR4J@206351|Neisseriales	Protein of unknown function (DUF2459)	-	-	-	-	-	DUF2459
2070	QMT36319.1	1051985.l11_19630	3.58e-122	351.0	COG0847@1|root,COG0847@2|Bacteria,1P0GY@1224|Proteobacteria,2VKZD@28216|Betaproteobacteria,2KR2J@206351|Neisseriales	DNA polymerase III	-	-	ko:K02342	ko00230,ko00240,ko01100,ko03030,ko03430,ko03440,map00230,map00240,map01100,map03030,map03430,map03440	ko00000,ko00001,ko00002,ko01000,ko03032,ko03400	RNase_T
2070	QMT36320.1	1051985.l11_19640	0.0	907.0	COG2905@1|root,COG2905@2|Bacteria,1MW8U@1224|Proteobacteria,2VHE1@28216|Betaproteobacteria,2KPTZ@206351|Neisseriales	Putative nucleotidyltransferase substrate binding domain	-	-	ko:K07182	-	ko00000	CBS,DUF294,DUF294_C,cNMP_binding
2070	QMT36321.1	1051985.l11_06290	4.16e-186	527.0	COG1565@1|root,COG1565@2|Bacteria,1N3CJ@1224|Proteobacteria,2VHBE@28216|Betaproteobacteria,2KPHC@206351|Neisseriales	cyclopropane-fatty-acyl-phospholipid synthase K00574	-	-	-	-	-	Methyltransf_28
2070	QMT36322.1	641149.HMPREF9016_02088	1.37e-81	244.0	COG2001@1|root,COG2001@2|Bacteria,1RHCG@1224|Proteobacteria,2VRGP@28216|Betaproteobacteria,2KR6Y@206351|Neisseriales	Belongs to the MraZ family	mraZ	-	ko:K03925	-	ko00000	MraZ
2070	QMT36323.1	435832.HMPREF0604_01410	7.76e-185	519.0	COG0275@1|root,COG0275@2|Bacteria,1MUT4@1224|Proteobacteria,2VIYT@28216|Betaproteobacteria,2KPFE@206351|Neisseriales	Specifically methylates the N4 position of cytidine in position 1402 (C1402) of 16S rRNA	mraW	-	ko:K03438	-	ko00000,ko01000,ko03009	Methyltransf_5
2070	QMT36324.1	1051985.l11_06260	1.38e-28	105.0	COG3116@1|root,COG3116@2|Bacteria	cell division	ftsL	GO:0000003,GO:0000910,GO:0005575,GO:0005623,GO:0005886,GO:0005887,GO:0007049,GO:0008150,GO:0009987,GO:0016020,GO:0016021,GO:0019954,GO:0022402,GO:0022414,GO:0031224,GO:0031226,GO:0032153,GO:0032505,GO:0043093,GO:0044425,GO:0044459,GO:0044464,GO:0051301,GO:0071944	ko:K03586	-	ko00000,ko03036	FtsL
2070	QMT36325.1	546266.NEIMUCOT_05476	4.87e-316	874.0	COG0768@1|root,COG0768@2|Bacteria,1MUNY@1224|Proteobacteria,2VIZM@28216|Betaproteobacteria,2KQD8@206351|Neisseriales	Catalyzes cross-linking of the peptidoglycan cell wall at the division septum	penA	-	ko:K03587	ko00550,ko01501,map00550,map01501	ko00000,ko00001,ko01000,ko01011,ko03036	PBP_dimer,Transpeptidase
2070	QMT36326.1	1051985.l11_06230	0.0	945.0	COG0769@1|root,COG0769@2|Bacteria,1MU6P@1224|Proteobacteria,2WGFS@28216|Betaproteobacteria,2KQ1I@206351|Neisseriales	Catalyzes the addition of meso-diaminopimelic acid to the nucleotide precursor UDP-N-acetylmuramoyl-L-alanyl-D-glutamate (UMAG) in the biosynthesis of bacterial cell-wall peptidoglycan	murE	-	ko:K01928	ko00300,ko00550,map00300,map00550	ko00000,ko00001,ko01000,ko01011	Mur_ligase,Mur_ligase_C,Mur_ligase_M
2070	QMT36327.1	489653.NLA_4650	7.53e-171	485.0	COG1373@1|root,COG1373@2|Bacteria,1R4HK@1224|Proteobacteria,2VMYI@28216|Betaproteobacteria,2KQSJ@206351|Neisseriales	ATPase (AAA superfamily	-	-	-	-	-	-
2070	QMT36328.1	1051985.l11_06220	9.43e-98	285.0	COG0739@1|root,COG0739@2|Bacteria,1RK0U@1224|Proteobacteria,2VUK1@28216|Betaproteobacteria,2KT6R@206351|Neisseriales	Peptidase family M23	-	-	ko:K21472	-	ko00000,ko01000,ko01002,ko01011	Peptidase_M23
2070	QMT36329.1	641149.HMPREF9016_00562	1.56e-65	220.0	COG1694@1|root,COG1694@2|Bacteria,1QVPM@1224|Proteobacteria,2WI1M@28216|Betaproteobacteria,2KU5F@206351|Neisseriales	Mazg nucleotide pyrophosphohydrolase	-	-	-	-	-	-
2070	QMT36330.1	882378.RBRH_01218	3.94e-29	116.0	2BYCF@1|root,33ZHD@2|Bacteria,1NYYA@1224|Proteobacteria,2W34Z@28216|Betaproteobacteria,1KEUD@119060|Burkholderiaceae	-	-	-	-	-	-	-
2070	QMT36332.1	1051985.l11_06190	1.61e-25	95.1	29AIS@1|root,2ZXIT@2|Bacteria,1P74Z@1224|Proteobacteria	-	-	-	-	-	-	-
2070	QMT36333.1	435832.HMPREF0604_01419	8.57e-232	641.0	COG0472@1|root,COG0472@2|Bacteria,1MUTK@1224|Proteobacteria,2VHAP@28216|Betaproteobacteria,2KQAE@206351|Neisseriales	First step of the lipid cycle reactions in the biosynthesis of the cell wall peptidoglycan	mraY	-	ko:K01000	ko00550,ko01100,ko01502,map00550,map01100,map01502	ko00000,ko00001,ko01000,ko01011	Glycos_transf_4,MraY_sig1
2070	QMT36334.1	546266.NEIMUCOT_05079	9.12e-70	215.0	COG2346@1|root,COG2346@2|Bacteria,1RH21@1224|Proteobacteria,2VSUJ@28216|Betaproteobacteria,2KRB2@206351|Neisseriales	Bacterial-like globin	-	-	ko:K06886	-	ko00000	Bac_globin
2070	QMT36335.1	489653.NLA_6641	2.93e-43	142.0	COG2827@1|root,COG2827@2|Bacteria,1MZME@1224|Proteobacteria,2VURH@28216|Betaproteobacteria,2KT9W@206351|Neisseriales	GIY-YIG catalytic domain	-	-	ko:K07461	-	ko00000	GIY-YIG
2070	QMT36336.1	1051985.l11_06150	1.14e-311	850.0	COG0771@1|root,COG0771@2|Bacteria,1MVYD@1224|Proteobacteria,2VHJ1@28216|Betaproteobacteria,2KPMJ@206351|Neisseriales	Cell wall formation. Catalyzes the addition of glutamate to the nucleotide precursor UDP-N-acetylmuramoyl-L-alanine (UMA)	murD	-	ko:K01925	ko00471,ko00550,ko01100,map00471,map00550,map01100	ko00000,ko00001,ko01000,ko01011	Mur_ligase_C,Mur_ligase_M
2070	QMT36338.1	1196083.SALWKB12_0283	1.99e-187	531.0	COG0772@1|root,COG0772@2|Bacteria,1MVDB@1224|Proteobacteria,2VI5Q@28216|Betaproteobacteria,2KPIJ@206351|Neisseriales	Peptidoglycan polymerase that is essential for cell division	ftsW	-	ko:K03588	ko04112,map04112	ko00000,ko00001,ko02000,ko03036	FTSW_RODA_SPOVE
2070	QMT36339.1	1120980.JQKH01000002_gene199	2.4e-192	541.0	COG0707@1|root,COG0707@2|Bacteria,1MVIB@1224|Proteobacteria,2VH32@28216|Betaproteobacteria,2KPQI@206351|Neisseriales	Cell wall formation. Catalyzes the transfer of a GlcNAc subunit on undecaprenyl-pyrophosphoryl-MurNAc-pentapeptide (lipid intermediate I) to form undecaprenyl-pyrophosphoryl-MurNAc- (pentapeptide)GlcNAc (lipid intermediate II)	murG	-	ko:K02563	ko00550,ko01100,ko01502,ko04112,map00550,map01100,map01502,map04112	ko00000,ko00001,ko01000,ko01011	Glyco_tran_28_C,Glyco_transf_28
2070	QMT36340.1	435832.HMPREF0604_00779	2.29e-37	134.0	COG3637@1|root,COG3637@2|Bacteria,1RK2R@1224|Proteobacteria,2VTC0@28216|Betaproteobacteria,2KRBQ@206351|Neisseriales	Opacity family porin protein	-	-	-	-	-	Opacity
2070	QMT36341.1	641149.HMPREF9016_01607	4.38e-279	773.0	COG0728@1|root,COG0728@2|Bacteria,1MUH0@1224|Proteobacteria,2VHTQ@28216|Betaproteobacteria,2KPUR@206351|Neisseriales	Involved in peptidoglycan biosynthesis. Transports lipid-linked peptidoglycan precursors from the inner to the outer leaflet of the cytoplasmic membrane	mviN	-	ko:K03980	-	ko00000,ko01011,ko02000	MVIN
2070	QMT36342.1	1051985.l11_16200	6.35e-214	593.0	COG3178@1|root,COG3178@2|Bacteria,1MXCH@1224|Proteobacteria,2VHBC@28216|Betaproteobacteria,2KQK6@206351|Neisseriales	Phosphotransferase enzyme family	-	-	ko:K07102	ko00520,ko01100,map00520,map01100	ko00000,ko00001,ko01000	APH
2070	QMT36343.1	1051985.l11_16190	0.0	1066.0	COG1452@1|root,COG1452@2|Bacteria,1MUJC@1224|Proteobacteria,2VIJ7@28216|Betaproteobacteria,2KQ3P@206351|Neisseriales	Together with LptE, is involved in the assembly of lipopolysaccharide (LPS) at the surface of the outer membrane	lptD	-	ko:K04744	-	ko00000,ko02000	OstA,OstA_C
2070	QMT36344.1	1051985.l11_16180	4.56e-101	306.0	COG0760@1|root,COG0760@2|Bacteria,1MVB3@1224|Proteobacteria,2VHHS@28216|Betaproteobacteria,2KR1R@206351|Neisseriales	Chaperone involved in the correct folding and assembly of outer membrane proteins. Recognizes specific patterns of aromatic residues and the orientation of their side chains, which are found more frequently in integral outer membrane proteins. May act in both early periplasmic and late outer membrane-associated steps of protein maturation	surA	-	ko:K03771	-	ko00000,ko01000,ko03110	Rotamase,Rotamase_3,SurA_N,SurA_N_3
2070	QMT36345.1	546268.NEISUBOT_03468	2.22e-314	860.0	COG0362@1|root,COG0362@2|Bacteria,1MVV8@1224|Proteobacteria,2VI62@28216|Betaproteobacteria,2KPES@206351|Neisseriales	Catalyzes the oxidative decarboxylation of 6- phosphogluconate to ribulose 5-phosphate and CO(2), with concomitant reduction of NADP to NADPH	gnd	-	ko:K00033	ko00030,ko00480,ko01100,ko01110,ko01120,ko01130,ko01200,map00030,map00480,map01100,map01110,map01120,map01130,map01200	ko00000,ko00001,ko00002,ko01000	6PGD,NAD_binding_2
2070	QMT36346.1	1121360.AUAQ01000013_gene2341	4.34e-35	151.0	COG3420@1|root,COG3420@2|Bacteria	alginic acid biosynthetic process	-	-	ko:K01795,ko:K07218,ko:K12287	ko00051,map00051	ko00000,ko00001,ko01000,ko02044	Beta_helix
2070	QMT36347.1	1051985.l11_21200	7.21e-250	702.0	COG1807@1|root,COG1807@2|Bacteria,1PUE3@1224|Proteobacteria,2VHPU@28216|Betaproteobacteria,2KPVM@206351|Neisseriales	4-amino-4-deoxy-L-arabinose transferase or related glycosyltransferase of PMT family K00754	-	-	-	-	-	PMT_2
2070	QMT36348.1	489653.NLA_19000	2.31e-42	139.0	COG0254@1|root,COG0254@2|Bacteria,1MZ69@1224|Proteobacteria,2VW5V@28216|Betaproteobacteria,2KRIV@206351|Neisseriales	Binds the 23S rRNA	rpmE	-	ko:K02909	ko03010,map03010	br01610,ko00000,ko00001,ko00002,ko03011	Ribosomal_L31
2070	QMT36349.1	1051985.l11_06450	0.0	869.0	COG0215@1|root,COG0215@2|Bacteria,1MV8H@1224|Proteobacteria,2VHN4@28216|Betaproteobacteria,2KPY4@206351|Neisseriales	Belongs to the class-I aminoacyl-tRNA synthetase family	cysS	-	ko:K01883	ko00970,map00970	ko00000,ko00001,ko00002,ko01000,ko01007,ko03016	DALR_2,tRNA-synt_1e,tRNA-synt_1g
2070	QMT36350.1	1051985.l11_06480	9.89e-237	655.0	COG0536@1|root,COG0536@2|Bacteria,1MUGZ@1224|Proteobacteria,2VIM2@28216|Betaproteobacteria,2KPCJ@206351|Neisseriales	An essential GTPase which binds GTP, GDP and possibly (p)ppGpp with moderate affinity, with high nucleotide exchange rates and a fairly low GTP hydrolysis rate. Plays a role in control of the cell cycle, stress response, ribosome biogenesis and in those bacteria that undergo differentiation, in morphogenesis control	obg	-	ko:K03979	-	ko00000,ko01000,ko03009	GTP1_OBG,MMR_HSR1
2070	QMT36351.1	1051985.l11_06550	2.63e-123	365.0	COG4255@1|root,COG4255@2|Bacteria,1RJS3@1224|Proteobacteria,2VTT7@28216|Betaproteobacteria,2KR2U@206351|Neisseriales	Protein conserved in bacteria	-	-	-	-	-	-
2070	QMT36352.1	1051985.l11_15520	8.87e-63	194.0	2CGNP@1|root,31ZAY@2|Bacteria,1RGYQ@1224|Proteobacteria,2VTG3@28216|Betaproteobacteria,2KRCF@206351|Neisseriales	Psort location Cytoplasmic, score 8.96	-	-	-	-	-	-
2070	QMT36353.1	641149.HMPREF9016_02145	2.49e-41	140.0	COG0824@1|root,COG0824@2|Bacteria,1REIH@1224|Proteobacteria,2VTNS@28216|Betaproteobacteria,2KRST@206351|Neisseriales	Acyl-CoA thioester hydrolase, YbgC YbaW family	-	-	ko:K12500	-	ko00000,ko01000,ko01004	4HBT,4HBT_2
2070	QMT36354.1	547045.NEISICOT_03625	7.32e-73	223.0	COG0526@1|root,COG0526@2|Bacteria,1RDGI@1224|Proteobacteria,2VT2S@28216|Betaproteobacteria,2KR7I@206351|Neisseriales	Redoxin family	-	-	-	-	-	AhpC-TSA,Redoxin
2070	QMT36355.1	1051985.l11_15490	1.26e-224	622.0	COG0722@1|root,COG0722@2|Bacteria,1MU5Q@1224|Proteobacteria,2VH4W@28216|Betaproteobacteria,2KQ6V@206351|Neisseriales	Stereospecific condensation of phosphoenolpyruvate (PEP) and D-erythrose-4-phosphate (E4P) giving rise to 3-deoxy-D- arabino-heptulosonate-7-phosphate (DAHP)	aroG	-	ko:K01626	ko00400,ko01100,ko01110,ko01130,ko01230,ko02024,map00400,map01100,map01110,map01130,map01230,map02024	ko00000,ko00001,ko00002,ko01000	DAHP_synth_1
2070	QMT36356.1	1123303.AQVD01000002_gene1681	3.28e-147	424.0	COG1680@1|root,COG1680@2|Bacteria,1V18R@1239|Firmicutes,4HEFR@91061|Bacilli	Beta-lactamase	-	-	-	-	-	Beta-lactamase
2070	QMT36357.1	546266.NEIMUCOT_04257	9.4e-155	440.0	COG1475@1|root,COG1475@2|Bacteria,1MW2E@1224|Proteobacteria,2VIG0@28216|Betaproteobacteria,2KQ06@206351|Neisseriales	Belongs to the ParB family	parB	-	ko:K03497	-	ko00000,ko03000,ko03036,ko04812	ParBc
2070	QMT36358.1	546266.NEIMUCOT_04256	2.99e-32	116.0	COG3312@1|root,COG3312@2|Bacteria,1N9JH@1224|Proteobacteria,2VVQ7@28216|Betaproteobacteria,2KRUI@206351|Neisseriales	Psort location CytoplasmicMembrane, score	atpI	-	ko:K02116	-	ko00000,ko00194	ATP-synt_I
2070	QMT36359.1	1051985.l11_15900	2.1e-189	528.0	COG0356@1|root,COG0356@2|Bacteria,1MV87@1224|Proteobacteria,2VHR5@28216|Betaproteobacteria,2KQAX@206351|Neisseriales	it plays a direct role in the translocation of protons across the membrane	atpB	-	ko:K02108	ko00190,ko00195,ko01100,map00190,map00195,map01100	ko00000,ko00001,ko00002,ko00194,ko03110	ATP-synt_A
2070	QMT36360.1	641147.HMPREF9021_01413	9.14e-41	135.0	COG0636@1|root,32S3K@2|Bacteria,1N1NA@1224|Proteobacteria,2VTY0@28216|Betaproteobacteria,2KRP0@206351|Neisseriales	F(1)F(0) ATP synthase produces ATP from ADP in the presence of a proton or sodium gradient. F-type ATPases consist of two structural domains, F(1) containing the extramembraneous catalytic core and F(0) containing the membrane proton channel, linked together by a central stalk and a peripheral stalk. During catalysis, ATP synthesis in the catalytic domain of F(1) is coupled via a rotary mechanism of the central stalk subunits to proton translocation	atpE	-	ko:K02110	ko00190,ko00195,ko01100,map00190,map00195,map01100	ko00000,ko00001,ko00002,ko00194	ATP-synt_C
2070	QMT36361.1	435832.HMPREF0604_01329	2.74e-58	185.0	COG0711@1|root,COG0711@2|Bacteria,1RHZ0@1224|Proteobacteria,2VRMS@28216|Betaproteobacteria,2KR00@206351|Neisseriales	Component of the F(0) channel, it forms part of the peripheral stalk, linking F(1) to F(0)	atpF	-	ko:K02109	ko00190,ko00195,ko01100,map00190,map00195,map01100	ko00000,ko00001,ko00002,ko00194	ATP-synt_B
2070	QMT36362.1	641147.HMPREF9021_01415	2.54e-78	238.0	COG0712@1|root,COG0712@2|Bacteria,1MVRH@1224|Proteobacteria,2VSJV@28216|Betaproteobacteria,2KRGX@206351|Neisseriales	F(1)F(0) ATP synthase produces ATP from ADP in the presence of a proton or sodium gradient. F-type ATPases consist of two structural domains, F(1) containing the extramembraneous catalytic core and F(0) containing the membrane proton channel, linked together by a central stalk and a peripheral stalk. During catalysis, ATP synthesis in the catalytic domain of F(1) is coupled via a rotary mechanism of the central stalk subunits to proton translocation	atpH	-	ko:K02113	ko00190,ko00195,ko01100,map00190,map00195,map01100	ko00000,ko00001,ko00002,ko00194	OSCP
2070	QMT36363.1	1051985.l11_15940	0.0	941.0	COG0056@1|root,COG0056@2|Bacteria,1MUG7@1224|Proteobacteria,2VHQU@28216|Betaproteobacteria,2KQ1R@206351|Neisseriales	Produces ATP from ADP in the presence of a proton gradient across the membrane. The alpha chain is a regulatory subunit	atpA	-	ko:K02111	ko00190,ko00195,ko01100,map00190,map00195,map01100	ko00000,ko00001,ko00002,ko00194,ko01000	ATP-synt_ab,ATP-synt_ab_C,ATP-synt_ab_N
2070	QMT36364.1	641149.HMPREF9016_01745	9.78e-169	476.0	COG0224@1|root,COG0224@2|Bacteria,1MU28@1224|Proteobacteria,2VJBW@28216|Betaproteobacteria,2KPNT@206351|Neisseriales	Produces ATP from ADP in the presence of a proton gradient across the membrane. The gamma chain is believed to be important in regulating ATPase activity and the flow of protons through the CF(0) complex	atpG	-	ko:K02115	ko00190,ko00195,ko01100,map00190,map00195,map01100	ko00000,ko00001,ko00002,ko00194	ATP-synt
2070	QMT36365.1	887327.HMPREF0476_1252	0.0	883.0	COG0055@1|root,COG0055@2|Bacteria,1MUFU@1224|Proteobacteria,2VHDZ@28216|Betaproteobacteria,2KQ7U@206351|Neisseriales	Produces ATP from ADP in the presence of a proton gradient across the membrane. The catalytic sites are hosted primarily by the beta subunits	atpD	-	ko:K02112	ko00190,ko00195,ko01100,map00190,map00195,map01100	ko00000,ko00001,ko00002,ko00194,ko01000	ATP-synt_ab,ATP-synt_ab_N
2070	QMT36366.1	435832.HMPREF0604_01334	1.19e-68	210.0	COG0355@1|root,COG0355@2|Bacteria,1RHE4@1224|Proteobacteria,2VR2R@28216|Betaproteobacteria,2KR54@206351|Neisseriales	Produces ATP from ADP in the presence of a proton gradient across the membrane	atpC	-	ko:K02114	ko00190,ko00195,ko01100,map00190,map00195,map01100	ko00000,ko00001,ko00002,ko00194	ATP-synt_DE,ATP-synt_DE_N
2070	QMT36368.1	1051985.l11_16440	2.69e-57	179.0	COG2824@1|root,COG2824@2|Bacteria,1RGUU@1224|Proteobacteria,2VSKS@28216|Betaproteobacteria,2KRA5@206351|Neisseriales	PhnA Zinc-Ribbon	phnA	-	ko:K06193	ko01120,map01120	ko00000	PhnA,PhnA_Zn_Ribbon
2070	QMT36369.1	1071679.BG57_09760	4.44e-176	523.0	COG3284@1|root,COG3284@2|Bacteria,1NRG5@1224|Proteobacteria,2VICI@28216|Betaproteobacteria,1K0YQ@119060|Burkholderiaceae	PFAM sigma-54 factor interaction domain-containing protein	acoR	-	ko:K21405	-	ko00000,ko03000	GAF,HTH_8,Sigma54_activat
2070	QMT36370.1	1156935.QWE_19183	1.36e-80	255.0	COG0523@1|root,COG0523@2|Bacteria,1MVZV@1224|Proteobacteria,2TS4B@28211|Alphaproteobacteria,4B9T3@82115|Rhizobiaceae	Cobalamin synthesis protein cobW C-terminal domain	-	-	-	-	-	CobW_C,cobW
2070	QMT36371.1	1051985.l11_03700	3.26e-155	438.0	COG1028@1|root,COG1028@2|Bacteria,1MWCY@1224|Proteobacteria,2VRP6@28216|Betaproteobacteria,2KT2H@206351|Neisseriales	KR domain	-	-	ko:K00059	ko00061,ko00333,ko00780,ko01040,ko01100,ko01130,ko01212,map00061,map00333,map00780,map01040,map01100,map01130,map01212	ko00000,ko00001,ko00002,ko01000,ko01004	adh_short_C2
2070	QMT36372.1	546274.EIKCOROL_02679	2.19e-210	585.0	COG3039@1|root,COG3039@2|Bacteria,1MVDK@1224|Proteobacteria,2VN3J@28216|Betaproteobacteria,2KRJM@206351|Neisseriales	Psort location Cytoplasmic, score 8.96	-	-	ko:K07481	-	ko00000	DDE_Tnp_1,DUF772
2070	QMT36373.1	216596.pRL120139	4.63e-24	94.7	2BZXS@1|root,330Q4@2|Bacteria,1N9KQ@1224|Proteobacteria,2UBZD@28211|Alphaproteobacteria,4BFEK@82115|Rhizobiaceae	-	-	-	-	-	-	-
2070	QMT36374.1	1005058.UMN179_00966	8.55e-313	858.0	COG0286@1|root,COG0286@2|Bacteria,1MW3A@1224|Proteobacteria,1RMRA@1236|Gammaproteobacteria,1Y84H@135625|Pasteurellales	Type I restriction-modification system methyltransferase subunit	hsdM	-	ko:K03427	-	ko00000,ko01000,ko02048	HsdM_N,N6_Mtase
2070	QMT36375.1	1028803.GG9_0571	1.3e-105	307.0	COG2184@1|root,COG2184@2|Bacteria,1R8IJ@1224|Proteobacteria,1S1R0@1236|Gammaproteobacteria,1Y82U@135625|Pasteurellales	Fic/DOC family	-	GO:0008150,GO:0050789,GO:0050794,GO:0051302,GO:0065007	ko:K04095	-	ko00000,ko03036	Fic
2070	QMT36376.1	1270196.JCKI01000001_gene3929	2.31e-69	223.0	COG0732@1|root,COG0732@2|Bacteria,4NKMB@976|Bacteroidetes,1IXQM@117747|Sphingobacteriia	Type I restriction modification DNA specificity domain	-	-	ko:K01154	-	ko00000,ko01000,ko02048	Methylase_S
2070	QMT36377.1	1217658.F987_02515	0.0	1608.0	COG0610@1|root,COG0610@2|Bacteria,1MU96@1224|Proteobacteria,1RP2Q@1236|Gammaproteobacteria,3NIG9@468|Moraxellaceae	Subunit R is required for both nuclease and ATPase activities, but not for modification	hsdR	-	ko:K01153	-	ko00000,ko01000,ko02048	EcoR124_C,HSDR_N,ResIII
2070	QMT36378.1	1415630.U771_06540	1e-23	93.6	2BZXS@1|root,330Q4@2|Bacteria,1N9KQ@1224|Proteobacteria,1SF0F@1236|Gammaproteobacteria	-	-	-	-	-	-	-
2070	QMT36379.1	887898.HMPREF0551_0206	9.41e-82	249.0	COG1182@1|root,COG1182@2|Bacteria,1P59R@1224|Proteobacteria,2VK5E@28216|Betaproteobacteria,1K2FV@119060|Burkholderiaceae	Catalyzes the reductive cleavage of azo bond in aromatic azo compounds to the corresponding amines. Requires NADH, but not NADPH, as an electron donor for its activity	azoR	-	ko:K01118	-	ko00000,ko01000	Flavodoxin_2
2070	QMT36380.1	675812.VHA_002265	7.75e-199	552.0	COG0726@1|root,COG0726@2|Bacteria,1MV3V@1224|Proteobacteria,1RPKM@1236|Gammaproteobacteria,1XTIJ@135623|Vibrionales	Polysaccharide deacetylase	-	-	ko:K22278	-	ko00000,ko01000	Polysacc_deac_1
2070	QMT36381.1	1121033.AUCF01000013_gene1618	5.25e-109	337.0	COG0154@1|root,COG0154@2|Bacteria,1MU51@1224|Proteobacteria,2TSYS@28211|Alphaproteobacteria,2JQZT@204441|Rhodospirillales	Amidase	-	-	ko:K02433	ko00970,ko01100,map00970,map01100	ko00000,ko00001,ko01000,ko03029	Amidase
2070	QMT36382.1	553217.ENHAE0001_1915	2.28e-131	386.0	COG2070@1|root,COG2070@2|Bacteria,1MU2F@1224|Proteobacteria,1RQK2@1236|Gammaproteobacteria,3NIKR@468|Moraxellaceae	Nitronate monooxygenase	-	-	ko:K00459	ko00910,map00910	ko00000,ko00001,ko01000	NMO
2070	QMT36384.1	641149.HMPREF9016_00206	9.97e-49	165.0	COG1309@1|root,COG1309@2|Bacteria,1NPN1@1224|Proteobacteria,2WF4Z@28216|Betaproteobacteria,2KT79@206351|Neisseriales	Bacterial regulatory proteins, tetR family	-	-	-	-	-	TetR_N
