key	query	seed_ortholog	evalue	score	eggNOG_OGs	description	preferred_name	GOs	KEGG_ko	KEGG_pathway	brite	PFAMs
2949	SUN83237.1	768726.HMPREF9178_1600	1.02e-43	145.0	2ABEK@1|root,310VG@2|Bacteria,1U4ZC@1239|Firmicutes,4IER2@91061|Bacilli,2TQFR@28037|Streptococcus mitis	-	-	-	-	-	-	-
2949	SUN83238.1	888833.HMPREF9421_1475	8.05e-107	312.0	COG1136@1|root,COG1136@2|Bacteria,1V3D1@1239|Firmicutes,4HXQ4@91061|Bacilli	AAA domain, putative AbiEii toxin, Type IV TA system	XK27_10210	-	ko:K02003	-	ko00000,ko00002,ko02000	ABC_tran
2949	SUN83239.1	1302863.I872_04510	3.05e-104	326.0	COG4652@1|root,COG4652@2|Bacteria,1U5RE@1239|Firmicutes,4HHTS@91061|Bacilli	bacteriocin-associated integral membrane protein	XK27_10205	-	ko:K02004	-	ko00000,ko00002,ko02000	DUF1430
2949	SUN83240.1	861455.HMPREF9184_01260	3.55e-46	168.0	COG4652@1|root,COG4652@2|Bacteria,1U5RE@1239|Firmicutes,4HHTS@91061|Bacilli	bacteriocin-associated integral membrane protein	XK27_10205	-	ko:K02004	-	ko00000,ko00002,ko02000	DUF1430
2949	SUN83241.1	864567.HMPREF8571_0689	3.4e-10	59.3	29UVG@1|root,30G7Y@2|Bacteria,1UFEG@1239|Firmicutes,4IEP3@91061|Bacilli,2TQDX@28037|Streptococcus mitis	Bacteriocin (Lactococcin_972)	-	-	-	-	-	Lactococcin_972
2949	SUN83242.1	888833.HMPREF9421_0289	1.91e-198	550.0	COG1396@1|root,COG1396@2|Bacteria,1V5SX@1239|Firmicutes,4HI3S@91061|Bacilli	Transcriptional	XK27_00025	-	-	-	-	HTH_19,HTH_3
2949	SUN83243.1	1114965.Spaf_1868	3.59e-141	399.0	COG2184@1|root,COG2184@2|Bacteria,1VK13@1239|Firmicutes,4IQYB@91061|Bacilli	Fic/DOC family	-	-	ko:K04095	-	ko00000,ko03036	Fic
2949	SUN83244.1	435842.HMPREF0848_01908	1.26e-38	128.0	2ETKC@1|root,33M40@2|Bacteria,1VPN1@1239|Firmicutes	-	-	-	-	-	-	-
2949	SUN83245.1	997830.HMPREF1124_1848	2.85e-303	827.0	COG0582@1|root,COG0582@2|Bacteria,1VRHF@1239|Firmicutes,4HUTG@91061|Bacilli,43FYJ@68892|Streptococcus infantis	Phage integrase, N-terminal SAM-like domain	-	-	-	-	-	Phage_int_SAM_3,Phage_integrase
2949	SUN83246.1	997830.HMPREF1124_1847	5.79e-52	164.0	2DIYU@1|root,304DH@2|Bacteria,1TWIU@1239|Firmicutes,4I5C9@91061|Bacilli,43GCW@68892|Streptococcus infantis	MerR HTH family regulatory protein	-	-	-	-	-	MerR_1
2949	SUN83247.1	888833.HMPREF9421_0292	1.13e-47	161.0	COG3942@1|root,COG3942@2|Bacteria	pathogenesis	isp2	-	-	-	-	Big_2,CHAP,GBS_Bsp-like,SLT
2949	SUN83248.1	888833.HMPREF9421_0292	1.21e-129	378.0	COG3942@1|root,COG3942@2|Bacteria	pathogenesis	isp2	-	-	-	-	Big_2,CHAP,GBS_Bsp-like,SLT
2949	SUN83249.1	889204.HMPREF9423_1695	1.13e-44	144.0	2DIZY@1|root,304F2@2|Bacteria,1TWMH@1239|Firmicutes,4I5FA@91061|Bacilli,43GK9@68892|Streptococcus infantis	-	-	-	-	-	-	-
2949	SUN83250.1	999425.HMPREF9186_00987	3.36e-89	280.0	2C6HY@1|root,33KT6@2|Bacteria,1VPRF@1239|Firmicutes,4HRNY@91061|Bacilli	-	-	-	-	-	-	-
2949	SUN83253.1	97137.C821_01944	6.88e-30	123.0	COG2946@1|root,COG2946@2|Bacteria,1UHNT@1239|Firmicutes,4HVQS@91061|Bacilli,3FBTB@33958|Lactobacillaceae	Replication initiation factor	nicK	-	ko:K07467	-	ko00000	HTH_3,Rep_trans
2949	SUN83257.1	97137.C821_01944	6.88e-30	123.0	COG2946@1|root,COG2946@2|Bacteria,1UHNT@1239|Firmicutes,4HVQS@91061|Bacilli,3FBTB@33958|Lactobacillaceae	Replication initiation factor	nicK	-	ko:K07467	-	ko00000	HTH_3,Rep_trans
2949	SUN83299.1	888048.HMPREF8577_1512	0.0	872.0	COG0593@1|root,COG0593@2|Bacteria,1TPV7@1239|Firmicutes,4H9MW@91061|Bacilli	it binds specifically double-stranded DNA at a 9 bp consensus (dnaA box) 5'-TTATC CA A CA A-3'. DnaA binds to ATP and to acidic phospholipids	dnaA	GO:0003674,GO:0003676,GO:0003677,GO:0003688,GO:0003690,GO:0005488,GO:0005515,GO:0005575,GO:0005622,GO:0005623,GO:0005737,GO:0005886,GO:0006139,GO:0006259,GO:0006260,GO:0006261,GO:0006270,GO:0006725,GO:0006807,GO:0008150,GO:0008152,GO:0009058,GO:0009059,GO:0009987,GO:0016020,GO:0034641,GO:0034645,GO:0042802,GO:0043170,GO:0043565,GO:0044237,GO:0044238,GO:0044249,GO:0044260,GO:0044424,GO:0044464,GO:0046483,GO:0071704,GO:0071944,GO:0090304,GO:0097159,GO:1901360,GO:1901363,GO:1901576,GO:1990837	ko:K02313	ko02020,ko04112,map02020,map04112	ko00000,ko00001,ko03032,ko03036	Bac_DnaA,Bac_DnaA_C,DnaA_N
2949	SUN83300.1	1114965.Spaf_0002	3.45e-263	722.0	COG0592@1|root,COG0592@2|Bacteria,1TQ7J@1239|Firmicutes,4H9TF@91061|Bacilli	Confers DNA tethering and processivity to DNA polymerases and other proteins. Acts as a clamp, forming a ring around DNA (a reaction catalyzed by the clamp-loading complex) which diffuses in an ATP-independent manner freely and bidirectionally along dsDNA. Initially characterized for its ability to contact the catalytic subunit of DNA polymerase III (Pol III), a complex, multichain enzyme responsible for most of the replicative synthesis in bacteria	dnaN	-	ko:K02338	ko00230,ko00240,ko01100,ko03030,ko03430,ko03440,map00230,map00240,map01100,map03030,map03430,map03440	ko00000,ko00001,ko00002,ko01000,ko03032,ko03400	DNA_pol3_beta,DNA_pol3_beta_2,DNA_pol3_beta_3
2949	SUN83301.1	888048.HMPREF8577_1514	9.84e-41	134.0	COG4481@1|root,COG4481@2|Bacteria,1VEQ7@1239|Firmicutes,4HNHU@91061|Bacilli	Protein conserved in bacteria	yyzM	-	-	-	-	DUF951
2949	SUN83302.1	1114965.Spaf_0003	2.99e-107	310.0	COG4808@1|root,COG4808@2|Bacteria	Protein of unknown function (DUF1307)	yehR	GO:0005575,GO:0005622,GO:0005623,GO:0005737,GO:0005829,GO:0044424,GO:0044444,GO:0044464	-	-	-	DUF1307
2949	SUN83303.1	1035189.HMPREF9954_0100	5.04e-257	706.0	COG0012@1|root,COG0012@2|Bacteria,1TPRK@1239|Firmicutes,4H9SQ@91061|Bacilli,43FP5@68892|Streptococcus infantis	ATPase that binds to both the 70S ribosome and the 50S ribosomal subunit in a nucleotide-independent manner	ychF	GO:0003674,GO:0003824,GO:0005575,GO:0005622,GO:0005623,GO:0005737,GO:0016462,GO:0016787,GO:0016817,GO:0016818,GO:0016887,GO:0017111,GO:0044424,GO:0044464	ko:K06942	-	ko00000,ko03009	MMR_HSR1,YchF-GTPase_C
2949	SUN83304.1	1114965.Spaf_0005	5.18e-134	379.0	COG0193@1|root,COG0193@2|Bacteria,1V3NB@1239|Firmicutes,4HH2Z@91061|Bacilli	The natural substrate for this enzyme may be peptidyl- tRNAs which drop off the ribosome during protein synthesis	pth	GO:0003674,GO:0003824,GO:0004045,GO:0016787,GO:0016788,GO:0052689,GO:0140098,GO:0140101	ko:K01056	-	ko00000,ko01000,ko03012	Pept_tRNA_hydro
2949	SUN83305.1	1114965.Spaf_0006	0.0	2217.0	COG1197@1|root,COG1197@2|Bacteria,1TPF1@1239|Firmicutes,4H9NB@91061|Bacilli	Couples transcription and DNA repair by recognizing RNA polymerase (RNAP) stalled at DNA lesions. Mediates ATP-dependent release of RNAP and its truncated transcript from the DNA, and recruitment of nucleotide excision repair machinery to the damaged site	mfd	-	ko:K03723	ko03420,map03420	ko00000,ko00001,ko01000,ko03400	CarD_CdnL_TRCF,DEAD,Helicase_C,TRCF
2949	SUN83306.1	1114965.Spaf_0007	1.62e-50	160.0	COG1188@1|root,COG1188@2|Bacteria,1VEI5@1239|Firmicutes,4HKJJ@91061|Bacilli	Ribosome-associated heat shock protein implicated in the recycling of the 50S subunit (S4 paralog)	yabO	-	-	-	-	S4
2949	SUN83307.1	1114965.Spaf_0008	2.54e-70	213.0	COG2919@1|root,COG2919@2|Bacteria,1VKC5@1239|Firmicutes,4HR53@91061|Bacilli	Septum formation initiator	divIC	-	ko:K13052	-	ko00000,ko03036	DivIC
2949	SUN83308.1	1114965.Spaf_0010	7.16e-300	818.0	COG2367@1|root,COG2367@2|Bacteria,1VGXR@1239|Firmicutes,4HP3Q@91061|Bacilli	Beta-lactamase class A	-	-	ko:K01467	ko01501,ko02020,map01501,map02020	ko00000,ko00001,ko00002,ko01000	Beta-lactamase2,SH3_8
2949	SUN83309.1	1114965.Spaf_0011	1.59e-305	833.0	COG0037@1|root,COG0037@2|Bacteria,1TPXP@1239|Firmicutes,4H9ZM@91061|Bacilli	Ligates lysine onto the cytidine present at position 34 of the AUA codon-specific tRNA(Ile) that contains the anticodon CAU, in an ATP-dependent manner. Cytidine is converted to lysidine, thus changing the amino acid specificity of the tRNA from methionine to isoleucine	tilS	-	ko:K04075,ko:K15780	ko00230,ko01100,ko01110,map00230,map01100,map01110	ko00000,ko00001,ko01000,ko03016	ATP_bind_3,TilS,TilS_C
2949	SUN83310.1	1114965.Spaf_0012	1.01e-122	350.0	COG0634@1|root,COG0634@2|Bacteria,1V1C9@1239|Firmicutes,4HFZ2@91061|Bacilli	Belongs to the purine pyrimidine phosphoribosyltransferase family	hpt	GO:0005575,GO:0005622,GO:0005623,GO:0005737,GO:0044424,GO:0044464	ko:K00760,ko:K15780	ko00230,ko00983,ko01100,ko01110,map00230,map00983,map01100,map01110	ko00000,ko00001,ko01000,ko03016	Pribosyltran
2949	SUN83311.1	1114965.Spaf_0013	0.0	1211.0	COG0465@1|root,COG0465@2|Bacteria,1TPTV@1239|Firmicutes,4HAJB@91061|Bacilli	Acts as a processive, ATP-dependent zinc metallopeptidase for both cytoplasmic and membrane proteins. Plays a role in the quality control of integral membrane proteins	ftsH	GO:0003674,GO:0003824,GO:0004176,GO:0005575,GO:0005623,GO:0006508,GO:0006807,GO:0008150,GO:0008152,GO:0008233,GO:0008237,GO:0009056,GO:0009057,GO:0016462,GO:0016787,GO:0016817,GO:0016818,GO:0016887,GO:0017111,GO:0019538,GO:0030163,GO:0030428,GO:0032502,GO:0042623,GO:0043170,GO:0043934,GO:0044238,GO:0044464,GO:0070011,GO:0071704,GO:0140096,GO:1901564,GO:1901565,GO:1901575	ko:K03798	-	ko00000,ko00002,ko01000,ko01002,ko03110	AAA,FtsH_ext,Peptidase_M41
2949	SUN83312.1	1114965.Spaf_0014	2.89e-105	304.0	COG1595@1|root,COG1595@2|Bacteria,1VG7U@1239|Firmicutes,4HNKD@91061|Bacilli	Belongs to the sigma-70 factor family	comX	-	ko:K03088,ko:K03091,ko:K12296	ko02020,ko02024,map02020,map02024	ko00000,ko00001,ko03000,ko03021	Sigma70_r2,Sigma70_r4_2
2949	SUN83313.1	1114965.Spaf_0015	8.71e-125	357.0	COG2826@1|root,COG2826@2|Bacteria	transposase and inactivated derivatives, IS30 family	-	-	-	-	-	HTH_38,rve
2949	SUN83314.1	1114965.Spaf_0017	4.13e-176	493.0	COG1792@1|root,COG1792@2|Bacteria,1TR1V@1239|Firmicutes,4HB0K@91061|Bacilli	Involved in formation and maintenance of cell shape	mreC	GO:0003674,GO:0005488,GO:0005515,GO:0005575,GO:0005623,GO:0005886,GO:0008150,GO:0008360,GO:0009273,GO:0009987,GO:0016020,GO:0022603,GO:0022604,GO:0030428,GO:0042546,GO:0043621,GO:0044085,GO:0044464,GO:0050789,GO:0050793,GO:0050794,GO:0051128,GO:0065007,GO:0065008,GO:0071554,GO:0071840,GO:0071944	ko:K03570	-	ko00000,ko03036	MreC
2949	SUN83315.1	1114965.Spaf_igr0017	5.72e-104	301.0	COG2891@1|root,COG2891@2|Bacteria	Involved in formation of the rod shape of the cell. May also contribute to regulation of formation of penicillin-binding proteins	mreD	GO:0005575,GO:0005623,GO:0005886,GO:0005887,GO:0008150,GO:0008360,GO:0016020,GO:0016021,GO:0022603,GO:0022604,GO:0031224,GO:0031226,GO:0044425,GO:0044459,GO:0044464,GO:0050789,GO:0050793,GO:0050794,GO:0051128,GO:0065007,GO:0065008,GO:0071944	ko:K03571	-	ko00000,ko03036	MreD
2949	SUN83316.1	1114965.Spaf_0018	1.97e-192	546.0	COG3883@1|root,COG3942@1|root,COG3883@2|Bacteria,COG3942@2|Bacteria,1UZ12@1239|Firmicutes,4HCUD@91061|Bacilli	CHAP domain protein	usp	-	ko:K21471	-	ko00000,ko01000,ko01002,ko01011	CHAP,NLPC_P60
2949	SUN83317.1	1114965.Spaf_0020	2.98e-224	619.0	COG0462@1|root,COG0462@2|Bacteria,1TQ6Q@1239|Firmicutes,4HB61@91061|Bacilli	Involved in the biosynthesis of the central metabolite phospho-alpha-D-ribosyl-1-pyrophosphate (PRPP) via the transfer of pyrophosphoryl group from ATP to 1-hydroxyl of ribose-5-phosphate (Rib-5-P)	prs	-	ko:K00948	ko00030,ko00230,ko01100,ko01110,ko01120,ko01130,ko01200,ko01230,map00030,map00230,map01100,map01110,map01120,map01130,map01200,map01230	ko00000,ko00001,ko00002,ko01000	Pribosyl_synth,Pribosyltran_N
2949	SUN83319.1	1046629.Ssal_02064	1.61e-08	60.5	2DVQ0@1|root,33WQM@2|Bacteria,1VVHE@1239|Firmicutes,4HW4J@91061|Bacilli	-	-	-	-	-	-	-
2949	SUN83320.1	1114965.Spaf_0023	3.97e-175	491.0	COG4509@1|root,COG4509@2|Bacteria,1TRWN@1239|Firmicutes,4HFQW@91061|Bacilli	sortase, SrtB family	srtB	-	ko:K08600	-	ko00000,ko01000,ko01002,ko01011	Sortase
2949	SUN83321.1	1114965.Spaf_0024	3.68e-277	758.0	COG0436@1|root,COG0436@2|Bacteria,1TP0J@1239|Firmicutes,4HA13@91061|Bacilli	Aminotransferase	araT	-	ko:K00841	ko00300,ko01100,ko01110,ko01230,map00300,map01100,map01110,map01230	ko00000,ko00001,ko00002,ko01000,ko01007	Aminotran_1_2
2949	SUN83322.1	1114965.Spaf_0026	1.02e-186	518.0	COG1381@1|root,COG1381@2|Bacteria,1UZ19@1239|Firmicutes,4HAHI@91061|Bacilli	Involved in DNA repair and RecF pathway recombination	recO	GO:0005575,GO:0005622,GO:0005623,GO:0006139,GO:0006259,GO:0006281,GO:0006302,GO:0006725,GO:0006807,GO:0006950,GO:0006974,GO:0008150,GO:0008152,GO:0009295,GO:0009987,GO:0033554,GO:0034641,GO:0043170,GO:0043226,GO:0043228,GO:0043229,GO:0043232,GO:0043590,GO:0044237,GO:0044238,GO:0044260,GO:0044424,GO:0044464,GO:0046483,GO:0050896,GO:0051716,GO:0071704,GO:0090304,GO:1901360	ko:K03584	ko03440,map03440	ko00000,ko00001,ko03400	RecO_C,RecO_N
2949	SUN83323.1	1114965.Spaf_0027	2.9e-229	632.0	COG0416@1|root,COG0416@2|Bacteria,1TPXS@1239|Firmicutes,4HA0R@91061|Bacilli	Catalyzes the reversible formation of acyl-phosphate (acyl-PO(4)) from acyl- acyl-carrier-protein (acyl-ACP). This enzyme utilizes acyl-ACP as fatty acyl donor, but not acyl-CoA	plsX	GO:0005575,GO:0005622,GO:0005623,GO:0005737,GO:0044424,GO:0044464	ko:K03621	ko00561,ko00564,ko01100,ko01110,map00561,map00564,map01100,map01110	ko00000,ko00001,ko00002,ko01000,ko01004	FA_synthesis
2949	SUN83324.1	1114965.Spaf_0028	7.48e-49	155.0	COG0236@1|root,COG0236@2|Bacteria	Carrier of the growing fatty acid chain in fatty acid biosynthesis	acpP_1	-	ko:K02078	-	ko00000,ko00001	PP-binding
2949	SUN83325.1	1114965.Spaf_0029	3.54e-166	464.0	COG0152@1|root,COG0152@2|Bacteria,1TP11@1239|Firmicutes,4H9U8@91061|Bacilli	Belongs to the SAICAR synthetase family	purC	-	ko:K01923	ko00230,ko01100,ko01110,ko01130,map00230,map01100,map01110,map01130	ko00000,ko00001,ko00002,ko01000	SAICAR_synt
2949	SUN83326.1	1114965.Spaf_0030	0.0	2377.0	COG0046@1|root,COG0047@1|root,COG0046@2|Bacteria,COG0047@2|Bacteria,1TPAS@1239|Firmicutes,4HB3N@91061|Bacilli	Part of the phosphoribosylformylglycinamidine synthase complex involved in the purines biosynthetic pathway. Catalyzes the ATP-dependent conversion of formylglycinamide ribonucleotide (FGAR) and glutamine to yield formylglycinamidine ribonucleotide (FGAM) and glutamate. The FGAM synthase complex is composed of three subunits. PurQ produces an ammonia molecule by converting glutamine to glutamate. PurL transfers the ammonia molecule to FGAR to form FGAM in an ATP-dependent manner. PurS interacts with PurQ and PurL and is thought to assist in the transfer of the ammonia molecule from PurQ to PurL	purL	-	ko:K01952	ko00230,ko01100,ko01110,ko01130,map00230,map01100,map01110,map01130	ko00000,ko00001,ko00002,ko01000	AIRS_C,GATase_5
2949	SUN83327.1	888048.HMPREF8577_1540	0.0	941.0	COG0034@1|root,COG0034@2|Bacteria,1TPH3@1239|Firmicutes,4HAXU@91061|Bacilli	Catalyzes the formation of phosphoribosylamine from phosphoribosylpyrophosphate (PRPP) and glutamine	purF	-	ko:K00764	ko00230,ko00250,ko01100,ko01110,ko01130,map00230,map00250,map01100,map01110,map01130	ko00000,ko00001,ko00002,ko01000,ko01002	GATase_6,GATase_7,Pribosyltran
2949	SUN83328.1	435842.HMPREF0848_01955	4.36e-240	660.0	COG0150@1|root,COG0150@2|Bacteria,1TP9J@1239|Firmicutes,4HABW@91061|Bacilli	Phosphoribosylformylglycinamidine cyclo-ligase	purM	-	ko:K01933	ko00230,ko01100,ko01110,ko01130,map00230,map01100,map01110,map01130	ko00000,ko00001,ko00002,ko01000	AIRS,AIRS_C
2949	SUN83329.1	264199.stu0034	1.81e-127	362.0	COG0299@1|root,COG0299@2|Bacteria,1V3RJ@1239|Firmicutes,4HGY5@91061|Bacilli	Catalyzes the transfer of a formyl group from 10- formyltetrahydrofolate to 5-phospho-ribosyl-glycinamide (GAR), producing 5-phospho-ribosyl-N-formylglycinamide (FGAR) and tetrahydrofolate	purN	-	ko:K11175	ko00230,ko00670,ko01100,ko01110,ko01130,map00230,map00670,map01100,map01110,map01130	ko00000,ko00001,ko00002,ko01000	Formyl_trans_N
2949	SUN83330.1	888048.HMPREF8577_1543	0.0	996.0	COG0138@1|root,COG0138@2|Bacteria,1TPQ5@1239|Firmicutes,4H9YY@91061|Bacilli	Bifunctional purine biosynthesis protein PurH	purH	-	ko:K00602	ko00230,ko00670,ko01100,ko01110,ko01130,ko01523,map00230,map00670,map01100,map01110,map01130,map01523	ko00000,ko00001,ko00002,ko01000,ko04147	AICARFT_IMPCHas,MGS
2949	SUN83331.1	888048.HMPREF8577_1544	8.34e-258	705.0	COG1705@1|root,COG3942@1|root,COG1705@2|Bacteria,COG3942@2|Bacteria,1UKJW@1239|Firmicutes,4ITJ7@91061|Bacilli	GBS Bsp-like repeat	-	-	-	-	-	CHAP,GBS_Bsp-like
2949	SUN83332.1	1114965.Spaf_0036	1.77e-300	820.0	COG0151@1|root,COG0151@2|Bacteria,1UHN9@1239|Firmicutes,4HA70@91061|Bacilli	Belongs to the GARS family	purD	-	ko:K01945	ko00230,ko01100,ko01110,ko01130,map00230,map01100,map01110,map01130	ko00000,ko00001,ko00002,ko01000	GARS_A,GARS_C,GARS_N
2949	SUN83333.1	1114965.Spaf_0038	1.23e-104	304.0	COG0041@1|root,COG0041@2|Bacteria,1V1MV@1239|Firmicutes,4HFR7@91061|Bacilli	Catalyzes the conversion of N5-carboxyaminoimidazole ribonucleotide (N5-CAIR) to 4-carboxy-5-aminoimidazole ribonucleotide (CAIR)	purE	-	ko:K01588	ko00230,ko01100,ko01110,ko01130,map00230,map01100,map01110,map01130	ko00000,ko00001,ko00002,ko01000	AIRC
2949	SUN83334.1	888048.HMPREF8577_1548	4.48e-256	702.0	COG0026@1|root,COG0026@2|Bacteria,1TQCD@1239|Firmicutes,4H9M5@91061|Bacilli	Catalyzes the ATP-dependent conversion of 5- aminoimidazole ribonucleotide (AIR) and HCO(3)(-) to N5- carboxyaminoimidazole ribonucleotide (N5-CAIR)	purK	GO:0005575,GO:0005622,GO:0005623,GO:0005737,GO:0005829,GO:0044424,GO:0044444,GO:0044464	ko:K01589	ko00230,ko01100,ko01110,ko01130,map00230,map01100,map01110,map01130	ko00000,ko00001,ko00002,ko01000	2-Hacid_dh_C,ATP-grasp
2949	SUN83335.1	1114965.Spaf_0040	5.61e-224	617.0	COG1893@1|root,COG1893@2|Bacteria,1UD8U@1239|Firmicutes	Ketopantoate reductase	-	-	ko:K00077	ko00770,ko01100,ko01110,map00770,map01100,map01110	ko00000,ko00001,ko00002,ko01000	ApbA
2949	SUN83336.1	999425.HMPREF9186_01276	4.38e-47	150.0	2DZH9@1|root,32VAR@2|Bacteria,1VIUY@1239|Firmicutes,4HZSZ@91061|Bacilli	-	-	-	-	-	-	-
2949	SUN83337.1	1114965.Spaf_0043	2.04e-312	851.0	COG0015@1|root,COG0015@2|Bacteria,1TPMM@1239|Firmicutes,4HACW@91061|Bacilli	Belongs to the lyase 1 family. Adenylosuccinate lyase subfamily	purB	GO:0003674,GO:0003824,GO:0004018,GO:0006139,GO:0006163,GO:0006164,GO:0006167,GO:0006725,GO:0006753,GO:0006793,GO:0006796,GO:0006807,GO:0008150,GO:0008152,GO:0009058,GO:0009117,GO:0009123,GO:0009124,GO:0009126,GO:0009127,GO:0009150,GO:0009152,GO:0009156,GO:0009161,GO:0009165,GO:0009167,GO:0009168,GO:0009259,GO:0009260,GO:0009987,GO:0016829,GO:0016840,GO:0016842,GO:0017144,GO:0018130,GO:0019438,GO:0019637,GO:0019693,GO:0034641,GO:0034654,GO:0044208,GO:0044237,GO:0044238,GO:0044249,GO:0044271,GO:0044281,GO:0046033,GO:0046390,GO:0046483,GO:0055086,GO:0070626,GO:0071704,GO:0072521,GO:0072522,GO:0090407,GO:1901135,GO:1901137,GO:1901293,GO:1901360,GO:1901362,GO:1901564,GO:1901566,GO:1901576	ko:K01756	ko00230,ko00250,ko01100,ko01110,ko01130,map00230,map00250,map01100,map01110,map01130	ko00000,ko00001,ko00002,ko01000	ADSL_C,Lyase_1
2949	SUN83338.1	1114965.Spaf_0044	6.88e-170	474.0	COG2188@1|root,COG2188@2|Bacteria,1VCJ9@1239|Firmicutes,4HM7V@91061|Bacilli	GntR family	-	-	-	-	-	GntR,UTRA
2949	SUN83339.1	1316408.HSISM1_694	0.0	1213.0	COG1874@1|root,COG1874@2|Bacteria,1TSHK@1239|Firmicutes,4HBAR@91061|Bacilli	Belongs to the glycosyl hydrolase 35 family	bgaC	-	ko:K12308	ko00052,map00052	ko00000,ko00001,ko01000	Glyco_hydro_35
2949	SUN83340.1	1114965.Spaf_0046	3.26e-106	306.0	COG3444@1|root,COG3444@2|Bacteria,1V46G@1239|Firmicutes,4HHPN@91061|Bacilli	PTS system sorbose subfamily IIB component	-	-	ko:K02794	ko00051,ko00520,ko01100,ko02060,map00051,map00520,map01100,map02060	ko00000,ko00001,ko00002,ko01000,ko02000	PTSIIB_sorb
2949	SUN83341.1	1114965.Spaf_0047	3.05e-206	572.0	COG3715@1|root,COG3715@2|Bacteria,1UYP8@1239|Firmicutes,4IQM3@91061|Bacilli	PTS system sorbose-specific iic component	XK27_08455	-	ko:K02795	ko00051,ko00520,ko01100,ko02060,map00051,map00520,map01100,map02060	ko00000,ko00001,ko00002,ko02000	EII-Sor
2949	SUN83342.1	1316408.HSISM1_697	1.24e-194	540.0	COG3716@1|root,COG3716@2|Bacteria,1VT7M@1239|Firmicutes,4HV2X@91061|Bacilli	PTS system mannose fructose sorbose family IID component	manZ_1	-	ko:K02796	ko00051,ko00520,ko01100,ko02060,map00051,map00520,map01100,map02060	ko00000,ko00001,ko00002,ko02000	EIID-AGA
2949	SUN83343.1	1316408.HSISM1_698	1.59e-90	265.0	COG2893@1|root,COG2893@2|Bacteria,1VB8U@1239|Firmicutes,4HKV5@91061|Bacilli	PTS system fructose IIA component	-	-	ko:K02793	ko00051,ko00520,ko01100,ko02060,map00051,map00520,map01100,map02060	ko00000,ko00001,ko00002,ko01000,ko02000	EIIA-man
2949	SUN83344.1	1114965.Spaf_0051	3.93e-270	740.0	COG2222@1|root,COG2222@2|Bacteria,1TQUT@1239|Firmicutes,4HDKQ@91061|Bacilli	Sugar isomerase, AgaS family	agaS	-	ko:K02082	-	ko00000,ko01000	SIS
2949	SUN83345.1	1316408.HSISM1_700	5.04e-258	706.0	COG2017@1|root,COG2017@2|Bacteria,1TQGJ@1239|Firmicutes,4HADZ@91061|Bacilli	converts alpha-aldose to the beta-anomer	galM	-	ko:K01785	ko00010,ko00052,ko01100,ko01110,ko01120,ko01130,map00010,map00052,map01100,map01110,map01120,map01130	ko00000,ko00001,ko00002,ko01000	Aldose_epim
2949	SUN83346.1	1316408.HSISM1_701	1.77e-235	648.0	COG2255@1|root,COG2255@2|Bacteria,1TR47@1239|Firmicutes,4HBMW@91061|Bacilli	The RuvA-RuvB complex in the presence of ATP renatures cruciform structure in supercoiled DNA with palindromic sequence, indicating that it may promote strand exchange reactions in homologous recombination. RuvAB is a helicase that mediates the Holliday junction migration by localized denaturation and reannealing	ruvB	-	ko:K03551	ko03440,map03440	ko00000,ko00001,ko01000,ko03400	RuvB_C,RuvB_N
2949	SUN83347.1	1316408.HSISM1_702	2.67e-131	372.0	COG3575@1|root,COG3575@2|Bacteria,1V1YD@1239|Firmicutes,4HGK6@91061|Bacilli	protein conserved in bacteria	-	-	ko:K09962	-	ko00000	NTP_transf_6
2949	SUN83348.1	1114965.Spaf_0055	1.3e-102	297.0	COG0394@1|root,COG0394@2|Bacteria,1V6SG@1239|Firmicutes,4HIZN@91061|Bacilli	Belongs to the low molecular weight phosphotyrosine protein phosphatase family	ptpA	-	ko:K01104	-	ko00000,ko01000	LMWPc
2949	SUN83349.1	1114965.Spaf_0056	1.12e-39	137.0	COG4642@1|root,COG4642@2|Bacteria,1V30F@1239|Firmicutes,4HT0A@91061|Bacilli	MORN repeat protein	-	-	-	-	-	MORN
2949	SUN83350.1	1114965.Spaf_0057	0.0	1073.0	COG1835@1|root,COG1835@2|Bacteria,1U6DU@1239|Firmicutes,4H9XT@91061|Bacilli	Acyltransferase	XK27_09800	-	-	-	-	Acyl_transf_3
2949	SUN83351.1	1114965.Spaf_0058	0.0	1721.0	COG1012@1|root,COG1454@1|root,COG1012@2|Bacteria,COG1454@2|Bacteria,1TPB4@1239|Firmicutes,4HAN8@91061|Bacilli	belongs to the iron- containing alcohol dehydrogenase family	adhE	-	ko:K04072	ko00010,ko00071,ko00350,ko00620,ko00625,ko00626,ko00650,ko01100,ko01110,ko01120,ko01130,ko01220,map00010,map00071,map00350,map00620,map00625,map00626,map00650,map01100,map01110,map01120,map01130,map01220	ko00000,ko00001,ko01000	Aldedh,Fe-ADH
2949	SUN83352.1	888821.HMPREF9394_0963	1.04e-24	107.0	2AQAX@1|root,31FGY@2|Bacteria,1UA20@1239|Firmicutes,4IKAZ@91061|Bacilli,1WR1N@1305|Streptococcus sanguinis	-	-	-	-	-	-	-
2949	SUN83353.1	888816.HMPREF9389_1509	2.36e-16	75.1	2AQU2@1|root,31G25@2|Bacteria,1UA8A@1239|Firmicutes,4IKJQ@91061|Bacilli,1WRX8@1305|Streptococcus sanguinis	-	-	-	-	-	-	-
2949	SUN83354.1	888816.HMPREF9389_1510	3.17e-09	57.4	29RKY@1|root,30CQ5@2|Bacteria,1UA7A@1239|Firmicutes,4IKIH@91061|Bacilli,1WRUQ@1305|Streptococcus sanguinis	-	-	-	-	-	-	-
2949	SUN83355.1	1114965.Spaf_0062	1.02e-259	711.0	COG1063@1|root,COG1063@2|Bacteria,1TPIW@1239|Firmicutes,4HB2G@91061|Bacilli	Dehydrogenase	adh	-	ko:K00001,ko:K18369	ko00010,ko00071,ko00350,ko00625,ko00626,ko00640,ko00830,ko00980,ko00982,ko01100,ko01110,ko01120,ko01130,ko01220,map00010,map00071,map00350,map00625,map00626,map00640,map00830,map00980,map00982,map01100,map01110,map01120,map01130,map01220	ko00000,ko00001,ko01000	ADH_N,ADH_zinc_N
2949	SUN83357.1	1114965.Spaf_0064	8.05e-166	463.0	COG3010@1|root,COG3010@2|Bacteria,1TSR7@1239|Firmicutes,4HBPF@91061|Bacilli	Converts N-acetylmannosamine-6-phosphate (ManNAc-6-P) to N-acetylglucosamine-6-phosphate (GlcNAc-6-P)	nanE	-	ko:K01788	ko00520,map00520	ko00000,ko00001,ko01000	NanE
2949	SUN83358.1	1114965.Spaf_0065	0.0	868.0	COG1653@1|root,COG1653@2|Bacteria,1UZ65@1239|Firmicutes,4HCPG@91061|Bacilli	ABC transporter	-	-	ko:K02027,ko:K10117	ko02010,map02010	ko00000,ko00001,ko00002,ko02000	SBP_bac_1
2949	SUN83359.1	1114965.Spaf_0066	1.34e-200	556.0	COG1175@1|root,COG1175@2|Bacteria,1TT6K@1239|Firmicutes,4HBZJ@91061|Bacilli	ABC transporter (Permease	-	-	ko:K02025,ko:K17238	ko02010,map02010	ko00000,ko00001,ko00002,ko02000	BPD_transp_1
2949	SUN83360.1	1114965.Spaf_0067	3.82e-192	534.0	COG0395@1|root,COG0395@2|Bacteria,1TPDZ@1239|Firmicutes,4HF1H@91061|Bacilli	ABC transporter (Permease	-	-	ko:K02026	-	ko00000,ko00002,ko02000	BPD_transp_1
2949	SUN83361.1	888048.HMPREF8577_1587	4.55e-109	313.0	COG2731@1|root,COG2731@2|Bacteria,1VIQH@1239|Firmicutes,4I03Z@91061|Bacilli	YhcH YjgK YiaL family protein	-	-	-	-	-	DUF386
2949	SUN83362.1	1114965.Spaf_0069	4.09e-142	402.0	COG5578@1|root,COG5578@2|Bacteria,1V69Y@1239|Firmicutes,4HH89@91061|Bacilli	Protein of unknown function, DUF624	yteU	-	-	-	-	DUF624
2949	SUN83363.1	888048.HMPREF8577_1589	7.19e-217	599.0	COG0329@1|root,COG0329@2|Bacteria,1TQRK@1239|Firmicutes,4HEMA@91061|Bacilli	Belongs to the DapA family	nanH	-	ko:K01639	ko00520,map00520	ko00000,ko00001,ko01000	DHDPS
2949	SUN83364.1	1114965.Spaf_0071	1.08e-215	595.0	COG1940@1|root,COG1940@2|Bacteria,1TP04@1239|Firmicutes,4HGYM@91061|Bacilli	ROK family	nanK	-	-	-	-	ROK
2949	SUN83365.1	1316408.HSISM1_713	4.1e-187	521.0	COG1737@1|root,COG1737@2|Bacteria,1TR5E@1239|Firmicutes,4IQVU@91061|Bacilli	cog cog1737	XK27_06230	-	-	-	-	HTH_6,SIS
2949	SUN83366.1	706437.HMPREF0813_00967	3.9e-11	62.8	2BAQX@1|root,3245V@2|Bacteria,1TVWX@1239|Firmicutes,4I4HT@91061|Bacilli,42EBX@671232|Streptococcus anginosus group	-	-	-	ko:K02107	ko00190,map00190	ko00000,ko00001,ko00002	-
2949	SUN83367.1	888048.HMPREF8577_1593	0.0	1202.0	COG1269@1|root,COG1269@2|Bacteria,1TPTE@1239|Firmicutes,4HDJH@91061|Bacilli	Belongs to the V-ATPase 116 kDa subunit family	ntpI	-	ko:K02123	ko00190,ko01100,map00190,map01100	ko00000,ko00001,ko00002	V_ATPase_I
