key	query	seed_ortholog	evalue	score	eggNOG_OGs	description	preferred_name	GOs	KEGG_ko	KEGG_pathway	brite	PFAMs
2961	SQG42203.1	873448.STRPO_1390	0.0	886.0	COG0593@1|root,COG0593@2|Bacteria,1TPV7@1239|Firmicutes,4H9MW@91061|Bacilli	it binds specifically double-stranded DNA at a 9 bp consensus (dnaA box) 5'-TTATC CA A CA A-3'. DnaA binds to ATP and to acidic phospholipids	dnaA	GO:0003674,GO:0003676,GO:0003677,GO:0003688,GO:0003690,GO:0005488,GO:0005515,GO:0005575,GO:0005622,GO:0005623,GO:0005737,GO:0005886,GO:0006139,GO:0006259,GO:0006260,GO:0006261,GO:0006270,GO:0006725,GO:0006807,GO:0008150,GO:0008152,GO:0009058,GO:0009059,GO:0009987,GO:0016020,GO:0034641,GO:0034645,GO:0042802,GO:0043170,GO:0043565,GO:0044237,GO:0044238,GO:0044249,GO:0044260,GO:0044424,GO:0044464,GO:0046483,GO:0071704,GO:0071944,GO:0090304,GO:0097159,GO:1901360,GO:1901363,GO:1901576,GO:1990837	ko:K02313	ko02020,ko04112,map02020,map04112	ko00000,ko00001,ko03032,ko03036	Bac_DnaA,Bac_DnaA_C,DnaA_N
2961	SQG42206.1	873448.STRPO_1391	2.4e-258	709.0	COG0592@1|root,COG0592@2|Bacteria,1TQ7J@1239|Firmicutes,4H9TF@91061|Bacilli	Confers DNA tethering and processivity to DNA polymerases and other proteins. Acts as a clamp, forming a ring around DNA (a reaction catalyzed by the clamp-loading complex) which diffuses in an ATP-independent manner freely and bidirectionally along dsDNA. Initially characterized for its ability to contact the catalytic subunit of DNA polymerase III (Pol III), a complex, multichain enzyme responsible for most of the replicative synthesis in bacteria	dnaN	-	ko:K02338	ko00230,ko00240,ko01100,ko03030,ko03430,ko03440,map00230,map00240,map01100,map03030,map03430,map03440	ko00000,ko00001,ko00002,ko01000,ko03032,ko03400	DNA_pol3_beta,DNA_pol3_beta_2,DNA_pol3_beta_3
2961	SQG42210.1	873448.STRPO_1392	1.26e-42	139.0	COG4481@1|root,COG4481@2|Bacteria,1VEQ7@1239|Firmicutes,4HNHU@91061|Bacilli	Protein conserved in bacteria	yyzM	-	-	-	-	DUF951
2961	SQG42212.1	873448.STRPO_1393	7.49e-91	266.0	COG1396@1|root,COG1396@2|Bacteria,1VK84@1239|Firmicutes,4ISBS@91061|Bacilli	Cro/C1-type HTH DNA-binding domain	-	-	-	-	-	HTH_3
2961	SQG42214.1	873448.STRPO_1394	1.51e-258	709.0	COG0012@1|root,COG0012@2|Bacteria,1TPRK@1239|Firmicutes,4H9SQ@91061|Bacilli	ATPase that binds to both the 70S ribosome and the 50S ribosomal subunit in a nucleotide-independent manner	ychF	GO:0003674,GO:0003824,GO:0005575,GO:0005622,GO:0005623,GO:0005737,GO:0016462,GO:0016787,GO:0016817,GO:0016818,GO:0016887,GO:0017111,GO:0044424,GO:0044464	ko:K06942	-	ko00000,ko03009	MMR_HSR1,YchF-GTPase_C
2961	SQG42216.1	873448.STRPO_1395	3.76e-133	377.0	COG0193@1|root,COG0193@2|Bacteria,1V3NB@1239|Firmicutes,4HH2Z@91061|Bacilli	The natural substrate for this enzyme may be peptidyl- tRNAs which drop off the ribosome during protein synthesis	pth	GO:0003674,GO:0003824,GO:0004045,GO:0016787,GO:0016788,GO:0052689,GO:0140098,GO:0140101	ko:K01056	-	ko00000,ko01000,ko03012	Pept_tRNA_hydro
2961	SQG42219.1	873448.STRPO_1396	0.0	2254.0	COG1197@1|root,COG1197@2|Bacteria,1TPF1@1239|Firmicutes,4H9NB@91061|Bacilli	Couples transcription and DNA repair by recognizing RNA polymerase (RNAP) stalled at DNA lesions. Mediates ATP-dependent release of RNAP and its truncated transcript from the DNA, and recruitment of nucleotide excision repair machinery to the damaged site	mfd	-	ko:K03723	ko03420,map03420	ko00000,ko00001,ko01000,ko03400	CarD_CdnL_TRCF,DEAD,Helicase_C,TRCF
2961	SQG42221.1	873448.STRPO_1397	0.0	929.0	COG2244@1|root,COG2244@2|Bacteria,1TNYX@1239|Firmicutes,4HACG@91061|Bacilli	Membrane protein involved in the export of O-antigen and teichoic acid	yabM	GO:0005575,GO:0005623,GO:0005886,GO:0016020,GO:0044464,GO:0071944	ko:K03328	-	ko00000	Polysacc_synt,Polysacc_synt_C
2961	SQG42224.1	873448.STRPO_1398	1.18e-51	163.0	COG1188@1|root,COG1188@2|Bacteria,1VEI5@1239|Firmicutes,4HKJJ@91061|Bacilli	Ribosome-associated heat shock protein implicated in the recycling of the 50S subunit (S4 paralog)	yabO	-	-	-	-	S4
2961	SQG42226.1	873448.STRPO_1399	1.12e-78	234.0	COG2919@1|root,COG2919@2|Bacteria,1VKC5@1239|Firmicutes,4HR53@91061|Bacilli	Septum formation initiator	divIC	-	ko:K13052	-	ko00000,ko03036	DivIC
2961	SQG42228.1	873448.STRPO_1401	3.52e-311	847.0	COG2367@1|root,COG2367@2|Bacteria,1V9UI@1239|Firmicutes,4HRN8@91061|Bacilli	Beta-lactamase enzyme family	-	-	ko:K01467	ko01501,ko02020,map01501,map02020	ko00000,ko00001,ko00002,ko01000	Beta-lactamase2
2961	SQG42231.1	873448.STRPO_1402	8.93e-309	841.0	COG0037@1|root,COG0037@2|Bacteria,1TPXP@1239|Firmicutes,4H9ZM@91061|Bacilli	Ligates lysine onto the cytidine present at position 34 of the AUA codon-specific tRNA(Ile) that contains the anticodon CAU, in an ATP-dependent manner. Cytidine is converted to lysidine, thus changing the amino acid specificity of the tRNA from methionine to isoleucine	tilS	-	ko:K04075,ko:K15780	ko00230,ko01100,ko01110,map00230,map01100,map01110	ko00000,ko00001,ko01000,ko03016	ATP_bind_3,TilS,TilS_C
2961	SQG42233.1	873448.STRPO_1403	1.56e-126	360.0	COG0634@1|root,COG0634@2|Bacteria,1V1C9@1239|Firmicutes,4HFZ2@91061|Bacilli	Belongs to the purine pyrimidine phosphoribosyltransferase family	hpt	GO:0005575,GO:0005622,GO:0005623,GO:0005737,GO:0044424,GO:0044464	ko:K00760,ko:K15780	ko00230,ko00983,ko01100,ko01110,map00230,map00983,map01100,map01110	ko00000,ko00001,ko01000,ko03016	Pribosyltran
2961	SQG42235.1	873448.STRPO_1404	0.0	1222.0	COG0465@1|root,COG0465@2|Bacteria,1TPTV@1239|Firmicutes,4HAJB@91061|Bacilli	Acts as a processive, ATP-dependent zinc metallopeptidase for both cytoplasmic and membrane proteins. Plays a role in the quality control of integral membrane proteins	ftsH	GO:0003674,GO:0003824,GO:0004176,GO:0005575,GO:0005623,GO:0006508,GO:0006807,GO:0008150,GO:0008152,GO:0008233,GO:0008237,GO:0009056,GO:0009057,GO:0016462,GO:0016787,GO:0016817,GO:0016818,GO:0016887,GO:0017111,GO:0019538,GO:0030163,GO:0030428,GO:0032502,GO:0042623,GO:0043170,GO:0043934,GO:0044238,GO:0044464,GO:0070011,GO:0071704,GO:0140096,GO:1901564,GO:1901565,GO:1901575	ko:K03798	-	ko00000,ko00002,ko01000,ko01002,ko03110	AAA,FtsH_ext,Peptidase_M41
2961	SQG42237.1	873448.STRPO_1405	8.96e-317	865.0	COG0531@1|root,COG0531@2|Bacteria,1TQ4K@1239|Firmicutes,4HA66@91061|Bacilli	amino acid	yfnA	-	ko:K03294	-	ko00000	AA_permease_2
2961	SQG42239.1	873448.STRPO_1427	1.04e-181	507.0	COG1792@1|root,COG1792@2|Bacteria,1TR1V@1239|Firmicutes,4HB0K@91061|Bacilli	Involved in formation and maintenance of cell shape	mreC	GO:0003674,GO:0005488,GO:0005515,GO:0005575,GO:0005623,GO:0005886,GO:0008150,GO:0008360,GO:0009273,GO:0009987,GO:0016020,GO:0022603,GO:0022604,GO:0030428,GO:0042546,GO:0043621,GO:0044085,GO:0044464,GO:0050789,GO:0050793,GO:0050794,GO:0051128,GO:0065007,GO:0065008,GO:0071554,GO:0071840,GO:0071944	ko:K03570	-	ko00000,ko03036	MreC
2961	SQG42241.1	764298.STRMA_1639	3.63e-10	63.2	COG2891@1|root,COG2891@2|Bacteria	Involved in formation of the rod shape of the cell. May also contribute to regulation of formation of penicillin-binding proteins	mreD	GO:0005575,GO:0005623,GO:0005886,GO:0005887,GO:0008150,GO:0008360,GO:0016020,GO:0016021,GO:0022603,GO:0022604,GO:0031224,GO:0031226,GO:0044425,GO:0044459,GO:0044464,GO:0050789,GO:0050793,GO:0050794,GO:0051128,GO:0065007,GO:0065008,GO:0071944	ko:K03571	-	ko00000,ko03036	MreD
2961	SQG42243.1	873448.STRPO_1429	9.01e-205	577.0	COG3883@1|root,COG3942@1|root,COG3883@2|Bacteria,COG3942@2|Bacteria,1VCXB@1239|Firmicutes,4IS6H@91061|Bacilli	CHAP domain	pcsB	-	ko:K21471	-	ko00000,ko01000,ko01002,ko01011	CHAP
2961	SQG42245.1	873448.STRPO_1430	7.92e-221	610.0	COG0462@1|root,COG0462@2|Bacteria,1TQ6Q@1239|Firmicutes,4HB61@91061|Bacilli	Involved in the biosynthesis of the central metabolite phospho-alpha-D-ribosyl-1-pyrophosphate (PRPP) via the transfer of pyrophosphoryl group from ATP to 1-hydroxyl of ribose-5-phosphate (Rib-5-P)	prs	-	ko:K00948	ko00030,ko00230,ko01100,ko01110,ko01120,ko01130,ko01200,ko01230,map00030,map00230,map01100,map01110,map01120,map01130,map01200,map01230	ko00000,ko00001,ko00002,ko01000	Pribosyl_synth,Pribosyltran_N
2961	SQG42247.1	873448.STRPO_1431	1.11e-282	772.0	COG0436@1|root,COG0436@2|Bacteria,1TP0J@1239|Firmicutes,4HA13@91061|Bacilli	Aminotransferase	araT	-	ko:K00841	ko00300,ko01100,ko01110,ko01230,map00300,map01100,map01110,map01230	ko00000,ko00001,ko00002,ko01000,ko01007	Aminotran_1_2
2961	SQG42248.1	873448.STRPO_1432	5.05e-186	516.0	COG1381@1|root,COG1381@2|Bacteria,1UZ19@1239|Firmicutes,4HAHI@91061|Bacilli	Involved in DNA repair and RecF pathway recombination	recO	GO:0005575,GO:0005622,GO:0005623,GO:0006139,GO:0006259,GO:0006281,GO:0006302,GO:0006725,GO:0006807,GO:0006950,GO:0006974,GO:0008150,GO:0008152,GO:0009295,GO:0009987,GO:0033554,GO:0034641,GO:0043170,GO:0043226,GO:0043228,GO:0043229,GO:0043232,GO:0043590,GO:0044237,GO:0044238,GO:0044260,GO:0044424,GO:0044464,GO:0046483,GO:0050896,GO:0051716,GO:0071704,GO:0090304,GO:1901360	ko:K03584	ko03440,map03440	ko00000,ko00001,ko03400	RecO_C,RecO_N
2961	SQG42252.1	873448.STRPO_1433	2.39e-230	635.0	COG0416@1|root,COG0416@2|Bacteria,1TPXS@1239|Firmicutes,4HA0R@91061|Bacilli	Catalyzes the reversible formation of acyl-phosphate (acyl-PO(4)) from acyl- acyl-carrier-protein (acyl-ACP). This enzyme utilizes acyl-ACP as fatty acyl donor, but not acyl-CoA	plsX	GO:0005575,GO:0005622,GO:0005623,GO:0005737,GO:0044424,GO:0044464	ko:K03621	ko00561,ko00564,ko01100,ko01110,map00561,map00564,map01100,map01110	ko00000,ko00001,ko00002,ko01000,ko01004	FA_synthesis
2961	SQG42254.1	873448.STRPO_1434	3.33e-47	151.0	COG0236@1|root,COG0236@2|Bacteria	Carrier of the growing fatty acid chain in fatty acid biosynthesis	acpP_1	-	ko:K02078	-	ko00000,ko00001	PP-binding
2961	SQG42257.1	873448.STRPO_1436	9.65e-275	749.0	COG3942@1|root,COG3942@2|Bacteria,1VUNU@1239|Firmicutes,4HVY0@91061|Bacilli	CHAP domain	-	-	-	-	-	CHAP,SH3_5
2961	SQG42259.1	873448.STRPO_1437	1.15e-138	392.0	2FERH@1|root,346QI@2|Bacteria,1VZBW@1239|Firmicutes,4I16Q@91061|Bacilli	-	-	-	-	-	-	-
2961	SQG42261.1	873448.STRPO_1439	1.75e-312	851.0	COG0015@1|root,COG0015@2|Bacteria,1TPMM@1239|Firmicutes,4HACW@91061|Bacilli	Belongs to the lyase 1 family. Adenylosuccinate lyase subfamily	purB	GO:0003674,GO:0003824,GO:0004018,GO:0006139,GO:0006163,GO:0006164,GO:0006167,GO:0006725,GO:0006753,GO:0006793,GO:0006796,GO:0006807,GO:0008150,GO:0008152,GO:0009058,GO:0009117,GO:0009123,GO:0009124,GO:0009126,GO:0009127,GO:0009150,GO:0009152,GO:0009156,GO:0009161,GO:0009165,GO:0009167,GO:0009168,GO:0009259,GO:0009260,GO:0009987,GO:0016829,GO:0016840,GO:0016842,GO:0017144,GO:0018130,GO:0019438,GO:0019637,GO:0019693,GO:0034641,GO:0034654,GO:0044208,GO:0044237,GO:0044238,GO:0044249,GO:0044271,GO:0044281,GO:0046033,GO:0046390,GO:0046483,GO:0055086,GO:0070626,GO:0071704,GO:0072521,GO:0072522,GO:0090407,GO:1901135,GO:1901137,GO:1901293,GO:1901360,GO:1901362,GO:1901564,GO:1901566,GO:1901576	ko:K01756	ko00230,ko00250,ko01100,ko01110,ko01130,map00230,map00250,map01100,map01110,map01130	ko00000,ko00001,ko00002,ko01000	ADSL_C,Lyase_1
2961	SQG42263.1	873448.STRPO_1440	2.63e-210	582.0	COG1396@1|root,COG1396@2|Bacteria,1UYX5@1239|Firmicutes,4HF70@91061|Bacilli	transcriptional	-	-	ko:K20342,ko:K20391	ko02024,map02024	ko00000,ko00001,ko03000	HTH_19,HTH_3
2961	SQG42267.1	873448.STRPO_1441	7.61e-230	633.0	COG2255@1|root,COG2255@2|Bacteria,1TR47@1239|Firmicutes,4HBMW@91061|Bacilli	The RuvA-RuvB complex in the presence of ATP renatures cruciform structure in supercoiled DNA with palindromic sequence, indicating that it may promote strand exchange reactions in homologous recombination. RuvAB is a helicase that mediates the Holliday junction migration by localized denaturation and reannealing	ruvB	-	ko:K03551	ko03440,map03440	ko00000,ko00001,ko01000,ko03400	RuvB_C,RuvB_N
2961	SQG42269.1	873448.STRPO_1442	8.83e-47	149.0	COG0394@1|root,COG0394@2|Bacteria	Belongs to the low molecular weight phosphotyrosine protein phosphatase family	ptpA	-	ko:K01104,ko:K20945	ko05111,map05111	ko00000,ko00001,ko01000	LMWPc
2961	SQG42272.1	873448.STRPO_1443	1.5e-44	143.0	COG0394@1|root,COG0394@2|Bacteria	Belongs to the low molecular weight phosphotyrosine protein phosphatase family	ptpA	-	ko:K01104,ko:K20945	ko05111,map05111	ko00000,ko00001,ko01000	LMWPc
2961	SQG42275.1	873448.STRPO_1444	4.62e-53	170.0	COG4642@1|root,COG4642@2|Bacteria,1V30F@1239|Firmicutes,4I214@91061|Bacilli	protein conserved in bacteria	-	-	-	-	-	MORN
2961	SQG42277.1	873448.STRPO_1445	0.0	1131.0	COG1835@1|root,COG1835@2|Bacteria,1U6DU@1239|Firmicutes,4H9XT@91061|Bacilli	Acyltransferase	XK27_09800	-	-	-	-	Acyl_transf_3
2961	SQG42281.1	873448.STRPO_1446	0.0	1728.0	COG1012@1|root,COG1454@1|root,COG1012@2|Bacteria,COG1454@2|Bacteria,1TPB4@1239|Firmicutes,4HAN8@91061|Bacilli	belongs to the iron- containing alcohol dehydrogenase family	adhE	-	ko:K04072	ko00010,ko00071,ko00350,ko00620,ko00625,ko00626,ko00650,ko01100,ko01110,ko01120,ko01130,ko01220,map00010,map00071,map00350,map00620,map00625,map00626,map00650,map01100,map01110,map01120,map01130,map01220	ko00000,ko00001,ko01000	Aldedh,Fe-ADH
2961	SQG42283.1	873448.STRPO_1447	0.0	954.0	COG0498@1|root,COG0498@2|Bacteria,1TPR0@1239|Firmicutes,4H9R7@91061|Bacilli	Threonine synthase	thrC	-	ko:K01733	ko00260,ko00750,ko01100,ko01110,ko01120,ko01230,map00260,map00750,map01100,map01110,map01120,map01230	ko00000,ko00001,ko00002,ko01000	PALP,Thr_synth_N
2961	SQG42285.1	873448.STRPO_1448	4.67e-275	756.0	COG0534@1|root,COG0534@2|Bacteria,1TQMT@1239|Firmicutes,4H9Y2@91061|Bacilli	Mate efflux family protein	norN	-	-	-	-	MatE
2961	SQG42287.1	1123299.AUKZ01000006_gene966	4.29e-64	196.0	COG0051@1|root,COG0051@2|Bacteria,1V6C9@1239|Firmicutes,4HIKH@91061|Bacilli	Involved in the binding of tRNA to the ribosomes	rpsJ	GO:0003674,GO:0003735,GO:0005198,GO:0005575,GO:0005622,GO:0005623,GO:0005737,GO:0005840,GO:0006412,GO:0006518,GO:0006807,GO:0008150,GO:0008152,GO:0009058,GO:0009059,GO:0009987,GO:0010467,GO:0015935,GO:0019538,GO:0032991,GO:0034641,GO:0034645,GO:0043043,GO:0043170,GO:0043226,GO:0043228,GO:0043229,GO:0043232,GO:0043603,GO:0043604,GO:0044237,GO:0044238,GO:0044249,GO:0044260,GO:0044267,GO:0044271,GO:0044391,GO:0044422,GO:0044424,GO:0044444,GO:0044446,GO:0044464,GO:0071704,GO:1901564,GO:1901566,GO:1901576,GO:1990904	ko:K02946	ko03010,map03010	br01610,ko00000,ko00001,ko00002,ko03011	Ribosomal_S10
2961	SQG42289.1	873448.STRPO_1450	1.11e-142	403.0	COG0087@1|root,COG0087@2|Bacteria,1TPFT@1239|Firmicutes,4HAEN@91061|Bacilli	One of the primary rRNA binding proteins, it binds directly near the 3'-end of the 23S rRNA, where it nucleates assembly of the 50S subunit	rplC	GO:0008150,GO:0009893,GO:0010468,GO:0010604,GO:0010628,GO:0019219,GO:0019222,GO:0031323,GO:0031325,GO:0044087,GO:0044089,GO:0045935,GO:0048518,GO:0048522,GO:0050789,GO:0050794,GO:0051171,GO:0051173,GO:0051252,GO:0051254,GO:0060255,GO:0065007,GO:0080090,GO:0090069,GO:0090070,GO:2000232,GO:2000234	ko:K02906	ko03010,map03010	br01610,ko00000,ko00001,ko00002,ko03011	Ribosomal_L3
2961	SQG42291.1	873448.STRPO_1451	1.06e-135	385.0	COG0088@1|root,COG0088@2|Bacteria,1TPGW@1239|Firmicutes,4HB01@91061|Bacilli	Forms part of the polypeptide exit tunnel	rplD	GO:0003674,GO:0003676,GO:0003723,GO:0003735,GO:0005198,GO:0005488,GO:0005575,GO:0005622,GO:0005623,GO:0005737,GO:0005829,GO:0005840,GO:0006412,GO:0006518,GO:0006807,GO:0008150,GO:0008152,GO:0009058,GO:0009059,GO:0009987,GO:0010467,GO:0015934,GO:0019538,GO:0022625,GO:0022626,GO:0032991,GO:0034641,GO:0034645,GO:0043043,GO:0043170,GO:0043226,GO:0043228,GO:0043229,GO:0043232,GO:0043603,GO:0043604,GO:0044237,GO:0044238,GO:0044249,GO:0044260,GO:0044267,GO:0044271,GO:0044391,GO:0044422,GO:0044424,GO:0044444,GO:0044445,GO:0044446,GO:0044464,GO:0071704,GO:0097159,GO:1901363,GO:1901564,GO:1901566,GO:1901576,GO:1990904	ko:K02926	ko03010,map03010	br01610,ko00000,ko00001,ko00002,ko03011	Ribosomal_L4
2961	SQG42293.1	873448.STRPO_1452	6e-60	185.0	COG0089@1|root,COG0089@2|Bacteria,1VA4W@1239|Firmicutes,4HKCV@91061|Bacilli	One of the early assembly proteins it binds 23S rRNA. One of the proteins that surrounds the polypeptide exit tunnel on the outside of the ribosome. Forms the main docking site for trigger factor binding to the ribosome	rplW	GO:0000027,GO:0003674,GO:0003676,GO:0003723,GO:0003735,GO:0005198,GO:0005488,GO:0005575,GO:0005622,GO:0005623,GO:0005737,GO:0005829,GO:0005840,GO:0006412,GO:0006518,GO:0006807,GO:0006996,GO:0008150,GO:0008152,GO:0009058,GO:0009059,GO:0009987,GO:0010467,GO:0015934,GO:0016043,GO:0019538,GO:0022607,GO:0022613,GO:0022618,GO:0022625,GO:0022626,GO:0032991,GO:0034622,GO:0034641,GO:0034645,GO:0042254,GO:0042255,GO:0042273,GO:0043043,GO:0043170,GO:0043226,GO:0043228,GO:0043229,GO:0043232,GO:0043603,GO:0043604,GO:0043933,GO:0044085,GO:0044237,GO:0044238,GO:0044249,GO:0044260,GO:0044267,GO:0044271,GO:0044391,GO:0044422,GO:0044424,GO:0044444,GO:0044445,GO:0044446,GO:0044464,GO:0065003,GO:0070925,GO:0071704,GO:0071826,GO:0071840,GO:0097159,GO:1901363,GO:1901564,GO:1901566,GO:1901576,GO:1990904	ko:K02892	ko03010,map03010	br01610,ko00000,ko00001,ko00002,ko03011	Ribosomal_L23
2961	SQG42295.1	873448.STRPO_1453	2.06e-195	542.0	COG0090@1|root,COG0090@2|Bacteria,1TP9X@1239|Firmicutes,4HAE8@91061|Bacilli	One of the primary rRNA binding proteins. Required for association of the 30S and 50S subunits to form the 70S ribosome, for tRNA binding and peptide bond formation. It has been suggested to have peptidyltransferase activity	rplB	GO:0002181,GO:0003674,GO:0003676,GO:0003723,GO:0003735,GO:0005198,GO:0005488,GO:0005575,GO:0005622,GO:0005623,GO:0005737,GO:0005829,GO:0005840,GO:0006412,GO:0006518,GO:0006807,GO:0008150,GO:0008152,GO:0009058,GO:0009059,GO:0009987,GO:0010467,GO:0015934,GO:0019538,GO:0022625,GO:0022626,GO:0032991,GO:0034641,GO:0034645,GO:0043043,GO:0043170,GO:0043226,GO:0043228,GO:0043229,GO:0043232,GO:0043603,GO:0043604,GO:0044237,GO:0044238,GO:0044249,GO:0044260,GO:0044267,GO:0044271,GO:0044391,GO:0044422,GO:0044424,GO:0044444,GO:0044445,GO:0044446,GO:0044464,GO:0071704,GO:0097159,GO:1901363,GO:1901564,GO:1901566,GO:1901576,GO:1990904	ko:K02886	ko03010,map03010	br01610,ko00000,ko00001,ko00002,ko03011	Ribosomal_L2,Ribosomal_L2_C
2961	SQG42297.1	1000570.HMPREF9966_1567	2.83e-62	190.0	COG0185@1|root,COG0185@2|Bacteria,1V6CX@1239|Firmicutes,4HIG0@91061|Bacilli,42DQ5@671232|Streptococcus anginosus group	Protein S19 forms a complex with S13 that binds strongly to the 16S ribosomal RNA	rpsS	GO:0000028,GO:0003674,GO:0003735,GO:0005198,GO:0005575,GO:0005622,GO:0005623,GO:0005737,GO:0005829,GO:0005840,GO:0006996,GO:0008150,GO:0009987,GO:0015935,GO:0016043,GO:0022607,GO:0022613,GO:0022618,GO:0022626,GO:0022627,GO:0032991,GO:0034622,GO:0042254,GO:0042255,GO:0042274,GO:0043226,GO:0043228,GO:0043229,GO:0043232,GO:0043933,GO:0044085,GO:0044391,GO:0044422,GO:0044424,GO:0044444,GO:0044445,GO:0044446,GO:0044464,GO:0065003,GO:0070925,GO:0071826,GO:0071840,GO:1990904	ko:K02965	ko03010,map03010	br01610,ko00000,ko00001,ko00002,ko03011	Ribosomal_S19
2961	SQG42299.1	1346.DQ08_00410	2.85e-70	212.0	COG0091@1|root,COG0091@2|Bacteria,1V6PU@1239|Firmicutes,4HIK2@91061|Bacilli	The globular domain of the protein is located near the polypeptide exit tunnel on the outside of the subunit, while an extended beta-hairpin is found that lines the wall of the exit tunnel in the center of the 70S ribosome	rplV	GO:0003674,GO:0003735,GO:0005198,GO:0005575,GO:0005622,GO:0005623,GO:0005737,GO:0005829,GO:0005840,GO:0015934,GO:0022625,GO:0022626,GO:0032991,GO:0043226,GO:0043228,GO:0043229,GO:0043232,GO:0044391,GO:0044422,GO:0044424,GO:0044444,GO:0044445,GO:0044446,GO:0044464,GO:1990904	ko:K02890	ko03010,map03010	br01610,ko00000,ko00001,ko00002,ko03011	Ribosomal_L22
2961	SQG42301.1	873448.STRPO_1456	2.71e-152	428.0	COG0092@1|root,COG0092@2|Bacteria,1TPCP@1239|Firmicutes,4HAUR@91061|Bacilli	Binds the lower part of the 30S subunit head. Binds mRNA in the 70S ribosome, positioning it for translation	rpsC	GO:0002181,GO:0003674,GO:0003735,GO:0005198,GO:0005575,GO:0005622,GO:0005623,GO:0005737,GO:0005829,GO:0005840,GO:0006412,GO:0006518,GO:0006807,GO:0008150,GO:0008152,GO:0009058,GO:0009059,GO:0009987,GO:0010467,GO:0015935,GO:0019538,GO:0022626,GO:0022627,GO:0032991,GO:0034641,GO:0034645,GO:0043043,GO:0043170,GO:0043226,GO:0043228,GO:0043229,GO:0043232,GO:0043603,GO:0043604,GO:0044237,GO:0044238,GO:0044249,GO:0044260,GO:0044267,GO:0044271,GO:0044391,GO:0044422,GO:0044424,GO:0044444,GO:0044445,GO:0044446,GO:0044464,GO:0071704,GO:1901564,GO:1901566,GO:1901576,GO:1990904	ko:K02982	ko03010,map03010	br01610,ko00000,ko00001,ko00002,ko03011	KH_2,Ribosomal_S3_C
2961	SQG42303.1	1123301.KB904201_gene1740	1.77e-93	273.0	COG0197@1|root,COG0197@2|Bacteria,1V1AY@1239|Firmicutes,4HFPN@91061|Bacilli	Binds 23S rRNA and is also seen to make contacts with the A and possibly P site tRNAs	rplP	GO:0003674,GO:0003676,GO:0003723,GO:0003735,GO:0005198,GO:0005488,GO:0005575,GO:0005622,GO:0005623,GO:0005737,GO:0005829,GO:0005840,GO:0015934,GO:0019843,GO:0022625,GO:0022626,GO:0032991,GO:0043226,GO:0043228,GO:0043229,GO:0043232,GO:0044391,GO:0044422,GO:0044424,GO:0044444,GO:0044445,GO:0044446,GO:0044464,GO:0097159,GO:1901363,GO:1990904	ko:K02878	ko03010,map03010	br01610,ko00000,ko00001,ko00002,ko03011	Ribosomal_L16
2961	SQG42306.1	873448.STRPO_1458	3.07e-35	120.0	COG0255@1|root,COG0255@2|Bacteria,1VEME@1239|Firmicutes,4HNUP@91061|Bacilli	Belongs to the universal ribosomal protein uL29 family	rpmC	GO:0005575,GO:0005622,GO:0005623,GO:0005737,GO:0005829,GO:0005840,GO:0015934,GO:0022625,GO:0022626,GO:0032991,GO:0043226,GO:0043228,GO:0043229,GO:0043232,GO:0044391,GO:0044422,GO:0044424,GO:0044444,GO:0044445,GO:0044446,GO:0044464,GO:1990904	ko:K02904	ko03010,map03010	br01610,ko00000,ko00001,ko00002,ko03011	Ribosomal_L29
2961	SQG42309.1	873448.STRPO_1459	6.22e-52	164.0	COG0186@1|root,COG0186@2|Bacteria,1V9YC@1239|Firmicutes,4HKDN@91061|Bacilli	One of the primary rRNA binding proteins, it binds specifically to the 5'-end of 16S ribosomal RNA	rpsQ	GO:0003674,GO:0003735,GO:0005198,GO:0005575,GO:0005622,GO:0005623,GO:0005737,GO:0005829,GO:0005840,GO:0006412,GO:0006518,GO:0006807,GO:0008150,GO:0008152,GO:0009058,GO:0009059,GO:0009987,GO:0010467,GO:0015935,GO:0019538,GO:0022626,GO:0022627,GO:0032991,GO:0034641,GO:0034645,GO:0043043,GO:0043170,GO:0043226,GO:0043228,GO:0043229,GO:0043232,GO:0043603,GO:0043604,GO:0044237,GO:0044238,GO:0044249,GO:0044260,GO:0044267,GO:0044271,GO:0044391,GO:0044422,GO:0044424,GO:0044444,GO:0044445,GO:0044446,GO:0044464,GO:0071704,GO:1901564,GO:1901566,GO:1901576,GO:1990904	ko:K02961	ko03010,map03010	br01610,ko00000,ko00001,ko00002,ko03011	Ribosomal_S17
2961	SQG42312.1	1123298.KB904065_gene2033	2.18e-80	238.0	COG0093@1|root,COG0093@2|Bacteria,1V3N0@1239|Firmicutes,4HGYR@91061|Bacilli	Binds to 23S rRNA. Forms part of two intersubunit bridges in the 70S ribosome	rplN	GO:0003674,GO:0003676,GO:0003723,GO:0003735,GO:0005198,GO:0005488,GO:0005575,GO:0005622,GO:0005623,GO:0005737,GO:0005829,GO:0005840,GO:0015934,GO:0019843,GO:0022625,GO:0022626,GO:0032991,GO:0043226,GO:0043228,GO:0043229,GO:0043232,GO:0044391,GO:0044422,GO:0044424,GO:0044444,GO:0044445,GO:0044446,GO:0044464,GO:0070180,GO:0097159,GO:1901363,GO:1990904	ko:K02874	ko03010,map03010	br01610,ko00000,ko00001,ko00002,ko03011	Ribosomal_L14
2961	SQG42315.1	873448.STRPO_1461	8.06e-64	195.0	COG0198@1|root,COG0198@2|Bacteria,1V9ZQ@1239|Firmicutes,4HKH9@91061|Bacilli	One of the proteins that surrounds the polypeptide exit tunnel on the outside of the subunit	rplX	GO:0005575,GO:0005622,GO:0005623,GO:0005737,GO:0005829,GO:0005840,GO:0006412,GO:0006518,GO:0006807,GO:0008150,GO:0008152,GO:0009058,GO:0009059,GO:0009987,GO:0010467,GO:0015934,GO:0019538,GO:0022625,GO:0022626,GO:0032991,GO:0034641,GO:0034645,GO:0043043,GO:0043170,GO:0043226,GO:0043228,GO:0043229,GO:0043232,GO:0043603,GO:0043604,GO:0044237,GO:0044238,GO:0044249,GO:0044260,GO:0044267,GO:0044271,GO:0044391,GO:0044422,GO:0044424,GO:0044444,GO:0044445,GO:0044446,GO:0044464,GO:0071704,GO:1901564,GO:1901566,GO:1901576,GO:1990904	ko:K02895	ko03010,map03010	br01610,ko00000,ko00001,ko00002,ko03011	KOW,ribosomal_L24
2961	SQG42318.1	873448.STRPO_1462	1.18e-121	347.0	COG0094@1|root,COG0094@2|Bacteria,1TPE0@1239|Firmicutes,4HBAX@91061|Bacilli	This is 1 of the proteins that binds and probably mediates the attachment of the 5S RNA into the large ribosomal subunit, where it forms part of the central protuberance. In the 70S ribosome it contacts protein S13 of the 30S subunit (bridge B1b), connecting the 2 subunits	rplE	GO:0000027,GO:0003674,GO:0003676,GO:0003723,GO:0003735,GO:0005198,GO:0005488,GO:0005575,GO:0005622,GO:0005623,GO:0005737,GO:0005829,GO:0005840,GO:0006412,GO:0006518,GO:0006807,GO:0006996,GO:0008150,GO:0008152,GO:0009058,GO:0009059,GO:0009987,GO:0010467,GO:0015934,GO:0016043,GO:0019538,GO:0022607,GO:0022613,GO:0022618,GO:0022625,GO:0022626,GO:0032991,GO:0034622,GO:0034641,GO:0034645,GO:0042254,GO:0042255,GO:0042273,GO:0043043,GO:0043170,GO:0043226,GO:0043228,GO:0043229,GO:0043232,GO:0043603,GO:0043604,GO:0043933,GO:0044085,GO:0044237,GO:0044238,GO:0044249,GO:0044260,GO:0044267,GO:0044271,GO:0044391,GO:0044422,GO:0044424,GO:0044444,GO:0044445,GO:0044446,GO:0044464,GO:0065003,GO:0070925,GO:0071704,GO:0071826,GO:0071840,GO:0097159,GO:1901363,GO:1901564,GO:1901566,GO:1901576,GO:1990904	ko:K02931	ko03010,map03010	br01610,ko00000,ko00001,ko00002,ko03011	Ribosomal_L5,Ribosomal_L5_C
2961	SQG42320.1	1314.HKU360_00090	2.03e-39	130.0	COG0199@1|root,COG0199@2|Bacteria,1VZ7X@1239|Firmicutes,4HYSS@91061|Bacilli	Binds 16S rRNA, required for the assembly of 30S particles and may also be responsible for determining the conformation of the 16S rRNA at the A site	rpsN	-	ko:K02954	ko03010,map03010	br01610,ko00000,ko00001,ko00002,ko03011	Ribosomal_S14
