key	query	seed_ortholog	evalue	score	eggNOG_OGs	description	preferred_name	GOs	KEGG_ko	KEGG_pathway	brite	PFAMs
2978	SQG45335.1	218495.SUB0001	0.0	887.0	COG0593@1|root,COG0593@2|Bacteria,1TPV7@1239|Firmicutes,4H9MW@91061|Bacilli	it binds specifically double-stranded DNA at a 9 bp consensus (dnaA box) 5'-TTATC CA A CA A-3'. DnaA binds to ATP and to acidic phospholipids	dnaA	GO:0003674,GO:0003676,GO:0003677,GO:0003688,GO:0003690,GO:0005488,GO:0005515,GO:0005575,GO:0005622,GO:0005623,GO:0005737,GO:0005886,GO:0006139,GO:0006259,GO:0006260,GO:0006261,GO:0006270,GO:0006725,GO:0006807,GO:0008150,GO:0008152,GO:0009058,GO:0009059,GO:0009987,GO:0016020,GO:0034641,GO:0034645,GO:0042802,GO:0043170,GO:0043565,GO:0044237,GO:0044238,GO:0044249,GO:0044260,GO:0044424,GO:0044464,GO:0046483,GO:0071704,GO:0071944,GO:0090304,GO:0097159,GO:1901360,GO:1901363,GO:1901576,GO:1990837	ko:K02313	ko02020,ko04112,map02020,map04112	ko00000,ko00001,ko03032,ko03036	Bac_DnaA,Bac_DnaA_C,DnaA_N
2978	SQG45336.1	218495.SUB0002	1.1e-259	713.0	COG0592@1|root,COG0592@2|Bacteria,1TQ7J@1239|Firmicutes,4H9TF@91061|Bacilli	Confers DNA tethering and processivity to DNA polymerases and other proteins. Acts as a clamp, forming a ring around DNA (a reaction catalyzed by the clamp-loading complex) which diffuses in an ATP-independent manner freely and bidirectionally along dsDNA. Initially characterized for its ability to contact the catalytic subunit of DNA polymerase III (Pol III), a complex, multichain enzyme responsible for most of the replicative synthesis in bacteria	dnaN	-	ko:K02338	ko00230,ko00240,ko01100,ko03030,ko03430,ko03440,map00230,map00240,map01100,map03030,map03430,map03440	ko00000,ko00001,ko00002,ko01000,ko03032,ko03400	DNA_pol3_beta,DNA_pol3_beta_2,DNA_pol3_beta_3
2978	SQG45337.1	218495.SUB0003	3.36e-46	148.0	COG4481@1|root,COG4481@2|Bacteria,1VEQ7@1239|Firmicutes,4HNHU@91061|Bacilli	Protein conserved in bacteria	yyzM	-	-	-	-	DUF951
2978	SQG45338.1	218495.SUB0004	1.12e-86	255.0	COG1396@1|root,COG1396@2|Bacteria,1VK84@1239|Firmicutes,4ISBS@91061|Bacilli	Cro/C1-type HTH DNA-binding domain	-	-	-	-	-	HTH_3
2978	SQG45339.1	218495.SUB0005	8.71e-258	707.0	COG0012@1|root,COG0012@2|Bacteria,1TPRK@1239|Firmicutes,4H9SQ@91061|Bacilli	ATPase that binds to both the 70S ribosome and the 50S ribosomal subunit in a nucleotide-independent manner	ychF	GO:0003674,GO:0003824,GO:0005575,GO:0005622,GO:0005623,GO:0005737,GO:0016462,GO:0016787,GO:0016817,GO:0016818,GO:0016887,GO:0017111,GO:0044424,GO:0044464	ko:K06942	-	ko00000,ko03009	MMR_HSR1,YchF-GTPase_C
2978	SQG45340.1	218495.SUB0006	6.05e-133	377.0	COG0193@1|root,COG0193@2|Bacteria,1V3NB@1239|Firmicutes,4HH2Z@91061|Bacilli	The natural substrate for this enzyme may be peptidyl- tRNAs which drop off the ribosome during protein synthesis	pth	GO:0003674,GO:0003824,GO:0004045,GO:0016787,GO:0016788,GO:0052689,GO:0140098,GO:0140101	ko:K01056	-	ko00000,ko01000,ko03012	Pept_tRNA_hydro
2978	SQG45341.1	218495.SUB0007	0.0	2227.0	COG1197@1|root,COG1197@2|Bacteria,1TPF1@1239|Firmicutes,4H9NB@91061|Bacilli	Couples transcription and DNA repair by recognizing RNA polymerase (RNAP) stalled at DNA lesions. Mediates ATP-dependent release of RNAP and its truncated transcript from the DNA, and recruitment of nucleotide excision repair machinery to the damaged site	mfd	-	ko:K03723	ko03420,map03420	ko00000,ko00001,ko01000,ko03400	CarD_CdnL_TRCF,DEAD,Helicase_C,TRCF
2978	SQG45342.1	218495.SUB0008	0.0	901.0	COG2244@1|root,COG2244@2|Bacteria,1TNYX@1239|Firmicutes,4HACG@91061|Bacilli	Membrane protein involved in the export of O-antigen and teichoic acid	yabM	GO:0005575,GO:0005623,GO:0005886,GO:0016020,GO:0044464,GO:0071944	ko:K03328	-	ko00000	Polysacc_synt,Polysacc_synt_C
2978	SQG45343.1	218495.SUB0009	5.83e-52	164.0	COG1188@1|root,COG1188@2|Bacteria,1VEI5@1239|Firmicutes,4HKJJ@91061|Bacilli	Ribosome-associated heat shock protein implicated in the recycling of the 50S subunit (S4 paralog)	yabO	-	-	-	-	S4
2978	SQG45344.1	218495.SUB0010	6.74e-80	237.0	COG2919@1|root,COG2919@2|Bacteria,1VKC5@1239|Firmicutes,4HR53@91061|Bacilli	Septum formation initiator	divIC	-	ko:K13052	-	ko00000,ko03036	DivIC
2978	SQG45345.1	218495.SUB0012	2.18e-305	833.0	COG2367@1|root,COG2367@2|Bacteria,1V9UI@1239|Firmicutes,4HRN8@91061|Bacilli	Beta-lactamase enzyme family	-	-	ko:K01467	ko01501,ko02020,map01501,map02020	ko00000,ko00001,ko00002,ko01000	Beta-lactamase2
2978	SQG45346.1	218495.SUB0013	1.09e-309	843.0	COG0037@1|root,COG0037@2|Bacteria,1TPXP@1239|Firmicutes,4H9ZM@91061|Bacilli	Ligates lysine onto the cytidine present at position 34 of the AUA codon-specific tRNA(Ile) that contains the anticodon CAU, in an ATP-dependent manner. Cytidine is converted to lysidine, thus changing the amino acid specificity of the tRNA from methionine to isoleucine	tilS	-	ko:K04075,ko:K15780	ko00230,ko01100,ko01110,map00230,map01100,map01110	ko00000,ko00001,ko01000,ko03016	ATP_bind_3,TilS,TilS_C
2978	SQG45347.1	218495.SUB0014	2.59e-125	357.0	COG0634@1|root,COG0634@2|Bacteria,1V1C9@1239|Firmicutes,4HFZ2@91061|Bacilli	Belongs to the purine pyrimidine phosphoribosyltransferase family	hpt	GO:0005575,GO:0005622,GO:0005623,GO:0005737,GO:0044424,GO:0044464	ko:K00760,ko:K15780	ko00230,ko00983,ko01100,ko01110,map00230,map00983,map01100,map01110	ko00000,ko00001,ko01000,ko03016	Pribosyltran
2978	SQG45348.1	218495.SUB0015	0.0	1229.0	COG0465@1|root,COG0465@2|Bacteria,1TPTV@1239|Firmicutes,4HAJB@91061|Bacilli	Acts as a processive, ATP-dependent zinc metallopeptidase for both cytoplasmic and membrane proteins. Plays a role in the quality control of integral membrane proteins	ftsH	GO:0003674,GO:0003824,GO:0004176,GO:0005575,GO:0005623,GO:0006508,GO:0006807,GO:0008150,GO:0008152,GO:0008233,GO:0008237,GO:0009056,GO:0009057,GO:0016462,GO:0016787,GO:0016817,GO:0016818,GO:0016887,GO:0017111,GO:0019538,GO:0030163,GO:0030428,GO:0032502,GO:0042623,GO:0043170,GO:0043934,GO:0044238,GO:0044464,GO:0070011,GO:0071704,GO:0140096,GO:1901564,GO:1901565,GO:1901575	ko:K03798	-	ko00000,ko00002,ko01000,ko01002,ko03110	AAA,FtsH_ext,Peptidase_M41
2978	SQG45349.1	218495.SUB0016	2.75e-291	800.0	COG0531@1|root,COG0531@2|Bacteria,1TQ4K@1239|Firmicutes,4HA66@91061|Bacilli	amino acid	yfnA	-	ko:K03294	-	ko00000	AA_permease_2
2978	SQG45350.1	218495.SUB0017	2.67e-184	513.0	COG1792@1|root,COG1792@2|Bacteria	regulation of cell shape	mreC	GO:0003674,GO:0005488,GO:0005515,GO:0005575,GO:0005623,GO:0005886,GO:0005887,GO:0007163,GO:0008150,GO:0008360,GO:0009273,GO:0009987,GO:0016020,GO:0016021,GO:0022603,GO:0022604,GO:0030428,GO:0031224,GO:0031226,GO:0042546,GO:0043621,GO:0044085,GO:0044425,GO:0044459,GO:0044464,GO:0050789,GO:0050793,GO:0050794,GO:0051128,GO:0065007,GO:0065008,GO:0071554,GO:0071840,GO:0071944,GO:0071963	ko:K03570	-	ko00000,ko03036	MreC
2978	SQG45351.1	1321372.AQQB01000069_gene571	0.00048	46.6	2AMJE@1|root,31CF6@2|Bacteria,1U96W@1239|Firmicutes,4IJ90@91061|Bacilli,1WTYB@1307|Streptococcus suis	rod shape-determining protein MreD	-	-	-	-	-	MreD
2978	SQG45352.1	218495.SUB0019	2.31e-153	447.0	COG3883@1|root,COG3942@1|root,COG3883@2|Bacteria,COG3942@2|Bacteria,1VCXB@1239|Firmicutes,4IS6H@91061|Bacilli	CHAP domain	pcsB	-	ko:K21471	-	ko00000,ko01000,ko01002,ko01011	CHAP
2978	SQG45353.1	218495.SUB0020	1.6e-220	609.0	COG0462@1|root,COG0462@2|Bacteria,1TQ6Q@1239|Firmicutes,4HB61@91061|Bacilli	Involved in the biosynthesis of the central metabolite phospho-alpha-D-ribosyl-1-pyrophosphate (PRPP) via the transfer of pyrophosphoryl group from ATP to 1-hydroxyl of ribose-5-phosphate (Rib-5-P)	prs	-	ko:K00948	ko00030,ko00230,ko01100,ko01110,ko01120,ko01130,ko01200,ko01230,map00030,map00230,map01100,map01110,map01120,map01130,map01200,map01230	ko00000,ko00001,ko00002,ko01000	Pribosyl_synth,Pribosyltran_N
2978	SQG45354.1	218495.SUB0021	6.42e-282	770.0	COG0436@1|root,COG0436@2|Bacteria,1TP0J@1239|Firmicutes,4HA13@91061|Bacilli	Aminotransferase	araT	-	ko:K00841	ko00300,ko01100,ko01110,ko01230,map00300,map01100,map01110,map01230	ko00000,ko00001,ko00002,ko01000,ko01007	Aminotran_1_2
2978	SQG45355.1	218495.SUB0022	2.06e-185	515.0	COG1381@1|root,COG1381@2|Bacteria,1UZ19@1239|Firmicutes,4HAHI@91061|Bacilli	Involved in DNA repair and RecF pathway recombination	recO	GO:0005575,GO:0005622,GO:0005623,GO:0006139,GO:0006259,GO:0006281,GO:0006302,GO:0006725,GO:0006807,GO:0006950,GO:0006974,GO:0008150,GO:0008152,GO:0009295,GO:0009987,GO:0033554,GO:0034641,GO:0043170,GO:0043226,GO:0043228,GO:0043229,GO:0043232,GO:0043590,GO:0044237,GO:0044238,GO:0044260,GO:0044424,GO:0044464,GO:0046483,GO:0050896,GO:0051716,GO:0071704,GO:0090304,GO:1901360	ko:K03584	ko03440,map03440	ko00000,ko00001,ko03400	RecO_C,RecO_N
2978	SQG45356.1	218495.SUB0023	1.38e-229	633.0	COG0416@1|root,COG0416@2|Bacteria,1TPXS@1239|Firmicutes,4HA0R@91061|Bacilli	Catalyzes the reversible formation of acyl-phosphate (acyl-PO(4)) from acyl- acyl-carrier-protein (acyl-ACP). This enzyme utilizes acyl-ACP as fatty acyl donor, but not acyl-CoA	plsX	GO:0005575,GO:0005622,GO:0005623,GO:0005737,GO:0044424,GO:0044464	ko:K03621	ko00561,ko00564,ko01100,ko01110,map00561,map00564,map01100,map01110	ko00000,ko00001,ko00002,ko01000,ko01004	FA_synthesis
2978	SQG45357.1	218495.SUB0024	4.73e-47	151.0	COG0236@1|root,COG0236@2|Bacteria	Carrier of the growing fatty acid chain in fatty acid biosynthesis	acpP	GO:0000035,GO:0000036,GO:0003674,GO:0005488,GO:0005575,GO:0005618,GO:0005622,GO:0005623,GO:0005737,GO:0005829,GO:0005886,GO:0005975,GO:0006082,GO:0006139,GO:0006163,GO:0006629,GO:0006631,GO:0006633,GO:0006637,GO:0006643,GO:0006644,GO:0006664,GO:0006725,GO:0006732,GO:0006753,GO:0006790,GO:0006793,GO:0006796,GO:0006807,GO:0008150,GO:0008152,GO:0008610,GO:0008654,GO:0009058,GO:0009117,GO:0009150,GO:0009245,GO:0009247,GO:0009259,GO:0009311,GO:0009312,GO:0009987,GO:0016020,GO:0016051,GO:0016053,GO:0019637,GO:0019693,GO:0019752,GO:0019842,GO:0030312,GO:0031177,GO:0032787,GO:0033218,GO:0033865,GO:0033875,GO:0034032,GO:0034641,GO:0035383,GO:0036094,GO:0040007,GO:0043167,GO:0043168,GO:0043436,GO:0043603,GO:0044237,GO:0044238,GO:0044249,GO:0044255,GO:0044281,GO:0044283,GO:0044424,GO:0044444,GO:0044464,GO:0044620,GO:0046394,GO:0046467,GO:0046483,GO:0046493,GO:0048037,GO:0051186,GO:0051192,GO:0055086,GO:0071704,GO:0071944,GO:0072330,GO:0072341,GO:0072521,GO:0090407,GO:0140104,GO:1901135,GO:1901137,GO:1901269,GO:1901271,GO:1901360,GO:1901564,GO:1901576,GO:1903509	ko:K02078	-	ko00000,ko00001	PP-binding
2978	SQG45358.1	218495.SUB0025	1.52e-161	453.0	COG0152@1|root,COG0152@2|Bacteria,1TP11@1239|Firmicutes,4H9U8@91061|Bacilli	Belongs to the SAICAR synthetase family	purC	-	ko:K01923	ko00230,ko01100,ko01110,ko01130,map00230,map01100,map01110,map01130	ko00000,ko00001,ko00002,ko01000	SAICAR_synt
2978	SQG45359.1	218495.SUB0026	0.0	2394.0	COG0046@1|root,COG0047@1|root,COG0046@2|Bacteria,COG0047@2|Bacteria,1TPAS@1239|Firmicutes,4HB3N@91061|Bacilli	Part of the phosphoribosylformylglycinamidine synthase complex involved in the purines biosynthetic pathway. Catalyzes the ATP-dependent conversion of formylglycinamide ribonucleotide (FGAR) and glutamine to yield formylglycinamidine ribonucleotide (FGAM) and glutamate. The FGAM synthase complex is composed of three subunits. PurQ produces an ammonia molecule by converting glutamine to glutamate. PurL transfers the ammonia molecule to FGAR to form FGAM in an ATP-dependent manner. PurS interacts with PurQ and PurL and is thought to assist in the transfer of the ammonia molecule from PurQ to PurL	purL	-	ko:K01952	ko00230,ko01100,ko01110,ko01130,map00230,map01100,map01110,map01130	ko00000,ko00001,ko00002,ko01000	AIRS_C,GATase_5
2978	SQG45360.1	218495.SUB0027	0.0	967.0	COG0034@1|root,COG0034@2|Bacteria,1TPH3@1239|Firmicutes,4HAXU@91061|Bacilli	Catalyzes the formation of phosphoribosylamine from phosphoribosylpyrophosphate (PRPP) and glutamine	purF	-	ko:K00764	ko00230,ko00250,ko01100,ko01110,ko01130,map00230,map00250,map01100,map01110,map01130	ko00000,ko00001,ko00002,ko01000,ko01002	GATase_6,GATase_7,Pribosyltran
2978	SQG45361.1	218495.SUB0028	3.58e-239	658.0	COG0150@1|root,COG0150@2|Bacteria,1TP9J@1239|Firmicutes,4HABW@91061|Bacilli	Phosphoribosylformylglycinamidine cyclo-ligase	purM	-	ko:K01933	ko00230,ko01100,ko01110,ko01130,map00230,map01100,map01110,map01130	ko00000,ko00001,ko00002,ko01000	AIRS,AIRS_C
2978	SQG45362.1	218495.SUB0029	1.09e-128	365.0	COG0299@1|root,COG0299@2|Bacteria,1V3RJ@1239|Firmicutes,4HGY5@91061|Bacilli	Catalyzes the transfer of a formyl group from 10- formyltetrahydrofolate to 5-phospho-ribosyl-glycinamide (GAR), producing 5-phospho-ribosyl-N-formylglycinamide (FGAR) and tetrahydrofolate	purN	-	ko:K11175	ko00230,ko00670,ko01100,ko01110,ko01130,map00230,map00670,map01100,map01110,map01130	ko00000,ko00001,ko00002,ko01000	Formyl_trans_N
2978	SQG45363.1	218495.SUB0030	0.0	996.0	COG0138@1|root,COG0138@2|Bacteria,1TPQ5@1239|Firmicutes,4H9YY@91061|Bacilli	Bifunctional purine biosynthesis protein PurH	purH	-	ko:K00602	ko00230,ko00670,ko01100,ko01110,ko01130,ko01523,map00230,map00670,map01100,map01110,map01130,map01523	ko00000,ko00001,ko00002,ko01000,ko04147	AICARFT_IMPCHas,MGS
2978	SQG45364.1	218495.SUB0038	5.85e-169	472.0	COG2188@1|root,COG2188@2|Bacteria,1V1YY@1239|Firmicutes,4HGGR@91061|Bacilli	UTRA	XK27_08435	-	ko:K03710	-	ko00000,ko03000	GntR,UTRA
2978	SQG45365.1	218495.SUB0039	6.36e-277	758.0	COG2222@1|root,COG2222@2|Bacteria,1TQUT@1239|Firmicutes,4HDKQ@91061|Bacilli	Sugar isomerase, AgaS family	agaS	-	ko:K02082	-	ko00000,ko01000	SIS
2978	SQG45366.1	218495.SUB0040	1.14e-228	630.0	COG3684@1|root,COG3684@2|Bacteria,1TQRR@1239|Firmicutes,4HBS9@91061|Bacilli	Belongs to the aldolase LacD family	lacD	GO:0003674,GO:0003824,GO:0006082,GO:0006790,GO:0008150,GO:0008152,GO:0009056,GO:0009987,GO:0016054,GO:0016829,GO:0016830,GO:0016832,GO:0044237,GO:0044248,GO:0044273,GO:0044281,GO:0044282,GO:0061595,GO:0071704,GO:1901135,GO:1901136,GO:1901575,GO:1902776,GO:1902777	ko:K01635	ko00052,ko01100,ko02024,map00052,map01100,map02024	ko00000,ko00001,ko01000	DeoC
2978	SQG45367.1	218495.SUB0041	2.8e-169	473.0	COG2188@1|root,COG2188@2|Bacteria	DNA-binding transcription factor activity	XK27_08440	-	-	-	-	GntR,UTRA
2978	SQG45368.1	218495.SUB0042	0.0	1221.0	COG1874@1|root,COG1874@2|Bacteria,1TSHK@1239|Firmicutes,4HBAR@91061|Bacilli	Belongs to the glycosyl hydrolase 35 family	bgaC	-	ko:K12308	ko00052,map00052	ko00000,ko00001,ko01000	Glyco_hydro_35
2978	SQG45369.1	218495.SUB0043	7.63e-107	308.0	COG3444@1|root,COG3444@2|Bacteria,1V46G@1239|Firmicutes,4HVT4@91061|Bacilli	PTS system sorbose subfamily IIB component	levE	-	ko:K02794	ko00051,ko00520,ko01100,ko02060,map00051,map00520,map01100,map02060	ko00000,ko00001,ko00002,ko01000,ko02000	PTSIIB_sorb
2978	SQG45370.1	218495.SUB0044	6.91e-202	560.0	COG3715@1|root,COG3715@2|Bacteria,1TSX0@1239|Firmicutes,4HBRB@91061|Bacilli	iic component	-	-	ko:K02795	ko00051,ko00520,ko01100,ko02060,map00051,map00520,map01100,map02060	ko00000,ko00001,ko00002,ko02000	EII-Sor
2978	SQG45371.1	218495.SUB0045	2.6e-191	531.0	COG3716@1|root,COG3716@2|Bacteria,1UMKU@1239|Firmicutes,4HC75@91061|Bacilli	mannose fructose sorbose family IID component	-	-	ko:K02796	ko00051,ko00520,ko01100,ko02060,map00051,map00520,map01100,map02060	ko00000,ko00001,ko00002,ko02000	EIID-AGA
2978	SQG45372.1	218495.SUB0046	7.28e-92	268.0	COG2893@1|root,COG2893@2|Bacteria,1VB8U@1239|Firmicutes,4HW7K@91061|Bacilli	PTS system fructose IIA component	-	-	ko:K02793	ko00051,ko00520,ko01100,ko02060,map00051,map00520,map01100,map02060	ko00000,ko00001,ko00002,ko01000,ko02000	EIIA-man
2978	SQG45373.1	218495.SUB0048	2.17e-267	731.0	COG3942@1|root,COG3942@2|Bacteria,1VUNU@1239|Firmicutes,4HVY0@91061|Bacilli	CHAP domain	-	-	-	-	-	CHAP,SH3_5
2978	SQG45375.1	218495.SUB0053	1.36e-304	830.0	COG0151@1|root,COG0151@2|Bacteria,1UHN9@1239|Firmicutes,4HA70@91061|Bacilli	Belongs to the GARS family	purD	-	ko:K01945	ko00230,ko01100,ko01110,ko01130,map00230,map01100,map01110,map01130	ko00000,ko00001,ko00002,ko01000	GARS_A,GARS_C,GARS_N
2978	SQG45376.1	218495.SUB0054	1.48e-104	303.0	COG0041@1|root,COG0041@2|Bacteria,1V1MV@1239|Firmicutes,4HFR7@91061|Bacilli	Catalyzes the conversion of N5-carboxyaminoimidazole ribonucleotide (N5-CAIR) to 4-carboxy-5-aminoimidazole ribonucleotide (CAIR)	purE	-	ko:K01588	ko00230,ko01100,ko01110,ko01130,map00230,map01100,map01110,map01130	ko00000,ko00001,ko00002,ko01000	AIRC
2978	SQG45377.1	218495.SUB0055	1.81e-252	693.0	COG0026@1|root,COG0026@2|Bacteria,1TQCD@1239|Firmicutes,4H9M5@91061|Bacilli	Catalyzes the ATP-dependent conversion of 5- aminoimidazole ribonucleotide (AIR) and HCO(3)(-) to N5- carboxyaminoimidazole ribonucleotide (N5-CAIR)	purK	GO:0005575,GO:0005622,GO:0005623,GO:0005737,GO:0005829,GO:0044424,GO:0044444,GO:0044464	ko:K01589	ko00230,ko01100,ko01110,ko01130,map00230,map01100,map01110,map01130	ko00000,ko00001,ko00002,ko01000	2-Hacid_dh_C,ATP-grasp
2978	SQG45378.1	218495.SUB0056	1.23e-312	851.0	COG0015@1|root,COG0015@2|Bacteria,1TPMM@1239|Firmicutes,4HACW@91061|Bacilli	Belongs to the lyase 1 family. Adenylosuccinate lyase subfamily	purB	GO:0003674,GO:0003824,GO:0004018,GO:0006139,GO:0006163,GO:0006164,GO:0006167,GO:0006725,GO:0006753,GO:0006793,GO:0006796,GO:0006807,GO:0008150,GO:0008152,GO:0009058,GO:0009117,GO:0009123,GO:0009124,GO:0009126,GO:0009127,GO:0009150,GO:0009152,GO:0009156,GO:0009161,GO:0009165,GO:0009167,GO:0009168,GO:0009259,GO:0009260,GO:0009987,GO:0016829,GO:0016840,GO:0016842,GO:0017144,GO:0018130,GO:0019438,GO:0019637,GO:0019693,GO:0034641,GO:0034654,GO:0044208,GO:0044237,GO:0044238,GO:0044249,GO:0044271,GO:0044281,GO:0046033,GO:0046390,GO:0046483,GO:0055086,GO:0070626,GO:0071704,GO:0072521,GO:0072522,GO:0090407,GO:1901135,GO:1901137,GO:1901293,GO:1901360,GO:1901362,GO:1901564,GO:1901566,GO:1901576	ko:K01756	ko00230,ko00250,ko01100,ko01110,ko01130,map00230,map00250,map01100,map01110,map01130	ko00000,ko00001,ko00002,ko01000	ADSL_C,Lyase_1
2978	SQG45379.1	218495.SUB0057	1.06e-205	571.0	COG1396@1|root,COG1396@2|Bacteria,1UYX5@1239|Firmicutes	transcriptional regulators	-	-	ko:K20342,ko:K20391	ko02024,map02024	ko00000,ko00001,ko03000	HTH_19,HTH_3,TPR_12,TPR_8
2978	SQG45381.1	218495.SUB0059	3.06e-237	652.0	COG2255@1|root,COG2255@2|Bacteria,1TR47@1239|Firmicutes,4HBMW@91061|Bacilli	The RuvA-RuvB complex in the presence of ATP renatures cruciform structure in supercoiled DNA with palindromic sequence, indicating that it may promote strand exchange reactions in homologous recombination. RuvAB is a helicase that mediates the Holliday junction migration by localized denaturation and reannealing	ruvB	-	ko:K03551	ko03440,map03440	ko00000,ko00001,ko01000,ko03400	RuvB_C,RuvB_N
2978	SQG45382.1	218495.SUB0060	6.87e-105	302.0	COG0394@1|root,COG0394@2|Bacteria,1V6SG@1239|Firmicutes,4HIZN@91061|Bacilli	Belongs to the low molecular weight phosphotyrosine protein phosphatase family	ptpA	-	ko:K01104	-	ko00000,ko01000	LMWPc
2978	SQG45383.1	218495.SUB0061	1.7e-30	112.0	COG4642@1|root,COG4642@2|Bacteria,1V30F@1239|Firmicutes,4I214@91061|Bacilli	protein conserved in bacteria	-	-	-	-	-	MORN
2978	SQG45384.1	218495.SUB0062	0.0	1134.0	COG1835@1|root,COG1835@2|Bacteria,1U6DU@1239|Firmicutes,4H9XT@91061|Bacilli	Acyltransferase	XK27_09800	-	-	-	-	Acyl_transf_3
2978	SQG45385.1	218495.SUB0063	0.0	1730.0	COG1012@1|root,COG1454@1|root,COG1012@2|Bacteria,COG1454@2|Bacteria,1TPB4@1239|Firmicutes,4HAN8@91061|Bacilli	belongs to the iron- containing alcohol dehydrogenase family	adhE	-	ko:K04072	ko00010,ko00071,ko00350,ko00620,ko00625,ko00626,ko00650,ko01100,ko01110,ko01120,ko01130,ko01220,map00010,map00071,map00350,map00620,map00625,map00626,map00650,map01100,map01110,map01120,map01130,map01220	ko00000,ko00001,ko01000	Aldedh,Fe-ADH
2978	SQG45387.1	218495.SUB0065	0.0	948.0	COG0498@1|root,COG0498@2|Bacteria,1TPR0@1239|Firmicutes,4H9R7@91061|Bacilli	Threonine synthase	thrC	-	ko:K01733	ko00260,ko00750,ko01100,ko01110,ko01120,ko01230,map00260,map00750,map01100,map01110,map01120,map01230	ko00000,ko00001,ko00002,ko01000	PALP,Thr_synth_N
2978	SQG45388.1	218495.SUB0066	6.57e-276	758.0	COG0534@1|root,COG0534@2|Bacteria,1TQMT@1239|Firmicutes,4H9Y2@91061|Bacilli	Mate efflux family protein	norN	-	-	-	-	MatE
2978	SQG45389.1	1123299.AUKZ01000006_gene966	4.29e-64	196.0	COG0051@1|root,COG0051@2|Bacteria,1V6C9@1239|Firmicutes,4HIKH@91061|Bacilli	Involved in the binding of tRNA to the ribosomes	rpsJ	GO:0003674,GO:0003735,GO:0005198,GO:0005575,GO:0005622,GO:0005623,GO:0005737,GO:0005840,GO:0006412,GO:0006518,GO:0006807,GO:0008150,GO:0008152,GO:0009058,GO:0009059,GO:0009987,GO:0010467,GO:0015935,GO:0019538,GO:0032991,GO:0034641,GO:0034645,GO:0043043,GO:0043170,GO:0043226,GO:0043228,GO:0043229,GO:0043232,GO:0043603,GO:0043604,GO:0044237,GO:0044238,GO:0044249,GO:0044260,GO:0044267,GO:0044271,GO:0044391,GO:0044422,GO:0044424,GO:0044444,GO:0044446,GO:0044464,GO:0071704,GO:1901564,GO:1901566,GO:1901576,GO:1990904	ko:K02946	ko03010,map03010	br01610,ko00000,ko00001,ko00002,ko03011	Ribosomal_S10
2978	SQG45390.1	218495.SUB0068	3.17e-142	402.0	COG0087@1|root,COG0087@2|Bacteria,1TPFT@1239|Firmicutes,4HAEN@91061|Bacilli	One of the primary rRNA binding proteins, it binds directly near the 3'-end of the 23S rRNA, where it nucleates assembly of the 50S subunit	rplC	GO:0008150,GO:0009893,GO:0010468,GO:0010604,GO:0010628,GO:0019219,GO:0019222,GO:0031323,GO:0031325,GO:0044087,GO:0044089,GO:0045935,GO:0048518,GO:0048522,GO:0050789,GO:0050794,GO:0051171,GO:0051173,GO:0051252,GO:0051254,GO:0060255,GO:0065007,GO:0080090,GO:0090069,GO:0090070,GO:2000232,GO:2000234	ko:K02906	ko03010,map03010	br01610,ko00000,ko00001,ko00002,ko03011	Ribosomal_L3
2978	SQG45391.1	218495.SUB0069	2.13e-135	384.0	COG0088@1|root,COG0088@2|Bacteria,1TPGW@1239|Firmicutes,4HB01@91061|Bacilli	Forms part of the polypeptide exit tunnel	rplD	GO:0003674,GO:0003676,GO:0003723,GO:0003735,GO:0005198,GO:0005488,GO:0005575,GO:0005622,GO:0005623,GO:0005737,GO:0005829,GO:0005840,GO:0006412,GO:0006518,GO:0006807,GO:0008150,GO:0008152,GO:0009058,GO:0009059,GO:0009987,GO:0010467,GO:0015934,GO:0019538,GO:0022625,GO:0022626,GO:0032991,GO:0034641,GO:0034645,GO:0043043,GO:0043170,GO:0043226,GO:0043228,GO:0043229,GO:0043232,GO:0043603,GO:0043604,GO:0044237,GO:0044238,GO:0044249,GO:0044260,GO:0044267,GO:0044271,GO:0044391,GO:0044422,GO:0044424,GO:0044444,GO:0044445,GO:0044446,GO:0044464,GO:0071704,GO:0097159,GO:1901363,GO:1901564,GO:1901566,GO:1901576,GO:1990904	ko:K02926	ko03010,map03010	br01610,ko00000,ko00001,ko00002,ko03011	Ribosomal_L4
2978	SQG45392.1	218495.SUB0070	8.52e-60	184.0	COG0089@1|root,COG0089@2|Bacteria,1VA4W@1239|Firmicutes,4HKCV@91061|Bacilli	One of the early assembly proteins it binds 23S rRNA. One of the proteins that surrounds the polypeptide exit tunnel on the outside of the ribosome. Forms the main docking site for trigger factor binding to the ribosome	rplW	GO:0000027,GO:0003674,GO:0003676,GO:0003723,GO:0003735,GO:0005198,GO:0005488,GO:0005575,GO:0005622,GO:0005623,GO:0005737,GO:0005829,GO:0005840,GO:0006412,GO:0006518,GO:0006807,GO:0006996,GO:0008150,GO:0008152,GO:0009058,GO:0009059,GO:0009987,GO:0010467,GO:0015934,GO:0016043,GO:0019538,GO:0022607,GO:0022613,GO:0022618,GO:0022625,GO:0022626,GO:0032991,GO:0034622,GO:0034641,GO:0034645,GO:0042254,GO:0042255,GO:0042273,GO:0043043,GO:0043170,GO:0043226,GO:0043228,GO:0043229,GO:0043232,GO:0043603,GO:0043604,GO:0043933,GO:0044085,GO:0044237,GO:0044238,GO:0044249,GO:0044260,GO:0044267,GO:0044271,GO:0044391,GO:0044422,GO:0044424,GO:0044444,GO:0044445,GO:0044446,GO:0044464,GO:0065003,GO:0070925,GO:0071704,GO:0071826,GO:0071840,GO:0097159,GO:1901363,GO:1901564,GO:1901566,GO:1901576,GO:1990904	ko:K02892	ko03010,map03010	br01610,ko00000,ko00001,ko00002,ko03011	Ribosomal_L23
2978	SQG45393.1	218495.SUB0071	1.02e-195	543.0	COG0090@1|root,COG0090@2|Bacteria,1TP9X@1239|Firmicutes,4HAE8@91061|Bacilli	One of the primary rRNA binding proteins. Required for association of the 30S and 50S subunits to form the 70S ribosome, for tRNA binding and peptide bond formation. It has been suggested to have peptidyltransferase activity	rplB	GO:0002181,GO:0003674,GO:0003676,GO:0003723,GO:0003735,GO:0005198,GO:0005488,GO:0005575,GO:0005622,GO:0005623,GO:0005737,GO:0005829,GO:0005840,GO:0006412,GO:0006518,GO:0006807,GO:0008150,GO:0008152,GO:0009058,GO:0009059,GO:0009987,GO:0010467,GO:0015934,GO:0019538,GO:0022625,GO:0022626,GO:0032991,GO:0034641,GO:0034645,GO:0043043,GO:0043170,GO:0043226,GO:0043228,GO:0043229,GO:0043232,GO:0043603,GO:0043604,GO:0044237,GO:0044238,GO:0044249,GO:0044260,GO:0044267,GO:0044271,GO:0044391,GO:0044422,GO:0044424,GO:0044444,GO:0044445,GO:0044446,GO:0044464,GO:0071704,GO:0097159,GO:1901363,GO:1901564,GO:1901566,GO:1901576,GO:1990904	ko:K02886	ko03010,map03010	br01610,ko00000,ko00001,ko00002,ko03011	Ribosomal_L2,Ribosomal_L2_C
2978	SQG45394.1	1000570.HMPREF9966_1567	2.83e-62	190.0	COG0185@1|root,COG0185@2|Bacteria,1V6CX@1239|Firmicutes,4HIG0@91061|Bacilli,42DQ5@671232|Streptococcus anginosus group	Protein S19 forms a complex with S13 that binds strongly to the 16S ribosomal RNA	rpsS	GO:0000028,GO:0003674,GO:0003735,GO:0005198,GO:0005575,GO:0005622,GO:0005623,GO:0005737,GO:0005829,GO:0005840,GO:0006996,GO:0008150,GO:0009987,GO:0015935,GO:0016043,GO:0022607,GO:0022613,GO:0022618,GO:0022626,GO:0022627,GO:0032991,GO:0034622,GO:0042254,GO:0042255,GO:0042274,GO:0043226,GO:0043228,GO:0043229,GO:0043232,GO:0043933,GO:0044085,GO:0044391,GO:0044422,GO:0044424,GO:0044444,GO:0044445,GO:0044446,GO:0044464,GO:0065003,GO:0070925,GO:0071826,GO:0071840,GO:1990904	ko:K02965	ko03010,map03010	br01610,ko00000,ko00001,ko00002,ko03011	Ribosomal_S19
