key	query	seed_ortholog	evalue	score	eggNOG_OGs	description	preferred_name	GOs	KEGG_ko	KEGG_pathway	brite	PFAMs
2978	SQG45825.1	218495.SUB0442	5.51e-205	567.0	COG0313@1|root,COG0313@2|Bacteria,1TP6U@1239|Firmicutes,4HAH8@91061|Bacilli	Catalyzes the 2'-O-methylation of the ribose of cytidine 1402 (C1402) in 16S rRNA	rsmI	GO:0000154,GO:0000451,GO:0000453,GO:0001510,GO:0006139,GO:0006364,GO:0006396,GO:0006725,GO:0006807,GO:0008150,GO:0008152,GO:0009451,GO:0009987,GO:0010467,GO:0016070,GO:0016072,GO:0022613,GO:0031167,GO:0032259,GO:0034470,GO:0034641,GO:0034660,GO:0042254,GO:0043170,GO:0043412,GO:0043414,GO:0044085,GO:0044237,GO:0044238,GO:0044260,GO:0046483,GO:0071704,GO:0071840,GO:0090304,GO:1901360	ko:K07056	-	ko00000,ko01000,ko03009	TP_methylase
2978	SQG45826.1	663952.SDD27957_02185	2.82e-62	193.0	29R8K@1|root,30CA0@2|Bacteria,1U9FU@1239|Firmicutes,4IJJF@91061|Bacilli,1MA2B@119603|Streptococcus dysgalactiae group	-	-	-	-	-	-	-
2978	SQG45827.1	218495.SUB0444	1.2e-147	416.0	COG3142@1|root,COG3142@2|Bacteria,1TQYI@1239|Firmicutes,4HE1E@91061|Bacilli	Participates in the control of copper homeostasis	cutC	-	ko:K06201	-	ko00000	CutC
2978	SQG45828.1	218495.SUB0445	2.72e-262	718.0	COG1932@1|root,COG1932@2|Bacteria,1TP6Y@1239|Firmicutes,4HATT@91061|Bacilli	Catalyzes the reversible conversion of 3- phosphohydroxypyruvate to phosphoserine and of 3-hydroxy-2-oxo-4- phosphonooxybutanoate to phosphohydroxythreonine	serC	GO:0003674,GO:0003824,GO:0004648,GO:0005575,GO:0005622,GO:0005623,GO:0005737,GO:0006082,GO:0006520,GO:0006563,GO:0006564,GO:0006807,GO:0008150,GO:0008152,GO:0008483,GO:0008652,GO:0009058,GO:0009069,GO:0009070,GO:0009987,GO:0016053,GO:0016740,GO:0016769,GO:0019752,GO:0043436,GO:0044237,GO:0044238,GO:0044249,GO:0044281,GO:0044283,GO:0044424,GO:0044464,GO:0046394,GO:0071704,GO:1901564,GO:1901566,GO:1901576,GO:1901605,GO:1901607	ko:K00831	ko00260,ko00680,ko00750,ko01100,ko01120,ko01130,ko01200,ko01230,map00260,map00680,map00750,map01100,map01120,map01130,map01200,map01230	ko00000,ko00001,ko00002,ko01000,ko01007	Aminotran_5
2978	SQG45829.1	218495.SUB0446	3.4e-131	372.0	COG1247@1|root,COG1247@2|Bacteria,1V40A@1239|Firmicutes,4HPEZ@91061|Bacilli	acetyltransferase, GNAT family	-	-	-	-	-	Acetyltransf_1
2978	SQG45830.1	218495.SUB0447	3.88e-278	761.0	COG0111@1|root,COG0111@2|Bacteria,1V410@1239|Firmicutes,4H9PH@91061|Bacilli	Belongs to the D-isomer specific 2-hydroxyacid dehydrogenase family	serA	-	ko:K00058	ko00260,ko00680,ko01100,ko01120,ko01130,ko01200,ko01230,map00260,map00680,map01100,map01120,map01130,map01200,map01230	ko00000,ko00001,ko00002,ko01000,ko04147	2-Hacid_dh,2-Hacid_dh_C,ACT_4
2978	SQG45831.1	218495.SUB0448	5.43e-115	330.0	COG0350@1|root,COG0350@2|Bacteria,1V2MB@1239|Firmicutes,4IPK4@91061|Bacilli	Involved in the cellular defense against the biological effects of O6-methylguanine (O6-MeG) and O4-methylthymine (O4-MeT) in DNA. Repairs the methylated nucleobase in DNA by stoichiometrically transferring the methyl group to a cysteine residue in the enzyme. This is a suicide reaction the enzyme is irreversibly inactivated	ogt	-	ko:K00567	-	ko00000,ko01000,ko03400	DNA_binding_1,Methyltransf_1N
2978	SQG45832.1	218495.SUB0449	2.14e-80	238.0	COG1393@1|root,COG1393@2|Bacteria,1VA5Q@1239|Firmicutes,4HKQQ@91061|Bacilli	Belongs to the ArsC family	yusI	-	ko:K00537	-	ko00000,ko01000	ArsC,Glutaredoxin
2978	SQG45833.1	218495.SUB0450	4.71e-208	576.0	COG3965@1|root,COG3965@2|Bacteria	Cation efflux family	-	-	-	-	-	Cation_efflux
2978	SQG45834.1	218495.SUB0451	2.94e-97	282.0	COG2764@1|root,COG2764@2|Bacteria,1V3WE@1239|Firmicutes,4HHHS@91061|Bacilli	Protein conserved in bacteria	phnB	-	ko:K04750	-	ko00000	3-dmu-9_3-mt,Glyoxalase
2978	SQG45835.1	218495.SUB0452	4.73e-85	250.0	COG0346@1|root,COG0346@2|Bacteria,1V6MB@1239|Firmicutes,4HHPH@91061|Bacilli	glyoxalase	glxI	-	ko:K01759	ko00620,map00620	ko00000,ko00001,ko01000	Glyoxalase
2978	SQG45836.1	218495.SUB0453	5.75e-152	427.0	COG4912@1|root,COG4912@2|Bacteria,1V4WB@1239|Firmicutes	DNA alkylation repair enzyme	alkD	-	-	-	-	DNA_alkylation
2978	SQG45837.1	218495.SUB0454	1.78e-204	565.0	COG0708@1|root,COG0708@2|Bacteria,1TPFB@1239|Firmicutes,4HAIU@91061|Bacilli	exodeoxyribonuclease III	xth	GO:0003674,GO:0003824,GO:0003906,GO:0004518,GO:0004527,GO:0004529,GO:0004536,GO:0005575,GO:0005622,GO:0005623,GO:0005737,GO:0006139,GO:0006259,GO:0006281,GO:0006284,GO:0006725,GO:0006807,GO:0006950,GO:0006974,GO:0008150,GO:0008152,GO:0008296,GO:0008309,GO:0008311,GO:0008408,GO:0009987,GO:0016787,GO:0016788,GO:0016796,GO:0016895,GO:0033554,GO:0034641,GO:0043170,GO:0044237,GO:0044238,GO:0044260,GO:0044424,GO:0044464,GO:0046483,GO:0050896,GO:0051716,GO:0071704,GO:0090304,GO:0090305,GO:0140097,GO:1901360	ko:K01142	ko03410,map03410	ko00000,ko00001,ko01000,ko03400	Exo_endo_phos
2978	SQG45838.1	218495.SUB0455	1.4e-58	181.0	COG0640@1|root,COG0640@2|Bacteria,1VA3M@1239|Firmicutes,4HKWM@91061|Bacilli	Transcriptional	sdpR	GO:0001067,GO:0003674,GO:0003676,GO:0003677,GO:0005488,GO:0006355,GO:0008150,GO:0009889,GO:0010468,GO:0010556,GO:0019219,GO:0019222,GO:0031323,GO:0031326,GO:0044212,GO:0050789,GO:0050794,GO:0051171,GO:0051252,GO:0060255,GO:0065007,GO:0080090,GO:0097159,GO:1901363,GO:1903506,GO:2000112,GO:2001141	-	-	-	HTH_20,HTH_5
2978	SQG45839.1	218495.SUB0456	9.5e-149	418.0	COG5658@1|root,COG5658@2|Bacteria,1V5Y5@1239|Firmicutes,4IR7T@91061|Bacilli	Protein of unknown function (DUF1648)	-	-	-	-	-	DUF1648,SdpI
2978	SQG45840.1	218495.SUB0457	0.0	1064.0	2BW99@1|root,2Z7PD@2|Bacteria,1TQFA@1239|Firmicutes,4HC1J@91061|Bacilli	Psort location CytoplasmicMembrane, score	XK27_11280	-	-	-	-	-
2978	SQG45841.1	218495.SUB0458	4.82e-166	464.0	COG3619@1|root,COG3619@2|Bacteria,1VEWY@1239|Firmicutes,4HPCN@91061|Bacilli	Protein of unknown function (DUF1275)	XK27_09195	-	-	-	-	DUF1275
2978	SQG45842.1	218495.SUB0459	0.0	1328.0	COG0073@1|root,COG0143@1|root,COG0073@2|Bacteria,COG0143@2|Bacteria,1TPA1@1239|Firmicutes,4H9VC@91061|Bacilli	Is required not only for elongation of protein synthesis but also for the initiation of all mRNA translation through initiator tRNA(fMet) aminoacylation	metG	GO:0003674,GO:0003824,GO:0004812,GO:0004825,GO:0005575,GO:0005622,GO:0005623,GO:0005737,GO:0006082,GO:0006139,GO:0006399,GO:0006412,GO:0006418,GO:0006431,GO:0006518,GO:0006520,GO:0006725,GO:0006807,GO:0008150,GO:0008152,GO:0009058,GO:0009059,GO:0009987,GO:0010467,GO:0016070,GO:0016874,GO:0016875,GO:0019538,GO:0019752,GO:0034641,GO:0034645,GO:0034660,GO:0043038,GO:0043039,GO:0043043,GO:0043170,GO:0043436,GO:0043603,GO:0043604,GO:0044237,GO:0044238,GO:0044249,GO:0044260,GO:0044267,GO:0044271,GO:0044281,GO:0044424,GO:0044464,GO:0046483,GO:0071704,GO:0090304,GO:0140098,GO:0140101,GO:1901360,GO:1901564,GO:1901566,GO:1901576	ko:K01874	ko00450,ko00970,map00450,map00970	ko00000,ko00001,ko00002,ko01000,ko01007,ko03016	Anticodon_1,tRNA-synt_1g,tRNA_bind
2978	SQG45843.1	1123301.KB904188_gene503	3.79e-27	108.0	COG2898@1|root,COG2898@2|Bacteria,1TQI2@1239|Firmicutes,4HBHU@91061|Bacilli	Catalyzes the transfer of a lysyl group from L-lysyl- tRNA(Lys) to membrane-bound phosphatidylglycerol (PG), which produces lysylphosphatidylglycerol (LPG), a major component of the bacterial membrane with a positive net charge. LPG synthesis contributes to bacterial virulence as it is involved in the resistance mechanism against cationic antimicrobial peptides (CAMP) produces by the host's immune system (defensins, cathelicidins) and by the competing microorganisms	mprF	GO:0005575,GO:0005623,GO:0005886,GO:0016020,GO:0044464,GO:0071944	ko:K14205	ko01503,ko02020,ko05150,map01503,map02020,map05150	ko00000,ko00001,ko00002,ko01000,ko01504	DUF2156,LPG_synthase_TM
2978	SQG45844.1	910313.HMPREF9320_0241	7.07e-54	186.0	COG2898@1|root,COG2898@2|Bacteria,1TQI2@1239|Firmicutes,4HBHU@91061|Bacilli	Catalyzes the transfer of a lysyl group from L-lysyl- tRNA(Lys) to membrane-bound phosphatidylglycerol (PG), which produces lysylphosphatidylglycerol (LPG), a major component of the bacterial membrane with a positive net charge. LPG synthesis contributes to bacterial virulence as it is involved in the resistance mechanism against cationic antimicrobial peptides (CAMP) produces by the host's immune system (defensins, cathelicidins) and by the competing microorganisms	mprF	GO:0005575,GO:0005623,GO:0005886,GO:0016020,GO:0044464,GO:0071944	ko:K14205	ko01503,ko02020,ko05150,map01503,map02020,map05150	ko00000,ko00001,ko00002,ko01000,ko01504	DUF2156,LPG_synthase_TM
2978	SQG45845.1	218495.SUB0462	1.78e-300	822.0	COG1114@1|root,COG1114@2|Bacteria,1TQIS@1239|Firmicutes,4HAKA@91061|Bacilli	Component of the transport system for branched-chain amino acids	brnQ	GO:0003333,GO:0003674,GO:0005215,GO:0005304,GO:0005342,GO:0005575,GO:0005623,GO:0005886,GO:0006810,GO:0006811,GO:0006812,GO:0006820,GO:0006855,GO:0006865,GO:0008150,GO:0008324,GO:0008509,GO:0008514,GO:0015075,GO:0015171,GO:0015175,GO:0015179,GO:0015188,GO:0015190,GO:0015238,GO:0015318,GO:0015658,GO:0015711,GO:0015803,GO:0015804,GO:0015807,GO:0015818,GO:0015820,GO:0015829,GO:0015849,GO:0015893,GO:0016020,GO:0022857,GO:0034220,GO:0042221,GO:0042493,GO:0044464,GO:0046942,GO:0046943,GO:0050896,GO:0051179,GO:0051234,GO:0055085,GO:0071702,GO:0071705,GO:0071944,GO:0098655,GO:0098656,GO:1902475,GO:1903785,GO:1903825,GO:1905039	ko:K03311	-	ko00000	Branch_AA_trans
2978	SQG45847.1	218495.SUB0464	2.56e-54	169.0	2E68Y@1|root,330X0@2|Bacteria,1VFBF@1239|Firmicutes,4HP3V@91061|Bacilli	Protein of unknown function (DUF2829)	XK27_01315	-	-	-	-	DUF2829
2978	SQG45848.1	218495.SUB0465	1.05e-161	453.0	COG1028@1|root,COG1028@2|Bacteria,1U8IC@1239|Firmicutes,4HC26@91061|Bacilli	Oxidoreductase, short chain dehydrogenase reductase family protein	fabG	-	ko:K00059	ko00061,ko00333,ko00780,ko01040,ko01100,ko01130,ko01212,map00061,map00333,map00780,map01040,map01100,map01130,map01212	ko00000,ko00001,ko00002,ko01000,ko01004	adh_short,adh_short_C2
2978	SQG45849.1	218495.SUB0466	5.39e-224	618.0	COG0673@1|root,COG0673@2|Bacteria,1TQSS@1239|Firmicutes,4HV6B@91061|Bacilli	Oxidoreductase family, NAD-binding Rossmann fold	-	-	-	-	-	GFO_IDH_MocA,GFO_IDH_MocA_C
2978	SQG45850.1	218495.SUB0468	1.99e-314	858.0	COG1207@1|root,COG1207@2|Bacteria,1TP88@1239|Firmicutes,4H9V5@91061|Bacilli	Catalyzes the last two sequential reactions in the de novo biosynthetic pathway for UDP-N-acetylglucosamine (UDP- GlcNAc). The C-terminal domain catalyzes the transfer of acetyl group from acetyl coenzyme A to glucosamine-1-phosphate (GlcN-1-P) to produce N-acetylglucosamine-1-phosphate (GlcNAc-1-P), which is converted into UDP-GlcNAc by the transfer of uridine 5- monophosphate (from uridine 5-triphosphate), a reaction catalyzed by the N-terminal domain	glmU	GO:0000270,GO:0000271,GO:0003674,GO:0003824,GO:0003977,GO:0005975,GO:0005976,GO:0006022,GO:0006023,GO:0006024,GO:0006629,GO:0006807,GO:0008150,GO:0008152,GO:0008610,GO:0008653,GO:0009058,GO:0009059,GO:0009103,GO:0009252,GO:0009273,GO:0009987,GO:0016051,GO:0016740,GO:0016772,GO:0016779,GO:0030203,GO:0033692,GO:0034637,GO:0034645,GO:0042546,GO:0043170,GO:0044036,GO:0044038,GO:0044085,GO:0044237,GO:0044238,GO:0044249,GO:0044255,GO:0044260,GO:0044262,GO:0044264,GO:0070569,GO:0070589,GO:0071554,GO:0071704,GO:0071840,GO:1901135,GO:1901137,GO:1901564,GO:1901566,GO:1901576,GO:1903509	ko:K04042	ko00520,ko01100,ko01130,map00520,map01100,map01130	ko00000,ko00001,ko00002,ko01000	Hexapep,Hexapep_2,NTP_transf_3,NTP_transferase
2978	SQG45851.1	218495.SUB0469	5.61e-127	361.0	COG0494@1|root,COG0494@2|Bacteria,1V6F5@1239|Firmicutes,4HII9@91061|Bacilli	AdP-ribose pyrophosphatase	nudF	-	ko:K01515	ko00230,map00230	ko00000,ko00001,ko01000	NUDIX
2978	SQG45852.1	40041.SZO_04790	1.89e-25	97.1	29HZT@1|root,304WV@2|Bacteria,1TXC3@1239|Firmicutes,4I69Z@91061|Bacilli,1M9S8@119603|Streptococcus dysgalactiae group	-	-	-	-	-	-	-
2978	SQG45853.1	218495.SUB0471	9.31e-155	435.0	COG0775@1|root,COG0775@2|Bacteria,1U7WK@1239|Firmicutes,4HB8K@91061|Bacilli	Catalyzes the irreversible cleavage of the glycosidic bond in both 5'-methylthioadenosine (MTA) and S- adenosylhomocysteine (SAH AdoHcy) to adenine and the corresponding thioribose, 5'-methylthioribose and S-ribosylhomocysteine, respectively	mtnN	-	ko:K01243	ko00270,ko01100,ko01230,map00270,map01100,map01230	ko00000,ko00001,ko00002,ko01000	PNP_UDP_1
2978	SQG45854.1	218495.SUB0472	4.88e-154	432.0	COG1321@1|root,COG1321@2|Bacteria,1V97J@1239|Firmicutes,4IR68@91061|Bacilli	Transcriptional regulator	ideR	-	ko:K03709	-	ko00000,ko03000	Fe_dep_repr_C,Fe_dep_repress,FeoA
2978	SQG45855.1	218495.SUB0473	1.32e-219	606.0	COG0803@1|root,COG0803@2|Bacteria,1TRKU@1239|Firmicutes,4HAKT@91061|Bacilli	Belongs to the bacterial solute-binding protein 9 family	psaA	-	ko:K11704,ko:K19971,ko:K19975,ko:K19976	ko02010,map02010	ko00000,ko00001,ko00002,ko02000	ZnuA
2978	SQG45856.1	218495.SUB0474	7.7e-168	469.0	COG1121@1|root,COG1121@2|Bacteria,1TQJ3@1239|Firmicutes,4HA2W@91061|Bacilli	ABC transporter, ATP-binding protein	sitB	-	ko:K02074,ko:K09820,ko:K10830,ko:K11706,ko:K19973	ko02010,map02010	ko00000,ko00001,ko00002,ko01000,ko02000	ABC_tran
2978	SQG45857.1	218495.SUB0475	1.83e-174	489.0	COG1108@1|root,COG1108@2|Bacteria,1TPZB@1239|Firmicutes,4HBD7@91061|Bacilli	ABC-type Mn2 Zn2 transport systems, permease components	mtsC	GO:0005575,GO:0005623,GO:0005886,GO:0008150,GO:0010035,GO:0010038,GO:0010043,GO:0016020,GO:0042221,GO:0044464,GO:0050896,GO:0071944	ko:K11705,ko:K19972,ko:K19976	ko02010,map02010	ko00000,ko00001,ko00002,ko02000	ABC-3
2978	SQG45858.1	218495.SUB0477	7.14e-188	522.0	COG0652@1|root,COG0652@2|Bacteria,1TRHW@1239|Firmicutes,4HHA1@91061|Bacilli	PPIases accelerate the folding of proteins. It catalyzes the cis-trans isomerization of proline imidic peptide bonds in oligopeptides	-	-	ko:K03767	ko01503,ko04217,map01503,map04217	ko00000,ko00001,ko01000,ko03110,ko04147	Pro_isomerase
2978	SQG45859.1	218495.SUB0479	0.0	1496.0	COG1674@1|root,COG1674@2|Bacteria,1TPJR@1239|Firmicutes,4H9WA@91061|Bacilli	Belongs to the FtsK SpoIIIE SftA family	ftsK	GO:0000003,GO:0006355,GO:0008150,GO:0009889,GO:0010468,GO:0010556,GO:0019219,GO:0019222,GO:0019954,GO:0030436,GO:0031323,GO:0031326,GO:0032502,GO:0043934,GO:0050789,GO:0050794,GO:0051171,GO:0051252,GO:0060255,GO:0065007,GO:0080090,GO:1903506,GO:2000112,GO:2001141	ko:K03466	-	ko00000,ko03036	FtsK_4TM,FtsK_SpoIIIE,Ftsk_gamma
2978	SQG45860.1	218495.SUB0480	6.61e-71	214.0	2DSU9@1|root,33HF9@2|Bacteria,1VNK9@1239|Firmicutes	Protein of unknown function (DUF3397)	-	-	-	-	-	DUF3397
2978	SQG45861.1	218495.SUB0481	6.6e-91	266.0	COG0080@1|root,COG0080@2|Bacteria,1V1BS@1239|Firmicutes,4HFQ0@91061|Bacilli	Forms part of the ribosomal stalk which helps the ribosome interact with GTP-bound translation factors	rplK	GO:0000027,GO:0003674,GO:0003676,GO:0003723,GO:0003735,GO:0005198,GO:0005488,GO:0005575,GO:0005622,GO:0005623,GO:0005737,GO:0005829,GO:0005840,GO:0006412,GO:0006518,GO:0006807,GO:0006996,GO:0008150,GO:0008152,GO:0009058,GO:0009059,GO:0009987,GO:0010467,GO:0015934,GO:0016043,GO:0019538,GO:0019843,GO:0022607,GO:0022613,GO:0022618,GO:0022625,GO:0022626,GO:0032991,GO:0034622,GO:0034641,GO:0034645,GO:0042254,GO:0042255,GO:0042273,GO:0043043,GO:0043170,GO:0043226,GO:0043228,GO:0043229,GO:0043232,GO:0043603,GO:0043604,GO:0043933,GO:0044085,GO:0044237,GO:0044238,GO:0044249,GO:0044260,GO:0044267,GO:0044271,GO:0044391,GO:0044422,GO:0044424,GO:0044444,GO:0044445,GO:0044446,GO:0044464,GO:0065003,GO:0070925,GO:0071704,GO:0071826,GO:0071840,GO:0097159,GO:1901363,GO:1901564,GO:1901566,GO:1901576,GO:1990904	ko:K02867	ko03010,map03010	br01610,ko00000,ko00001,ko00002,ko03011	Ribosomal_L11,Ribosomal_L11_N
2978	SQG45862.1	218495.SUB0482	2.88e-153	431.0	COG0081@1|root,COG0081@2|Bacteria,1TPTS@1239|Firmicutes,4HAK4@91061|Bacilli	Binds directly to 23S rRNA. The L1 stalk is quite mobile in the ribosome, and is involved in E site tRNA release	rplA	GO:0000470,GO:0003674,GO:0003676,GO:0003723,GO:0005488,GO:0005575,GO:0005622,GO:0005623,GO:0005737,GO:0005829,GO:0005840,GO:0006139,GO:0006364,GO:0006396,GO:0006412,GO:0006518,GO:0006725,GO:0006807,GO:0008150,GO:0008152,GO:0009058,GO:0009059,GO:0009987,GO:0010467,GO:0015934,GO:0016070,GO:0016072,GO:0019538,GO:0022613,GO:0022625,GO:0022626,GO:0032991,GO:0034470,GO:0034641,GO:0034645,GO:0034660,GO:0042254,GO:0042273,GO:0043043,GO:0043170,GO:0043226,GO:0043228,GO:0043229,GO:0043232,GO:0043603,GO:0043604,GO:0044085,GO:0044237,GO:0044238,GO:0044249,GO:0044260,GO:0044267,GO:0044271,GO:0044391,GO:0044422,GO:0044424,GO:0044444,GO:0044445,GO:0044446,GO:0044464,GO:0046483,GO:0071704,GO:0071840,GO:0090304,GO:0097159,GO:1901360,GO:1901363,GO:1901564,GO:1901566,GO:1901576,GO:1990904	ko:K02863	ko03010,map03010	br01610,ko00000,ko00001,ko00002,ko03011	Ribosomal_L1
2978	SQG45863.1	218495.SUB0483	4.45e-168	470.0	COG0528@1|root,COG0528@2|Bacteria,1TPXN@1239|Firmicutes,4H9UB@91061|Bacilli	Catalyzes the reversible phosphorylation of UMP to UDP	pyrH	-	ko:K09903	ko00240,ko01100,map00240,map01100	ko00000,ko00001,ko01000	AA_kinase
2978	SQG45864.1	218495.SUB0484	1.31e-116	335.0	COG0233@1|root,COG0233@2|Bacteria,1V1F2@1239|Firmicutes,4HFSH@91061|Bacilli	Responsible for the release of ribosomes from messenger RNA at the termination of protein biosynthesis. May increase the efficiency of translation by recycling ribosomes from one round of translation to another	frr	GO:0002181,GO:0002184,GO:0003674,GO:0005488,GO:0005575,GO:0005622,GO:0005623,GO:0005737,GO:0006412,GO:0006415,GO:0006518,GO:0006807,GO:0008150,GO:0008152,GO:0009058,GO:0009059,GO:0009987,GO:0010467,GO:0016043,GO:0019538,GO:0022411,GO:0032984,GO:0034641,GO:0034645,GO:0043021,GO:0043023,GO:0043043,GO:0043170,GO:0043603,GO:0043604,GO:0043624,GO:0043933,GO:0044237,GO:0044238,GO:0044249,GO:0044260,GO:0044267,GO:0044271,GO:0044424,GO:0044464,GO:0044877,GO:0071704,GO:0071840,GO:1901564,GO:1901566,GO:1901576	ko:K02838	-	ko00000,ko03012	RRF
2978	SQG45865.1	218495.SUB0485	1.78e-204	565.0	COG2996@1|root,COG2996@2|Bacteria,1TQ1Z@1239|Firmicutes,4HDAZ@91061|Bacilli	Protein conserved in bacteria	yitL	-	ko:K00243	-	ko00000	S1_2
2978	SQG45866.1	218495.SUB0486	1.53e-123	351.0	COG0225@1|root,COG0225@2|Bacteria,1TQ3E@1239|Firmicutes,4HAIV@91061|Bacilli	Has an important function as a repair enzyme for proteins that have been inactivated by oxidation. Catalyzes the reversible oxidation-reduction of methionine sulfoxide in proteins to methionine	msrA	-	ko:K07304,ko:K12267	-	ko00000,ko01000	PMSR,SelR
2978	SQG45867.1	218495.SUB0487	1.15e-47	152.0	COG4479@1|root,COG4479@2|Bacteria,1VFI4@1239|Firmicutes,4HR7P@91061|Bacilli	Belongs to the UPF0346 family	yozE	-	-	-	-	YozE_SAM_like
2978	SQG45868.1	218495.SUB0488	3.82e-255	700.0	COG1702@1|root,COG1702@2|Bacteria,1TP35@1239|Firmicutes,4HBD5@91061|Bacilli	phosphate starvation-inducible protein PhoH	phoH	-	ko:K06217	-	ko00000	PhoH
2978	SQG45869.1	218495.SUB0489	2.47e-142	400.0	COG1573@1|root,COG1573@2|Bacteria,1V1F8@1239|Firmicutes,4HFVS@91061|Bacilli	Uracil-DNA glycosylase	ung2	-	-	-	-	UDG
2978	SQG45870.1	218495.SUB0490	8.53e-115	329.0	COG0319@1|root,COG0319@2|Bacteria,1V6BU@1239|Firmicutes,4HIIE@91061|Bacilli	Single strand-specific metallo-endoribonuclease involved in late-stage 70S ribosome quality control and in maturation of the 3' terminus of the 16S rRNA	ybeY	-	ko:K07042	-	ko00000,ko03009	UPF0054
2978	SQG45871.1	218495.SUB0491	2.63e-80	239.0	COG0818@1|root,COG0818@2|Bacteria,1VEGR@1239|Firmicutes,4HNKN@91061|Bacilli	Diacylglycerol kinase	dgkA	-	ko:K00887,ko:K00901	ko00550,ko00561,ko00564,ko01100,ko01110,ko04070,ko04072,ko05231,map00550,map00561,map00564,map01100,map01110,map04070,map04072,map05231	ko00000,ko00001,ko01000	DAGK_prokar
2978	SQG45872.1	218495.SUB0492	8.19e-213	588.0	COG1159@1|root,COG1159@2|Bacteria,1TP3R@1239|Firmicutes,4H9WF@91061|Bacilli	An essential GTPase that binds both GDP and GTP, with rapid nucleotide exchange. Plays a role in 16S rRNA processing and 30S ribosomal subunit biogenesis and possibly also in cell cycle regulation and energy metabolism	era	GO:0000166,GO:0001882,GO:0001883,GO:0003674,GO:0003824,GO:0003924,GO:0005488,GO:0005525,GO:0005575,GO:0005622,GO:0005623,GO:0005737,GO:0005886,GO:0006275,GO:0008150,GO:0008156,GO:0009889,GO:0009890,GO:0009892,GO:0010556,GO:0010558,GO:0010605,GO:0016020,GO:0016462,GO:0016787,GO:0016817,GO:0016818,GO:0017076,GO:0017111,GO:0019001,GO:0019003,GO:0019219,GO:0019222,GO:0030174,GO:0031323,GO:0031324,GO:0031326,GO:0031327,GO:0032297,GO:0032549,GO:0032550,GO:0032553,GO:0032555,GO:0032561,GO:0035639,GO:0036094,GO:0043167,GO:0043168,GO:0044424,GO:0044464,GO:0045934,GO:0048518,GO:0048519,GO:0048522,GO:0048523,GO:0050789,GO:0050794,GO:0051052,GO:0051053,GO:0051171,GO:0051172,GO:0051302,GO:0051781,GO:0060255,GO:0065007,GO:0071944,GO:0080090,GO:0090329,GO:0097159,GO:0097367,GO:1901265,GO:1901363,GO:2000104,GO:2000112,GO:2000113	ko:K03595	-	ko00000,ko03009,ko03029	KH_2,MMR_HSR1
2978	SQG45873.1	171101.spr1549	2.66e-18	82.0	2DIVW@1|root,3048F@2|Bacteria,1TW9P@1239|Firmicutes,4I517@91061|Bacilli,1WVQ7@1313|Streptococcus pneumoniae	-	-	-	-	-	-	-
2978	SQG45874.1	862967.SIR_0229	1.28e-63	207.0	2DISJ@1|root,30420@2|Bacteria,1TVV4@1239|Firmicutes,4I4CK@91061|Bacilli,42E6B@671232|Streptococcus anginosus group	-	-	-	-	-	-	-
2978	SQG45875.1	862967.SIR_0230	5.77e-12	70.1	2DISA@1|root,3041B@2|Bacteria,1TVTD@1239|Firmicutes,4I46U@91061|Bacilli,42DZD@671232|Streptococcus anginosus group	-	-	-	-	-	-	-
2978	SQG45876.1	218495.SUB0497	2.61e-146	412.0	COG1131@1|root,COG1131@2|Bacteria,1V31F@1239|Firmicutes,4IPTI@91061|Bacilli	ABC transporter	-	-	ko:K01990	-	ko00000,ko00002,ko02000	ABC_tran
2978	SQG45877.1	218495.SUB0498	2.57e-169	473.0	COG3279@1|root,COG3279@2|Bacteria	phosphorelay signal transduction system	agrA	-	ko:K07707	ko02020,ko02024,map02020,map02024	ko00000,ko00001,ko00002,ko02022	LytTR,Response_reg
2978	SQG45878.1	218495.SUB0499	6.39e-269	740.0	COG3290@1|root,COG3290@2|Bacteria	protein histidine kinase activity	blpH	-	ko:K02476,ko:K07706	ko02020,ko02024,map02020,map02024	ko00000,ko00001,ko00002,ko01000,ko01001,ko02022	HATPase_c_5
2978	SQG45880.1	218495.SUB0501	0.0	1347.0	COG2274@1|root,COG2274@2|Bacteria,1V77J@1239|Firmicutes,4HAX2@91061|Bacilli	ABC-type bacteriocin lantibiotic exporters, contain an N-terminal double-glycine peptidase domain	comA	-	ko:K06147,ko:K06148,ko:K20344	ko02010,ko02024,map02010,map02024	ko00000,ko00001,ko02000	ABC_membrane,ABC_tran,Peptidase_C39
2978	SQG45882.1	1314.HKU360_00423	4.26e-29	105.0	2DF7N@1|root,2ZQT1@2|Bacteria,1W683@1239|Firmicutes,4I0GM@91061|Bacilli	-	-	-	-	-	-	-
2978	SQG45886.1	862969.SCI_0588	2.22e-16	73.9	2DITA@1|root,3043B@2|Bacteria,1TVXW@1239|Firmicutes,4I4JM@91061|Bacilli,42EDX@671232|Streptococcus anginosus group	-	-	-	-	-	-	-
2978	SQG45887.1	218495.SUB0510	1.85e-59	184.0	2EGBF@1|root,32DTV@2|Bacteria,1U844@1239|Firmicutes,4I1WZ@91061|Bacilli	Enterocin A Immunity	-	-	-	-	-	EntA_Immun
2978	SQG45888.1	1035187.HMPREF9959_1822	0.000111	44.7	29NF1@1|root,309CY@2|Bacteria,1U4UN@1239|Firmicutes,4IEJX@91061|Bacilli,2TQB3@28037|Streptococcus mitis	-	-	-	-	-	-	-
2978	SQG45889.1	278197.PEPE_0082	3.88e-09	54.7	29PUZ@1|root,30AT6@2|Bacteria,1U72R@1239|Firmicutes,4IGXA@91061|Bacilli,3F8WE@33958|Lactobacillaceae	Class II bacteriocin	-	-	-	-	-	Bacteriocin_II
2978	SQG45890.1	171101.spr1091	8.04e-11	61.2	2BGRW@1|root,32AR1@2|Bacteria,1TW8G@1239|Firmicutes,4I4ZP@91061|Bacilli,1WVM1@1313|Streptococcus pneumoniae	Enterocin A Immunity	-	-	-	-	-	EntA_Immun
2978	SQG45891.1	218495.SUB0516	1.85e-59	184.0	2EQ91@1|root,33HV8@2|Bacteria,1VPTF@1239|Firmicutes,4HS1H@91061|Bacilli	Enterocin A Immunity	-	-	-	-	-	EntA_Immun
2978	SQG45892.1	218495.SUB0517	7.49e-196	543.0	COG0266@1|root,COG0266@2|Bacteria,1TPM9@1239|Firmicutes,4H9Q7@91061|Bacilli	Involved in base excision repair of DNA damaged by oxidation or by mutagenic agents. Acts as DNA glycosylase that recognizes and removes damaged bases. Has a preference for oxidized purines, such as 7,8-dihydro-8-oxoguanine (8-oxoG). Has AP (apurinic apyrimidinic) lyase activity and introduces nicks in the DNA strand. Cleaves the DNA backbone by beta-delta elimination to generate a single-strand break at the site of the removed base with both 3'- and 5'-phosphates	fpg	-	ko:K10563	ko03410,map03410	ko00000,ko00001,ko01000,ko03400	Fapy_DNA_glyco,H2TH,zf-FPG_IleRS
2978	SQG45893.1	218495.SUB0518	7.86e-132	374.0	COG0237@1|root,COG0237@2|Bacteria,1V6FS@1239|Firmicutes,4HII3@91061|Bacilli	Catalyzes the phosphorylation of the 3'-hydroxyl group of dephosphocoenzyme A to form coenzyme A	coaE	GO:0003674,GO:0003824,GO:0004140,GO:0006139,GO:0006163,GO:0006164,GO:0006725,GO:0006732,GO:0006753,GO:0006793,GO:0006796,GO:0006807,GO:0008150,GO:0008152,GO:0009058,GO:0009108,GO:0009117,GO:0009150,GO:0009152,GO:0009165,GO:0009259,GO:0009260,GO:0009987,GO:0015936,GO:0015937,GO:0016301,GO:0016310,GO:0016740,GO:0016772,GO:0016773,GO:0018130,GO:0019438,GO:0019637,GO:0019693,GO:0033865,GO:0033866,GO:0033875,GO:0034030,GO:0034032,GO:0034033,GO:0034641,GO:0034654,GO:0044237,GO:0044238,GO:0044249,GO:0044271,GO:0044281,GO:0046390,GO:0046483,GO:0051186,GO:0051188,GO:0055086,GO:0071704,GO:0072521,GO:0072522,GO:0090407,GO:1901135,GO:1901137,GO:1901293,GO:1901360,GO:1901362,GO:1901564,GO:1901566,GO:1901576	ko:K00859	ko00770,ko01100,map00770,map01100	ko00000,ko00001,ko00002,ko01000	CoaE
2978	SQG45894.1	218495.SUB0519	2.22e-146	413.0	COG2364@1|root,COG2364@2|Bacteria,1V47R@1239|Firmicutes,4HUNV@91061|Bacilli	Membrane	-	-	ko:K07149	-	ko00000	-
2978	SQG45895.1	218495.SUB0520	0.0	920.0	COG0433@1|root,COG0433@2|Bacteria,1TR1F@1239|Firmicutes,4HBVA@91061|Bacilli	Bacterial protein of unknown function (DUF853)	XK27_06890	-	ko:K06915	-	ko00000	DUF853
2978	SQG45896.1	218495.SUB0521	1.2e-249	689.0	COG0477@1|root,COG2814@2|Bacteria,1TRDJ@1239|Firmicutes,4H9Q9@91061|Bacilli	Major Facilitator	pmrA	-	ko:K08161	-	ko00000,ko02000	MFS_1,MFS_1_like,Sugar_tr
