key	query	seed_ortholog	evalue	score	eggNOG_OGs	description	preferred_name	GOs	KEGG_ko	KEGG_pathway	brite	PFAMs
3138	ADG90284.1	633148.Tagg_0001	4.12e-274	751.0	COG1474@1|root,arCOG00467@2157|Archaea,2XPXH@28889|Crenarchaeota	Involved in regulation of DNA replication	cdc6-1	-	ko:K10725	-	ko00000,ko03032	AAA_16,AAA_22,Cdc6_C
3138	ADG90285.1	633148.Tagg_0002	6.79e-135	382.0	COG1628@1|root,arCOG00928@2157|Archaea,2XQHW@28889|Crenarchaeota	Belongs to the UPF0215 family	-	-	ko:K09120	-	ko00000	DUF99
3138	ADG90286.1	633148.Tagg_0003	0.0	1292.0	COG1274@1|root,arCOG05865@2157|Archaea,2XPQX@28889|Crenarchaeota	Catalyzes the conversion of oxaloacetate (OAA) to phosphoenolpyruvate (PEP), the rate-limiting step in the metabolic pathway that produces glucose from lactate and other precursors derived from the citric acid cycle	pckG	-	ko:K01596	ko00010,ko00020,ko00620,ko01100,ko01110,ko01120,ko01130,ko03320,ko04068,ko04151,ko04152,ko04910,ko04920,ko04922,ko04931,ko04964,map00010,map00020,map00620,map01100,map01110,map01120,map01130,map03320,map04068,map04151,map04152,map04910,map04920,map04922,map04931,map04964	ko00000,ko00001,ko00002,ko01000	PEPCK_C,PEPCK_N
3138	ADG90287.1	633148.Tagg_0004	0.0	915.0	COG0160@1|root,arCOG00915@2157|Archaea,2XPTE@28889|Crenarchaeota	Belongs to the class-III pyridoxal-phosphate-dependent aminotransferase family	-	-	ko:K00823,ko:K00836	ko00250,ko00260,ko00410,ko00640,ko00650,ko01100,ko01120,ko01210,ko01230,map00250,map00260,map00410,map00640,map00650,map01100,map01120,map01210,map01230	ko00000,ko00001,ko00002,ko01000,ko01007	Aminotran_3
3138	ADG90288.1	633148.Tagg_0005	1.3e-53	168.0	arCOG11268@1|root,arCOG11268@2157|Archaea	-	-	-	-	-	-	-
3138	ADG90289.1	633148.Tagg_0007	0.0	1142.0	COG1964@1|root,arCOG00933@2157|Archaea,2XPQM@28889|Crenarchaeota	PFAM Radical SAM domain protein	-	-	ko:K06937	-	ko00000,ko01000	Fer4_12,Fer4_14,Radical_SAM
3138	ADG90290.1	633148.Tagg_0008	3.46e-137	388.0	COG1936@1|root,arCOG01038@2157|Archaea,2XQII@28889|Crenarchaeota	Broad-specificity nucleoside monophosphate (NMP) kinase that catalyzes the reversible transfer of the terminal phosphate group between nucleoside triphosphates and monophosphates	-	-	ko:K18532	ko00230,ko01100,ko01110,ko01130,ko03008,map00230,map01100,map01110,map01130,map03008	ko00000,ko00001,ko00002,ko01000,ko03009	AAA_18
3138	ADG90291.1	633148.Tagg_0009	1.06e-190	529.0	COG1161@1|root,arCOG00350@2157|Archaea,2XQ1K@28889|Crenarchaeota	Belongs to the TRAFAC class YlqF YawG GTPase family. MTG1 subfamily	-	-	-	-	-	MMR_HSR1,RsgA_GTPase
3138	ADG90292.1	633148.Tagg_0010	5.3e-40	132.0	COG2104@1|root,arCOG00535@2157|Archaea,2XRCE@28889|Crenarchaeota	Sulfur transfer protein involved in thiamine biosynthesis	-	-	ko:K03154	ko04122,map04122	ko00000,ko00001	ThiS
3138	ADG90293.1	633148.Tagg_0011	4.3e-170	475.0	COG0476@1|root,arCOG01676@2157|Archaea,2XQ9E@28889|Crenarchaeota	PFAM UBA THIF-type NAD FAD binding protein	-	-	ko:K21029	ko04122,map04122	ko00000,ko00001,ko01000	ThiF
3138	ADG90294.1	633148.Tagg_0012	1.38e-59	184.0	COG1977@1|root,arCOG00536@2157|Archaea,2XR47@28889|Crenarchaeota	Molybdopterin converting factor, small subunit	-	-	ko:K03636	ko04122,map04122	ko00000,ko00001	ThiS
3138	ADG90295.1	633148.Tagg_0013	3.66e-41	135.0	arCOG11218@1|root,arCOG11218@2157|Archaea	-	-	-	-	-	-	ThiS
3138	ADG90296.1	633148.Tagg_0014	1.85e-265	727.0	COG0498@1|root,arCOG01434@2157|Archaea,2XQDT@28889|Crenarchaeota	Pyridoxal-5'-phosphate-dependent protein beta subunit	-	-	ko:K01733	ko00260,ko00750,ko01100,ko01110,ko01120,ko01230,map00260,map00750,map01100,map01110,map01120,map01230	ko00000,ko00001,ko00002,ko01000	PALP
3138	ADG90297.1	633148.Tagg_0015	5.75e-135	382.0	COG0311@1|root,arCOG00034@2157|Archaea,2XQEU@28889|Crenarchaeota	Catalyzes the hydrolysis of glutamine to glutamate and ammonia as part of the biosynthesis of pyridoxal 5'-phosphate. The resulting ammonia molecule is channeled to the active site of PdxS	pdxT	GO:0005575,GO:0005622,GO:0005623,GO:0005737,GO:0005829,GO:0006081,GO:0006725,GO:0006732,GO:0006766,GO:0006767,GO:0006793,GO:0006796,GO:0006807,GO:0008150,GO:0008152,GO:0008614,GO:0009058,GO:0009108,GO:0009110,GO:0009987,GO:0017144,GO:0018130,GO:0019438,GO:0019637,GO:0032991,GO:0034641,GO:0042364,GO:0042816,GO:0042819,GO:0042822,GO:0042823,GO:0044237,GO:0044249,GO:0044271,GO:0044281,GO:0044283,GO:0044424,GO:0044444,GO:0044464,GO:0046184,GO:0046483,GO:0051186,GO:0051188,GO:0071704,GO:0072524,GO:0072525,GO:0090407,GO:1901360,GO:1901362,GO:1901564,GO:1901566,GO:1901576,GO:1901615,GO:1901617,GO:1902494,GO:1903600	ko:K08681	ko00750,map00750	ko00000,ko00001,ko01000	SNO
3138	ADG90298.1	633148.Tagg_0016	1.24e-235	648.0	COG0214@1|root,arCOG04075@2157|Archaea,2XPKX@28889|Crenarchaeota	Catalyzes the formation of pyridoxal 5'-phosphate from ribose 5-phosphate (RBP), glyceraldehyde 3-phosphate (G3P) and ammonia. The ammonia is provided by the PdxT subunit. Can also use ribulose 5-phosphate and dihydroxyacetone phosphate as substrates, resulting from enzyme-catalyzed isomerization of RBP and G3P, respectively	pdxS	-	ko:K06215	ko00750,map00750	ko00000,ko00001,ko01000	SOR_SNZ
3138	ADG90299.1	633148.Tagg_0017	0.0	916.0	COG1055@1|root,arCOG00238@2157|Archaea,2XQCU@28889|Crenarchaeota	Citrate transporter	-	-	-	-	-	CitMHS
3138	ADG90300.1	633148.Tagg_0018	5.3e-110	317.0	COG4739@1|root,arCOG04483@2157|Archaea,2XQGM@28889|Crenarchaeota	protein containing a ferredoxin domain (DUF2148)	-	-	-	-	-	DUF2148
3138	ADG90302.1	633148.Tagg_0020	7.25e-118	337.0	COG1720@1|root,arCOG00761@2157|Archaea,2XQIA@28889|Crenarchaeota	Uncharacterised protein family UPF0066	-	-	-	-	-	UPF0066
3138	ADG90303.1	633148.Tagg_0021	3.32e-263	721.0	COG1748@1|root,arCOG00243@2157|Archaea,2XQJJ@28889|Crenarchaeota	Saccharopine dehydrogenase	-	-	-	-	-	Sacchrp_dh_C,Sacchrp_dh_NADP,Semialdhyde_dh,UDPG_MGDP_dh_N
3138	ADG90304.1	633148.Tagg_0022	1.73e-170	477.0	COG0428@1|root,arCOG00576@2157|Archaea,2XQN6@28889|Crenarchaeota	PFAM zinc iron permease	-	-	ko:K07238	-	ko00000,ko02000	Zip
3138	ADG90305.1	633148.Tagg_0023	0.0	1202.0	COG0449@1|root,arCOG00057@2157|Archaea,2XPJW@28889|Crenarchaeota	Catalyzes the first step in hexosamine metabolism, converting fructose-6P into glucosamine-6P using glutamine as a nitrogen source	glmS	GO:0003674,GO:0003824,GO:0004360,GO:0006002,GO:0006040,GO:0006047,GO:0006139,GO:0006464,GO:0006486,GO:0006487,GO:0006725,GO:0006793,GO:0006796,GO:0006807,GO:0008150,GO:0008152,GO:0008483,GO:0009058,GO:0009059,GO:0009100,GO:0009101,GO:0009225,GO:0009987,GO:0016740,GO:0016769,GO:0019538,GO:0019637,GO:0034641,GO:0034645,GO:0036211,GO:0043170,GO:0043412,GO:0043413,GO:0044237,GO:0044238,GO:0044249,GO:0044260,GO:0044267,GO:0044281,GO:0046483,GO:0055086,GO:0070085,GO:0070548,GO:0071704,GO:1901135,GO:1901137,GO:1901360,GO:1901564,GO:1901566,GO:1901576	ko:K00820	ko00250,ko00520,ko01100,ko01130,ko04931,map00250,map00520,map01100,map01130,map04931	ko00000,ko00001,ko01000,ko01002	GATase_6,SIS
3138	ADG90306.1	633148.Tagg_0024	2.69e-157	441.0	COG0528@1|root,arCOG00858@2157|Archaea,2XQKQ@28889|Crenarchaeota	Catalyzes the reversible phosphorylation of UMP to UDP	pyrH	-	ko:K09903	ko00240,ko01100,map00240,map01100	ko00000,ko00001,ko01000	AA_kinase
3138	ADG90307.1	633148.Tagg_0025	5.85e-159	446.0	COG0565@1|root,arCOG01018@2157|Archaea,2XQJS@28889|Crenarchaeota	TIGRFAM RNA methyltransferase, TrmH family, group 1	-	-	-	-	-	SpoU_methylase
3138	ADG90308.1	633148.Tagg_0026	1.13e-107	310.0	COG2890@1|root,arCOG00109@2157|Archaea,2XQV3@28889|Crenarchaeota	PFAM methyltransferase small	-	-	ko:K02493	-	ko00000,ko01000,ko03012	MTS
3138	ADG90309.1	633148.Tagg_0027	3.78e-168	471.0	COG0030@1|root,arCOG04131@2157|Archaea,2XQCE@28889|Crenarchaeota	Specifically dimethylates two adjacent adenosines in the loop of a conserved hairpin near the 3'-end of 16S rRNA in the 30S particle. May play a critical role in biogenesis of 30S subunits	ksgA	GO:0000154,GO:0000179,GO:0001510,GO:0003674,GO:0003824,GO:0005575,GO:0005622,GO:0005623,GO:0005737,GO:0006139,GO:0006364,GO:0006396,GO:0006725,GO:0006807,GO:0008150,GO:0008152,GO:0008168,GO:0008170,GO:0008173,GO:0008649,GO:0008757,GO:0009451,GO:0009987,GO:0010467,GO:0016070,GO:0016072,GO:0016433,GO:0016740,GO:0016741,GO:0022613,GO:0031167,GO:0032259,GO:0034470,GO:0034641,GO:0034660,GO:0042254,GO:0043170,GO:0043412,GO:0043414,GO:0044085,GO:0044237,GO:0044238,GO:0044260,GO:0044424,GO:0044464,GO:0046483,GO:0071704,GO:0071840,GO:0090304,GO:0140098,GO:0140102,GO:1901360	ko:K02528	-	ko00000,ko01000,ko03009	RrnaAD
3138	ADG90310.1	633148.Tagg_0028	1.22e-133	379.0	COG1491@1|root,arCOG04130@2157|Archaea,2XQPC@28889|Crenarchaeota	Protein of unknown function (DUF655)	-	-	ko:K07572	-	ko00000	DUF655
3138	ADG90311.1	633148.Tagg_0029	1.67e-79	236.0	COG1460@1|root,arCOG01016@2157|Archaea,2XR9U@28889|Crenarchaeota	RNA polymerase Rpb4	-	-	ko:K03051	ko00230,ko00240,ko01100,ko03020,map00230,map00240,map01100,map03020	br01611,ko00000,ko00001,ko00002,ko01000,ko03021	RNA_pol_Rpb4
3138	ADG90312.1	633148.Tagg_0030	2.86e-68	206.0	COG2139@1|root,arCOG04129@2157|Archaea,2XQR1@28889|Crenarchaeota	Belongs to the eukaryotic ribosomal protein eL21 family	rpl21e	GO:0003674,GO:0003735,GO:0005198,GO:0005575,GO:0005622,GO:0005623,GO:0005737,GO:0005829,GO:0005840,GO:0006412,GO:0006518,GO:0006807,GO:0008150,GO:0008152,GO:0009058,GO:0009059,GO:0009987,GO:0010467,GO:0015934,GO:0019538,GO:0022625,GO:0022626,GO:0032991,GO:0034641,GO:0034645,GO:0043043,GO:0043170,GO:0043226,GO:0043228,GO:0043229,GO:0043232,GO:0043603,GO:0043604,GO:0044237,GO:0044238,GO:0044249,GO:0044260,GO:0044267,GO:0044271,GO:0044391,GO:0044422,GO:0044424,GO:0044444,GO:0044445,GO:0044446,GO:0044464,GO:0071704,GO:1901564,GO:1901566,GO:1901576,GO:1990904	ko:K02889	ko03010,map03010	br01610,ko00000,ko00001,ko00002,ko03011	Ribosomal_L21e
3138	ADG90313.1	633148.Tagg_0031	2.64e-315	859.0	COG1258@1|root,arCOG01015@2157|Archaea,2XQ08@28889|Crenarchaeota	Responsible for synthesis of pseudouridine from uracil- 54 and uracil-55 in the psi GC loop of transfer RNAs	pus10	-	ko:K07583	-	ko00000,ko01000,ko03016	THUMP
3138	ADG90314.1	633148.Tagg_0032	4.11e-129	367.0	arCOG01240@1|root,arCOG01240@2157|Archaea,2XSBS@28889|Crenarchaeota	-	-	-	-	-	-	-
3138	ADG90315.1	633148.Tagg_0033	1.8e-305	835.0	COG0541@1|root,arCOG01228@2157|Archaea,2XPWI@28889|Crenarchaeota	Involved in targeting and insertion of nascent membrane proteins into the cytoplasmic membrane. Binds to the hydrophobic signal sequence of the ribosome-nascent chain (RNC) as it emerges from the ribosomes. The SRP-RNC complex is then targeted to the cytoplasmic membrane where it interacts with the SRP receptor FtsY	srp54	-	ko:K03106	ko02024,ko03060,ko03070,map02024,map03060,map03070	ko00000,ko00001,ko00002,ko01000,ko02044	SRP54,SRP54_N,SRP_SPB
3138	ADG90316.1	633148.Tagg_0034	1.35e-123	352.0	COG0197@1|root,arCOG04113@2157|Archaea,2XQ8E@28889|Crenarchaeota	Belongs to the universal ribosomal protein uL16 family	rpl10e	GO:0000027,GO:0003674,GO:0003676,GO:0003723,GO:0003735,GO:0005198,GO:0005488,GO:0005575,GO:0005622,GO:0005623,GO:0005737,GO:0005829,GO:0005840,GO:0006412,GO:0006518,GO:0006807,GO:0006996,GO:0008150,GO:0008152,GO:0009058,GO:0009059,GO:0009987,GO:0010467,GO:0015934,GO:0016043,GO:0019538,GO:0022607,GO:0022613,GO:0022618,GO:0022625,GO:0022626,GO:0032991,GO:0034622,GO:0034641,GO:0034645,GO:0042254,GO:0042255,GO:0042273,GO:0043043,GO:0043170,GO:0043226,GO:0043228,GO:0043229,GO:0043232,GO:0043603,GO:0043604,GO:0043933,GO:0044085,GO:0044237,GO:0044238,GO:0044249,GO:0044260,GO:0044267,GO:0044271,GO:0044391,GO:0044422,GO:0044424,GO:0044444,GO:0044445,GO:0044446,GO:0044464,GO:0065003,GO:0070925,GO:0071704,GO:0071826,GO:0071840,GO:0097159,GO:1901363,GO:1901564,GO:1901566,GO:1901576,GO:1990904	ko:K02866	ko03010,map03010	br01610,ko00000,ko00001,ko00002,ko03011	Ribosomal_L16
3138	ADG90317.1	633148.Tagg_0035	1.51e-235	647.0	COG1736@1|root,arCOG04112@2157|Archaea,2XQ71@28889|Crenarchaeota	TIGRFAM diphthamide biosynthesis protein	-	-	ko:K07561	-	ko00000,ko01000,ko03012	Diphthamide_syn
3138	ADG90318.1	633148.Tagg_0036	6.41e-148	416.0	COG2263@1|root,arCOG00910@2157|Archaea,2XQNB@28889|Crenarchaeota	RNA methylase	-	-	ko:K07579	-	ko00000	Cons_hypoth95,MTS,Methyltransf_25,Methyltransf_31,PrmA
3138	ADG90319.1	633148.Tagg_0037	8.62e-126	358.0	COG1096@1|root,arCOG00676@2157|Archaea,2XQRA@28889|Crenarchaeota	Non-catalytic component of the exosome, which is a complex involved in RNA degradation. Increases the RNA binding and the efficiency of RNA degradation. Helpful for the interaction of the exosome with A-poor RNAs	csl4	-	ko:K07573	ko03018,map03018	ko00000,ko00001,ko00002,ko03019	ECR1_N,S1
3138	ADG90320.1	633148.Tagg_0038	3.44e-146	412.0	COG3286@1|root,arCOG00908@2157|Archaea,2XQZ9@28889|Crenarchaeota	protein conserved in archaea (DUF2067)	-	-	ko:K09742	-	ko00000	DUF2067
3138	ADG90321.1	633148.Tagg_0039	3.74e-58	180.0	COG1761@1|root,arCOG04111@2157|Archaea,2XR1W@28889|Crenarchaeota	PFAM RNA polymerase, dimerisation	-	-	ko:K03056	ko00230,ko00240,ko01100,ko03020,map00230,map00240,map01100,map03020	br01611,ko00000,ko00001,ko00002,ko01000,ko03021	RNA_pol_L_2
3138	ADG90323.1	633148.Tagg_0041	2.16e-83	245.0	COG1594@1|root,arCOG00579@2157|Archaea,2XQQ6@28889|Crenarchaeota	Belongs to the archaeal rpoM eukaryotic RPA12 RPB9 RPC11 RNA polymerase family	tfs	GO:0003674,GO:0005488,GO:0006355,GO:0008150,GO:0008270,GO:0009889,GO:0010468,GO:0010556,GO:0019219,GO:0019222,GO:0031323,GO:0031326,GO:0043167,GO:0043169,GO:0046872,GO:0046914,GO:0050789,GO:0050794,GO:0051171,GO:0051252,GO:0060255,GO:0065007,GO:0080090,GO:1903506,GO:2000112,GO:2001141	ko:K03057	ko01100,map01100	br01611,ko00000,ko03021	RNA_POL_M_15KD,TFIIS_C
3138	ADG90324.1	633148.Tagg_0042	8.6e-169	472.0	COG0592@1|root,arCOG00488@2157|Archaea,2XQCF@28889|Crenarchaeota	Sliding clamp subunit that acts as a moving platform for DNA processing. Responsible for tethering the catalytic subunit of DNA polymerase and other proteins to DNA during high-speed replication	pcn	GO:0003674,GO:0005575,GO:0005622,GO:0005623,GO:0006139,GO:0006259,GO:0006260,GO:0006261,GO:0006271,GO:0006272,GO:0006725,GO:0006807,GO:0008150,GO:0008152,GO:0009058,GO:0009059,GO:0009987,GO:0016070,GO:0022616,GO:0030234,GO:0030337,GO:0032991,GO:0034641,GO:0034645,GO:0043170,GO:0043626,GO:0044237,GO:0044238,GO:0044249,GO:0044260,GO:0044424,GO:0044464,GO:0044796,GO:0046483,GO:0050790,GO:0065007,GO:0065009,GO:0071704,GO:0090304,GO:0098772,GO:1901360,GO:1901576	ko:K04802	ko03030,ko03410,ko03420,ko03430,ko04110,ko04530,ko05161,ko05166,map03030,map03410,map03420,map03430,map04110,map04530,map05161,map05166	ko00000,ko00001,ko00002,ko03032,ko03400	PCNA_C,PCNA_N
3138	ADG90325.1	633148.Tagg_0043	5.77e-267	731.0	COG1467@1|root,arCOG04110@2157|Archaea,2XQI5@28889|Crenarchaeota	Catalytic subunit of DNA primase, an RNA polymerase that catalyzes the synthesis of short RNA molecules used as primers for DNA polymerase during DNA replication. The small subunit contains the primase catalytic core and has DNA synthesis activity on its own. Binding to the large subunit stabilizes and modulates the activity, increasing the rate of DNA synthesis while decreasing the length of the DNA fragments, and conferring RNA synthesis capability. The DNA polymerase activity may enable DNA primase to also catalyze primer extension after primer synthesis. May also play a role in DNA repair	priS	GO:0003674,GO:0003676,GO:0003677,GO:0003697,GO:0003824,GO:0003896,GO:0003899,GO:0005488,GO:0006139,GO:0006259,GO:0006260,GO:0006261,GO:0006269,GO:0006725,GO:0006807,GO:0008150,GO:0008152,GO:0009058,GO:0009059,GO:0009987,GO:0016070,GO:0016740,GO:0016772,GO:0016779,GO:0018130,GO:0019438,GO:0032774,GO:0034062,GO:0034641,GO:0034645,GO:0034654,GO:0043170,GO:0044237,GO:0044238,GO:0044249,GO:0044260,GO:0044271,GO:0046483,GO:0071704,GO:0090304,GO:0097159,GO:0097747,GO:0140098,GO:1901360,GO:1901362,GO:1901363,GO:1901576	ko:K02683	ko03030,map03030	ko00000,ko00001,ko01000,ko03032	DNA_primase_S
3138	ADG90326.1	633148.Tagg_0044	8.26e-106	306.0	COG1711@1|root,arCOG00551@2157|Archaea,2XRH8@28889|Crenarchaeota	protein conserved in archaea	-	-	-	-	-	-
3138	ADG90327.1	633148.Tagg_0045	7.92e-81	240.0	arCOG08884@1|root,arCOG08884@2157|Archaea,2XREU@28889|Crenarchaeota	-	-	-	-	-	-	-
3138	ADG90328.1	633148.Tagg_0046	0.0	1255.0	COG1287@1|root,arCOG02044@2157|Archaea,2XQNJ@28889|Crenarchaeota	Oligosaccharyl transferase STT3 subunit (B5) (Integral membrane protein 1)	-	-	-	-	-	-
3138	ADG90329.1	633148.Tagg_0047	2.54e-174	488.0	COG1093@1|root,arCOG04107@2157|Archaea,2XPRP@28889|Crenarchaeota	Translation initiation factor 2	eif2a	GO:0003674,GO:0003676,GO:0003723,GO:0003743,GO:0005488,GO:0005575,GO:0005622,GO:0005623,GO:0005737,GO:0005840,GO:0006412,GO:0006413,GO:0006518,GO:0006807,GO:0008135,GO:0008150,GO:0008152,GO:0009058,GO:0009059,GO:0009987,GO:0010467,GO:0019538,GO:0032991,GO:0034641,GO:0034645,GO:0043021,GO:0043022,GO:0043043,GO:0043170,GO:0043226,GO:0043228,GO:0043229,GO:0043232,GO:0043603,GO:0043604,GO:0044237,GO:0044238,GO:0044249,GO:0044260,GO:0044267,GO:0044271,GO:0044424,GO:0044444,GO:0044464,GO:0044877,GO:0071704,GO:0097159,GO:1901363,GO:1901564,GO:1901566,GO:1901576,GO:1990904	ko:K03237	ko03013,ko04138,ko04140,ko04141,ko04210,ko04932,ko05160,ko05162,ko05164,ko05168,map03013,map04138,map04140,map04141,map04210,map04932,map05160,map05162,map05164,map05168	ko00000,ko00001,ko03012	EIF_2_alpha,S1
3138	ADG90330.1	633148.Tagg_0048	1.44e-46	149.0	COG2260@1|root,arCOG00906@2157|Archaea,2XR3J@28889|Crenarchaeota	more specifically in 18S rRNA pseudouridylation and in cleavage of pre-rRNA	nop10	-	ko:K11130	ko03008,map03008	ko00000,ko00001,ko00002,ko03009,ko03032	Nop10p
3138	ADG90331.1	633148.Tagg_0049	4.62e-189	526.0	COG0697@1|root,arCOG00272@2157|Archaea,2XQIX@28889|Crenarchaeota	PFAM EamA-like transporter family	-	-	ko:K03298	-	ko00000,ko02000	EamA
3138	ADG90332.1	633148.Tagg_0050	5.19e-59	182.0	arCOG11908@1|root,arCOG11908@2157|Archaea	-	-	-	-	-	-	-
3138	ADG90333.1	633148.Tagg_0051	6.13e-110	316.0	COG3260@1|root,arCOG01553@2157|Archaea,2XQ9F@28889|Crenarchaeota	NADH ubiquinone oxidoreductase 20 kDa subunit	-	-	ko:K12144	-	ko00000,ko01000	Oxidored_q6
3138	ADG90334.1	633148.Tagg_0052	2.81e-112	323.0	COG1143@1|root,arCOG01543@2157|Archaea,2XQEZ@28889|Crenarchaeota	COG1143 Formate hydrogenlyase subunit 6 NADH ubiquinone oxidoreductase 23 kD subunit (chain I)	-	-	ko:K12143	-	ko00000	Fer4,Fer4_7
3138	ADG90335.1	633148.Tagg_0053	0.0	1097.0	COG0852@1|root,COG3261@1|root,arCOG01547@2157|Archaea,arCOG01551@2157|Archaea,2XPQK@28889|Crenarchaeota	NADH dehydrogenase (Ubiquinone), 30 kDa subunit	-	-	-	-	-	Complex1_30kDa,Complex1_49kDa,NiFeSe_Hases
3138	ADG90336.1	633148.Tagg_0054	9.55e-189	526.0	COG0650@1|root,arCOG01545@2157|Archaea,2XQMW@28889|Crenarchaeota	COG0650 Formate hydrogenlyase subunit 4	-	-	-	-	-	NADHdh
3138	ADG90337.1	633148.Tagg_0055	1.32e-48	155.0	arCOG10624@1|root,arCOG10624@2157|Archaea	-	-	-	-	-	-	-
3138	ADG90338.1	633148.Tagg_0056	0.0	917.0	COG0651@1|root,arCOG01537@2157|Archaea,2XPRC@28889|Crenarchaeota	COG0651 Formate hydrogenlyase subunit 3 Multisubunit Na H antiporter MnhD subunit	-	-	ko:K00342	ko00190,ko01100,map00190,map01100	ko00000,ko00001,ko00002,ko01000	Proton_antipo_M
3138	ADG90339.1	633148.Tagg_0057	0.0	917.0	COG0651@1|root,arCOG01537@2157|Archaea,2XPZA@28889|Crenarchaeota	NADH Ubiquinone plastoquinone (Complex I)	-	-	-	-	-	Proton_antipo_M
3138	ADG90340.1	633148.Tagg_0058	2.85e-128	363.0	COG0437@1|root,arCOG01500@2157|Archaea,2XQF6@28889|Crenarchaeota	4Fe-4S ferredoxin iron-sulfur binding domain protein	-	-	ko:K00124,ko:K21308	ko00630,ko00680,ko00920,ko01100,ko01120,ko01200,map00630,map00680,map00920,map01100,map01120,map01200	ko00000,ko00001	Fer4,Fer4_11,Fer4_3,Fer4_4
3138	ADG90341.1	633148.Tagg_0059	1.21e-265	727.0	COG0493@1|root,arCOG01292@2157|Archaea,2XPR1@28889|Crenarchaeota	PFAM FAD-dependent pyridine nucleotide-disulphide oxidoreductase	-	-	ko:K00266	ko00250,ko00910,ko01100,ko01110,ko01120,ko01130,ko01230,map00250,map00910,map01100,map01110,map01120,map01130,map01230	ko00000,ko00001,ko01000	Pyr_redox_2
3138	ADG90342.1	633148.Tagg_0060	1.97e-169	473.0	COG0561@1|root,arCOG01213@2157|Archaea,2XQHH@28889|Crenarchaeota	Catalyzes the dephosphorylation of 2-phosphoglycolate	-	-	ko:K22223	ko00630,ko01100,ko01110,ko01130,map00630,map01100,map01110,map01130	ko00000,ko00001,ko01000	Hydrolase_3
3138	ADG90343.1	633148.Tagg_0061	8.75e-145	408.0	COG0637@1|root,arCOG02293@2157|Archaea,2XQKY@28889|Crenarchaeota	TIGRFAM haloacid dehalogenase superfamily, subfamily IA, variant 3 with third motif having DD or ED	-	-	ko:K01091	ko00630,ko01100,ko01110,ko01130,map00630,map01100,map01110,map01130	ko00000,ko00001,ko01000	HAD_2
3138	ADG90345.1	633148.Tagg_0063	8.7e-198	549.0	COG0382@1|root,arCOG00476@2157|Archaea,2XQNM@28889|Crenarchaeota	PFAM UbiA prenyltransferase	-	-	ko:K17105	ko00564,map00564	ko00000,ko00001,ko01000	UbiA
3138	ADG90346.1	633148.Tagg_0064	7.14e-195	541.0	COG0671@1|root,arCOG03056@2157|Archaea,2XSRE@28889|Crenarchaeota	PFAM phosphoesterase, PA-phosphatase related	-	-	-	-	-	PAP2
3138	ADG90347.1	633148.Tagg_0065	5.05e-233	641.0	COG0166@1|root,arCOG00052@2157|Archaea,2XQ4V@28889|Crenarchaeota	Bifunctional phosphoglucose phosphomannose isomerase	-	GO:0003674,GO:0003824,GO:0004340,GO:0004396,GO:0005975,GO:0006082,GO:0006090,GO:0006091,GO:0006096,GO:0006139,GO:0006163,GO:0006164,GO:0006165,GO:0006725,GO:0006732,GO:0006733,GO:0006753,GO:0006754,GO:0006757,GO:0006793,GO:0006796,GO:0006807,GO:0008150,GO:0008152,GO:0009056,GO:0009058,GO:0009108,GO:0009117,GO:0009123,GO:0009124,GO:0009126,GO:0009127,GO:0009132,GO:0009135,GO:0009141,GO:0009142,GO:0009144,GO:0009145,GO:0009150,GO:0009152,GO:0009156,GO:0009161,GO:0009165,GO:0009166,GO:0009167,GO:0009168,GO:0009179,GO:0009185,GO:0009199,GO:0009201,GO:0009205,GO:0009206,GO:0009259,GO:0009260,GO:0009987,GO:0016052,GO:0016053,GO:0016301,GO:0016310,GO:0016740,GO:0016772,GO:0016773,GO:0017144,GO:0018130,GO:0019200,GO:0019359,GO:0019362,GO:0019363,GO:0019438,GO:0019439,GO:0019637,GO:0019693,GO:0019752,GO:0032787,GO:0034404,GO:0034641,GO:0034654,GO:0034655,GO:0042866,GO:0043436,GO:0044237,GO:0044238,GO:0044248,GO:0044249,GO:0044262,GO:0044270,GO:0044271,GO:0044281,GO:0044283,GO:0046031,GO:0046034,GO:0046390,GO:0046394,GO:0046434,GO:0046483,GO:0046496,GO:0046700,GO:0046835,GO:0046939,GO:0051156,GO:0051186,GO:0051188,GO:0055086,GO:0071704,GO:0072330,GO:0072521,GO:0072522,GO:0072524,GO:0072525,GO:0090407,GO:1901135,GO:1901137,GO:1901292,GO:1901293,GO:1901360,GO:1901361,GO:1901362,GO:1901564,GO:1901566,GO:1901575,GO:1901576	ko:K15916	ko00010,ko00030,ko00051,ko00500,ko00520,ko01100,ko01110,ko01120,ko01130,ko01200,map00010,map00030,map00051,map00500,map00520,map01100,map01110,map01120,map01130,map01200	ko00000,ko00001,ko00002,ko01000	SIS,bact-PGI_C
3138	ADG90348.1	633148.Tagg_0066	2.32e-144	407.0	arCOG05993@1|root,arCOG05993@2157|Archaea,2XR67@28889|Crenarchaeota	-	-	-	-	-	-	-
3138	ADG90349.1	633148.Tagg_0067	1.06e-106	308.0	arCOG04234@1|root,arCOG04234@2157|Archaea,2XQD0@28889|Crenarchaeota	-	-	-	-	-	-	-
3138	ADG90350.1	633148.Tagg_0068	1.4e-48	154.0	arCOG08866@1|root,arCOG08866@2157|Archaea,2XREC@28889|Crenarchaeota	-	-	-	-	-	-	-
3138	ADG90351.1	633148.Tagg_0069	1.08e-176	494.0	COG4345@1|root,arCOG03772@2157|Archaea,2XQC3@28889|Crenarchaeota	PFAM Uncharacterised conserved protein UCP037214	-	-	-	-	-	DUF2258
3138	ADG90352.1	633148.Tagg_0070	3.72e-238	654.0	COG0608@1|root,arCOG00424@2157|Archaea,2XPR0@28889|Crenarchaeota	phosphoesterase RecJ domain protein	-	-	ko:K07463	-	ko00000	DHH,DHHA1
3138	ADG90353.1	633148.Tagg_0071	7.59e-245	672.0	COG0582@1|root,arCOG01917@1|root,arCOG01241@2157|Archaea,arCOG01917@2157|Archaea,2XPNW@28889|Crenarchaeota	Site-specific tyrosine recombinase, which acts by catalyzing the cutting and rejoining of the recombining DNA molecules	xerA	-	ko:K04763	-	ko00000,ko03036	Phage_int_SAM_1,Phage_int_SAM_4,Phage_integrase,zinc_ribbon_2
3138	ADG90354.1	633148.Tagg_0072	5.23e-107	308.0	arCOG08865@1|root,arCOG08865@2157|Archaea,2XQRF@28889|Crenarchaeota	-	-	-	-	-	-	-
3138	ADG90355.1	633148.Tagg_0073	0.0	1060.0	COG4882@1|root,arCOG02960@2157|Archaea,2XQU8@28889|Crenarchaeota	Aminopeptidase Iap family-like protein	-	-	-	-	-	PA,Peptidase_M28
3138	ADG90356.1	633148.Tagg_0074	0.0	993.0	COG0008@1|root,arCOG00402@2157|Archaea,2XPVB@28889|Crenarchaeota	Catalyzes the attachment of proline to tRNA(Pro) in a two-step reaction proline is first activated by ATP to form Pro- AMP and then transferred to the acceptor end of tRNA(Pro)	proS	-	ko:K01881	ko00970,map00970	ko00000,ko00001,ko00002,ko01000,ko01007,ko03016	HGTP_anticodon,ProRS-C_1,tRNA-synt_2b
3138	ADG90357.1	633148.Tagg_0075	6.93e-49	155.0	arCOG04211@1|root,arCOG04211@2157|Archaea,2XR4C@28889|Crenarchaeota	-	-	-	-	-	-	-
3138	ADG90358.1	633148.Tagg_0076	1.02e-161	452.0	COG2102@1|root,arCOG00035@2157|Archaea,2XQDN@28889|Crenarchaeota	ATP binding protein	-	-	ko:K06927	-	ko00000,ko01000,ko03012	Diphthami_syn_2
3138	ADG90359.1	633148.Tagg_0077	1.62e-166	465.0	COG1237@1|root,arCOG00503@2157|Archaea,2XQRS@28889|Crenarchaeota	PFAM beta-lactamase domain protein	-	-	ko:K06897	ko00790,map00790	ko00000,ko00001,ko01000	Lactamase_B
3138	ADG90360.1	633148.Tagg_0078	0.0	927.0	COG1156@1|root,arCOG00865@2157|Archaea,2XPKW@28889|Crenarchaeota	Produces ATP from ADP in the presence of a proton gradient across the membrane. The archaeal beta chain is a regulatory subunit	atpB	-	ko:K02118	ko00190,ko01100,map00190,map01100	ko00000,ko00001,ko00002	ATP-synt_ab,ATP-synt_ab_N
