key	query	seed_ortholog	evalue	score	eggNOG_OGs	description	preferred_name	GOs	KEGG_ko	KEGG_pathway	brite	PFAMs
3140	GGM98118.1	300852.55771791	2.89e-183	513.0	COG0863@1|root,COG0863@2|Bacteria,1WID5@1297|Deinococcus-Thermus	DNA methylase	-	-	ko:K00590,ko:K07319	-	ko00000,ko01000,ko02048	N6_N4_Mtase
3140	GGM98124.1	1123388.AQWU01000051_gene1447	2.36e-186	522.0	COG0564@1|root,COG0564@2|Bacteria,1WI0R@1297|Deinococcus-Thermus	Responsible for synthesis of pseudouridine from uracil	rluD	-	ko:K06180	-	ko00000,ko01000,ko03009	PseudoU_synth_2,S4
3140	GGM98127.1	300852.55771834	1.47e-179	502.0	COG0410@1|root,COG0410@2|Bacteria,1WIEV@1297|Deinococcus-Thermus	ABC-type branched-chain amino acid transport systems ATPase component	-	-	ko:K01996	ko02010,ko02024,map02010,map02024	ko00000,ko00001,ko00002,ko02000	ABC_tran
3140	GGM98134.1	262724.TT_C0082	1.05e-274	753.0	COG0683@1|root,COG0683@2|Bacteria,1WIUB@1297|Deinococcus-Thermus	COG0683 ABC-type branched-chain amino acid transport systems, periplasmic component	-	-	ko:K01999	ko02010,ko02024,map02010,map02024	ko00000,ko00001,ko00002,ko02000	Peripla_BP_6
3140	GGM98137.1	300852.55771832	1.78e-242	667.0	COG4177@1|root,COG4177@2|Bacteria,1WJ18@1297|Deinococcus-Thermus	branched-chain amino acid transport system, permease component	-	-	ko:K01998	ko02010,ko02024,map02010,map02024	ko00000,ko00001,ko00002,ko02000	BPD_transp_2
3140	GGM98147.1	300852.55771831	6.23e-191	532.0	COG0559@1|root,COG0559@2|Bacteria,1WI8C@1297|Deinococcus-Thermus	COG0559 Branched-chain amino acid ABC-type transport system, permease components	-	-	ko:K01997	ko02010,ko02024,map02010,map02024	ko00000,ko00001,ko00002,ko02000	BPD_transp_2
3140	GGM98150.1	262724.TT_C0079	0.0	1253.0	COG1022@1|root,COG1022@2|Bacteria,1WIHH@1297|Deinococcus-Thermus	AMP-dependent synthetase and ligase	-	-	ko:K01897	ko00061,ko00071,ko01100,ko01212,ko02024,ko03320,ko04146,ko04216,ko04714,ko04920,map00061,map00071,map01100,map01212,map02024,map03320,map04146,map04216,map04714,map04920	ko00000,ko00001,ko00002,ko01000,ko01004,ko04147	AMP-binding
3140	GGM98153.1	262724.TT_C0078	1.76e-159	449.0	COG0411@1|root,COG0411@2|Bacteria,1WJ2M@1297|Deinococcus-Thermus	COG0411 ABC-type branched-chain amino acid transport systems ATPase component	-	-	ko:K01995	ko02010,ko02024,map02010,map02024	ko00000,ko00001,ko00002,ko02000	ABC_tran,BCA_ABC_TP_C
3140	GGM98160.1	300852.55771828	5.84e-25	93.2	COG0230@1|root,COG0230@2|Bacteria,1WKP1@1297|Deinococcus-Thermus	Belongs to the bacterial ribosomal protein bL34 family	rpmH	-	ko:K02914	ko03010,map03010	br01610,ko00000,ko00001,ko00002,ko03011	Ribosomal_L34
3140	GGM98163.1	498848.TaqDRAFT_3822	1.55e-42	139.0	COG0594@1|root,COG0594@2|Bacteria,1WKD9@1297|Deinococcus-Thermus	RNaseP catalyzes the removal of the 5'-leader sequence from pre-tRNA to produce the mature 5'-terminus. It can also cleave other RNA substrates such as 4.5S RNA. The protein component plays an auxiliary but essential role in vivo by binding to the 5'-leader sequence and broadening the substrate specificity of the ribozyme	rnpA	-	ko:K03536	-	ko00000,ko01000,ko03016	Ribonuclease_P
3140	GGM98170.1	1111069.TCCBUS3UF1_16920	1.79e-46	149.0	COG0759@1|root,COG0759@2|Bacteria,1WKD2@1297|Deinococcus-Thermus	Could be involved in insertion of integral membrane proteins into the membrane	-	-	ko:K08998	-	ko00000	Haemolytic
3140	GGM98178.1	300852.55771825	5.13e-273	751.0	COG0706@1|root,COG0706@2|Bacteria,1WIWR@1297|Deinococcus-Thermus	Required for the insertion and or proper folding and or complex formation of integral membrane proteins into the membrane. Involved in integration of membrane proteins that insert both dependently and independently of the Sec translocase complex, as well as at least some lipoproteins. Aids folding of multispanning membrane proteins	yidC	-	ko:K03217	ko02024,ko03060,ko03070,map02024,map03060,map03070	ko00000,ko00001,ko00002,ko02044,ko03029	60KD_IMP
3140	GGM98181.1	1123388.AQWU01000066_gene765	5.37e-114	329.0	COG1847@1|root,COG1847@2|Bacteria,1WJEC@1297|Deinococcus-Thermus	single-stranded nucleic acid binding R3H	-	-	ko:K06346	-	ko00000	KH_4,R3H
3140	GGM98189.1	1330700.JQNC01000003_gene198	1.11e-122	358.0	COG2890@1|root,COG2890@2|Bacteria,1WJ2A@1297|Deinococcus-Thermus	Methylates the class 1 translation termination release factors RF1 PrfA and RF2 PrfB on the glutamine residue of the universally conserved GGQ motif	prmC	GO:0003674,GO:0003824,GO:0005575,GO:0005622,GO:0005623,GO:0005737,GO:0005829,GO:0008150,GO:0008152,GO:0008168,GO:0008757,GO:0016740,GO:0016741,GO:0032259,GO:0044424,GO:0044444,GO:0044464	ko:K02493	-	ko00000,ko01000,ko03012	MTS
3140	GGM98194.1	1123386.AUIW01000020_gene1569	6.44e-132	395.0	COG4372@1|root,COG4372@2|Bacteria,1WJST@1297|Deinococcus-Thermus	protein with the myosin-like domain	-	-	-	-	-	DUF3084
3140	GGM98197.1	498848.TaqDRAFT_3816	1.95e-162	456.0	COG1137@1|root,COG1137@2|Bacteria,1WJ7Z@1297|Deinococcus-Thermus	ABC-type (Unclassified) transport system, ATPase component	-	-	ko:K06861	ko02010,map02010	ko00000,ko00001,ko00002,ko01000,ko02000	ABC_tran
3140	GGM98200.1	300852.55771820	0.0	896.0	COG0008@1|root,COG0008@2|Bacteria,1WJBD@1297|Deinococcus-Thermus	Catalyzes the attachment of glutamate to tRNA(Glu) in a two-step reaction glutamate is first activated by ATP to form Glu-AMP and then transferred to the acceptor end of tRNA(Glu)	gltX	-	ko:K01885	ko00860,ko00970,ko01100,ko01110,ko01120,map00860,map00970,map01100,map01110,map01120	ko00000,ko00001,ko00002,ko01000,ko01007,ko02048,ko03016	tRNA-synt_1c
3140	GGM98206.1	262724.TT_C0069	4.15e-77	233.0	2EDX2@1|root,30PV3@2|Bacteria,1WJYS@1297|Deinococcus-Thermus	-	-	-	-	-	-	-
3140	GGM98212.1	300852.55771818	6.3e-199	553.0	COG0552@1|root,COG0552@2|Bacteria,1WI54@1297|Deinococcus-Thermus	Involved in targeting and insertion of nascent membrane proteins into the cytoplasmic membrane. Acts as a receptor for the complex formed by the signal recognition particle (SRP) and the ribosome-nascent chain (RNC)	ftsY	-	ko:K03110	ko02024,ko03060,ko03070,map02024,map03060,map03070	ko00000,ko00001,ko00002,ko02044	SRP54,SRP54_N
3140	GGM98216.1	262724.TT_C0067	1.68e-86	255.0	COG1495@1|root,COG1495@2|Bacteria,1WJZX@1297|Deinococcus-Thermus	Belongs to the DsbB family	-	-	ko:K03611	-	ko00000,ko03110	DsbB
3140	GGM98219.1	1449357.JQLK01000001_gene46	8.65e-104	307.0	2EKDD@1|root,33E3P@2|Bacteria,1WJIQ@1297|Deinococcus-Thermus	-	-	-	-	-	-	-
3140	GGM98223.1	262724.TT_C1062	0.0	1282.0	COG0210@1|root,COG0210@2|Bacteria,1WI0I@1297|Deinococcus-Thermus	PFAM UvrD REP helicase	uvrD	-	ko:K03657	ko03420,ko03430,map03420,map03430	ko00000,ko00001,ko01000,ko03400	DUF3553,UvrD-helicase,UvrD_C
3140	GGM98226.1	300852.55772810	4.78e-194	540.0	COG1109@1|root,COG1109@2|Bacteria,1WIXG@1297|Deinococcus-Thermus	Phosphoglucomutase phosphomannomutase, alpha beta alpha domain II	-	-	-	-	-	PGM_PMM_I,PGM_PMM_II
3140	GGM98230.1	262724.TT_C1064	9.47e-212	587.0	COG0491@1|root,COG0491@2|Bacteria,1WJDH@1297|Deinococcus-Thermus	PFAM Metallo-beta-lactamase superfamily	-	-	-	-	-	Lactamase_B
3140	GGM98244.1	262724.TT_C0026	3.35e-120	346.0	COG4221@1|root,COG4221@2|Bacteria,1WJK7@1297|Deinococcus-Thermus	Short-chain Dehydrogenase reductase	-	-	-	-	-	adh_short
3140	GGM98251.1	300852.55771775	7.89e-58	181.0	COG5652@1|root,COG5652@2|Bacteria,1WK8S@1297|Deinococcus-Thermus	PFAM VanZ like	-	-	-	-	-	VanZ
3140	GGM98257.1	262724.TT_C0024	8.64e-84	248.0	COG0346@1|root,COG0346@2|Bacteria,1WJZW@1297|Deinococcus-Thermus	PFAM Glyoxalase bleomycin resistance protein dioxygenase	-	-	ko:K05606	ko00280,ko00630,ko00640,ko00720,ko01100,ko01120,ko01200,map00280,map00630,map00640,map00720,map01100,map01120,map01200	ko00000,ko00001,ko00002,ko01000	Glyoxalase_4
3140	GGM98264.1	262724.TT_C0023	0.0	1036.0	COG3573@1|root,COG3573@2|Bacteria,1WIAH@1297|Deinococcus-Thermus	FAD binding domain	-	-	ko:K07077	-	ko00000	FAD_binding_2
3140	GGM98269.1	1330700.JQNC01000003_gene1475	1.84e-194	543.0	COG1145@1|root,COG1148@1|root,COG1145@2|Bacteria,COG1148@2|Bacteria,1WJ5X@1297|Deinococcus-Thermus	4Fe-4S dicluster domain	-	-	-	-	-	Fer4,Fer4_4,Fer4_7,Fer4_9
3140	GGM98273.1	1449357.JQLK01000001_gene758	2.31e-222	617.0	COG1605@1|root,COG2876@1|root,COG1605@2|Bacteria,COG2876@2|Bacteria,1WJ86@1297|Deinococcus-Thermus	chorismate mutase domain of gram positive AroA protein	-	-	ko:K13853	ko00400,ko01100,ko01110,ko01130,ko01230,map00400,map01100,map01110,map01130,map01230	ko00000,ko00001,ko00002,ko01000	CM_2,DAHP_synth_1
3140	GGM98284.1	751945.Theos_1587	7.22e-158	444.0	COG0805@1|root,COG0805@2|Bacteria,1WJCW@1297|Deinococcus-Thermus	Part of the twin-arginine translocation (Tat) system that transports large folded proteins containing a characteristic twin-arginine motif in their signal peptide across membranes	tatC	-	ko:K03118	ko03060,ko03070,map03060,map03070	ko00000,ko00001,ko00002,ko02044	TatC
3140	GGM98287.1	262724.TT_C0018	1.25e-32	114.0	COG1826@1|root,COG1826@2|Bacteria,1WKBC@1297|Deinococcus-Thermus	Part of the twin-arginine translocation (Tat) system that transports large folded proteins containing a characteristic twin-arginine motif in their signal peptide across membranes. TatA could form the protein-conducting channel of the Tat system	-	-	ko:K03116	ko03060,ko03070,map03060,map03070	ko00000,ko00001,ko00002,ko02044	MttA_Hcf106
3140	GGM98294.1	300852.55771767	3.49e-281	774.0	COG1207@1|root,COG1207@2|Bacteria,1WIYX@1297|Deinococcus-Thermus	Catalyzes the last two sequential reactions in the de novo biosynthetic pathway for UDP-N-acetylglucosamine (UDP- GlcNAc). The C-terminal domain catalyzes the transfer of acetyl group from acetyl coenzyme A to glucosamine-1-phosphate (GlcN-1-P) to produce N-acetylglucosamine-1-phosphate (GlcNAc-1-P), which is converted into UDP-GlcNAc by the transfer of uridine 5- monophosphate (from uridine 5-triphosphate), a reaction catalyzed by the N-terminal domain	glmU	-	ko:K04042	ko00520,ko01100,ko01130,map00520,map01100,map01130	ko00000,ko00001,ko00002,ko01000	Hexapep,NTP_transf_3
3140	GGM98305.1	1111069.TCCBUS3UF1_4130	3.03e-192	535.0	COG0682@1|root,COG0682@2|Bacteria,1WJCB@1297|Deinococcus-Thermus	Transfers the N-acyl diglyceride group on what will become the N-terminal cysteine of membrane lipoproteins	lgt	-	ko:K13292	-	ko00000,ko01000	LGT
3140	GGM98311.1	300852.55771765	9.48e-40	132.0	COG0695@1|root,COG0695@2|Bacteria,1WKQ6@1297|Deinococcus-Thermus	Glutaredoxin-like domain (DUF836)	-	-	-	-	-	DUF836
3140	GGM98315.1	262724.TT_C0014	6.53e-97	283.0	COG2839@1|root,COG2839@2|Bacteria,1WJV1@1297|Deinococcus-Thermus	Protein of unknown function (DUF456)	-	-	ko:K09793	-	ko00000	DUF456
3140	GGM98324.1	498848.TaqDRAFT_3740	2.38e-207	578.0	COG0686@1|root,COG0686@2|Bacteria,1WIYT@1297|Deinococcus-Thermus	Alanine dehydrogenase/PNT, N-terminal domain	-	-	ko:K00259	ko00250,ko00430,ko01100,map00250,map00430,map01100	ko00000,ko00001,ko01000	AlaDh_PNT_C,AlaDh_PNT_N
3140	GGM98329.1	262724.TT_C1083	3.48e-305	833.0	COG0427@1|root,COG0427@2|Bacteria,1WJIT@1297|Deinococcus-Thermus	Acetyl-CoA hydrolase/transferase C-terminal domain	-	-	-	-	-	AcetylCoA_hyd_C,AcetylCoA_hydro
3140	GGM98334.1	262724.TT_C1931	0.0	1137.0	COG0550@1|root,COG0551@1|root,COG0550@2|Bacteria,COG0551@2|Bacteria,1WJ8E@1297|Deinococcus-Thermus	Releases the supercoiling and torsional tension of DNA, which is introduced during the DNA replication and transcription, by transiently cleaving and rejoining one strand of the DNA duplex. Introduces a single-strand break via transesterification at a target site in duplex DNA. The scissile phosphodiester is attacked by the catalytic tyrosine of the enzyme, resulting in the formation of a DNA-(5'-phosphotyrosyl)-enzyme intermediate and the expulsion of a 3'-OH DNA strand. The free DNA strand then undergoes passage around the unbroken strand, thus removing DNA supercoils. Finally, in the religation step, the DNA 3'-OH attacks the covalent intermediate to expel the active-site tyrosine and restore the DNA phosphodiester backbone	topA	-	ko:K03168	-	ko00000,ko01000,ko03032,ko03400	Topoisom_bac,Toprim,Toprim_C_rpt,zf-C4_Topoisom
3140	GGM98341.1	751945.Theos_0417	6.64e-41	136.0	2E9S3@1|root,333Y8@2|Bacteria,1WKEH@1297|Deinococcus-Thermus	-	-	-	-	-	-	-
3140	GGM98344.1	1123388.AQWU01000063_gene2046	7.71e-210	587.0	COG2720@1|root,COG2720@2|Bacteria,1WIWB@1297|Deinococcus-Thermus	PFAM VanW like protein	vanW	-	-	-	-	VanW
3140	GGM98355.1	1449357.JQLK01000001_gene740	7.17e-139	396.0	COG1187@1|root,COG1187@2|Bacteria,1WJ02@1297|Deinococcus-Thermus	Belongs to the pseudouridine synthase RsuA family	-	-	ko:K06183	-	ko00000,ko01000,ko03009	PseudoU_synth_2,S4
3140	GGM98358.1	1123386.AUIW01000010_gene91	9.29e-51	162.0	COG1708@1|root,COG1708@2|Bacteria,1WKFG@1297|Deinococcus-Thermus	Nucleotidyltransferase domain	-	-	-	-	-	NTP_transf_2
3140	GGM98361.1	1123386.AUIW01000010_gene90	3.22e-72	219.0	COG2250@1|root,COG2250@2|Bacteria,1WK1C@1297|Deinococcus-Thermus	HEPN domain	-	-	-	-	-	HEPN
3140	GGM98364.1	262724.TT_C1848	5.52e-237	657.0	COG2872@1|root,COG2872@2|Bacteria,1WIB4@1297|Deinococcus-Thermus	metal-dependent hydrolase related to alanyl-tRNA synthetase HxxxH domain	-	-	ko:K01872	ko00970,map00970	ko00000,ko00001,ko00002,ko01000,ko01007,ko03016	DHHA1,tRNA-synt_2c,tRNA_SAD
3140	GGM98367.1	1123388.AQWU01000063_gene2032	1.49e-157	444.0	COG1028@1|root,COG1028@2|Bacteria,1WIHF@1297|Deinococcus-Thermus	Short-chain dehydrogenase reductase SDR	-	-	-	-	-	adh_short_C2
3140	GGM98388.1	1123388.AQWU01000063_gene2031	7.06e-114	328.0	COG0492@1|root,COG0492@2|Bacteria,1WIAS@1297|Deinococcus-Thermus	FAD binding domain	-	-	-	-	-	Pyr_redox_2
3140	GGM98395.1	1123388.AQWU01000063_gene2030	4.55e-233	651.0	COG2815@1|root,COG2815@2|Bacteria,1WJKE@1297|Deinococcus-Thermus	PFAM PASTA domain	-	-	-	-	-	PASTA
3140	GGM98398.1	262724.TT_C0005	1.71e-60	187.0	COG0792@1|root,COG0792@2|Bacteria,1WK60@1297|Deinococcus-Thermus	Belongs to the UPF0102 family	-	-	ko:K07460	-	ko00000	UPF0102
3140	GGM98409.1	300852.55771755	0.0	1099.0	COG0043@1|root,COG0043@2|Bacteria,1WI75@1297|Deinococcus-Thermus	Belongs to the UbiD family	vdcC	-	ko:K03182	ko00130,ko01100,ko01110,map00130,map01100,map01110	ko00000,ko00001,ko00002,ko01000	UbiD
3140	GGM98414.1	743525.TSC_c22910	6.65e-193	538.0	COG0220@1|root,COG0220@2|Bacteria,1WI0J@1297|Deinococcus-Thermus	Catalyzes the formation of N(7)-methylguanine at position 46 (m7G46) in tRNA	trmB	GO:0001510,GO:0003674,GO:0003824,GO:0005575,GO:0005622,GO:0005623,GO:0005737,GO:0006139,GO:0006396,GO:0006399,GO:0006400,GO:0006725,GO:0006807,GO:0008033,GO:0008150,GO:0008152,GO:0008168,GO:0008173,GO:0008175,GO:0008176,GO:0008757,GO:0009451,GO:0009987,GO:0010467,GO:0016070,GO:0016423,GO:0016740,GO:0016741,GO:0030488,GO:0032259,GO:0032991,GO:0034470,GO:0034641,GO:0034660,GO:0034708,GO:0036265,GO:0043170,GO:0043412,GO:0043414,GO:0043527,GO:0044237,GO:0044238,GO:0044260,GO:0044424,GO:0044444,GO:0044464,GO:0046483,GO:0071704,GO:0090304,GO:0106004,GO:0140098,GO:0140101,GO:1901360,GO:1902494,GO:1990234	ko:K03439	-	ko00000,ko01000,ko03016	Methyltransf_4
3140	GGM98419.1	743525.TSC_c23090	2.76e-230	637.0	COG1168@1|root,COG1168@2|Bacteria,1WI5E@1297|Deinococcus-Thermus	Bifunctional PLP-dependent enzyme with beta-cystathionase and maltose regulon repressor activities	-	-	ko:K14155	ko00270,ko00450,ko01100,ko01110,ko01230,map00270,map00450,map01100,map01110,map01230	ko00000,ko00001,ko01000,ko01007	Aminotran_1_2
3140	GGM98423.1	498848.TaqDRAFT_3722	2.8e-96	281.0	COG0071@1|root,COG0071@2|Bacteria,1WJU3@1297|Deinococcus-Thermus	Belongs to the small heat shock protein (HSP20) family	-	-	ko:K13993	ko04141,map04141	ko00000,ko00001,ko03110	HSP20
3140	GGM98426.1	300852.55773004	2.59e-161	452.0	COG2897@1|root,COG2897@2|Bacteria,1WIGT@1297|Deinococcus-Thermus	Rhodanese Homology Domain	-	-	ko:K01011	ko00270,ko00920,ko01100,ko01120,ko04122,map00270,map00920,map01100,map01120,map04122	ko00000,ko00001,ko01000	Rhodanese
3140	GGM98431.1	262724.TT_C1259	4.87e-141	399.0	COG0491@1|root,COG0491@2|Bacteria,1WIMP@1297|Deinococcus-Thermus	COGs COG0491 Zn-dependent hydrolase including glyoxylase	-	-	-	-	-	Lactamase_B
3140	GGM98434.1	1123388.AQWU01000063_gene2058	2.26e-51	174.0	COG1579@1|root,COG1579@2|Bacteria,1WJTQ@1297|Deinococcus-Thermus	Zn-ribbon protein, possibly nucleic acid-binding	-	-	ko:K07164	-	ko00000	zf-RING_7
3140	GGM98440.1	262724.TT_C1261	1.01e-90	266.0	COG1764@1|root,COG1764@2|Bacteria,1WJVD@1297|Deinococcus-Thermus	redox protein regulator of disulfide bond formation	osmC	-	ko:K04063	-	ko00000	OsmC
3140	GGM98445.1	743525.TSC_c23150	1.16e-129	369.0	COG3374@1|root,COG3374@2|Bacteria,1WJJZ@1297|Deinococcus-Thermus	Protein of unknown function (DUF981)	-	-	ko:K08980	-	ko00000	DUF981
3140	GGM98449.1	262724.TT_C1263	1.7e-164	462.0	COG0696@1|root,COG0696@2|Bacteria,1WIS3@1297|Deinococcus-Thermus	PFAM Metalloenzyme	-	-	-	-	-	Metalloenzyme
3140	GGM98452.1	1123388.AQWU01000063_gene2061	2.8e-179	506.0	COG1840@1|root,COG1840@2|Bacteria,1WITN@1297|Deinococcus-Thermus	ABC-type Fe3 transport system, periplasmic component	-	-	ko:K02012	ko02010,map02010	ko00000,ko00001,ko00002,ko02000	SBP_bac_1,SBP_bac_11,SBP_bac_6,SBP_bac_8
3140	GGM98455.1	1330700.JQNC01000003_gene1509	3.33e-287	794.0	COG1178@1|root,COG1178@2|Bacteria,1WJ2J@1297|Deinococcus-Thermus	ABC-type Fe3 transport system permease component	-	-	ko:K02011	ko02010,map02010	ko00000,ko00001,ko00002,ko02000	BPD_transp_1
3140	GGM98459.1	498848.TaqDRAFT_3714	1.19e-206	576.0	COG3842@1|root,COG3842@2|Bacteria,1WIBV@1297|Deinococcus-Thermus	ABC-type spermidine putrescine transport systems, ATPase components	-	-	ko:K02010	ko02010,map02010	ko00000,ko00001,ko00002,ko01000,ko02000	ABC_tran,TOBE_2
3140	GGM98467.1	262724.TT_C1267	2.72e-147	418.0	COG0101@1|root,COG0101@2|Bacteria,1WJ4J@1297|Deinococcus-Thermus	Formation of pseudouridine at positions 38, 39 and 40 in the anticodon stem and loop of transfer RNAs	truA	GO:0001522,GO:0003674,GO:0003824,GO:0006139,GO:0006396,GO:0006399,GO:0006400,GO:0006725,GO:0006807,GO:0008033,GO:0008150,GO:0008152,GO:0009451,GO:0009982,GO:0009987,GO:0010467,GO:0016070,GO:0016853,GO:0016866,GO:0031119,GO:0034470,GO:0034641,GO:0034660,GO:0043170,GO:0043412,GO:0044237,GO:0044238,GO:0046483,GO:0071704,GO:0090304,GO:1901360	ko:K06173	-	ko00000,ko01000,ko03016	PseudoU_synth_1
3140	GGM98487.1	743525.TSC_c23210	3.05e-250	691.0	COG1173@1|root,COG1173@2|Bacteria,1WI67@1297|Deinococcus-Thermus	ABC-type dipeptide oligopeptide nickel transport systems, permease components	appC	-	ko:K02034	ko02024,map02024	ko00000,ko00001,ko00002,ko02000	BPD_transp_1,OppC_N
3140	GGM98493.1	743525.TSC_c23220	4.78e-226	624.0	COG0601@1|root,COG0601@2|Bacteria,1WIUD@1297|Deinococcus-Thermus	ABC-type dipeptide oligopeptide nickel transport systems, permease components	-	-	ko:K02033	ko02024,map02024	ko00000,ko00001,ko00002,ko02000	BPD_transp_1
3140	GGM98496.1	262724.TT_C1271	0.0	1169.0	COG0747@1|root,COG0747@2|Bacteria,1WI8D@1297|Deinococcus-Thermus	PFAM Bacterial extracellular solute-binding proteins, family 5 Middle	-	-	ko:K02035	ko02024,map02024	ko00000,ko00001,ko00002,ko02000	SBP_bac_5
3140	GGM98509.1	1123388.AQWU01000063_gene2068	4.49e-88	258.0	COG0316@1|root,COG0316@2|Bacteria,1WKA9@1297|Deinococcus-Thermus	Belongs to the HesB IscA family	hesB	-	ko:K13628	-	ko00000,ko03016	Fe-S_biosyn
3140	GGM98514.1	300852.55773018	3.94e-252	694.0	COG0006@1|root,COG0006@2|Bacteria,1WIH7@1297|Deinococcus-Thermus	PFAM Metallopeptidase family M24	-	-	ko:K01262	-	ko00000,ko01000,ko01002	Peptidase_M24
3140	GGM98524.1	262724.TT_C1274	2.81e-190	532.0	COG0462@1|root,COG0462@2|Bacteria,1WJ6U@1297|Deinococcus-Thermus	Involved in the biosynthesis of the central metabolite phospho-alpha-D-ribosyl-1-pyrophosphate (PRPP) via the transfer of pyrophosphoryl group from ATP to 1-hydroxyl of ribose-5-phosphate (Rib-5-P)	prs	-	ko:K00948	ko00030,ko00230,ko01100,ko01110,ko01120,ko01130,ko01200,ko01230,map00030,map00230,map01100,map01110,map01120,map01130,map01200,map01230	ko00000,ko00001,ko00002,ko01000	Pribosyl_synth,Pribosyltran_N
3140	GGM98528.1	262724.TT_C1275	1.99e-149	422.0	COG1073@1|root,COG1073@2|Bacteria,1WIJN@1297|Deinococcus-Thermus	alpha beta	-	-	ko:K06889	-	ko00000	FSH1,Hydrolase_4
3140	GGM98534.1	1111069.TCCBUS3UF1_3640	4.32e-98	288.0	COG1801@1|root,COG1801@2|Bacteria,1WIFG@1297|Deinococcus-Thermus	Protein of unknown function DUF72	-	-	-	-	-	DUF72
3140	GGM98537.1	1123388.AQWU01000063_gene2073	0.0	1144.0	COG1166@1|root,COG1166@2|Bacteria,1WJ0J@1297|Deinococcus-Thermus	Catalyzes the biosynthesis of agmatine from arginine	speA	-	ko:K01585	ko00330,ko01100,map00330,map01100	ko00000,ko00001,ko00002,ko01000	Orn_Arg_deC_N
3140	GGM98546.1	262724.TT_C1278	5.16e-172	489.0	COG2199@1|root,COG3706@2|Bacteria,1WIYY@1297|Deinococcus-Thermus	TIGRFAM diguanylate cyclase (GGDEF) domain	-	-	-	-	-	GGDEF
3140	GGM98550.1	262724.TT_C1279	7.66e-279	764.0	COG0192@1|root,COG0192@2|Bacteria,1WI7E@1297|Deinococcus-Thermus	Catalyzes the formation of S-adenosylmethionine (AdoMet) from methionine and ATP. The overall synthetic reaction is composed of two sequential steps, AdoMet formation and the subsequent tripolyphosphate hydrolysis which occurs prior to release of AdoMet from the enzyme	metK	GO:0003674,GO:0003824,GO:0004478,GO:0005575,GO:0005622,GO:0005623,GO:0005737,GO:0005829,GO:0016740,GO:0016765,GO:0044424,GO:0044444,GO:0044464	ko:K00789	ko00270,ko01100,ko01110,ko01230,map00270,map01100,map01110,map01230	ko00000,ko00001,ko00002,ko01000	S-AdoMet_synt_C,S-AdoMet_synt_M,S-AdoMet_synt_N
3140	GGM98557.1	262724.TT_C1280	2.79e-158	446.0	COG0796@1|root,COG0796@2|Bacteria,1WI52@1297|Deinococcus-Thermus	Provides the (R)-glutamate required for cell wall biosynthesis	murI	GO:0000270,GO:0003674,GO:0003824,GO:0006022,GO:0006023,GO:0006024,GO:0006807,GO:0008150,GO:0008152,GO:0008881,GO:0009058,GO:0009059,GO:0009252,GO:0009273,GO:0009987,GO:0016853,GO:0016854,GO:0016855,GO:0030203,GO:0034645,GO:0036361,GO:0042546,GO:0043170,GO:0044036,GO:0044038,GO:0044085,GO:0044237,GO:0044249,GO:0044260,GO:0047661,GO:0070589,GO:0071554,GO:0071704,GO:0071840,GO:1901135,GO:1901137,GO:1901564,GO:1901566,GO:1901576	ko:K01776	ko00471,ko01100,map00471,map01100	ko00000,ko00001,ko01000,ko01011	Asp_Glu_race
3140	GGM98564.1	1123389.ATXJ01000005_gene1890	8.31e-141	399.0	COG1611@1|root,COG1611@2|Bacteria,1WIN5@1297|Deinococcus-Thermus	Cytokinin riboside 5'-monophosphate phosphoribohydrolase	-	-	ko:K06966	ko00230,ko00240,map00230,map00240	ko00000,ko00001,ko01000	Lysine_decarbox
3140	GGM98568.1	300852.55773036	8.61e-134	380.0	COG0127@1|root,COG0127@2|Bacteria,1WJCE@1297|Deinococcus-Thermus	Pyrophosphatase that catalyzes the hydrolysis of nucleoside triphosphates to their monophosphate derivatives, with a high preference for the non-canonical purine nucleotides XTP (xanthosine triphosphate), dITP (deoxyinosine triphosphate) and ITP. Seems to function as a house-cleaning enzyme that removes non-canonical purine nucleotides from the nucleotide pool, thus preventing their incorporation into DNA RNA and avoiding chromosomal lesions	-	GO:0003674,GO:0003824,GO:0005575,GO:0005622,GO:0005623,GO:0005737,GO:0005829,GO:0006139,GO:0006725,GO:0006753,GO:0006793,GO:0006796,GO:0006807,GO:0008150,GO:0008152,GO:0009056,GO:0009058,GO:0009141,GO:0009143,GO:0009987,GO:0016462,GO:0016787,GO:0016817,GO:0016818,GO:0018130,GO:0019438,GO:0019439,GO:0019637,GO:0034404,GO:0034641,GO:0034654,GO:0034655,GO:0044237,GO:0044238,GO:0044248,GO:0044249,GO:0044270,GO:0044271,GO:0044281,GO:0044283,GO:0044424,GO:0044444,GO:0044464,GO:0046434,GO:0046483,GO:0046700,GO:0047429,GO:0055086,GO:0071704,GO:1901292,GO:1901360,GO:1901361,GO:1901362,GO:1901575,GO:1901576	ko:K02428	ko00230,map00230	ko00000,ko00001,ko01000	Ham1p_like
3140	GGM98586.1	262724.TT_C1289	8.96e-230	634.0	COG1723@1|root,COG1723@2|Bacteria,1WIRP@1297|Deinococcus-Thermus	PFAM Uncharacterised ACR, YagE family COG1723	-	-	-	-	-	-
3140	GGM98596.1	300852.55773034	5.82e-272	746.0	COG2182@1|root,COG2182@2|Bacteria,1WIGD@1297|Deinococcus-Thermus	extracellular solute-binding protein	-	-	ko:K15770	ko02010,map02010	ko00000,ko00001,ko00002,ko02000	SBP_bac_8
3140	GGM98603.1	1449080.JQMV01000003_gene2039	5.94e-285	782.0	COG1175@1|root,COG1175@2|Bacteria,1WI7U@1297|Deinococcus-Thermus	PFAM Binding-protein-dependent transport system inner membrane component	-	-	ko:K15771	ko02010,map02010	ko00000,ko00001,ko00002,ko02000	BPD_transp_1
3140	GGM98607.1	262724.TT_C1286	2.84e-286	785.0	COG3833@1|root,COG3833@2|Bacteria,1WIF1@1297|Deinococcus-Thermus	ABC-type maltose transport systems, permease component	-	-	ko:K15772	ko02010,map02010	ko00000,ko00001,ko00002,ko02000	BPD_transp_1
3140	GGM98609.1	262724.TT_C1283	0.0	1055.0	COG0366@1|root,COG0366@2|Bacteria,1WJA3@1297|Deinococcus-Thermus	PFAM alpha amylase, catalytic	-	-	ko:K01187	ko00052,ko00500,ko01100,map00052,map00500,map01100	ko00000,ko00001,ko01000	Alpha-amylase
3140	GGM98614.1	262724.TT_C1282	0.0	1124.0	COG1193@1|root,COG1193@2|Bacteria,1WIC7@1297|Deinococcus-Thermus	Endonuclease that is involved in the suppression of homologous recombination and may therefore have a key role in the control of bacterial genetic diversity	mutS2	-	ko:K07456	ko03430,map03430	ko00000,ko00001,ko03400	MutS_V,Smr
3140	GGM98622.1	262724.TT_C1494	7.61e-80	238.0	COG0824@1|root,COG0824@2|Bacteria,1WKH6@1297|Deinococcus-Thermus	PFAM thioesterase superfamily	-	-	ko:K07107	-	ko00000,ko01000	4HBT,4HBT_2
3140	GGM98625.1	262724.TT_C1501	0.0	980.0	COG1164@1|root,COG1164@2|Bacteria,1WIRX@1297|Deinococcus-Thermus	Oligoendopeptidase, pepF M3 family	-	-	-	-	-	Peptidase_M3,Peptidase_M3_N
3140	GGM98628.1	300852.55773235	7.92e-60	187.0	COG0394@1|root,COG0394@2|Bacteria,1WJVY@1297|Deinococcus-Thermus	Low molecular weight phosphotyrosine protein phosphatase	-	-	ko:K03741	-	ko00000,ko01000	LMWPc
3140	GGM98637.1	300852.55773236	1.8e-141	401.0	COG0500@1|root,COG2226@2|Bacteria,1WIUM@1297|Deinococcus-Thermus	Methyltransferase required for the conversion of demethylmenaquinol (DMKH2) to menaquinol (MKH2)	menG	-	ko:K03183	ko00130,ko01100,ko01110,map00130,map01100,map01110	ko00000,ko00001,ko00002,ko01000	Ubie_methyltran
