key	query	seed_ortholog	evalue	score	eggNOG_OGs	description	preferred_name	GOs	KEGG_ko	KEGG_pathway	brite	PFAMs
3140	GGN03231.1	518766.Rmar_1093	8.47e-250	714.0	COG0610@1|root,COG0610@2|Bacteria,4NFJ8@976|Bacteroidetes,1FJN3@1100069|Bacteroidetes Order II. Incertae sedis	Subunit R is required for both nuclease and ATPase activities, but not for modification	hsdR	-	ko:K01153	-	ko00000,ko01000,ko02048	HSDR_N,ResIII
3140	GGN03239.1	743525.TSC_c08170	1.85e-59	196.0	COG0732@1|root,COG0732@2|Bacteria,1WKUF@1297|Deinococcus-Thermus	Type I restriction modification DNA specificity domain	-	-	ko:K01154	-	ko00000,ko01000,ko02048	Methylase_S
3140	GGN03270.1	1449357.JQLK01000001_gene1022	7.75e-62	194.0	COG4636@1|root,COG4636@2|Bacteria,1WJSZ@1297|Deinococcus-Thermus	Putative restriction endonuclease	-	-	-	-	-	Uma2
3140	GGN03280.1	1123388.AQWU01000065_gene2001	6.33e-208	578.0	COG0618@1|root,COG0618@2|Bacteria,1WJ01@1297|Deinococcus-Thermus	phosphoesterase RecJ domain protein	-	-	ko:K06881	ko00920,ko01100,ko01120,map00920,map01100,map01120	ko00000,ko00001,ko01000,ko03400	DHH,DHHA1
3140	GGN03299.1	1111069.TCCBUS3UF1_18050	2.01e-151	427.0	COG1028@1|root,COG1028@2|Bacteria,1WIJC@1297|Deinococcus-Thermus	Short-chain dehydrogenase reductase SDR	-	-	-	-	-	adh_short_C2
3140	GGN03310.1	262724.TT_C0091	2.84e-85	252.0	COG1051@1|root,COG1051@2|Bacteria,1WJZ7@1297|Deinococcus-Thermus	Belongs to the Nudix hydrolase family	-	-	ko:K03574,ko:K12944	-	ko00000,ko01000,ko03400	NUDIX
3140	GGN03315.1	300852.55771841	5.5e-165	463.0	COG0558@1|root,COG0558@2|Bacteria,1WIUS@1297|Deinococcus-Thermus	Belongs to the CDP-alcohol phosphatidyltransferase class-I family	-	-	-	-	-	CDP-OH_P_transf
3140	GGN03320.1	262724.TT_C0089	4.77e-114	330.0	COG0283@1|root,COG0283@2|Bacteria,1WI82@1297|Deinococcus-Thermus	Belongs to the cytidylate kinase family. Type 1 subfamily	cmk	GO:0003674,GO:0003824,GO:0004127,GO:0004592,GO:0005575,GO:0005622,GO:0005623,GO:0005737,GO:0005829,GO:0006082,GO:0006139,GO:0006520,GO:0006573,GO:0006575,GO:0006725,GO:0006732,GO:0006753,GO:0006766,GO:0006767,GO:0006793,GO:0006796,GO:0006807,GO:0008150,GO:0008152,GO:0009058,GO:0009081,GO:0009108,GO:0009110,GO:0009117,GO:0009123,GO:0009165,GO:0009987,GO:0015939,GO:0015940,GO:0016053,GO:0016301,GO:0016310,GO:0016740,GO:0016772,GO:0016776,GO:0016874,GO:0016879,GO:0016881,GO:0018130,GO:0019205,GO:0019438,GO:0019637,GO:0019752,GO:0032787,GO:0033317,GO:0034641,GO:0034654,GO:0042364,GO:0042398,GO:0043436,GO:0043603,GO:0043604,GO:0044237,GO:0044238,GO:0044249,GO:0044271,GO:0044281,GO:0044283,GO:0044424,GO:0044444,GO:0044464,GO:0046394,GO:0046483,GO:0046939,GO:0046940,GO:0050145,GO:0051186,GO:0051188,GO:0055086,GO:0071704,GO:0072330,GO:0090407,GO:1901293,GO:1901360,GO:1901362,GO:1901564,GO:1901566,GO:1901576,GO:1901605	ko:K00945	ko00240,ko01100,map00240,map01100	ko00000,ko00001,ko00002,ko01000	Cytidylate_kin
3140	GGN03324.1	262724.TT_C0088	3.88e-283	776.0	COG0128@1|root,COG0128@2|Bacteria,1WI9P@1297|Deinococcus-Thermus	Catalyzes the transfer of the enolpyruvyl moiety of phosphoenolpyruvate (PEP) to the 5-hydroxyl of shikimate-3- phosphate (S3P) to produce enolpyruvyl shikimate-3-phosphate and inorganic phosphate	aroA	GO:0003674,GO:0003824,GO:0003866,GO:0006082,GO:0008150,GO:0008152,GO:0009058,GO:0009423,GO:0009987,GO:0016053,GO:0016740,GO:0016765,GO:0019752,GO:0043436,GO:0043648,GO:0043650,GO:0044237,GO:0044249,GO:0044281,GO:0044283,GO:0046394,GO:0046417,GO:0071704,GO:1901576	ko:K00800	ko00400,ko01100,ko01110,ko01130,ko01230,map00400,map01100,map01110,map01130,map01230	ko00000,ko00001,ko00002,ko01000	EPSP_synthase
3140	GGN03327.1	1330700.JQNC01000003_gene81	6.72e-151	428.0	COG1482@1|root,COG1482@2|Bacteria,1WJV9@1297|Deinococcus-Thermus	PFAM Phosphomannose isomerase type I	-	-	ko:K01809	ko00051,ko00520,ko01100,ko01110,ko01130,map00051,map00520,map01100,map01110,map01130	ko00000,ko00001,ko00002,ko01000	PMI_typeI
3140	GGN03331.1	1111069.TCCBUS3UF1_18120	6.16e-183	511.0	28IC9@1|root,2Z8EN@2|Bacteria,1WIM1@1297|Deinococcus-Thermus	Bacterial phospho-glucose isomerase C-terminal SIS domain	-	-	-	-	-	bact-PGI_C
3140	GGN03338.1	1111069.TCCBUS3UF1_18130	2.7e-136	388.0	COG1515@1|root,COG1515@2|Bacteria,1WJ7E@1297|Deinococcus-Thermus	DNA repair enzyme involved in the repair of deaminated bases. Selectively cleaves double-stranded DNA at the second phosphodiester bond 3' to a deoxyinosine leaving behind the intact lesion on the nicked DNA	nfi	-	ko:K05982	-	ko00000,ko01000,ko03400	Endonuclease_5
3140	GGN03345.1	1449357.JQLK01000001_gene1011	1.23e-120	347.0	COG0204@1|root,COG0204@2|Bacteria,1WJXG@1297|Deinococcus-Thermus	PFAM Phospholipid glycerol acyltransferase	-	-	ko:K00655	ko00561,ko00564,ko01100,ko01110,map00561,map00564,map01100,map01110	ko00000,ko00001,ko00002,ko01000,ko01004	Acyltransferase
3140	GGN03353.1	1123389.ATXJ01000001_gene480	1.22e-54	171.0	COG0776@1|root,COG0776@2|Bacteria,1WK4X@1297|Deinococcus-Thermus	Histone-like DNA-binding protein which is capable of wrapping DNA to stabilize it, and thus to prevent its denaturation under extreme environmental conditions	-	GO:0003674,GO:0003676,GO:0003677,GO:0005488,GO:0005575,GO:0005622,GO:0005623,GO:0005737,GO:0005829,GO:0008150,GO:0009889,GO:0010556,GO:0019219,GO:0019222,GO:0031323,GO:0031326,GO:0044424,GO:0044444,GO:0044464,GO:0050789,GO:0050794,GO:0051171,GO:0051252,GO:0060255,GO:0065007,GO:0080090,GO:0097159,GO:1901363,GO:1903506,GO:2001141	ko:K03530	-	ko00000,ko03032,ko03036,ko03400	Bac_DNA_binding
3140	GGN03357.1	1123388.AQWU01000065_gene1987	0.0	1135.0	COG0465@1|root,COG0465@2|Bacteria,1WIQ8@1297|Deinococcus-Thermus	Acts as a processive, ATP-dependent zinc metallopeptidase for both cytoplasmic and membrane proteins. Plays a role in the quality control of integral membrane proteins	-	-	ko:K03798	-	ko00000,ko00002,ko01000,ko01002,ko03110	AAA,FtsH_ext,Peptidase_M41
3140	GGN03360.1	300852.55772873	0.0	1117.0	COG0443@1|root,COG0443@2|Bacteria,1WIVP@1297|Deinococcus-Thermus	Heat shock 70 kDa protein	dnaK	-	ko:K04043	ko03018,ko04212,ko05152,map03018,map04212,map05152	ko00000,ko00001,ko03019,ko03029,ko03110,ko04147	HSP70
3140	GGN03363.1	300852.55772872	4.18e-100	293.0	COG0576@1|root,COG0576@2|Bacteria,1WJGI@1297|Deinococcus-Thermus	Participates actively in the response to hyperosmotic and heat shock by preventing the aggregation of stress-denatured proteins, in association with DnaK and GrpE. It is the nucleotide exchange factor for DnaK and may function as a thermosensor. Unfolded proteins bind initially to DnaJ	grpE	GO:0000166,GO:0000774,GO:0003674,GO:0005488,GO:0005515,GO:0008150,GO:0017076,GO:0030234,GO:0030554,GO:0036094,GO:0050790,GO:0051082,GO:0060589,GO:0060590,GO:0065007,GO:0065009,GO:0097159,GO:0098772,GO:1901265,GO:1901363	ko:K03687	-	ko00000,ko03029,ko03110	GrpE
3140	GGN03367.1	262724.TT_C1125	1.32e-188	525.0	COG0484@1|root,COG0484@2|Bacteria,1WIGZ@1297|Deinococcus-Thermus	DnaJ-class molecular chaperone with C-terminal Zn finger domain	dnaJ2	-	ko:K05516	-	ko00000,ko03036,ko03110	DnaJ,DnaJ_C
3140	GGN03371.1	1330700.JQNC01000003_gene72	4.15e-42	138.0	COG0789@1|root,COG0789@2|Bacteria,1WKBF@1297|Deinococcus-Thermus	MerR HTH family regulatory protein	-	-	ko:K18997	-	ko00000,ko03036	MerR_2
3140	GGN03374.1	262724.TT_C1123	0.0	1479.0	COG0542@1|root,COG0542@2|Bacteria,1WIQM@1297|Deinococcus-Thermus	Part of a stress-induced multi-chaperone system, it is involved in the recovery of the cell from heat-induced damage, in cooperation with DnaK, DnaJ and GrpE	clpB	GO:0003674,GO:0005488,GO:0005515,GO:0042802	ko:K03695	ko04213,map04213	ko00000,ko00001,ko03110	AAA,AAA_2,ClpB_D2-small,Clp_N
3140	GGN03389.1	300852.55772868	3.02e-79	236.0	COG1633@1|root,COG1633@2|Bacteria,1WK1G@1297|Deinococcus-Thermus	Rubrerythrin	-	-	-	-	-	Rubrerythrin
3140	GGN03397.1	262724.TT_C1121	1.36e-268	737.0	COG1503@1|root,COG1503@2|Bacteria,1WJ3F@1297|Deinococcus-Thermus	translation release factor activity	-	-	-	-	-	Host_attach
3140	GGN03408.1	262724.TT_C1120	4.91e-85	251.0	COG0071@1|root,COG0071@2|Bacteria,1WJV5@1297|Deinococcus-Thermus	Belongs to the small heat shock protein (HSP20) family	ibpA	-	ko:K13993	ko04141,map04141	ko00000,ko00001,ko03110	HSP20
3140	GGN03419.1	262724.TT_C1119	8.32e-157	440.0	COG2129@1|root,COG2129@2|Bacteria,1WI7H@1297|Deinococcus-Thermus	Metallophosphoesterase, calcineurin superfamily	-	-	ko:K07096	-	ko00000	Metallophos_3
3140	GGN03422.1	262724.TT_C1118	5.01e-91	267.0	COG2193@1|root,COG2193@2|Bacteria,1WK3C@1297|Deinococcus-Thermus	Ferritin Dps family protein	-	-	ko:K03594	ko00860,map00860	ko00000,ko00001,ko01000	Ferritin
3140	GGN03425.1	526227.Mesil_0414	2.41e-113	330.0	COG1225@1|root,COG1225@2|Bacteria,1WNGU@1297|Deinococcus-Thermus	Redoxin	-	-	-	-	-	AhpC-TSA
3140	GGN03430.1	926560.KE387023_gene1319	6.51e-36	123.0	COG0695@1|root,COG0695@2|Bacteria	Has a glutathione-disulfide oxidoreductase activity in the presence of NADPH and glutathione reductase. Reduces low molecular weight disulfides and proteins	-	-	ko:K03676,ko:K18917	-	ko00000,ko01000,ko03110	Glutaredoxin
3140	GGN03434.1	262724.TT_C1117	9.43e-93	271.0	COG3118@1|root,COG3118@2|Bacteria,1WK8Q@1297|Deinococcus-Thermus	Thioredoxin	-	-	ko:K03672	-	ko00000,ko01000,ko03110	Thioredoxin
3140	GGN03438.1	1111069.TCCBUS3UF1_18280	2.15e-78	234.0	COG0071@1|root,COG0071@2|Bacteria,1WJTA@1297|Deinococcus-Thermus	Small heat shock protein, HSP20 family	-	-	ko:K13993	ko04141,map04141	ko00000,ko00001,ko03110	HSP20
3140	GGN03442.1	1111069.TCCBUS3UF1_18290	6.19e-92	270.0	arCOG05087@1|root,31BBY@2|Bacteria,1WJUF@1297|Deinococcus-Thermus	Domain of unknown function (DUF1931)	-	-	-	-	-	DUF1931
3140	GGN03447.1	262724.TT_C1114	1.09e-75	228.0	COG3431@1|root,COG3431@2|Bacteria,1WJTK@1297|Deinococcus-Thermus	Phosphate-starvation-inducible E	-	-	-	-	-	PsiE
3140	GGN03449.1	262724.TT_C1113	3.51e-96	281.0	COG0490@1|root,COG0490@2|Bacteria,1WJS3@1297|Deinococcus-Thermus	regulatory, ligand-binding protein related to C-terminal domains of K channels	-	-	ko:K07228	-	ko00000	TrkA_C
3140	GGN03452.1	262724.TT_C1112	3.98e-213	595.0	COG0475@1|root,COG0475@2|Bacteria,1WI84@1297|Deinococcus-Thermus	PFAM sodium hydrogen exchanger	-	-	ko:K03455	-	ko00000	Na_H_Exchanger
3140	GGN03459.1	743525.TSC_c20410	3.3e-176	493.0	COG0616@1|root,COG0616@2|Bacteria,1WIZG@1297|Deinococcus-Thermus	COGs COG0616 Periplasmic serine protease (ClpP class)	-	-	-	-	-	SDH_sah
3140	GGN03465.1	1111069.TCCBUS3UF1_18340	7.87e-128	365.0	COG0705@1|root,COG0705@2|Bacteria,1WIDY@1297|Deinococcus-Thermus	PFAM Rhomboid family	-	-	-	-	-	Rhomboid
3140	GGN03469.1	1123388.AQWU01000065_gene1969	1.79e-65	203.0	COG0517@1|root,COG0517@2|Bacteria,1WKCD@1297|Deinococcus-Thermus	PFAM CBS domain	-	-	-	-	-	CBS
3140	GGN03473.1	262724.TT_C1108	1.07e-236	655.0	COG0475@1|root,COG0475@2|Bacteria,1WI4G@1297|Deinococcus-Thermus	Kef-type K transport systems membrane components	-	-	-	-	-	Na_H_Exchanger
3140	GGN03487.1	262724.TT_C1107	1.34e-211	598.0	COG0457@1|root,COG0741@1|root,COG0457@2|Bacteria,COG0741@2|Bacteria,1WIRC@1297|Deinococcus-Thermus	COGs COG0741 Soluble lytic murein transglycosylase and related regulatory protein (some contain LysM invasin domains)	-	-	ko:K08309	-	ko00000,ko01000,ko01011	SLT,TPR_8
3140	GGN03494.1	262724.TT_C1106	1.67e-292	801.0	COG0305@1|root,COG0305@2|Bacteria,1WIM7@1297|Deinococcus-Thermus	Participates in initiation and elongation during chromosome replication	dnaB	-	ko:K02314	ko03030,ko04112,map03030,map04112	ko00000,ko00001,ko01000,ko03032	DnaB,DnaB_C,Intein_splicing,LAGLIDADG_3
3140	GGN03505.1	300852.55772851	1.26e-113	328.0	COG2199@1|root,COG2199@2|Bacteria,1WIE1@1297|Deinococcus-Thermus	Protoglobin	-	-	-	-	-	Protoglobin
3140	GGN03510.1	300852.55772850	0.0	2843.0	COG0067@1|root,COG0069@1|root,COG0070@1|root,COG0067@2|Bacteria,COG0069@2|Bacteria,COG0070@2|Bacteria,1WIA7@1297|Deinococcus-Thermus	PFAM Conserved region in glutamate synthase	-	-	ko:K00265,ko:K00284	ko00250,ko00630,ko00910,ko01100,ko01110,ko01120,ko01130,ko01230,map00250,map00630,map00910,map01100,map01110,map01120,map01130,map01230	ko00000,ko00001,ko01000	GATase_2,GXGXG,Glu_syn_central,Glu_synthase
3140	GGN03518.1	1449080.JQMV01000003_gene1968	1.59e-193	539.0	COG1475@1|root,COG1475@2|Bacteria,1WIS1@1297|Deinococcus-Thermus	Domain of unknown function (DUF4032)	-	-	-	-	-	DUF4032,ParBc
3140	GGN03523.1	498848.TaqDRAFT_4839	3.14e-73	222.0	COG0802@1|root,COG0802@2|Bacteria,1WKEV@1297|Deinococcus-Thermus	PFAM Uncharacterised P-loop hydrolase UPF0079	-	-	ko:K06925	-	ko00000,ko03016	TsaE
3140	GGN03526.1	1123388.AQWU01000027_gene305	4.9e-91	268.0	COG0526@1|root,COG0526@2|Bacteria,1WJUT@1297|Deinococcus-Thermus	Thioredoxin-like	-	-	-	-	-	AhpC-TSA
3140	GGN03529.1	1123388.AQWU01000027_gene306	1.76e-82	247.0	COG2389@1|root,COG2389@2|Bacteria,1WJUN@1297|Deinococcus-Thermus	metal-binding protein (DUF2227)	-	-	-	-	-	DUF2227
3140	GGN03532.1	1123386.AUIW01000015_gene546	2.18e-138	394.0	COG4242@1|root,COG4242@2|Bacteria,1WIAZ@1297|Deinococcus-Thermus	Belongs to the peptidase S51 family	-	-	ko:K13282	-	ko00000,ko01000,ko01002	Peptidase_S51
3140	GGN03536.1	262724.TT_C1819	2.63e-102	299.0	COG1309@1|root,COG1309@2|Bacteria,1WIY5@1297|Deinococcus-Thermus	PFAM Bacterial regulatory proteins, tetR family	-	-	-	-	-	TetR_N
3140	GGN03539.1	743525.TSC_c03370	3.22e-109	315.0	COG1329@1|root,COG1329@2|Bacteria,1WI68@1297|Deinococcus-Thermus	transcriptional regulator	-	-	ko:K07736	-	ko00000,ko03000	CarD_CdnL_TRCF
3140	GGN03550.1	1330700.JQNC01000003_gene1993	8.38e-99	290.0	COG0819@1|root,COG0819@2|Bacteria,1WI45@1297|Deinococcus-Thermus	Catalyzes an amino-pyrimidine hydrolysis reaction at the C5' of the pyrimidine moiety of thiamine compounds, a reaction that is part of a thiamine salvage pathway	-	-	ko:K20896	ko00730,ko01100,map00730,map01100	ko00000,ko00001,ko01000	-
3140	GGN03554.1	1449080.JQMV01000003_gene355	9.14e-151	428.0	COG1947@1|root,COG1947@2|Bacteria,1WJXM@1297|Deinococcus-Thermus	Catalyzes the phosphorylation of the position 2 hydroxy group of 4-diphosphocytidyl-2C-methyl-D-erythritol	ispE	GO:0003674,GO:0003824,GO:0006793,GO:0006796,GO:0008150,GO:0008152,GO:0009987,GO:0016301,GO:0016310,GO:0016740,GO:0016772,GO:0016773,GO:0044237,GO:0050515	ko:K00919	ko00900,ko01100,ko01110,ko01130,map00900,map01100,map01110,map01130	ko00000,ko00001,ko00002,ko01000	GHMP_kinases_C,GHMP_kinases_N
3140	GGN03564.1	1123386.AUIW01000015_gene551	1.24e-126	363.0	COG1211@1|root,COG1211@2|Bacteria,1WI23@1297|Deinococcus-Thermus	Catalyzes the formation of 4-diphosphocytidyl-2-C- methyl-D-erythritol from CTP and 2-C-methyl-D-erythritol 4- phosphate (MEP)	ispD	GO:0003674,GO:0003824,GO:0016740,GO:0016772,GO:0016779,GO:0050518,GO:0070567	ko:K00991	ko00900,ko01100,ko01110,ko01130,map00900,map01100,map01110,map01130	ko00000,ko00001,ko00002,ko01000	IspD
3140	GGN03567.1	751945.Theos_2071	1.63e-141	404.0	COG1968@1|root,COG1968@2|Bacteria,1WI57@1297|Deinococcus-Thermus	Catalyzes the dephosphorylation of undecaprenyl diphosphate (UPP). Confers resistance to bacitracin	uppP	-	ko:K06153	ko00550,map00550	ko00000,ko00001,ko01000,ko01011	BacA
3140	GGN03578.1	1123388.AQWU01000027_gene314	1.27e-218	607.0	COG0075@1|root,COG0075@2|Bacteria,1WI2G@1297|Deinococcus-Thermus	Aminotransferase, class V	-	-	ko:K00830	ko00250,ko00260,ko00630,ko00680,ko01100,ko01110,ko01120,ko01130,ko01200,ko04146,map00250,map00260,map00630,map00680,map01100,map01110,map01120,map01130,map01200,map04146	ko00000,ko00001,ko00002,ko01000,ko01007	Aminotran_5
3140	GGN03595.1	1123388.AQWU01000027_gene315	1.77e-200	561.0	COG0484@1|root,COG0484@2|Bacteria,1WI37@1297|Deinococcus-Thermus	ATP binding to DnaK triggers the release of the substrate protein, thus completing the reaction cycle. Several rounds of ATP-dependent interactions between DnaJ, DnaK and GrpE are required for fully efficient folding. Also involved, together with DnaK and GrpE, in the DNA replication of plasmids through activation of initiation proteins	dnaJ	-	ko:K03686	-	ko00000,ko03029,ko03110	DnaJ,DnaJ_C,DnaJ_CXXCXGXG
3140	GGN03607.1	262724.TT_C1811	3.25e-48	154.0	COG1278@1|root,COG1278@2|Bacteria,1WKC4@1297|Deinococcus-Thermus	PFAM Cold-shock protein, DNA-binding	-	-	ko:K03704	-	ko00000,ko03000	CSD
3140	GGN03618.1	1449357.JQLK01000001_gene243	7.93e-87	257.0	COG1670@1|root,COG1670@2|Bacteria,1WI91@1297|Deinococcus-Thermus	PFAM Acetyltransferase (GNAT) family	-	-	-	-	-	Acetyltransf_1,Acetyltransf_3
3140	GGN03638.1	262724.TT_C1809	2.03e-47	152.0	COG1146@1|root,COG1146@2|Bacteria,1WKCK@1297|Deinococcus-Thermus	Ferredoxin	-	-	-	-	-	Fer4
3140	GGN03646.1	1123389.ATXJ01000008_gene2186	6.03e-94	277.0	COG3620@1|root,COG3620@2|Bacteria,1WJJ5@1297|Deinococcus-Thermus	sequence-specific DNA binding	-	-	-	-	-	-
3140	GGN03650.1	1123388.AQWU01000043_gene384	6.43e-133	380.0	COG2266@1|root,COG2266@2|Bacteria,1WIEX@1297|Deinococcus-Thermus	MobA-like NTP transferase domain	-	-	-	-	-	NTP_transf_3
3140	GGN03659.1	1123388.AQWU01000043_gene385	1.38e-108	317.0	COG5658@1|root,COG5658@2|Bacteria,1WK4A@1297|Deinococcus-Thermus	Protein of unknown function (DUF1648)	-	-	-	-	-	DUF1648,SdpI
3140	GGN03664.1	1123389.ATXJ01000008_gene2184	5.49e-270	746.0	COG1470@1|root,COG3895@1|root,COG1470@2|Bacteria,COG3895@2|Bacteria,1WIA5@1297|Deinococcus-Thermus	PFAM PEGA domain	-	-	-	-	-	DUF4384,PEGA
3140	GGN03682.1	1111069.TCCBUS3UF1_19950	5.68e-210	582.0	COG0825@1|root,COG0825@2|Bacteria,1WJ82@1297|Deinococcus-Thermus	Component of the acetyl coenzyme A carboxylase (ACC) complex. First, biotin carboxylase catalyzes the carboxylation of biotin on its carrier protein (BCCP) and then the CO(2) group is transferred by the carboxyltransferase to acetyl-CoA to form malonyl-CoA	accA	-	ko:K01962	ko00061,ko00620,ko00640,ko00720,ko01100,ko01110,ko01120,ko01130,ko01200,ko01212,map00061,map00620,map00640,map00720,map01100,map01110,map01120,map01130,map01200,map01212	ko00000,ko00001,ko00002,ko01000	ACCA
3140	GGN03688.1	743525.TSC_c03220	5.34e-186	519.0	COG0777@1|root,COG0777@2|Bacteria,1WIB7@1297|Deinococcus-Thermus	Component of the acetyl coenzyme A carboxylase (ACC) complex. Biotin carboxylase (BC) catalyzes the carboxylation of biotin on its carrier protein (BCCP) and then the CO(2) group is transferred by the transcarboxylase to acetyl-CoA to form malonyl- CoA	accD	-	ko:K01963	ko00061,ko00620,ko00640,ko00720,ko01100,ko01110,ko01120,ko01130,ko01200,ko01212,map00061,map00620,map00640,map00720,map01100,map01110,map01120,map01130,map01200,map01212	ko00000,ko00001,ko00002,ko01000	Carboxyl_trans
3140	GGN03693.1	1449357.JQLK01000001_gene250	1.4e-64	199.0	COG1664@1|root,COG1664@2|Bacteria,1WKED@1297|Deinococcus-Thermus	Integral membrane protein CcmA involved in cell shape determination	-	-	-	-	-	Bactofilin
3140	GGN03710.1	498848.TaqDRAFT_4817	2.89e-171	483.0	COG0739@1|root,COG0739@2|Bacteria,1WIP1@1297|Deinococcus-Thermus	PFAM Peptidase family M23	-	-	-	-	-	Peptidase_M23
3140	GGN03713.1	262724.TT_C1412	2.71e-267	736.0	COG0213@1|root,COG0213@2|Bacteria,1WIM2@1297|Deinococcus-Thermus	pyrimidine-nucleoside phosphorylase	-	-	ko:K00756,ko:K00758	ko00240,ko00983,ko01100,ko05219,map00240,map00983,map01100,map05219	ko00000,ko00001,ko01000	Glycos_trans_3N,Glycos_transf_3,PYNP_C
3140	GGN03725.1	262724.TT_C1414	2.7e-205	569.0	COG0191@1|root,COG0191@2|Bacteria,1WIKG@1297|Deinococcus-Thermus	fructose-1,6-bisphosphate aldolase, class II, various bacterial and amitochondriate protist	fba	-	ko:K01624	ko00010,ko00030,ko00051,ko00680,ko00710,ko01100,ko01110,ko01120,ko01130,ko01200,ko01230,map00010,map00030,map00051,map00680,map00710,map01100,map01110,map01120,map01130,map01200,map01230	ko00000,ko00001,ko00002,ko01000	F_bP_aldolase
3140	GGN03728.1	1111069.TCCBUS3UF1_20010	1.85e-246	679.0	COG2805@1|root,COG2805@2|Bacteria,1WI5S@1297|Deinococcus-Thermus	Tfp pilus assembly protein pilus retraction ATPase PilT	-	-	ko:K02669	-	ko00000,ko02035,ko02044	T2SSE
3140	GGN03733.1	262724.TT_C1416	5.77e-181	505.0	COG0414@1|root,COG0414@2|Bacteria,1WIB9@1297|Deinococcus-Thermus	Catalyzes the condensation of pantoate with beta-alanine in an ATP-dependent reaction via a pantoyl-adenylate intermediate	panC	GO:0003674,GO:0003824,GO:0004592,GO:0005575,GO:0005622,GO:0005623,GO:0005737,GO:0005829,GO:0006082,GO:0006520,GO:0006573,GO:0006575,GO:0006732,GO:0006766,GO:0006767,GO:0006807,GO:0008150,GO:0008152,GO:0009058,GO:0009081,GO:0009108,GO:0009110,GO:0009987,GO:0015939,GO:0015940,GO:0016053,GO:0016874,GO:0016879,GO:0016881,GO:0019752,GO:0032787,GO:0033317,GO:0034641,GO:0042364,GO:0042398,GO:0043436,GO:0043603,GO:0043604,GO:0044237,GO:0044238,GO:0044249,GO:0044271,GO:0044281,GO:0044283,GO:0044424,GO:0044444,GO:0044464,GO:0046394,GO:0051186,GO:0051188,GO:0071704,GO:0072330,GO:1901564,GO:1901566,GO:1901576,GO:1901605	ko:K01918	ko00410,ko00770,ko01100,ko01110,map00410,map00770,map01100,map01110	ko00000,ko00001,ko00002,ko01000	Pantoate_ligase
3140	GGN03737.1	262724.TT_C1417	5.12e-56	174.0	2ESTI@1|root,33KBY@2|Bacteria,1WK5S@1297|Deinococcus-Thermus	-	-	-	-	-	-	-
3140	GGN03748.1	1123388.AQWU01000043_gene397	7.6e-70	211.0	COG0799@1|root,COG0799@2|Bacteria,1WK1I@1297|Deinococcus-Thermus	Functions as a ribosomal silencing factor. Interacts with ribosomal protein L14 (rplN), blocking formation of intersubunit bridge B8. Prevents association of the 30S and 50S ribosomal subunits and the formation of functional ribosomes, thus repressing translation	rsfS	-	ko:K09710	-	ko00000,ko03009	RsfS
3140	GGN03755.1	1123388.AQWU01000043_gene398	2.53e-192	541.0	COG1316@1|root,COG1316@2|Bacteria,1WIR3@1297|Deinococcus-Thermus	TIGRFAM cell envelope-related function transcriptional attenuator	lytR	-	-	-	-	LytR_C,LytR_cpsA_psr
3140	GGN03760.1	751945.Theos_0258	6.91e-102	298.0	COG1713@1|root,COG1713@2|Bacteria,1WJCT@1297|Deinococcus-Thermus	HD superfamily hydrolase involved in NAD metabolism	-	-	-	-	-	HD
3140	GGN03767.1	1123389.ATXJ01000008_gene2170	1.26e-119	343.0	COG1057@1|root,COG1057@2|Bacteria,1WJ70@1297|Deinococcus-Thermus	Catalyzes the reversible adenylation of nicotinate mononucleotide (NaMN) to nicotinic acid adenine dinucleotide (NaAD)	nadD	-	ko:K00969	ko00760,ko01100,map00760,map01100	ko00000,ko00001,ko00002,ko01000	CTP_transf_like
3140	GGN03781.1	1123389.ATXJ01000008_gene2169	2.03e-240	667.0	COG0536@1|root,COG0536@2|Bacteria,1WIKJ@1297|Deinococcus-Thermus	An essential GTPase which binds GTP, GDP and possibly (p)ppGpp with moderate affinity, with high nucleotide exchange rates and a fairly low GTP hydrolysis rate. Plays a role in control of the cell cycle, stress response, ribosome biogenesis and in those bacteria that undergo differentiation, in morphogenesis control	obg	-	ko:K03979	-	ko00000,ko01000,ko03009	DUF1967,GTP1_OBG,MMR_HSR1
3140	GGN03786.1	751945.Theos_0255	9.99e-53	166.0	COG0211@1|root,COG0211@2|Bacteria,1WKBG@1297|Deinococcus-Thermus	Belongs to the bacterial ribosomal protein bL27 family	rpmA	GO:0003674,GO:0003735,GO:0005198,GO:0005575,GO:0005622,GO:0005623,GO:0005737,GO:0005829,GO:0005840,GO:0015934,GO:0022625,GO:0022626,GO:0032991,GO:0043226,GO:0043228,GO:0043229,GO:0043232,GO:0044391,GO:0044422,GO:0044424,GO:0044444,GO:0044445,GO:0044446,GO:0044464,GO:1990904	ko:K02899	ko03010,map03010	br01610,ko00000,ko00001,ko00002,ko03011	Ribosomal_L27
3140	GGN03792.1	1330700.JQNC01000003_gene1964	8.72e-59	182.0	COG0261@1|root,COG0261@2|Bacteria,1WKB6@1297|Deinococcus-Thermus	This protein binds to 23S rRNA in the presence of protein L20	rplU	GO:0003674,GO:0003735,GO:0005198	ko:K02888	ko03010,map03010	br01610,ko00000,ko00001,ko00002,ko03011	Ribosomal_L21p
3140	GGN03800.1	1123389.ATXJ01000008_gene2166	1.13e-40	134.0	COG1314@1|root,COG1314@2|Bacteria,1WKBM@1297|Deinococcus-Thermus	Preprotein translocase SecG subunit	-	-	ko:K03075	ko02024,ko03060,ko03070,map02024,map03060,map03070	ko00000,ko00001,ko00002,ko02044	SecG
3140	GGN03805.1	1449080.JQMV01000003_gene313	2.31e-181	509.0	COG1171@1|root,COG1171@2|Bacteria,1WI3F@1297|Deinococcus-Thermus	PFAM Pyridoxal-5'-phosphate-dependent protein beta subunit	-	-	ko:K01754	ko00260,ko00290,ko01100,ko01110,ko01130,ko01200,ko01230,map00260,map00290,map01100,map01110,map01130,map01200,map01230	ko00000,ko00001,ko00002,ko01000	PALP
3140	GGN03810.1	262724.TT_C1706	2.01e-289	789.0	COG0505@1|root,COG0505@2|Bacteria,1WJ1J@1297|Deinococcus-Thermus	Belongs to the CarA family	carA	GO:0000050,GO:0005575,GO:0005622,GO:0005623,GO:0005737,GO:0005951,GO:0006082,GO:0006520,GO:0006525,GO:0006526,GO:0006807,GO:0008150,GO:0008152,GO:0008652,GO:0009058,GO:0009064,GO:0009084,GO:0009987,GO:0016053,GO:0019627,GO:0019752,GO:0032991,GO:0034641,GO:0043436,GO:0043603,GO:0043604,GO:0044237,GO:0044238,GO:0044249,GO:0044271,GO:0044281,GO:0044283,GO:0044424,GO:0044444,GO:0044464,GO:0046394,GO:0071704,GO:0071941,GO:1901564,GO:1901566,GO:1901576,GO:1901605,GO:1901607,GO:1902494	ko:K01956	ko00240,ko00250,ko01100,map00240,map00250,map01100	ko00000,ko00001,ko00002,ko01000	CPSase_sm_chain,GATase
3140	GGN03813.1	1449080.JQMV01000003_gene310	1.61e-118	339.0	COG1246@1|root,COG1246@2|Bacteria,1WI5N@1297|Deinococcus-Thermus	PFAM Acetyltransferase (GNAT) family	-	-	ko:K00619	ko00220,ko01100,ko01110,ko01130,ko01210,ko01230,map00220,map01100,map01110,map01130,map01210,map01230	ko00000,ko00001,ko00002,ko01000	Acetyltransf_1
3140	GGN03817.1	262724.TT_C1702	1.75e-310	848.0	COG0165@1|root,COG0165@2|Bacteria,1WI7D@1297|Deinococcus-Thermus	argininosuccinate lyase	argH	GO:0003674,GO:0003824,GO:0004056,GO:0005575,GO:0005622,GO:0005623,GO:0005737,GO:0006082,GO:0006520,GO:0006525,GO:0006526,GO:0006591,GO:0006807,GO:0008150,GO:0008152,GO:0008652,GO:0009058,GO:0009064,GO:0009084,GO:0009987,GO:0016053,GO:0016829,GO:0016840,GO:0016842,GO:0019752,GO:0042450,GO:0043436,GO:0044237,GO:0044238,GO:0044249,GO:0044281,GO:0044283,GO:0044424,GO:0044464,GO:0046394,GO:0071704,GO:1901564,GO:1901566,GO:1901576,GO:1901605,GO:1901607	ko:K01755	ko00220,ko00250,ko01100,ko01110,ko01130,ko01230,map00220,map00250,map01100,map01110,map01130,map01230	ko00000,ko00001,ko00002,ko01000,ko04147	ASL_C2,Lyase_1
