key	query	seed_ortholog	evalue	score	eggNOG_OGs	description	preferred_name	GOs	KEGG_ko	KEGG_pathway	brite	PFAMs
3140	GGM94672.1	262724.TT_C0383	3.72e-77	230.0	COG0295@1|root,COG0295@2|Bacteria,1WKF5@1297|Deinococcus-Thermus	This enzyme scavenges exogenous and endogenous cytidine and 2'-deoxycytidine for UMP synthesis	-	-	ko:K01489	ko00240,ko00983,ko01100,map00240,map00983,map01100	ko00000,ko00001,ko01000	dCMP_cyt_deam_1
3140	GGM94674.1	300852.55772118	8.06e-113	328.0	2BMP5@1|root,32G8G@2|Bacteria,1WJPK@1297|Deinococcus-Thermus	-	-	-	-	-	-	-
3140	GGM94692.1	300852.55772119	4.02e-180	504.0	COG0329@1|root,COG0329@2|Bacteria,1WIBA@1297|Deinococcus-Thermus	Belongs to the DapA family	-	-	-	-	-	DHDPS
3140	GGM94695.1	1449080.JQMV01000003_gene867	7.01e-268	755.0	28KZQ@1|root,2ZAEW@2|Bacteria,1WIVS@1297|Deinococcus-Thermus	-	-	-	-	-	-	-
3140	GGM94701.1	1111069.TCCBUS3UF1_14690	9.65e-143	404.0	COG1760@1|root,COG1760@2|Bacteria,1WIC1@1297|Deinococcus-Thermus	TIGRFAM L-serine dehydratase, iron-sulfur-dependent, beta subunit	-	-	ko:K01752	ko00260,ko00270,ko01100,ko01110,ko01130,ko01200,ko01230,map00260,map00270,map01100,map01110,map01130,map01200,map01230	ko00000,ko00001,ko01000	ACT,SDH_beta
3140	GGM94707.1	1449080.JQMV01000003_gene869	1.9e-157	450.0	COG0642@1|root,COG2205@2|Bacteria,1WIDR@1297|Deinococcus-Thermus	Histidine kinase-, DNA gyrase B-, and HSP90-like ATPase	-	-	-	-	-	HATPase_c,HisKA
3140	GGM94715.1	300852.55772123	0.0	1137.0	COG0481@1|root,COG0481@2|Bacteria,1WIX4@1297|Deinococcus-Thermus	Required for accurate and efficient protein synthesis under certain stress conditions. May act as a fidelity factor of the translation reaction, by catalyzing a one-codon backward translocation of tRNAs on improperly translocated ribosomes. Back- translocation proceeds from a post-translocation (POST) complex to a pre-translocation (PRE) complex, thus giving elongation factor G a second chance to translocate the tRNAs correctly. Binds to ribosomes in a GTP-dependent manner	lepA	-	ko:K03596	ko05134,map05134	ko00000,ko00001	EFG_C,EFG_II,GTP_EFTU,GTP_EFTU_D2,LepA_C
3140	GGM94721.1	1123389.ATXJ01000002_gene1536	0.0	1186.0	COG0341@1|root,COG0342@1|root,COG0341@2|Bacteria,COG0342@2|Bacteria,1WIQ0@1297|Deinococcus-Thermus	Part of the Sec protein translocase complex. Interacts with the SecYEG preprotein conducting channel. SecDF uses the proton motive force (PMF) to complete protein translocation after the ATP-dependent function of SecA	secD	-	ko:K12257	ko02024,ko03060,ko03070,map02024,map03060,map03070	ko00000,ko00001,ko00002,ko02044	SecD_SecF,Sec_GG
3140	GGM94723.1	498848.TaqDRAFT_3855	1.77e-05	47.0	2A1RZ@1|root,30Q0M@2|Bacteria,1WKST@1297|Deinococcus-Thermus	-	-	-	-	-	-	-
3140	GGM94728.1	262724.TT_C0347	0.0	1007.0	COG0532@1|root,COG0532@2|Bacteria,1WI2Q@1297|Deinococcus-Thermus	One of the essential components for the initiation of protein synthesis. Protects formylmethionyl-tRNA from spontaneous hydrolysis and promotes its binding to the 30S ribosomal subunits. Also involved in the hydrolysis of GTP during the formation of the 70S ribosomal complex	infB	GO:0005575,GO:0005622,GO:0005623,GO:0005737,GO:0044424,GO:0044464	ko:K02519	-	ko00000,ko03012,ko03029	GTP_EFTU,GTP_EFTU_D2,IF-2,IF2_N
3140	GGM94732.1	262724.TT_C0348	2.19e-50	160.0	COG2740@1|root,COG2740@2|Bacteria,1WK87@1297|Deinococcus-Thermus	nucleic-acid-binding protein implicated in transcription termination	-	-	ko:K07742	-	ko00000	DUF448
3140	GGM94739.1	1123388.AQWU01000064_gene1903	1.73e-252	696.0	COG0195@1|root,COG0195@2|Bacteria,1WIKS@1297|Deinococcus-Thermus	Participates in both transcription termination and antitermination	nusA	-	ko:K02600	-	ko00000,ko03009,ko03021	KH_5,NusA_N,S1
3140	GGM94745.1	1449080.JQMV01000003_gene880	2.48e-86	255.0	COG0779@1|root,COG0779@2|Bacteria,1WK6M@1297|Deinococcus-Thermus	Required for maturation of 30S ribosomal subunits	rimP	GO:0000028,GO:0005575,GO:0005622,GO:0005623,GO:0005737,GO:0005829,GO:0006412,GO:0006518,GO:0006807,GO:0006996,GO:0008150,GO:0008152,GO:0009058,GO:0009059,GO:0009987,GO:0010467,GO:0016043,GO:0019538,GO:0022607,GO:0022613,GO:0022618,GO:0034622,GO:0034641,GO:0034645,GO:0042254,GO:0042255,GO:0042274,GO:0043043,GO:0043170,GO:0043603,GO:0043604,GO:0043933,GO:0044085,GO:0044237,GO:0044238,GO:0044249,GO:0044260,GO:0044267,GO:0044271,GO:0044424,GO:0044444,GO:0044464,GO:0065003,GO:0070925,GO:0071704,GO:0071826,GO:0071840,GO:1901564,GO:1901566,GO:1901576	ko:K09748	-	ko00000,ko03009	DUF150,DUF150_C
3140	GGM94755.1	262724.TT_C0699	3.65e-253	696.0	COG0117@1|root,COG1985@1|root,COG0117@2|Bacteria,COG1985@2|Bacteria,1WIP8@1297|Deinococcus-Thermus	Converts 2,5-diamino-6-(ribosylamino)-4(3h)-pyrimidinone 5'-phosphate into 5-amino-6-(ribosylamino)-2,4(1h,3h)- pyrimidinedione 5'-phosphate	ribD	-	ko:K11752	ko00740,ko01100,ko01110,ko02024,map00740,map01100,map01110,map02024	ko00000,ko00001,ko00002,ko01000	RibD_C,dCMP_cyt_deam_1
3140	GGM94758.1	262724.TT_C0698	1.92e-127	363.0	COG0307@1|root,COG0307@2|Bacteria,1WJTZ@1297|Deinococcus-Thermus	riboflavin synthase, alpha subunit	ribE	-	ko:K00793	ko00740,ko01100,ko01110,map00740,map01100,map01110	ko00000,ko00001,ko00002,ko01000	Lum_binding
3140	GGM94768.1	300852.55772444	9.51e-283	773.0	COG0108@1|root,COG0807@1|root,COG0108@2|Bacteria,COG0807@2|Bacteria,1WI7N@1297|Deinococcus-Thermus	Catalyzes the conversion of D-ribulose 5-phosphate to formate and 3,4-dihydroxy-2-butanone 4-phosphate	ribBA	-	ko:K14652	ko00740,ko00790,ko01100,ko01110,map00740,map00790,map01100,map01110	ko00000,ko00001,ko00002,ko01000	DHBP_synthase,GTP_cyclohydro2
3140	GGM94774.1	1111069.TCCBUS3UF1_14510	0.0	1046.0	COG2304@1|root,COG2304@2|Bacteria,1WIWZ@1297|Deinococcus-Thermus	von Willebrand factor, type A	-	-	-	-	-	VWA,VWA_2,VWA_3
3140	GGM94778.1	262724.TT_P0043	7.3e-196	545.0	COG0491@1|root,COG0491@2|Bacteria,1WI41@1297|Deinococcus-Thermus	Metallo-beta-lactamase superfamily	-	-	-	-	-	Lactamase_B
3140	GGM94782.1	751945.Theos_1161	2.57e-27	104.0	2A1R0@1|root,30PZI@2|Bacteria,1WKME@1297|Deinococcus-Thermus	-	-	-	-	-	-	-
3140	GGM94785.1	751945.Theos_1160	1.93e-100	292.0	COG2050@1|root,COG2050@2|Bacteria,1WJVA@1297|Deinococcus-Thermus	Thioesterase superfamily	-	-	-	-	-	4HBT
3140	GGM94788.1	262724.TT_C0676	4.64e-96	280.0	COG2185@1|root,COG2185@2|Bacteria,1WJS8@1297|Deinococcus-Thermus	TIGRFAM methylmalonyl-CoA mutase C-terminal domain	-	-	ko:K01849	ko00280,ko00630,ko00640,ko00720,ko01100,ko01120,ko01200,map00280,map00630,map00640,map00720,map01100,map01120,map01200	ko00000,ko00001,ko00002,ko01000	B12-binding
3140	GGM94792.1	262724.TT_C0677	0.0	1068.0	COG1884@1|root,COG1884@2|Bacteria,1WIX7@1297|Deinococcus-Thermus	Methylmalonyl-CoA mutase	-	-	ko:K01848,ko:K11942	ko00280,ko00630,ko00640,ko00720,ko01100,ko01120,ko01200,map00280,map00630,map00640,map00720,map01100,map01120,map01200	ko00000,ko00001,ko00002,ko01000	MM_CoA_mutase
3140	GGM94801.1	262724.TT_C0678	3.16e-169	477.0	COG0053@1|root,COG0053@2|Bacteria,1WI3N@1297|Deinococcus-Thermus	Belongs to the cation diffusion facilitator (CDF) transporter (TC 2.A.4) family	czrB	-	-	-	-	Cation_efflux,ZT_dimer
3140	GGM94809.1	743525.TSC_c09280	0.0	928.0	COG1190@1|root,COG1190@2|Bacteria,1WI4Z@1297|Deinococcus-Thermus	Belongs to the class-II aminoacyl-tRNA synthetase family	lysS	-	ko:K04567	ko00970,map00970	ko00000,ko00001,ko00002,ko01000,ko01007,ko03016	tRNA-synt_2,tRNA_anti-codon
3140	GGM94812.1	498848.TaqDRAFT_3872	2.82e-81	243.0	COG0782@1|root,COG0782@2|Bacteria,1WJ0Q@1297|Deinococcus-Thermus	Belongs to the GreA GreB family	gfh1	-	ko:K03624	-	ko00000,ko03021	GreA_GreB,GreA_GreB_N
3140	GGM94816.1	1111069.TCCBUS3UF1_14400	4.61e-72	217.0	2E7PI@1|root,33254@2|Bacteria,1WJYX@1297|Deinococcus-Thermus	-	-	-	-	-	-	-
3140	GGM94820.1	1111069.TCCBUS3UF1_14390	7.41e-55	173.0	COG0818@1|root,COG0818@2|Bacteria,1WJY6@1297|Deinococcus-Thermus	Diacylglycerol kinase	-	-	ko:K00901	ko00561,ko00564,ko01100,ko01110,ko04070,ko04072,ko05231,map00561,map00564,map01100,map01110,map04070,map04072,map05231	ko00000,ko00001,ko01000	DAGK_prokar
3140	GGM94822.1	262724.TT_C0683	7.19e-94	274.0	COG0319@1|root,COG0319@2|Bacteria,1WJWJ@1297|Deinococcus-Thermus	Single strand-specific metallo-endoribonuclease involved in late-stage 70S ribosome quality control and in maturation of the 3' terminus of the 16S rRNA	ybeY	-	ko:K07042	-	ko00000,ko03009	UPF0054
3140	GGM94827.1	743525.TSC_c09330	5.72e-215	596.0	COG1702@1|root,COG1702@2|Bacteria,1WIK4@1297|Deinococcus-Thermus	Phosphate starvation-inducible protein PhoH	phoH	-	ko:K06217	-	ko00000	KH_1,LAGLIDADG_3,PhoH
3140	GGM94839.1	1123388.AQWU01000064_gene1921	1.3e-27	105.0	2EBN0@1|root,335N7@2|Bacteria,1WK6A@1297|Deinococcus-Thermus	-	-	-	-	-	-	-
3140	GGM94845.1	1330700.JQNC01000003_gene482	3.19e-142	411.0	COG4864@1|root,COG4864@2|Bacteria,1WI32@1297|Deinococcus-Thermus	UPF0365 protein	-	-	-	-	-	YdfA_immunity
3140	GGM94850.1	262724.TT_C0687	1.44e-225	631.0	COG1030@1|root,COG1030@2|Bacteria,1WIAJ@1297|Deinococcus-Thermus	Membrane-bound serine protease (ClpP class)	-	-	ko:K07403	-	ko00000	CLP_protease,NfeD,SDH_sah
3140	GGM94855.1	300852.55772432	3.95e-161	454.0	COG0169@1|root,COG0169@2|Bacteria,1WIM8@1297|Deinococcus-Thermus	Involved in the biosynthesis of the chorismate, which leads to the biosynthesis of aromatic amino acids. Catalyzes the reversible NADPH linked reduction of 3-dehydroshikimate (DHSA) to yield shikimate (SA)	aroE	GO:0000166,GO:0003674,GO:0005488,GO:0036094,GO:0048037,GO:0050661,GO:0050662,GO:0097159,GO:1901265,GO:1901363	ko:K00014	ko00400,ko01100,ko01110,ko01130,ko01230,map00400,map01100,map01110,map01130,map01230	ko00000,ko00001,ko00002,ko01000	Shikimate_DH,Shikimate_dh_N
3140	GGM94862.1	300852.55772434	1.47e-66	205.0	COG4113@1|root,COG4113@2|Bacteria,1WMZ3@1297|Deinococcus-Thermus	Toxic component of a toxin-antitoxin (TA) module. An RNase	-	-	-	-	-	PIN
3140	GGM94876.1	262724.TT_C0689	2.99e-109	317.0	COG1739@1|root,COG1739@2|Bacteria,1WJVU@1297|Deinococcus-Thermus	PFAM Uncharacterised protein family UPF0029, Impact, N-terminal	-	-	-	-	-	DUF1949,UPF0029
3140	GGM94879.1	300852.55772436	0.0	1501.0	COG0258@1|root,COG0749@1|root,COG0258@2|Bacteria,COG0749@2|Bacteria,1WIA1@1297|Deinococcus-Thermus	In addition to polymerase activity, this DNA polymerase exhibits 5'-3' exonuclease activity	polA	-	ko:K02335	ko00230,ko00240,ko01100,ko03030,ko03410,ko03420,ko03440,map00230,map00240,map01100,map03030,map03410,map03420,map03440	ko00000,ko00001,ko01000,ko03032,ko03400	5_3_exonuc,5_3_exonuc_N,DNA_pol_A,Taq-exonuc
3140	GGM94884.1	262724.TT_C1752	5.83e-26	98.6	2A1N5@1|root,30PWE@2|Bacteria,1WK74@1297|Deinococcus-Thermus	-	-	-	-	-	-	-
3140	GGM94892.1	1123386.AUIW01000008_gene1867	2.47e-96	286.0	COG1296@1|root,COG1296@2|Bacteria,1WJG7@1297|Deinococcus-Thermus	Branched-chain amino acid permease	-	-	-	-	-	AzlC
3140	GGM94901.1	300852.55772438	1.03e-285	784.0	COG1109@1|root,COG1109@2|Bacteria,1WITP@1297|Deinococcus-Thermus	Catalyzes the conversion of glucosamine-6-phosphate to glucosamine-1-phosphate	glmM	-	ko:K03431	ko00520,ko01100,ko01130,map00520,map01100,map01130	ko00000,ko00001,ko01000	PGM_PMM_I,PGM_PMM_II,PGM_PMM_III,PGM_PMM_IV
3140	GGM94911.1	1123388.AQWU01000064_gene1928	1.26e-41	138.0	COG0858@1|root,COG0858@2|Bacteria,1WKDX@1297|Deinococcus-Thermus	One of several proteins that assist in the late maturation steps of the functional core of the 30S ribosomal subunit. Associates with free 30S ribosomal subunits (but not with 30S subunits that are part of 70S ribosomes or polysomes). Required for efficient processing of 16S rRNA. May interact with the 5'-terminal helix region of 16S rRNA	rbfA	-	ko:K02834	-	ko00000,ko03009	RBFA
3140	GGM94918.1	300852.55772290	1.54e-68	210.0	COG0824@1|root,COG0824@2|Bacteria,1WKEF@1297|Deinococcus-Thermus	PFAM thioesterase superfamily	-	-	ko:K07107	-	ko00000,ko01000	4HBT,4HBT_2
3140	GGM94930.1	498848.TaqDRAFT_4225	4.66e-119	343.0	COG1926@1|root,COG1926@2|Bacteria,1WJGC@1297|Deinococcus-Thermus	PFAM Phosphoribosyl transferase domain	-	-	-	-	-	Pribosyltran
3140	GGM94939.1	751945.Theos_1666	3.71e-83	246.0	COG1917@1|root,COG1917@2|Bacteria,1WJWS@1297|Deinococcus-Thermus	Cupin 2, conserved barrel domain protein	-	-	-	-	-	Cupin_2
3140	GGM94957.1	1111069.TCCBUS3UF1_16760	7.65e-191	534.0	COG1277@1|root,COG1277@2|Bacteria,1WJAA@1297|Deinococcus-Thermus	ABC-type transport system involved in multi-copper enzyme maturation permease component	-	-	ko:K01992	-	ko00000,ko00002,ko02000	ABC2_membrane_2
3140	GGM94969.1	1330700.JQNC01000003_gene217	3.09e-196	546.0	COG1131@1|root,COG1131@2|Bacteria,1WJ0H@1297|Deinococcus-Thermus	ABC-type multidrug transport system ATPase component	-	-	ko:K01990	-	ko00000,ko00002,ko02000	ABC_tran,DUF4162
3140	GGM94977.1	1123388.AQWU01000061_gene927	1.19e-230	640.0	COG1470@1|root,COG1470@2|Bacteria,1WIYF@1297|Deinococcus-Thermus	PFAM NPCBM-associated, NEW3 domain of alpha-galactosidase	-	-	-	-	-	NPCBM_assoc
3140	GGM94985.1	1330700.JQNC01000003_gene219	4.14e-94	275.0	COG1586@1|root,COG1586@2|Bacteria,1WJUZ@1297|Deinococcus-Thermus	Catalyzes the decarboxylation of S-adenosylmethionine to S-adenosylmethioninamine (dcAdoMet), the propylamine donor required for the synthesis of the polyamines spermine and spermidine from the diamine putrescine	-	-	ko:K01611	ko00270,ko00330,ko01100,map00270,map00330,map01100	ko00000,ko00001,ko00002,ko01000	AdoMet_dc
3140	GGM94991.1	262724.TT_C1092	5.17e-83	245.0	COG2009@1|root,COG2009@2|Bacteria,1WK5G@1297|Deinococcus-Thermus	TIGRFAM Succinate dehydrogenase, cytochrome b556 subunit	-	-	ko:K00241	ko00020,ko00190,ko00650,ko00720,ko01100,ko01110,ko01120,ko01130,ko01200,map00020,map00190,map00650,map00720,map01100,map01110,map01120,map01130,map01200	ko00000,ko00001,ko00002	Sdh_cyt
3140	GGM94994.1	262724.TT_C1091	1.05e-89	263.0	COG2142@1|root,COG2142@2|Bacteria,1WJU8@1297|Deinococcus-Thermus	PFAM Succinate dehydrogenase Fumarate reductase, transmembrane subunit	-	-	ko:K00242	ko00020,ko00190,ko00650,ko00720,ko01100,ko01110,ko01120,ko01130,ko01200,map00020,map00190,map00650,map00720,map01100,map01110,map01120,map01130,map01200	ko00000,ko00001,ko00002	Sdh_cyt
3140	GGM94999.1	300852.55772836	0.0	1127.0	COG1053@1|root,COG1053@2|Bacteria,1WIYZ@1297|Deinococcus-Thermus	succinate dehydrogenase or fumarate reductase, flavoprotein	sdhA	-	ko:K00239	ko00020,ko00190,ko00650,ko00720,ko01100,ko01110,ko01120,ko01130,ko01200,ko05134,map00020,map00190,map00650,map00720,map01100,map01110,map01120,map01130,map01200,map05134	ko00000,ko00001,ko00002,ko01000	FAD_binding_2,Succ_DH_flav_C
3140	GGM95014.1	300852.55772835	9.8e-167	466.0	COG0479@1|root,COG0479@2|Bacteria,1WIEW@1297|Deinococcus-Thermus	TIGRFAM succinate dehydrogenase and fumarate reductase iron-sulfur protein	-	-	ko:K00240	ko00020,ko00190,ko00650,ko00720,ko01100,ko01110,ko01120,ko01130,ko01200,map00020,map00190,map00650,map00720,map01100,map01110,map01120,map01130,map01200	ko00000,ko00001,ko00002,ko01000	Fer2_3,Fer4_10,Fer4_8
3140	GGM95020.1	743525.TSC_c18950	2.2e-128	365.0	COG0693@1|root,COG0693@2|Bacteria,1WJ0Y@1297|Deinococcus-Thermus	TIGRFAM intracellular protease, PfpI family	-	-	ko:K05520	-	ko00000,ko01000,ko01002	DJ-1_PfpI
3140	GGM95034.1	262724.TT_C1087	3.02e-293	801.0	COG0017@1|root,COG0017@2|Bacteria,1WJAX@1297|Deinococcus-Thermus	Aspartyl-tRNA synthetase with relaxed tRNA specificity since it is able to aspartylate not only its cognate tRNA(Asp) but also tRNA(Asn). Reaction proceeds in two steps L-aspartate is first activated by ATP to form Asp-AMP and then transferred to the acceptor end of tRNA(Asp Asn)	aspC	-	ko:K09759	ko00970,map00970	ko00000,ko00001,ko00002,ko01000,ko01007,ko03016	tRNA-synt_2,tRNA_anti-codon
3140	GGM95042.1	262724.TT_C1084	7.46e-155	437.0	COG0084@1|root,COG0084@2|Bacteria,1WI27@1297|Deinococcus-Thermus	TIGRFAM hydrolase, TatD family	tatD	-	ko:K03424	-	ko00000,ko01000	TatD_DNase
3140	GGM95052.1	1111069.TCCBUS3UF1_16650	5.55e-11	63.5	COG5621@1|root,COG5621@2|Bacteria,1WJ4S@1297|Deinococcus-Thermus	secreted hydrolase	-	-	-	-	-	CrtC,Lipocalin_9
3140	GGM95056.1	262724.TT_C0007	1.03e-132	378.0	COG0655@1|root,COG0655@2|Bacteria,1WJ36@1297|Deinococcus-Thermus	NADPH-dependent FMN reductase	-	-	-	-	-	FMN_red
3140	GGM95060.1	1111069.TCCBUS3UF1_16630	8.55e-110	317.0	COG1214@1|root,COG1214@2|Bacteria,1WJSS@1297|Deinococcus-Thermus	PFAM Peptidase M22, glycoprotease	-	-	ko:K01409	-	ko00000,ko01000,ko03016	Peptidase_M22
3140	GGM95066.1	262724.TT_C0009	1.58e-277	761.0	COG1175@1|root,COG1175@2|Bacteria,1WJ6F@1297|Deinococcus-Thermus	PFAM Binding-protein-dependent transport system inner membrane component	-	-	ko:K02025	-	ko00000,ko00002,ko02000	BPD_transp_1
3140	GGM95071.1	262724.TT_C0010	1.76e-277	759.0	COG0395@1|root,COG0395@2|Bacteria,1WJ2E@1297|Deinococcus-Thermus	ABC-type sugar transport system, permease component	-	-	ko:K02026,ko:K05815	ko02010,map02010	ko00000,ko00001,ko00002,ko02000	BPD_transp_1
3140	GGM95074.1	300852.55771761	1.13e-290	795.0	COG1653@1|root,COG1653@2|Bacteria,1WIUT@1297|Deinococcus-Thermus	ABC-type sugar transport system periplasmic component	-	-	ko:K02027,ko:K05813	ko02010,map02010	ko00000,ko00001,ko00002,ko02000	SBP_bac_8
3140	GGM95077.1	300852.55771762	0.0	1215.0	COG2414@1|root,COG2414@2|Bacteria,1WITA@1297|Deinococcus-Thermus	Aldehyde ferredoxin oxidoreductase, N-terminal domain	-	-	ko:K03738	ko00030,ko01100,ko01120,ko01200,map00030,map01100,map01120,map01200	ko00000,ko00001,ko00002,ko01000	AFOR_C,AFOR_N
3140	GGM95081.1	262724.TT_C0013	3.08e-141	400.0	COG1721@1|root,COG1721@2|Bacteria,1WJ9Y@1297|Deinococcus-Thermus	protein (some members contain a von Willebrand factor type A (vWA) domain)	-	-	-	-	-	DUF58
3140	GGM95084.1	300852.55772828	2.25e-217	601.0	COG1494@1|root,COG1494@2|Bacteria,1WI3D@1297|Deinococcus-Thermus	TIGRFAM fructose-1,6-bisphosphatase, class II	glpX	-	ko:K02446	ko00010,ko00030,ko00051,ko00680,ko00710,ko01100,ko01110,ko01120,ko01130,ko01200,map00010,map00030,map00051,map00680,map00710,map01100,map01110,map01120,map01130,map01200	ko00000,ko00001,ko00002,ko01000	FBPase_glpX
3140	GGM95094.1	300852.55772827	6.01e-134	381.0	COG0139@1|root,COG0140@1|root,COG0139@2|Bacteria,COG0140@2|Bacteria,1WIBP@1297|Deinococcus-Thermus	Histidine biosynthesis bifunctional protein hisIE	hisI	-	ko:K11755	ko00340,ko01100,ko01110,ko01230,map00340,map01100,map01110,map01230	ko00000,ko00001,ko00002,ko01000	PRA-CH,PRA-PH
3140	GGM95102.1	262724.TT_C1079	1.86e-165	464.0	COG0107@1|root,COG0107@2|Bacteria,1WJ30@1297|Deinococcus-Thermus	IGPS catalyzes the conversion of PRFAR and glutamine to IGP, AICAR and glutamate. The HisF subunit catalyzes the cyclization activity that produces IGP and AICAR from PRFAR using the ammonia provided by the HisH subunit	hisF	GO:0000107,GO:0003674,GO:0003824,GO:0016740,GO:0016757,GO:0016763	ko:K02500	ko00340,ko01100,ko01110,ko01230,map00340,map01100,map01110,map01230	ko00000,ko00001,ko00002,ko01000	His_biosynth
3140	GGM95107.1	262724.TT_C1077	4.25e-306	836.0	COG1206@1|root,COG1206@2|Bacteria,1WIFQ@1297|Deinococcus-Thermus	Catalyzes the folate-dependent formation of 5-methyl- uridine at position 54 (M-5-U54) in all tRNAs	trmFO	GO:0000166,GO:0001510,GO:0002097,GO:0002098,GO:0003674,GO:0005488,GO:0005575,GO:0005622,GO:0005623,GO:0005737,GO:0005829,GO:0006139,GO:0006396,GO:0006399,GO:0006400,GO:0006725,GO:0006807,GO:0008033,GO:0008150,GO:0008152,GO:0009451,GO:0009987,GO:0010467,GO:0016070,GO:0030488,GO:0032259,GO:0034470,GO:0034641,GO:0034660,GO:0036094,GO:0043167,GO:0043168,GO:0043170,GO:0043412,GO:0043414,GO:0044237,GO:0044238,GO:0044260,GO:0044424,GO:0044444,GO:0044464,GO:0046483,GO:0048037,GO:0050660,GO:0050662,GO:0071704,GO:0090304,GO:0097159,GO:1901265,GO:1901360,GO:1901363	ko:K04094	-	ko00000,ko01000,ko03016,ko03036	GIDA
3140	GGM95112.1	1449357.JQLK01000001_gene1157	1.75e-267	741.0	COG0769@1|root,COG0769@2|Bacteria,1WI4D@1297|Deinococcus-Thermus	Catalyzes the addition of an amino acid to the nucleotide precursor UDP-N-acetylmuramoyl-L-alanyl-D-glutamate (UMAG) in the biosynthesis of bacterial cell-wall peptidoglycan	murE	-	ko:K01928	ko00300,ko00550,map00300,map00550	ko00000,ko00001,ko01000,ko01011	Mur_ligase,Mur_ligase_C,Mur_ligase_M
3140	GGM95114.1	1111069.TCCBUS3UF1_16520	4.11e-205	572.0	COG0265@1|root,COG0265@2|Bacteria,1WI1N@1297|Deinococcus-Thermus	COGs COG0265 Trypsin-like serine protease typically periplasmic contain C-terminal PDZ domain	-	-	-	-	-	PDZ_2,Trypsin_2
3140	GGM95117.1	1123388.AQWU01000061_gene949	0.0	1061.0	COG0018@1|root,COG0018@2|Bacteria,1WI72@1297|Deinococcus-Thermus	Arginyl-tRNA synthetase	argS	GO:0003674,GO:0003824,GO:0004812,GO:0004814,GO:0005575,GO:0005622,GO:0005623,GO:0005737,GO:0006082,GO:0006139,GO:0006399,GO:0006412,GO:0006418,GO:0006420,GO:0006518,GO:0006520,GO:0006725,GO:0006807,GO:0008150,GO:0008152,GO:0009058,GO:0009059,GO:0009987,GO:0010467,GO:0016070,GO:0016874,GO:0016875,GO:0019538,GO:0019752,GO:0034641,GO:0034645,GO:0034660,GO:0043038,GO:0043039,GO:0043043,GO:0043170,GO:0043436,GO:0043603,GO:0043604,GO:0044237,GO:0044238,GO:0044249,GO:0044260,GO:0044267,GO:0044271,GO:0044281,GO:0044424,GO:0044464,GO:0046483,GO:0071704,GO:0090304,GO:0140098,GO:0140101,GO:1901360,GO:1901564,GO:1901566,GO:1901576	ko:K01887	ko00970,map00970	ko00000,ko00001,ko00002,ko01000,ko01007,ko03016,ko03029	Arg_tRNA_synt_N,DALR_1,tRNA-synt_1d
3140	GGM95133.1	300852.55772930	0.0	1038.0	COG0322@1|root,COG0322@2|Bacteria,1WJD8@1297|Deinococcus-Thermus	The UvrABC repair system catalyzes the recognition and processing of DNA lesions. UvrC both incises the 5' and 3' sides of the lesion. The N-terminal half is responsible for the 3' incision and the C-terminal half is responsible for the 5' incision	uvrC	GO:0005575,GO:0005622,GO:0005623,GO:0006950,GO:0006974,GO:0008150,GO:0009380,GO:0009987,GO:0032991,GO:0033554,GO:0044424,GO:0044464,GO:0050896,GO:0051716,GO:1902494,GO:1905347,GO:1905348,GO:1990391	ko:K03703	ko03420,map03420	ko00000,ko00001,ko03400	GIY-YIG,HHH_5,UVR,UvrC_HhH_N
3140	GGM95145.1	300852.55772929	1.04e-191	536.0	COG2355@1|root,COG2355@2|Bacteria,1WJQ9@1297|Deinococcus-Thermus	PFAM Membrane dipeptidase (Peptidase family M19)	-	-	ko:K01273	-	ko00000,ko00537,ko01000,ko01002,ko04147	Peptidase_M19
3140	GGM95149.1	262724.TT_C1180	5.07e-84	249.0	COG2050@1|root,COG2050@2|Bacteria,1WJS6@1297|Deinococcus-Thermus	PFAM thioesterase superfamily	-	-	-	-	-	4HBT
3140	GGM95153.1	1123388.AQWU01000061_gene953	4.31e-109	318.0	COG2267@1|root,COG2267@2|Bacteria,1WI8Q@1297|Deinococcus-Thermus	carboxylic ester hydrolase activity	-	-	-	-	-	Abhydrolase_4,Abhydrolase_6
3140	GGM95155.1	1123388.AQWU01000061_gene954	2.65e-62	192.0	COG2267@1|root,COG2267@2|Bacteria,1WK4V@1297|Deinococcus-Thermus	carboxylic ester hydrolase activity	-	-	-	-	-	-
3140	GGM95159.1	1123388.AQWU01000061_gene956	8.7e-222	615.0	COG0585@1|root,COG0585@2|Bacteria,1WJ08@1297|Deinococcus-Thermus	Responsible for synthesis of pseudouridine from uracil- 13 in transfer RNAs	truD	GO:0001522,GO:0003674,GO:0003824,GO:0006139,GO:0006725,GO:0006807,GO:0008150,GO:0008152,GO:0009451,GO:0009982,GO:0009987,GO:0016070,GO:0016853,GO:0016866,GO:0034641,GO:0043170,GO:0043412,GO:0044237,GO:0044238,GO:0046483,GO:0071704,GO:0090304,GO:1901360	ko:K06176	-	ko00000,ko01000,ko03016	TruD
3140	GGM95161.1	300852.55772914	0.0	1046.0	COG1164@1|root,COG1164@2|Bacteria,1WIBY@1297|Deinococcus-Thermus	TIGRFAM oligoendopeptidase, pepF M3 family	-	-	ko:K08602	-	ko00000,ko01000,ko01002	Peptidase_M3,Peptidase_M3_N
3140	GGM95165.1	262724.TT_C1171	0.0	977.0	COG0557@1|root,COG0557@2|Bacteria,1WIKR@1297|Deinococcus-Thermus	ribonuclease II	-	-	ko:K01147	-	ko00000,ko01000,ko03016	RNB
3140	GGM95169.1	1449080.JQMV01000003_gene1537	8.91e-308	838.0	COG0538@1|root,COG0538@2|Bacteria,1WIQQ@1297|Deinococcus-Thermus	TIGRFAM isocitrate dehydrogenase, NADP-dependent, prokaryotic type	-	-	ko:K00031	ko00020,ko00480,ko00720,ko01100,ko01110,ko01120,ko01130,ko01200,ko01210,ko01230,ko04146,map00020,map00480,map00720,map01100,map01110,map01120,map01130,map01200,map01210,map01230,map04146	br01601,ko00000,ko00001,ko00002,ko01000	Iso_dh
3140	GGM95182.1	751945.Theos_1633	9.87e-140	409.0	COG0477@1|root,COG0477@2|Bacteria	Major facilitator Superfamily	ydhC	-	ko:K07552	-	ko00000,ko02000	MFS_1
3140	GGM95186.1	262724.TT_C0330	3.63e-252	694.0	COG0183@1|root,COG0183@2|Bacteria,1WIQG@1297|Deinococcus-Thermus	Belongs to the thiolase family	-	-	ko:K00626,ko:K00632	ko00071,ko00072,ko00280,ko00281,ko00310,ko00362,ko00380,ko00592,ko00620,ko00630,ko00640,ko00642,ko00650,ko00720,ko00900,ko01100,ko01110,ko01120,ko01130,ko01200,ko01212,ko02020,map00071,map00072,map00280,map00281,map00310,map00362,map00380,map00592,map00620,map00630,map00640,map00642,map00650,map00720,map00900,map01100,map01110,map01120,map01130,map01200,map01212,map02020	ko00000,ko00001,ko00002,ko01000,ko04147	Thiolase_C,Thiolase_N
3140	GGM95237.1	498848.TaqDRAFT_3245	2.98e-143	407.0	COG1028@1|root,COG1028@2|Bacteria,1WJ80@1297|Deinococcus-Thermus	Belongs to the short-chain dehydrogenases reductases (SDR) family	-	-	-	-	-	adh_short
3140	GGM95240.1	300852.55772074	1.26e-156	443.0	COG1804@1|root,COG1804@2|Bacteria,1WJJG@1297|Deinococcus-Thermus	L-carnitine dehydratase bile acid-inducible protein F	-	-	-	-	-	CoA_transf_3
3140	GGM95247.1	1449080.JQMV01000003_gene782	3.41e-213	591.0	COG0657@1|root,COG0657@2|Bacteria,1WICH@1297|Deinococcus-Thermus	Pectinacetylesterase	-	-	-	-	-	PAE
3140	GGM95249.1	1123388.AQWU01000071_gene23	5.03e-150	426.0	28Q36@1|root,2ZCKW@2|Bacteria,1WI7M@1297|Deinococcus-Thermus	-	-	-	-	-	-	-
3140	GGM95252.1	262724.TT_C0902	0.0	1281.0	COG1200@1|root,COG1200@2|Bacteria,1WIPT@1297|Deinococcus-Thermus	Critical role in recombination and DNA repair. Helps process Holliday junction intermediates to mature products by catalyzing branch migration. Has a DNA unwinding activity characteristic of a DNA helicase with a 3'- to 5'- polarity. Unwinds branched duplex DNA (Y-DNA)	recG	-	ko:K03655	ko03440,map03440	ko00000,ko00001,ko01000,ko03400	DEAD,Helicase_C,RecG_wedge
3140	GGM95256.1	300852.55772647	2.03e-258	712.0	COG0612@1|root,COG0612@2|Bacteria,1WIM9@1297|Deinococcus-Thermus	PFAM Peptidase M16 inactive domain	-	-	-	-	-	Peptidase_M16,Peptidase_M16_C
