key	query	seed_ortholog	evalue	score	eggNOG_OGs	description	preferred_name	GOs	KEGG_ko	KEGG_pathway	brite	PFAMs
915	KZE29774.1	1304883.KI912532_gene3139	2.61e-106	313.0	COG0745@1|root,COG0745@2|Bacteria,1Q2S0@1224|Proteobacteria,2VM6W@28216|Betaproteobacteria,2KVG4@206389|Rhodocyclales	Transcriptional regulatory protein, C terminal	-	-	ko:K02483	-	ko00000,ko02022	Response_reg,Trans_reg_C
915	KZE29775.1	243365.CV_3843	3.81e-113	330.0	COG0745@1|root,COG0745@2|Bacteria,1Q2S0@1224|Proteobacteria,2VM6W@28216|Betaproteobacteria,2KQF4@206351|Neisseriales	Transcriptional regulatory protein, C terminal	-	-	ko:K07661	ko02020,map02020	ko00000,ko00001,ko00002,ko02022	Response_reg,Trans_reg_C
915	KZE29776.1	279714.FuraDRAFT_1471	6.23e-175	504.0	COG0642@1|root,COG2205@2|Bacteria,1N9SU@1224|Proteobacteria,2VI30@28216|Betaproteobacteria,2KQIX@206351|Neisseriales	His Kinase A (phosphoacceptor) domain	-	-	ko:K07639	ko02020,map02020	ko00000,ko00001,ko00002,ko01000,ko01001,ko02022	HATPase_c,HisKA
915	KZE29778.1	748280.NH8B_3972	1.2e-139	397.0	COG3128@1|root,COG3128@2|Bacteria,1MUI7@1224|Proteobacteria,2VJHT@28216|Betaproteobacteria,2KPFI@206351|Neisseriales	Prolyl 4-hydroxylase alpha subunit homologues.	-	-	ko:K07336	-	ko00000,ko01000	2OG-FeII_Oxy_3
915	KZE29779.1	279714.FuraDRAFT_3320	3.92e-280	794.0	COG4774@1|root,COG4774@2|Bacteria,1MV0X@1224|Proteobacteria,2VIQR@28216|Betaproteobacteria,2KQGS@206351|Neisseriales	TonB-dependent Receptor Plug Domain	-	-	ko:K16090	-	ko00000,ko02000	Plug,TonB_dep_Rec
915	KZE29780.1	279714.FuraDRAFT_3319	1.56e-73	222.0	COG0848@1|root,COG0848@2|Bacteria,1MZ6M@1224|Proteobacteria,2VSVW@28216|Betaproteobacteria,2KRC3@206351|Neisseriales	Transport energizing protein, ExbD TolR family	exbD	-	ko:K03559	-	ko00000,ko02000	ExbD
915	KZE29781.1	748280.NH8B_3969	1.86e-101	300.0	COG0811@1|root,COG0811@2|Bacteria,1NMPB@1224|Proteobacteria,2VJ4U@28216|Betaproteobacteria,2KQZT@206351|Neisseriales	Transporter, MotA TolQ ExbB proton channel family protein	exbB	-	ko:K03561	-	ko00000,ko02000	MotA_ExbB
915	KZE29782.1	279714.FuraDRAFT_3317	3.77e-35	131.0	COG0810@1|root,COG0810@2|Bacteria,1MZPX@1224|Proteobacteria,2VM32@28216|Betaproteobacteria,2KRSB@206351|Neisseriales	Interacts with outer membrane receptor proteins that carry out high-affinity binding and energy dependent uptake into the periplasmic space of specific substrates. It could act to transduce energy from the cytoplasmic membrane to specific energy- requiring processes in the outer membrane, resulting in the release into the periplasm of ligands bound by these outer membrane proteins	-	-	ko:K03832	-	ko00000,ko02000	TonB_C
915	KZE29783.1	279714.FuraDRAFT_3315	1.28e-115	332.0	COG5405@1|root,COG5405@2|Bacteria,1MVF2@1224|Proteobacteria,2VIFV@28216|Betaproteobacteria,2KQ76@206351|Neisseriales	Protease subunit of a proteasome-like degradation complex believed to be a general protein degrading machinery	hslV	-	ko:K01419	-	ko00000,ko01000,ko01002	Proteasome
915	KZE29784.1	243365.CV_0402	2.96e-241	672.0	COG1220@1|root,COG1220@2|Bacteria,1MVK9@1224|Proteobacteria,2VHG3@28216|Betaproteobacteria,2KPIU@206351|Neisseriales	this subunit has chaperone activity. The binding of ATP and its subsequent hydrolysis by HslU are essential for unfolding of protein substrates subsequently hydrolyzed by HslV. HslU recognizes the N-terminal part of its protein substrates and unfolds these before they are guided to HslV for hydrolysis	hslU	-	ko:K03667	-	ko00000,ko03110	AAA_2,ClpB_D2-small
915	KZE29786.1	557598.LHK_01373	5.64e-223	630.0	COG0477@1|root,COG2814@2|Bacteria,1MU1I@1224|Proteobacteria,2VJGS@28216|Betaproteobacteria,2KQ3D@206351|Neisseriales	Belongs to the major facilitator superfamily	emrB	-	ko:K03446	-	ko00000,ko00002,ko02000	MFS_1
915	KZE29787.1	748280.NH8B_3734	2.68e-122	365.0	COG1566@1|root,COG1566@2|Bacteria,1MU7I@1224|Proteobacteria,2VHA2@28216|Betaproteobacteria,2KQI4@206351|Neisseriales	Efflux pump membrane protein	emrA	-	ko:K03543	-	ko00000,ko00002,ko02000	Biotin_lipoyl_2,HlyD,HlyD_3,HlyD_D23
915	KZE29788.1	279714.FuraDRAFT_0198	6.64e-60	190.0	COG1846@1|root,COG1846@2|Bacteria,1NWZ4@1224|Proteobacteria,2VUJ0@28216|Betaproteobacteria,2KRRI@206351|Neisseriales	Transcriptional regulator, MarR family	emrR	-	ko:K15974	-	ko00000,ko00002,ko03000	MarR,MarR_2
915	KZE29789.1	279714.FuraDRAFT_3126	2.84e-130	380.0	COG0324@1|root,COG0324@2|Bacteria,1MUB2@1224|Proteobacteria,2VHEP@28216|Betaproteobacteria,2KPPY@206351|Neisseriales	Catalyzes the transfer of a dimethylallyl group onto the adenine at position 37 in tRNAs that read codons beginning with uridine, leading to the formation of N6-(dimethylallyl)adenosine (i(6)A)	miaA	-	ko:K00791	ko00908,ko01100,ko01110,map00908,map01100,map01110	ko00000,ko00001,ko01000,ko01006,ko03016	IPPT
915	KZE29790.1	1090318.ATTI01000001_gene121	1.06e-58	192.0	COG1794@1|root,COG1794@2|Bacteria,1MV03@1224|Proteobacteria,2TRKQ@28211|Alphaproteobacteria,2KD7T@204457|Sphingomonadales	aspartate racemase	-	-	ko:K01779	ko00250,ko01054,map00250,map01054	ko00000,ko00001,ko01000	Asp_Glu_race
915	KZE29791.1	279714.FuraDRAFT_3125	4.43e-254	707.0	COG2925@1|root,COG2925@2|Bacteria,1MV0U@1224|Proteobacteria,2VINN@28216|Betaproteobacteria,2KQTH@206351|Neisseriales	Exonuclease C-terminal	sbcB	-	ko:K01141	ko03430,map03430	ko00000,ko00001,ko01000,ko03400	Exonuc_X-T_C,RNase_T
915	KZE29792.1	243365.CV_1342	3.1e-315	875.0	COG0323@1|root,COG0323@2|Bacteria,1MV61@1224|Proteobacteria,2VIBW@28216|Betaproteobacteria,2KQ4F@206351|Neisseriales	This protein is involved in the repair of mismatches in DNA. It is required for dam-dependent methyl-directed DNA mismatch repair. May act as a molecular matchmaker , a protein that promotes the formation of a stable complex between two or more DNA-binding proteins in an ATP-dependent manner without itself being part of a final effector complex	mutL	-	ko:K03572	ko03430,map03430	ko00000,ko00001,ko03400	DNA_mis_repair,HATPase_c_3,MutL_C
915	KZE29793.1	557598.LHK_01013	4.03e-107	313.0	COG0586@1|root,COG0586@2|Bacteria,1MX4M@1224|Proteobacteria,2VJCP@28216|Betaproteobacteria,2KQAQ@206351|Neisseriales	Psort location CytoplasmicMembrane, score 10.00	dedA	-	ko:K03975	-	ko00000	SNARE_assoc
915	KZE29794.1	279714.FuraDRAFT_3404	1.17e-49	159.0	2E08V@1|root,32VWG@2|Bacteria,1N52T@1224|Proteobacteria,2VU56@28216|Betaproteobacteria	-	-	-	-	-	-	-
915	KZE29795.1	748280.NH8B_1294	9.31e-177	498.0	COG0341@1|root,COG0341@2|Bacteria,1MU74@1224|Proteobacteria,2VHZG@28216|Betaproteobacteria,2KQ4B@206351|Neisseriales	Part of the Sec protein translocase complex. Interacts with the SecYEG preprotein conducting channel. SecDF uses the proton motive force (PMF) to complete protein translocation after the ATP-dependent function of SecA	secF	-	ko:K03074	ko03060,ko03070,map03060,map03070	ko00000,ko00001,ko00002,ko02044	SecD_SecF,Sec_GG
915	KZE29796.1	279714.FuraDRAFT_3121	0.0	1011.0	COG0342@1|root,COG0342@2|Bacteria,1MV5U@1224|Proteobacteria,2VHKD@28216|Betaproteobacteria,2KPHZ@206351|Neisseriales	Part of the Sec protein translocase complex. Interacts with the SecYEG preprotein conducting channel. SecDF uses the proton motive force (PMF) to complete protein translocation after the ATP-dependent function of SecA	secD	-	ko:K03072	ko03060,ko03070,map03060,map03070	ko00000,ko00001,ko00002,ko02044	SecD-TM1,SecD_SecF,Sec_GG
915	KZE29797.1	279714.FuraDRAFT_3120	8.05e-48	155.0	COG1862@1|root,COG1862@2|Bacteria,1MZT2@1224|Proteobacteria,2VU6T@28216|Betaproteobacteria,2KRZX@206351|Neisseriales	Preprotein translocase subunit	yajC	-	ko:K03210	ko02024,ko03060,ko03070,map02024,map03060,map03070	ko00000,ko00001,ko00002,ko02044	YajC
915	KZE29798.1	243365.CV_1347	1.06e-258	710.0	COG0343@1|root,COG0343@2|Bacteria,1MUCA@1224|Proteobacteria,2VIRX@28216|Betaproteobacteria,2KQ6T@206351|Neisseriales	Catalyzes the base-exchange of a guanine (G) residue with the queuine precursor 7-aminomethyl-7-deazaguanine (PreQ1) at position 34 (anticodon wobble position) in tRNAs with GU(N) anticodons (tRNA-Asp, -Asn, -His and -Tyr). Catalysis occurs through a double-displacement mechanism. The nucleophile active site attacks the C1' of nucleotide 34 to detach the guanine base from the RNA, forming a covalent enzyme-RNA intermediate. The proton acceptor active site deprotonates the incoming PreQ1, allowing a nucleophilic attack on the C1' of the ribose to form the product. After dissociation, two additional enzymatic reactions on the tRNA convert PreQ1 to queuine (Q), resulting in the hypermodified nucleoside queuosine (7-(((4,5-cis-dihydroxy-2- cyclopenten-1-yl)amino)methyl)-7-deazaguanosine)	tgt	-	ko:K00773	-	ko00000,ko01000,ko03016	TGT
915	KZE29799.1	748280.NH8B_1299	0.0	1147.0	COG0441@1|root,COG0441@2|Bacteria,1MUP2@1224|Proteobacteria,2VHFD@28216|Betaproteobacteria,2KPFF@206351|Neisseriales	Catalyzes the attachment of threonine to tRNA(Thr) in a two-step reaction L-threonine is first activated by ATP to form Thr-AMP and then transferred to the acceptor end of tRNA(Thr)	thrS	-	ko:K01868	ko00970,map00970	ko00000,ko00001,ko00002,ko01000,ko01007,ko03016	HGTP_anticodon,TGS,tRNA-synt_2b,tRNA_SAD
915	KZE29800.1	279714.FuraDRAFT_3117	3.91e-94	276.0	COG0290@1|root,COG0290@2|Bacteria,1RDD2@1224|Proteobacteria,2VQ19@28216|Betaproteobacteria,2KQWG@206351|Neisseriales	IF-3 binds to the 30S ribosomal subunit and shifts the equilibrum between 70S ribosomes and their 50S and 30S subunits in favor of the free subunits, thus enhancing the availability of 30S subunits on which protein synthesis initiation begins	infC	-	ko:K02520	-	ko00000,ko03012,ko03029	IF3_C,IF3_N
915	KZE29801.1	243365.CV_1350	3.42e-33	115.0	COG0291@1|root,COG0291@2|Bacteria,1N6V4@1224|Proteobacteria,2VVS9@28216|Betaproteobacteria,2KRIQ@206351|Neisseriales	Belongs to the bacterial ribosomal protein bL35 family	rpmI	-	ko:K02916	ko03010,map03010	br01610,ko00000,ko00001,ko00002,ko03011	Ribosomal_L35p
915	KZE29802.1	243365.CV_1351	3.39e-69	210.0	COG0292@1|root,COG0292@2|Bacteria,1RGU2@1224|Proteobacteria,2VRWF@28216|Betaproteobacteria,2KR55@206351|Neisseriales	Binds directly to 23S ribosomal RNA and is necessary for the in vitro assembly process of the 50S ribosomal subunit. It is not involved in the protein synthesizing functions of that subunit	rplT	-	ko:K02887	ko03010,map03010	br01610,ko00000,ko00001,ko00002,ko03011	Ribosomal_L20
915	KZE29803.1	279714.FuraDRAFT_3114	3.1e-206	573.0	COG0016@1|root,COG0016@2|Bacteria,1MVD7@1224|Proteobacteria,2VIM9@28216|Betaproteobacteria,2KPR5@206351|Neisseriales	Belongs to the class-II aminoacyl-tRNA synthetase family. Phe-tRNA synthetase alpha subunit type 1 subfamily	pheS	-	ko:K01889	ko00970,map00970	ko00000,ko00001,ko00002,ko01000,ko01007,ko03016	Phe_tRNA-synt_N,tRNA-synt_2d
915	KZE29804.1	279714.FuraDRAFT_3113	0.0	1136.0	COG0072@1|root,COG0073@1|root,COG0072@2|Bacteria,COG0073@2|Bacteria,1MWKS@1224|Proteobacteria,2VHR1@28216|Betaproteobacteria,2KPX3@206351|Neisseriales	Belongs to the phenylalanyl-tRNA synthetase beta subunit family. Type 1 subfamily	pheT	-	ko:K01890	ko00970,map00970	ko00000,ko00001,ko00002,ko01000,ko01007,ko03016	B3_4,B5,FDX-ACB,tRNA_bind
915	KZE29805.1	243365.CV_1354	2.42e-60	186.0	COG0776@1|root,COG0776@2|Bacteria,1RH5Z@1224|Proteobacteria,2VT12@28216|Betaproteobacteria,2KRGJ@206351|Neisseriales	This protein is one of the two subunits of integration host factor, a specific DNA-binding protein that functions in genetic recombination as well as in transcriptional and translational control	ihfA	-	ko:K04764	-	ko00000,ko03032,ko03036,ko03400	Bac_DNA_binding
915	KZE29806.1	279714.FuraDRAFT_3111	4.25e-57	179.0	COG0789@1|root,COG0789@2|Bacteria,1RGYB@1224|Proteobacteria,2VSDF@28216|Betaproteobacteria,2KRSC@206351|Neisseriales	MerR HTH family regulatory protein	-	-	-	-	-	MerR_1
915	KZE29807.1	279714.FuraDRAFT_3038	2.74e-196	547.0	COG0031@1|root,COG0031@2|Bacteria,1MUBE@1224|Proteobacteria,2VJI3@28216|Betaproteobacteria,2KPYW@206351|Neisseriales	Belongs to the cysteine synthase cystathionine beta- synthase family	cysK	-	ko:K01738	ko00270,ko00920,ko01100,ko01110,ko01120,ko01130,ko01200,ko01230,map00270,map00920,map01100,map01110,map01120,map01130,map01200,map01230	ko00000,ko00001,ko00002,ko01000	PALP
915	KZE29808.1	243365.CV_3560	3.07e-31	116.0	2AXKK@1|root,31PKU@2|Bacteria,1RIEG@1224|Proteobacteria,2VSXS@28216|Betaproteobacteria,2KRD3@206351|Neisseriales	-	-	-	-	-	-	-
915	KZE29809.1	396588.Tgr7_1062	4.62e-52	167.0	COG3012@1|root,COG3012@2|Bacteria,1MZZK@1224|Proteobacteria,1S9FV@1236|Gammaproteobacteria,1WYWP@135613|Chromatiales	Belongs to the UPF0225 family	-	-	ko:K09858	-	ko00000	SEC-C
915	KZE30020.1	566466.NOR53_2016	2.41e-32	126.0	COG2199@1|root,COG3706@2|Bacteria,1R7HC@1224|Proteobacteria,1S6MK@1236|Gammaproteobacteria,1J7VI@118884|unclassified Gammaproteobacteria	HAMP (Histidine kinases, Adenylyl cyclases, Methyl binding proteins, Phosphatases) domain	-	-	-	-	-	GGDEF,Response_reg
915	KZE30021.1	243365.CV_3605	4.98e-62	194.0	COG2062@1|root,COG2062@2|Bacteria,1RIVH@1224|Proteobacteria,2VSSQ@28216|Betaproteobacteria,2KRJE@206351|Neisseriales	Phosphoglycerate mutase family	sixA	-	ko:K08296	-	ko00000,ko01000	His_Phos_1
915	KZE30022.1	748280.NH8B_0794	1.3e-86	263.0	COG1346@1|root,COG1346@2|Bacteria,1MV81@1224|Proteobacteria,2VH4N@28216|Betaproteobacteria,2KR4W@206351|Neisseriales	Psort location CytoplasmicMembrane, score 10.00	-	-	-	-	-	LrgB
915	KZE30023.1	279714.FuraDRAFT_1265	5.91e-32	116.0	COG1380@1|root,COG1380@2|Bacteria,1Q8KX@1224|Proteobacteria,2WAIK@28216|Betaproteobacteria,2KS85@206351|Neisseriales	LrgA family	-	-	-	-	-	LrgA
915	KZE30024.1	279714.FuraDRAFT_1266	1.05e-52	173.0	COG3161@1|root,COG3161@2|Bacteria,1N8BF@1224|Proteobacteria,2VU5V@28216|Betaproteobacteria,2KS9A@206351|Neisseriales	Removes the pyruvyl group from chorismate, with concomitant aromatization of the ring, to provide 4- hydroxybenzoate (4HB) for the ubiquinone pathway	ubiC	-	ko:K03181	ko00130,ko01100,ko01110,map00130,map01100,map01110	ko00000,ko00001,ko00002,ko01000	Chor_lyase
915	KZE30025.1	748280.NH8B_0791	7.73e-136	392.0	COG0382@1|root,COG0382@2|Bacteria,1MV4Q@1224|Proteobacteria,2VHEU@28216|Betaproteobacteria,2KQGJ@206351|Neisseriales	Catalyzes the prenylation of para-hydroxybenzoate (PHB) with an all-trans polyprenyl group. Mediates the second step in the final reaction sequence of ubiquinone-8 (UQ-8) biosynthesis, which is the condensation of the polyisoprenoid side chain with PHB, generating the first membrane-bound Q intermediate 3- octaprenyl-4-hydroxybenzoate	ubiA	-	ko:K03179	ko00130,ko01100,ko01110,map00130,map01100,map01110	ko00000,ko00001,ko00002,ko01000,ko01006	UbiA
915	KZE30026.1	279714.FuraDRAFT_1270	3.6e-146	420.0	COG0352@1|root,COG0494@1|root,COG0352@2|Bacteria,COG0494@2|Bacteria,1RCZM@1224|Proteobacteria,2VHTP@28216|Betaproteobacteria,2KR66@206351|Neisseriales	Belongs to the Nudix hydrolase family	-	-	ko:K03574	-	ko00000,ko01000,ko03400	NUDIX,TMP-TENI
915	KZE30027.1	748280.NH8B_0785	4.92e-154	439.0	COG2607@1|root,COG2607@2|Bacteria,1MVMX@1224|Proteobacteria,2VID5@28216|Betaproteobacteria,2KQ5E@206351|Neisseriales	Protein of unknown function (DUF815)	-	-	ko:K06923	-	ko00000	DUF815
915	KZE30028.1	748280.NH8B_0784	7.24e-123	354.0	COG0560@1|root,COG0560@2|Bacteria,1RA1A@1224|Proteobacteria,2VMGV@28216|Betaproteobacteria,2KQGM@206351|Neisseriales	HAD hydrolase, family IB	-	-	-	-	-	HAD
915	KZE30029.1	748280.NH8B_0783	8.91e-130	372.0	COG0593@1|root,COG0593@2|Bacteria,1MVW6@1224|Proteobacteria,2VSFD@28216|Betaproteobacteria,2KQIR@206351|Neisseriales	Belongs to the DnaA family	hda	-	ko:K10763	-	ko00000,ko03032	Bac_DnaA
915	KZE30030.1	243365.CV_3615	1.8e-214	596.0	COG0150@1|root,COG0150@2|Bacteria,1MURG@1224|Proteobacteria,2VHJT@28216|Betaproteobacteria,2KQ7M@206351|Neisseriales	Phosphoribosylformylglycinamidine cyclo-ligase	purM	-	ko:K01933	ko00230,ko01100,ko01110,ko01130,map00230,map01100,map01110,map01130	ko00000,ko00001,ko00002,ko01000	AIRS,AIRS_C
915	KZE30031.1	243365.CV_3616	1.45e-96	286.0	COG0299@1|root,COG0299@2|Bacteria,1MWN1@1224|Proteobacteria,2VJG8@28216|Betaproteobacteria,2KPGA@206351|Neisseriales	Catalyzes the transfer of a formyl group from 10- formyltetrahydrofolate to 5-phospho-ribosyl-glycinamide (GAR), producing 5-phospho-ribosyl-N-formylglycinamide (FGAR) and tetrahydrofolate	purN	-	ko:K11175	ko00230,ko00670,ko01100,ko01110,ko01130,map00230,map00670,map01100,map01110,map01130	ko00000,ko00001,ko00002,ko01000	Formyl_trans_N
915	KZE30032.1	748280.NH8B_0780	5.96e-70	230.0	COG3170@1|root,COG3170@2|Bacteria,1MWZB@1224|Proteobacteria,2VNBQ@28216|Betaproteobacteria,2KU4P@206351|Neisseriales	Protein of unknown function (DUF3108)	-	-	-	-	-	DUF3108
915	KZE30033.1	279714.FuraDRAFT_1279	1.55e-212	597.0	COG0144@1|root,COG0144@2|Bacteria,1MV2Q@1224|Proteobacteria,2VI1D@28216|Betaproteobacteria,2KPRA@206351|Neisseriales	ribosomal RNA small subunit methyltransferase B	-	-	ko:K03500	-	ko00000,ko01000,ko03009	Methyltr_RsmB-F,Methyltr_RsmF_N
915	KZE30034.1	279714.FuraDRAFT_1281	6.97e-56	175.0	COG0278@1|root,COG0278@2|Bacteria,1MZ4V@1224|Proteobacteria,2VSCX@28216|Betaproteobacteria,2KRAG@206351|Neisseriales	Belongs to the glutaredoxin family. Monothiol subfamily	grxD	-	ko:K07390	-	ko00000,ko03029,ko03110	Glutaredoxin
915	KZE30035.1	279714.FuraDRAFT_1289	3.65e-81	245.0	COG1335@1|root,COG1335@2|Bacteria,1MU5N@1224|Proteobacteria,2VJPQ@28216|Betaproteobacteria,2KR5U@206351|Neisseriales	isochorismatase family	-	-	-	-	-	DUF2322,Isochorismatase
915	KZE30036.1	557598.LHK_02051	2.06e-114	333.0	COG1136@1|root,COG1136@2|Bacteria,1MVSQ@1224|Proteobacteria,2WEGN@28216|Betaproteobacteria,2KU2Y@206351|Neisseriales	ATPases associated with a variety of cellular activities	-	-	ko:K09810	ko02010,map02010	ko00000,ko00001,ko00002,ko01000,ko02000	ABC_tran
915	KZE30037.1	557598.LHK_02052	3.9e-183	521.0	COG4591@1|root,COG4591@2|Bacteria,1Q2BY@1224|Proteobacteria,2VHS2@28216|Betaproteobacteria,2KSKW@206351|Neisseriales	MacB-like periplasmic core domain	-	-	ko:K09808	ko02010,map02010	ko00000,ko00001,ko00002,ko02000	FtsX,MacB_PCD
915	KZE30038.1	1121004.ATVC01000002_gene596	1.41e-57	197.0	COG0845@1|root,COG0845@2|Bacteria,1MU8D@1224|Proteobacteria,2VMY1@28216|Betaproteobacteria,2KU2Z@206351|Neisseriales	Belongs to the membrane fusion protein (MFP) (TC 8.A.1) family	-	-	-	-	-	-
915	KZE30039.1	1120999.JONM01000009_gene345	2.62e-32	115.0	COG4390@1|root,COG4390@2|Bacteria,1N8RK@1224|Proteobacteria,2VUJW@28216|Betaproteobacteria,2KU3Y@206351|Neisseriales	Uncharacterized protein conserved in bacteria (DUF2322)	-	-	-	-	-	DUF2322
915	KZE30040.1	279714.FuraDRAFT_2852	2.01e-238	666.0	COG0513@1|root,COG0513@2|Bacteria,1MU49@1224|Proteobacteria,2VH16@28216|Betaproteobacteria,2KPEP@206351|Neisseriales	Belongs to the DEAD box helicase family	rhlE4	-	-	-	-	DEAD,Helicase_C
915	KZE30041.1	279714.FuraDRAFT_2851	7.76e-178	500.0	COG1270@1|root,COG1270@2|Bacteria,1MWCK@1224|Proteobacteria,2VH7X@28216|Betaproteobacteria,2KPJH@206351|Neisseriales	Converts cobyric acid to cobinamide by the addition of aminopropanol on the F carboxylic group	-	-	ko:K02227	ko00860,ko01100,map00860,map01100	ko00000,ko00001,ko00002,ko01000	CobD_Cbib
915	KZE30042.1	748280.NH8B_3375	2.9e-27	106.0	COG3418@1|root,COG3418@2|Bacteria,1PVBK@1224|Proteobacteria,2WB79@28216|Betaproteobacteria,2KRZS@206351|Neisseriales	FlgN protein	-	-	ko:K02399	ko02040,map02040	ko00000,ko00001,ko02035	FlgN
915	KZE30043.1	279714.FuraDRAFT_2849	3.32e-19	82.0	COG2747@1|root,COG2747@2|Bacteria,1Q0RV@1224|Proteobacteria,2WBBB@28216|Betaproteobacteria,2KS91@206351|Neisseriales	Anti-sigma-28 factor, FlgM	flgM	-	ko:K02398	ko02020,ko02025,ko02026,ko02040,map02020,map02025,map02026,map02040	ko00000,ko00001,ko02035	FlgM
915	KZE30044.1	243365.CV_0999	9.66e-55	181.0	COG1261@1|root,COG1261@2|Bacteria,1N1SA@1224|Proteobacteria,2VR6V@28216|Betaproteobacteria,2KRM8@206351|Neisseriales	Involved in the assembly process of the P-ring formation. It may associate with FlgF on the rod constituting a structure essential for the P-ring assembly or may act as a modulator protein for the P-ring assembly	-	-	ko:K02386	ko02040,map02040	ko00000,ko00001,ko02035	ChapFlgA
915	KZE30045.1	748280.NH8B_3378	2.9e-285	785.0	COG0498@1|root,COG0498@2|Bacteria,1MUWQ@1224|Proteobacteria,2VHR6@28216|Betaproteobacteria,2KPMN@206351|Neisseriales	Threonine synthase	thrC	-	ko:K01733	ko00260,ko00750,ko01100,ko01110,ko01120,ko01230,map00260,map00750,map01100,map01110,map01120,map01230	ko00000,ko00001,ko00002,ko01000	PALP,Thr_synth_N
915	KZE30047.1	279714.FuraDRAFT_2846	1.38e-257	712.0	COG0460@1|root,COG0460@2|Bacteria,1MUDC@1224|Proteobacteria,2VH9T@28216|Betaproteobacteria,2KQ3H@206351|Neisseriales	Psort location Cytoplasmic, score 8.96	metL	-	ko:K00003	ko00260,ko00270,ko00300,ko01100,ko01110,ko01120,ko01130,ko01230,map00260,map00270,map00300,map01100,map01110,map01120,map01130,map01230	ko00000,ko00001,ko00002,ko01000	ACT,Homoserine_dh,NAD_binding_3
915	KZE30048.1	279714.FuraDRAFT_2845	5.43e-262	721.0	COG0436@1|root,COG0436@2|Bacteria,1MW0Z@1224|Proteobacteria,2VH4Z@28216|Betaproteobacteria,2KQA0@206351|Neisseriales	Aminotransferase AlaT	-	-	ko:K14260	ko00220,ko00250,ko00290,ko01100,ko01110,ko01130,ko01210,ko01230,map00220,map00250,map00290,map01100,map01110,map01130,map01210,map01230	ko00000,ko00001,ko01000,ko01007	Aminotran_1_2
915	KZE30049.1	279714.FuraDRAFT_2844	1.27e-51	166.0	COG3737@1|root,COG3737@2|Bacteria,1N083@1224|Proteobacteria,2VUF2@28216|Betaproteobacteria,2KS20@206351|Neisseriales	Protein of unknown function (DUF498/DUF598)	-	-	-	-	-	DUF498
915	KZE30050.1	748280.NH8B_3383	1.36e-293	810.0	COG0661@1|root,COG0661@2|Bacteria,1MU1Z@1224|Proteobacteria,2VJ07@28216|Betaproteobacteria,2KPMS@206351|Neisseriales	Is probably a protein kinase regulator of UbiI activity which is involved in aerobic coenzyme Q (ubiquinone) biosynthesis	ubiB	-	ko:K03688	-	ko00000	ABC1
915	KZE30051.1	279714.FuraDRAFT_2841	1.14e-83	253.0	COG3165@1|root,COG3165@2|Bacteria,1Q9C9@1224|Proteobacteria,2WAEX@28216|Betaproteobacteria,2KRJI@206351|Neisseriales	ubiquinone biosynthetic process from chorismate	-	-	ko:K03690	-	ko00000	SCP2
915	KZE30052.1	748280.NH8B_3385	1.72e-67	213.0	COG1280@1|root,COG1280@2|Bacteria,1MWA1@1224|Proteobacteria,2VNUR@28216|Betaproteobacteria,2KRQF@206351|Neisseriales	LysE type translocator	-	-	ko:K11250	-	ko00000,ko02000	LysE
915	KZE30053.1	748280.NH8B_3386	1.74e-164	461.0	COG0500@1|root,COG2226@2|Bacteria,1MX8I@1224|Proteobacteria,2VHBM@28216|Betaproteobacteria,2KQDR@206351|Neisseriales	Methyltransferase required for the conversion of demethylmenaquinol (DMKH2) to menaquinol (MKH2) and the conversion of 2-polyprenyl-6-methoxy-1,4-benzoquinol (DDMQH2) to 2- polyprenyl-3-methyl-6-methoxy-1,4-benzoquinol (DMQH2)	ubiE	-	ko:K03183	ko00130,ko01100,ko01110,map00130,map01100,map01110	ko00000,ko00001,ko00002,ko01000	Ubie_methyltran
915	KZE30054.1	279714.FuraDRAFT_2838	1.16e-64	199.0	COG3536@1|root,COG3536@2|Bacteria,1MZ5M@1224|Proteobacteria,2VR9K@28216|Betaproteobacteria,2KREN@206351|Neisseriales	Protein of unknown function (DUF971)	-	-	-	-	-	DUF971
915	KZE30055.1	243365.CV_0988	5.83e-191	536.0	COG0809@1|root,COG0809@2|Bacteria,1MUH3@1224|Proteobacteria,2VHJF@28216|Betaproteobacteria,2KPW1@206351|Neisseriales	Transfers and isomerizes the ribose moiety from AdoMet to the 7-aminomethyl group of 7-deazaguanine (preQ1-tRNA) to give epoxyqueuosine (oQ-tRNA)	queA	-	ko:K07568	-	ko00000,ko01000,ko03016	Queuosine_synth
915	KZE30056.1	243365.CV_0987	9.44e-85	252.0	COG0757@1|root,COG0757@2|Bacteria,1RDDT@1224|Proteobacteria,2VR4Y@28216|Betaproteobacteria,2KR78@206351|Neisseriales	Catalyzes a trans-dehydration via an enolate intermediate	aroQ	-	ko:K03786	ko00400,ko01100,ko01110,ko01130,ko01230,map00400,map01100,map01110,map01130,map01230	ko00000,ko00001,ko00002,ko01000	DHquinase_II
915	KZE30057.1	748280.NH8B_3390	3.75e-66	205.0	COG0511@1|root,COG0511@2|Bacteria,1RCXA@1224|Proteobacteria,2VR5S@28216|Betaproteobacteria,2KR4E@206351|Neisseriales	first, biotin carboxylase catalyzes the carboxylation of the carrier protein and then the transcarboxylase transfers the carboxyl group to form malonyl-CoA	accB	-	ko:K02160	ko00061,ko00620,ko00640,ko00720,ko01100,ko01110,ko01120,ko01130,ko01200,ko01212,map00061,map00620,map00640,map00720,map01100,map01110,map01120,map01130,map01200,map01212	ko00000,ko00001,ko00002	Biotin_lipoyl
915	KZE30058.1	243365.CV_0985	1.43e-306	838.0	COG0439@1|root,COG0439@2|Bacteria,1MU4H@1224|Proteobacteria,2VISB@28216|Betaproteobacteria,2KQ65@206351|Neisseriales	acetyl-CoA carboxylase, biotin carboxylase	accC	-	ko:K01961	ko00061,ko00620,ko00640,ko00720,ko01100,ko01110,ko01120,ko01130,ko01200,ko01212,map00061,map00620,map00640,map00720,map01100,map01110,map01120,map01130,map01200,map01212	ko00000,ko00001,ko00002,ko01000	Biotin_carb_C,Biotin_carb_N,CPSase_L_D2
915	KZE30059.1	243365.CV_0984	2.15e-164	465.0	COG2264@1|root,COG2264@2|Bacteria,1MUPC@1224|Proteobacteria,2VH76@28216|Betaproteobacteria,2KPSR@206351|Neisseriales	Ribosomal protein L11 methyltransferase	prmA	-	ko:K02687	-	ko00000,ko01000,ko03009	PrmA
915	KZE30060.1	748280.NH8B_3393	3.39e-89	280.0	2A4J7@1|root,30T5U@2|Bacteria,1RGAU@1224|Proteobacteria,2VU2M@28216|Betaproteobacteria,2KR8I@206351|Neisseriales	Protein of unknown function (DUF3426)	-	-	-	-	-	DUF3426,zinc_ribbon_5
915	KZE30061.1	279714.FuraDRAFT_2831	6.23e-64	201.0	COG2077@1|root,COG2077@2|Bacteria,1N8MI@1224|Proteobacteria,2VX3Q@28216|Betaproteobacteria,2KS3F@206351|Neisseriales	Thiol-specific peroxidase that catalyzes the reduction of hydrogen peroxide and organic hydroperoxides to water and alcohols, respectively. Plays a role in cell protection against oxidative stress by detoxifying peroxides	-	-	ko:K11065	-	ko00000,ko01000	AhpC-TSA
915	KZE30062.1	279714.FuraDRAFT_2830	9.18e-170	482.0	COG0240@1|root,COG0240@2|Bacteria,1MUU3@1224|Proteobacteria,2VJ91@28216|Betaproteobacteria,2KQ8E@206351|Neisseriales	Psort location Cytoplasmic, score 8.96	gpsA	-	ko:K00057	ko00564,ko01110,map00564,map01110	ko00000,ko00001,ko01000	NAD_Gly3P_dh_C,NAD_Gly3P_dh_N
