key	query	seed_ortholog	evalue	score	eggNOG_OGs	description	preferred_name	GOs	KEGG_ko	KEGG_pathway	brite	PFAMs
915	KZE33537.1	760117.JN27_11545	1.45e-150	446.0	COG0651@1|root,COG0651@2|Bacteria,1MURB@1224|Proteobacteria,2VH1Y@28216|Betaproteobacteria,473M5@75682|Oxalobacteraceae	Proton-conducting membrane transporter	-	-	ko:K05568	-	ko00000,ko02000	Proton_antipo_M
915	KZE33538.1	1123253.AUBD01000001_gene1817	5.02e-26	101.0	COG1006@1|root,COG1006@2|Bacteria,1RHXT@1224|Proteobacteria,1S6C0@1236|Gammaproteobacteria,1XCS3@135614|Xanthomonadales	NADH-ubiquinone/plastoquinone oxidoreductase chain 4L	-	-	-	-	-	Oxidored_q2
915	KZE33539.1	338963.Pcar_2622	1.28e-179	544.0	COG1009@1|root,COG1009@2|Bacteria,1MW2M@1224|Proteobacteria,42KZE@68525|delta/epsilon subdivisions,2WIWK@28221|Deltaproteobacteria,43S3T@69541|Desulfuromonadales	Domain of unknown function (DUF4040)	mrpA	-	ko:K05559,ko:K05565	-	ko00000,ko02000	DUF4040,MnhB,Proton_antipo_M,Proton_antipo_N
915	KZE33540.1	557598.LHK_00487	3.91e-53	182.0	COG0589@1|root,COG0589@2|Bacteria,1NR0T@1224|Proteobacteria,2VXP8@28216|Betaproteobacteria	Universal stress protein family	-	-	-	-	-	Usp
915	KZE33541.1	1149133.ppKF707_4776	4.58e-120	347.0	COG0693@1|root,COG0693@2|Bacteria,1MVTT@1224|Proteobacteria,1RPVK@1236|Gammaproteobacteria,1YEWI@136841|Pseudomonas aeruginosa group	DJ-1/PfpI family	-	-	-	-	-	DJ-1_PfpI
915	KZE33542.1	557598.LHK_00485	0.0	958.0	COG0474@1|root,COG0474@2|Bacteria,1MUU5@1224|Proteobacteria,2VH2F@28216|Betaproteobacteria,2KSUD@206351|Neisseriales	Cation transporter/ATPase, N-terminus	-	-	-	-	-	Cation_ATPase_C,Cation_ATPase_N,E1-E2_ATPase,Hydrolase,Hydrolase_3
915	KZE33543.1	279714.FuraDRAFT_2160	7.07e-186	532.0	COG0477@1|root,COG2814@2|Bacteria,1MVQQ@1224|Proteobacteria,2W004@28216|Betaproteobacteria,2KR0C@206351|Neisseriales	Uncharacterised MFS-type transporter YbfB	-	-	ko:K08195	-	ko00000,ko02000	MFS_1,MFS_4
915	KZE33544.1	748280.NH8B_2045	5.06e-145	411.0	COG0179@1|root,COG0179@2|Bacteria,1MVFA@1224|Proteobacteria,2VHG8@28216|Betaproteobacteria,2KR0Y@206351|Neisseriales	Fumarylacetoacetate (FAA) hydrolase family	-	-	ko:K16165	ko00350,ko01100,ko01120,map00350,map01100,map01120	ko00000,ko00001,ko01000	FAA_hydrolase
915	KZE33545.1	748280.NH8B_2046	7.27e-122	351.0	COG0625@1|root,COG0625@2|Bacteria,1RA4Y@1224|Proteobacteria,2VKEU@28216|Betaproteobacteria,2KR4Z@206351|Neisseriales	maleylacetoacetate isomerase	-	-	ko:K01801	ko00350,ko01100,ko01120,map00350,map01100,map01120	ko00000,ko00001,ko01000	GST_C_2,GST_N_3
915	KZE33546.1	279714.FuraDRAFT_2163	2.05e-276	757.0	COG0654@1|root,COG0654@2|Bacteria,1MWWT@1224|Proteobacteria,2VISJ@28216|Betaproteobacteria,2KRXE@206351|Neisseriales	FAD binding domain	-	-	ko:K22270	ko00362,ko01120,map00362,map01120	ko00000,ko00001,ko01000	FAD_binding_3
915	KZE33547.1	748280.NH8B_2048	6.19e-211	587.0	COG3435@1|root,COG3435@2|Bacteria,1MVJP@1224|Proteobacteria,2VM1T@28216|Betaproteobacteria,2KSM2@206351|Neisseriales	ARD/ARD' family	-	-	ko:K00450	ko00350,ko01100,ko01120,map00350,map01100,map01120	ko00000,ko00001,ko01000	Cupin_2
915	KZE33548.1	640081.Dsui_3481	2.23e-271	750.0	COG1027@1|root,COG1027@2|Bacteria,1R9JY@1224|Proteobacteria,2W02M@28216|Betaproteobacteria,2KV2S@206389|Rhodocyclales	Aspartate ammonia-lyase	aspA	-	ko:K01744	ko00250,ko01100,map00250,map01100	ko00000,ko00001,ko01000	FumaraseC_C,Lyase_1
915	KZE33549.1	279714.FuraDRAFT_2738	9.73e-133	385.0	COG0583@1|root,COG0583@2|Bacteria,1R4QT@1224|Proteobacteria,2VI4T@28216|Betaproteobacteria,2KSFA@206351|Neisseriales	LysR substrate binding domain	-	-	ko:K21645	-	ko00000,ko03000	HTH_1,LysR_substrate
915	KZE33550.1	1121440.AUMA01000006_gene1566	1.65e-152	442.0	COG2211@1|root,COG2211@2|Bacteria,1QVH9@1224|Proteobacteria	Pfam Major Facilitator Superfamily	-	-	-	-	-	MFS_1,Sugar_tr
915	KZE33551.1	880072.Desac_1606	2.59e-46	155.0	COG4087@1|root,COG4087@2|Bacteria,1N05K@1224|Proteobacteria,42U05@68525|delta/epsilon subdivisions,2WQDW@28221|Deltaproteobacteria,2MQI1@213462|Syntrophobacterales	COGs COG4087 Soluble P-type ATPase	-	-	-	-	-	Hydrolase,Hydrolase_3
915	KZE33553.1	196367.JNFG01000021_gene4967	7.72e-31	112.0	2C3D1@1|root,32P7P@2|Bacteria,1PIJX@1224|Proteobacteria,2W44Q@28216|Betaproteobacteria,1KDXX@119060|Burkholderiaceae	Uncharacterized ACR, COG1993	-	-	-	-	-	DUF190
915	KZE33554.1	748280.NH8B_0842	3.84e-219	616.0	COG0038@1|root,COG0038@2|Bacteria,1MV4K@1224|Proteobacteria,2VIIM@28216|Betaproteobacteria,2KPU5@206351|Neisseriales	Voltage gated chloride channel	-	-	-	-	-	Voltage_CLC
915	KZE33555.1	748280.NH8B_3784	0.0	999.0	COG0449@1|root,COG0449@2|Bacteria,1MW4K@1224|Proteobacteria,2VHVY@28216|Betaproteobacteria,2KPTE@206351|Neisseriales	Catalyzes the first step in hexosamine metabolism, converting fructose-6P into glucosamine-6P using glutamine as a nitrogen source	glmS	-	ko:K00820	ko00250,ko00520,ko01100,ko01130,ko04931,map00250,map00520,map01100,map01130,map04931	ko00000,ko00001,ko01000,ko01002	GATase_6,SIS
915	KZE33556.1	279714.FuraDRAFT_0145	3.76e-215	607.0	COG1207@1|root,COG1207@2|Bacteria,1MUPH@1224|Proteobacteria,2VH54@28216|Betaproteobacteria,2KPQD@206351|Neisseriales	Catalyzes the last two sequential reactions in the de novo biosynthetic pathway for UDP-N-acetylglucosamine (UDP- GlcNAc). The C-terminal domain catalyzes the transfer of acetyl group from acetyl coenzyme A to glucosamine-1-phosphate (GlcN-1-P) to produce N-acetylglucosamine-1-phosphate (GlcNAc-1-P), which is converted into UDP-GlcNAc by the transfer of uridine 5- monophosphate (from uridine 5-triphosphate), a reaction catalyzed by the N-terminal domain	glmU	-	ko:K04042	ko00520,ko01100,ko01130,map00520,map01100,map01130	ko00000,ko00001,ko00002,ko01000	Hexapep,NTP_transf_3
915	KZE33557.1	243365.CV_0673	2.49e-65	202.0	COG0355@1|root,COG0355@2|Bacteria,1RHE4@1224|Proteobacteria,2VR2R@28216|Betaproteobacteria,2KR54@206351|Neisseriales	Produces ATP from ADP in the presence of a proton gradient across the membrane	atpC	-	ko:K02114	ko00190,ko00195,ko01100,map00190,map00195,map01100	ko00000,ko00001,ko00002,ko00194	ATP-synt_DE,ATP-synt_DE_N
915	KZE33558.1	748280.NH8B_3787	9.05e-312	852.0	COG0055@1|root,COG0055@2|Bacteria,1MUFU@1224|Proteobacteria,2VHDZ@28216|Betaproteobacteria,2KQ7U@206351|Neisseriales	Produces ATP from ADP in the presence of a proton gradient across the membrane. The catalytic sites are hosted primarily by the beta subunits	atpD	-	ko:K02112	ko00190,ko00195,ko01100,map00190,map00195,map01100	ko00000,ko00001,ko00002,ko00194,ko01000	ATP-synt_ab,ATP-synt_ab_N
915	KZE33559.1	279714.FuraDRAFT_0142	7.44e-167	471.0	COG0224@1|root,COG0224@2|Bacteria,1MU28@1224|Proteobacteria,2VJBW@28216|Betaproteobacteria,2KPNT@206351|Neisseriales	Produces ATP from ADP in the presence of a proton gradient across the membrane. The gamma chain is believed to be important in regulating ATPase activity and the flow of protons through the CF(0) complex	atpG	-	ko:K02115	ko00190,ko00195,ko01100,map00190,map00195,map01100	ko00000,ko00001,ko00002,ko00194	ATP-synt
915	KZE33560.1	243365.CV_0670	0.0	919.0	COG0056@1|root,COG0056@2|Bacteria,1MUG7@1224|Proteobacteria,2VHQU@28216|Betaproteobacteria,2KQ1R@206351|Neisseriales	Produces ATP from ADP in the presence of a proton gradient across the membrane. The alpha chain is a regulatory subunit	atpA	-	ko:K02111	ko00190,ko00195,ko01100,map00190,map00195,map01100	ko00000,ko00001,ko00002,ko00194,ko01000	ATP-synt_ab,ATP-synt_ab_C,ATP-synt_ab_N
915	KZE33561.1	243365.CV_0669	1.98e-87	261.0	COG0712@1|root,COG0712@2|Bacteria,1MVRH@1224|Proteobacteria,2VSJV@28216|Betaproteobacteria,2KRGX@206351|Neisseriales	F(1)F(0) ATP synthase produces ATP from ADP in the presence of a proton or sodium gradient. F-type ATPases consist of two structural domains, F(1) containing the extramembraneous catalytic core and F(0) containing the membrane proton channel, linked together by a central stalk and a peripheral stalk. During catalysis, ATP synthesis in the catalytic domain of F(1) is coupled via a rotary mechanism of the central stalk subunits to proton translocation	atpH	-	ko:K02113	ko00190,ko00195,ko01100,map00190,map00195,map01100	ko00000,ko00001,ko00002,ko00194	OSCP
915	KZE33562.1	557598.LHK_03005	2.85e-53	172.0	COG0711@1|root,COG0711@2|Bacteria,1RHZ0@1224|Proteobacteria,2VRMS@28216|Betaproteobacteria,2KR00@206351|Neisseriales	Component of the F(0) channel, it forms part of the peripheral stalk, linking F(1) to F(0)	atpF	-	ko:K02109	ko00190,ko00195,ko01100,map00190,map00195,map01100	ko00000,ko00001,ko00002,ko00194	ATP-synt_B
915	KZE33563.1	279714.FuraDRAFT_0138	1.18e-42	141.0	COG0636@1|root,32S3K@2|Bacteria,1N1NA@1224|Proteobacteria,2VTY0@28216|Betaproteobacteria,2KRP0@206351|Neisseriales	F(1)F(0) ATP synthase produces ATP from ADP in the presence of a proton or sodium gradient. F-type ATPases consist of two structural domains, F(1) containing the extramembraneous catalytic core and F(0) containing the membrane proton channel, linked together by a central stalk and a peripheral stalk. During catalysis, ATP synthesis in the catalytic domain of F(1) is coupled via a rotary mechanism of the central stalk subunits to proton translocation	atpE	-	ko:K02110	ko00190,ko00195,ko01100,map00190,map00195,map01100	ko00000,ko00001,ko00002,ko00194	ATP-synt_C
915	KZE33564.1	243365.CV_0666	2.46e-163	460.0	COG0356@1|root,COG0356@2|Bacteria,1MV87@1224|Proteobacteria,2VHR5@28216|Betaproteobacteria,2KQAX@206351|Neisseriales	it plays a direct role in the translocation of protons across the membrane	atpB	-	ko:K02108	ko00190,ko00195,ko01100,map00190,map00195,map01100	ko00000,ko00001,ko00002,ko00194,ko03110	ATP-synt_A
915	KZE33565.1	279714.FuraDRAFT_0136	1.14e-25	100.0	2E8DI@1|root,332S0@2|Bacteria,1N83K@1224|Proteobacteria,2VWS9@28216|Betaproteobacteria,2KRV1@206351|Neisseriales	ATP synthase I chain	-	-	ko:K02116	-	ko00000,ko00194	ATP-synt_I
915	KZE33566.1	279714.FuraDRAFT_0135	3.86e-128	372.0	COG1475@1|root,COG1475@2|Bacteria,1MW2E@1224|Proteobacteria,2VIG0@28216|Betaproteobacteria,2KQ06@206351|Neisseriales	Belongs to the ParB family	parB	-	ko:K03497	-	ko00000,ko03000,ko03036,ko04812	ParBc
915	KZE33567.1	243365.CV_0663	1.4e-115	339.0	COG1192@1|root,COG1192@2|Bacteria,1MV43@1224|Proteobacteria,2VHNK@28216|Betaproteobacteria,2KPK8@206351|Neisseriales	CobQ CobB MinD ParA nucleotide binding domain protein	soj	-	ko:K03496	-	ko00000,ko03036,ko04812	AAA_31
915	KZE33568.1	279714.FuraDRAFT_0133	1.57e-108	317.0	COG0357@1|root,COG0357@2|Bacteria,1MY0K@1224|Proteobacteria,2VR3B@28216|Betaproteobacteria,2KQMA@206351|Neisseriales	Specifically methylates the N7 position of guanine in position 527 of 16S rRNA	gidB	-	ko:K03501	-	ko00000,ko01000,ko03009,ko03036	GidB
915	KZE33569.1	279714.FuraDRAFT_0132	0.0	1082.0	COG0445@1|root,COG0445@2|Bacteria,1MU6F@1224|Proteobacteria,2VIGG@28216|Betaproteobacteria,2KPX6@206351|Neisseriales	NAD-binding protein involved in the addition of a carboxymethylaminomethyl (cmnm) group at the wobble position (U34) of certain tRNAs, forming tRNA-cmnm(5)s(2)U34	gidA	-	ko:K03495	-	ko00000,ko03016,ko03036	GIDA,GIDA_assoc
915	KZE33570.1	748280.NH8B_3799	1.38e-138	396.0	COG3176@1|root,COG3176@2|Bacteria,1MWIM@1224|Proteobacteria,2VH4B@28216|Betaproteobacteria,2KQXQ@206351|Neisseriales	Psort location Cytoplasmic, score 8.96	-	-	-	-	-	Acetyltransf_5
915	KZE33571.1	748280.NH8B_3800	3.72e-121	350.0	COG1720@1|root,COG1720@2|Bacteria,1MUF0@1224|Proteobacteria,2VMVI@28216|Betaproteobacteria,2KQTV@206351|Neisseriales	Methyltransferase, YaeB family	-	-	-	-	-	UPF0066
915	KZE33572.1	279714.FuraDRAFT_0129	1.95e-95	291.0	COG4395@1|root,COG4395@2|Bacteria,1NSUG@1224|Proteobacteria,2VNS7@28216|Betaproteobacteria,2KQX5@206351|Neisseriales	Tim44	-	-	-	-	-	Tim44
915	KZE33573.1	279714.FuraDRAFT_0128	7.67e-155	449.0	COG2200@1|root,COG2200@2|Bacteria,1PDZY@1224|Proteobacteria,2VM72@28216|Betaproteobacteria,2KPD2@206351|Neisseriales	Putative diguanylate phosphodiesterase	-	-	-	-	-	EAL
915	KZE33574.1	243365.CV_0656	2.57e-74	229.0	COG2823@1|root,COG2823@2|Bacteria,1MUZ2@1224|Proteobacteria,2VQIS@28216|Betaproteobacteria,2KR5H@206351|Neisseriales	BON domain	-	-	-	-	-	BON
915	KZE33575.1	279714.FuraDRAFT_0126	2.8e-121	348.0	COG0279@1|root,COG0279@2|Bacteria,1NJ8X@1224|Proteobacteria,2VN12@28216|Betaproteobacteria,2KPW6@206351|Neisseriales	Catalyzes the isomerization of sedoheptulose 7-phosphate in D-glycero-D-manno-heptose 7-phosphate	gmhA	-	ko:K03271	ko00540,ko01100,map00540,map01100	ko00000,ko00001,ko00002,ko01000,ko01005	SIS_2
915	KZE33576.1	243365.CV_0654	1.11e-39	135.0	COG0792@1|root,COG0792@2|Bacteria,1N6VN@1224|Proteobacteria,2VU20@28216|Betaproteobacteria,2KRD8@206351|Neisseriales	Belongs to the UPF0102 family	-	-	ko:K07460	-	ko00000	UPF0102
915	KZE33577.1	279714.FuraDRAFT_0124	4.38e-97	300.0	COG3107@1|root,COG3107@2|Bacteria,1MUHR@1224|Proteobacteria,2VSUT@28216|Betaproteobacteria,2KR98@206351|Neisseriales	LppC putative lipoprotein	-	-	ko:K07121	-	ko00000	LppC
915	KZE33578.1	279714.FuraDRAFT_0123	4.38e-125	364.0	COG0313@1|root,COG0313@2|Bacteria,1MU0E@1224|Proteobacteria,2VHI1@28216|Betaproteobacteria,2KQ3M@206351|Neisseriales	Catalyzes the 2'-O-methylation of the ribose of cytidine 1402 (C1402) in 16S rRNA	rsmI	-	ko:K07056	-	ko00000,ko01000,ko03009	TP_methylase
915	KZE33579.1	748280.NH8B_3741	8.33e-39	138.0	COG4970@1|root,COG4970@2|Bacteria,1N7RS@1224|Proteobacteria,2VVPQ@28216|Betaproteobacteria,2KRGY@206351|Neisseriales	Type II transport protein GspH	-	-	ko:K08084	-	ko00000,ko02044	GspH,N_methyl
915	KZE33580.1	279714.FuraDRAFT_0190	3.37e-26	108.0	COG4967@1|root,COG4967@2|Bacteria,1RHZ5@1224|Proteobacteria,2VTBV@28216|Betaproteobacteria,2KRFT@206351|Neisseriales	type IV pilus modification protein PilV	pilV	-	ko:K02671	-	ko00000,ko02035,ko02044	N_methyl
915	KZE33581.1	1123393.KB891316_gene1148	3.61e-11	72.0	COG4966@1|root,COG4966@2|Bacteria,1R5YK@1224|Proteobacteria,2VQY3@28216|Betaproteobacteria	pilus assembly protein PilW	-	-	ko:K02672	-	ko00000,ko02035,ko02044	N_methyl,PilW
915	KZE33582.1	279714.FuraDRAFT_0192	1.1e-35	131.0	COG4726@1|root,COG4726@2|Bacteria,1RJ54@1224|Proteobacteria,2VTQ5@28216|Betaproteobacteria,2KRF6@206351|Neisseriales	Type IV pilus assembly protein PilX C-term	-	-	ko:K02673	-	ko00000,ko02035,ko02044	PilX,PilX_N
915	KZE33583.1	748280.NH8B_3736	3.84e-46	153.0	COG4968@1|root,COG4968@2|Bacteria,1N6QE@1224|Proteobacteria,2VW3E@28216|Betaproteobacteria,2KRS2@206351|Neisseriales	Type IV minor pilin ComP, DNA uptake sequence receptor	pilE	-	ko:K02655	-	ko00000,ko02035,ko02044	ComP_DUS,N_methyl
915	KZE33584.1	748280.NH8B_3582	4e-107	318.0	COG0204@1|root,COG0204@2|Bacteria,1N2DG@1224|Proteobacteria,2VSJD@28216|Betaproteobacteria,2KQTI@206351|Neisseriales	Belongs to the 1-acyl-sn-glycerol-3-phosphate acyltransferase family	plsC	-	ko:K00655	ko00561,ko00564,ko01100,ko01110,map00561,map00564,map01100,map01110	ko00000,ko00001,ko00002,ko01000,ko01004	Acyltransferase
915	KZE33585.1	748280.NH8B_3601	5.06e-183	533.0	COG0507@1|root,COG0507@2|Bacteria,1MW43@1224|Proteobacteria,2VGZ6@28216|Betaproteobacteria,2KPXS@206351|Neisseriales	A helicase nuclease that prepares dsDNA breaks (DSB) for recombinational DNA repair. Binds to DSBs and unwinds DNA via a highly rapid and processive ATP-dependent bidirectional helicase activity. Unwinds dsDNA until it encounters a Chi (crossover hotspot instigator) sequence from the 3' direction. Cuts ssDNA a few nucleotides 3' to the Chi site. The properties and activities of the enzyme are changed at Chi. The Chi-altered holoenzyme produces a long 3'-ssDNA overhang and facilitates RecA-binding to the ssDNA for homologous DNA recombination and repair. Holoenzyme degrades any linearized DNA that is unable to undergo homologous recombination. In the holoenzyme this subunit has ssDNA-dependent ATPase and 5'-3' helicase activity. When added to pre-assembled RecBC greatly stimulates nuclease activity and augments holoenzyme processivity. Negatively regulates the RecA-loading ability of RecBCD	recD	-	ko:K03581	ko03440,map03440	ko00000,ko00001,ko01000,ko03400	AAA_30,UvrD_C_2,Viral_helicase1
915	KZE33586.1	748280.NH8B_3603	0.0	1204.0	COG1074@1|root,COG1074@2|Bacteria,1MUTF@1224|Proteobacteria,2VI92@28216|Betaproteobacteria,2KPJ2@206351|Neisseriales	A helicase nuclease that prepares dsDNA breaks (DSB) for recombinational DNA repair. Binds to DSBs and unwinds DNA via a highly rapid and processive ATP-dependent bidirectional helicase activity. Unwinds dsDNA until it encounters a Chi (crossover hotspot instigator) sequence from the 3' direction. Cuts ssDNA a few nucleotides 3' to the Chi site. The properties and activities of the enzyme are changed at Chi. The Chi-altered holoenzyme produces a long 3'-ssDNA overhang and facilitates RecA-binding to the ssDNA for homologous DNA recombination and repair. Holoenzyme degrades any linearized DNA that is unable to undergo homologous recombination. In the holoenzyme this subunit contributes ATPase, 3'-5' helicase, exonuclease activity and loads RecA onto ssDNA	recB	-	ko:K03582	ko03440,map03440	ko00000,ko00001,ko01000,ko03400	PDDEXK_1,UvrD-helicase,UvrD_C
915	KZE33587.1	279714.FuraDRAFT_0300	1.37e-166	474.0	COG0142@1|root,COG0142@2|Bacteria,1MUK6@1224|Proteobacteria,2VHX4@28216|Betaproteobacteria,2KPH9@206351|Neisseriales	Belongs to the FPP GGPP synthase family	ispB	-	ko:K02523	ko00900,ko01110,map00900,map01110	ko00000,ko00001,ko01000,ko01006	polyprenyl_synt
915	KZE33588.1	1071679.BG57_28515	3.29e-179	516.0	COG1030@1|root,COG1030@2|Bacteria,1MUJN@1224|Proteobacteria,2VMUK@28216|Betaproteobacteria,1K09W@119060|Burkholderiaceae	serine protease	nfeD	-	ko:K07403	-	ko00000	NfeD
915	KZE33589.1	243365.CV_0834	0.0	1144.0	COG5009@1|root,COG5009@2|Bacteria,1MU5A@1224|Proteobacteria,2VHXF@28216|Betaproteobacteria,2KPM0@206351|Neisseriales	penicillin-binding protein 1A	mrcA	-	ko:K05366	ko00550,ko01100,ko01501,map00550,map01100,map01501	ko00000,ko00001,ko01000,ko01003,ko01011	PCB_OB,Transgly,Transpeptidase
915	KZE33590.1	748280.NH8B_3689	6.2e-81	244.0	COG3168@1|root,COG3168@2|Bacteria,1RI6V@1224|Proteobacteria,2VSVR@28216|Betaproteobacteria,2KRSS@206351|Neisseriales	Pilus assembly protein, PilP	pilP	-	ko:K02665	-	ko00000,ko02035,ko02044	PilP
915	KZE33591.1	243365.CV_0826	3.86e-41	139.0	COG3170@1|root,COG3170@2|Bacteria,1NDXW@1224|Proteobacteria,2VXGS@28216|Betaproteobacteria,2KRUW@206351|Neisseriales	Tfp pilus assembly protein FimV	-	-	-	-	-	-
915	KZE33592.1	279714.FuraDRAFT_0211	1.81e-218	609.0	COG2021@1|root,COG2021@2|Bacteria,1MVJV@1224|Proteobacteria,2VHU9@28216|Betaproteobacteria,2KPZZ@206351|Neisseriales	Transfers a succinyl group from succinyl-CoA to L- homoserine, forming succinyl-L-homoserine	metX	-	ko:K00641	ko00270,ko01100,ko01130,map00270,map01100,map01130	ko00000,ko00001,ko01000	Abhydrolase_1
915	KZE33593.1	279714.FuraDRAFT_1462	1.34e-241	667.0	COG3842@1|root,COG3842@2|Bacteria,1MU3I@1224|Proteobacteria,2VHEJ@28216|Betaproteobacteria,2KQJM@206351|Neisseriales	Part of the ABC transporter complex PotABCD involved in spermidine putrescine import. Responsible for energy coupling to the transport system	potA	-	ko:K11076	ko02010,map02010	ko00000,ko00001,ko00002,ko02000	ABC_tran,TOBE_2
915	KZE33594.1	62928.azo1280	1.28e-159	450.0	COG0543@1|root,COG0543@2|Bacteria,1QTSK@1224|Proteobacteria,2VH0M@28216|Betaproteobacteria,2KUPK@206389|Rhodocyclales	oxidoreductase FAD NAD(P)-binding	-	-	ko:K00528	-	ko00000,ko01000	FAD_binding_6,NAD_binding_1
915	KZE33595.1	1286631.X805_31090	5.36e-90	274.0	COG2207@1|root,COG2207@2|Bacteria,1NETZ@1224|Proteobacteria,2VPJ1@28216|Betaproteobacteria,1KKQW@119065|unclassified Burkholderiales	AraC-like ligand binding domain	-	-	-	-	-	AraC_binding,HTH_18
915	KZE33596.1	279714.FuraDRAFT_2165	1.81e-185	519.0	COG0583@1|root,COG0583@2|Bacteria,1N663@1224|Proteobacteria,2VIKU@28216|Betaproteobacteria,2KRFJ@206351|Neisseriales	LysR substrate binding domain	-	-	-	-	-	HTH_1,LysR_substrate
915	KZE33682.1	1268622.AVS7_01546	5.92e-95	281.0	COG1192@1|root,COG1192@2|Bacteria,1MWH3@1224|Proteobacteria,2VMD8@28216|Betaproteobacteria	PFAM Cobyrinic acid a,c-diamide synthase	-	-	ko:K03496	-	ko00000,ko03036,ko04812	AAA_31
915	KZE33683.1	243265.plu2709	2.53e-160	451.0	28KNW@1|root,2ZA74@2|Bacteria,1RCXY@1224|Proteobacteria	Recognizes the double-stranded sequence CTCGAG and cleaves after C-1	-	-	ko:K01155	-	ko00000,ko01000,ko02048	XhoI
915	KZE33684.1	243265.plu2710	0.0	949.0	COG0827@1|root,COG0827@2|Bacteria,1MVG5@1224|Proteobacteria,1SZ1A@1236|Gammaproteobacteria	TaqI-like C-terminal specificity domain	-	-	-	-	-	Eco57I,TaqI_C
915	KZE33685.1	1395571.TMS3_0107740	4.63e-98	289.0	COG1961@1|root,COG1961@2|Bacteria,1MXXT@1224|Proteobacteria,1S08N@1236|Gammaproteobacteria	Site-specific recombinases, DNA invertase Pin homologs	-	-	ko:K14060	-	ko00000	HTH_7,Resolvase
915	KZE33689.1	34506.g1689	1.23e-129	392.0	COG2132@1|root,KOG1263@2759|Eukaryota,39IQA@33154|Opisthokonta,3CKUY@33208|Metazoa,3DH42@33213|Bilateria,40Q48@6231|Nematoda,1M7MP@119089|Chromadorea,41696@6236|Rhabditida	Resolvase, N terminal domain	-	-	-	-	-	Resolvase
915	KZE33837.1	279714.FuraDRAFT_1687	1.96e-138	392.0	COG0066@1|root,COG0066@2|Bacteria,1MVXB@1224|Proteobacteria,2VIJC@28216|Betaproteobacteria,2KPI7@206351|Neisseriales	Catalyzes the isomerization between 2-isopropylmalate and 3-isopropylmalate, via the formation of 2-isopropylmaleate	leuD	-	ko:K01704	ko00290,ko00660,ko01100,ko01110,ko01210,ko01230,map00290,map00660,map01100,map01110,map01210,map01230	br01601,ko00000,ko00001,ko00002,ko01000	Aconitase_C
915	KZE33838.1	279714.FuraDRAFT_1685	5.83e-296	812.0	COG0065@1|root,COG0065@2|Bacteria,1MVYR@1224|Proteobacteria,2VHSH@28216|Betaproteobacteria,2KPJM@206351|Neisseriales	Catalyzes the isomerization between 2-isopropylmalate and 3-isopropylmalate, via the formation of 2-isopropylmaleate	leuC	-	ko:K01703	ko00290,ko00660,ko00966,ko01100,ko01110,ko01210,ko01230,map00290,map00660,map00966,map01100,map01110,map01210,map01230	br01601,ko00000,ko00001,ko00002,ko01000	Aconitase
915	KZE33839.1	243365.CV_2787	9.43e-57	180.0	COG1188@1|root,COG1188@2|Bacteria,1MZR6@1224|Proteobacteria,2VTY8@28216|Betaproteobacteria,2KR8W@206351|Neisseriales	S4 domain protein	hslR	-	ko:K04762	-	ko00000,ko03110	S4
915	KZE33840.1	243365.CV_2788	3.45e-100	296.0	COG0179@1|root,COG0179@2|Bacteria,1MVFA@1224|Proteobacteria,2VHG8@28216|Betaproteobacteria,2KR0Y@206351|Neisseriales	Fumarylacetoacetate (FAA) hydrolase family	-	-	-	-	-	FAA_hydrolase
915	KZE33841.1	279714.FuraDRAFT_1681	0.0	931.0	COG3243@1|root,COG3243@2|Bacteria,1MU68@1224|Proteobacteria,2VH50@28216|Betaproteobacteria,2KPR7@206351|Neisseriales	Poly-beta-hydroxybutyrate polymerase (PhaC) N-terminus	phaC	-	ko:K03821	ko00650,map00650	ko00000,ko00001,ko01000	PhaC_N
915	KZE33842.1	557598.LHK_01112	4.39e-221	617.0	COG0183@1|root,COG0183@2|Bacteria,1MU5G@1224|Proteobacteria,2VH4C@28216|Betaproteobacteria,2KPXE@206351|Neisseriales	Belongs to the thiolase family	-	-	ko:K00626	ko00071,ko00072,ko00280,ko00310,ko00362,ko00380,ko00620,ko00630,ko00640,ko00650,ko00720,ko00900,ko01100,ko01110,ko01120,ko01130,ko01200,ko01212,ko02020,map00071,map00072,map00280,map00310,map00362,map00380,map00620,map00630,map00640,map00650,map00720,map00900,map01100,map01110,map01120,map01130,map01200,map01212,map02020	ko00000,ko00001,ko00002,ko01000,ko04147	Thiolase_C,Thiolase_N
915	KZE33843.1	243365.CV_1962	7.49e-310	856.0	COG0018@1|root,COG0018@2|Bacteria,1MU4J@1224|Proteobacteria,2VHT1@28216|Betaproteobacteria,2KPWY@206351|Neisseriales	Arginyl-tRNA synthetase	argS	-	ko:K01887	ko00970,map00970	ko00000,ko00001,ko00002,ko01000,ko01007,ko03016,ko03029	Arg_tRNA_synt_N,DALR_1,tRNA-synt_1d
915	KZE33844.1	748280.NH8B_1482	1.56e-310	847.0	COG0826@1|root,COG0826@2|Bacteria,1MUQG@1224|Proteobacteria,2VH51@28216|Betaproteobacteria,2KPVQ@206351|Neisseriales	Peptidase, U32 family	-	-	ko:K08303	ko05120,map05120	ko00000,ko00001,ko01000,ko01002	Peptidase_U32,Peptidase_U32_C
915	KZE33845.1	279714.FuraDRAFT_1676	9.06e-56	177.0	COG3741@1|root,COG3741@2|Bacteria,1NBYI@1224|Proteobacteria,2VXZG@28216|Betaproteobacteria,2KT51@206351|Neisseriales	N-formylglutamate amidohydrolase	-	-	-	-	-	-
915	KZE33847.1	757424.Hsero_1728	1.9e-104	312.0	COG2833@1|root,COG2833@2|Bacteria,1MW0V@1224|Proteobacteria,2VIX0@28216|Betaproteobacteria,473DG@75682|Oxalobacteraceae	Protein of unknown function (DUF455)	-	-	-	-	-	DUF455
915	KZE33848.1	279714.FuraDRAFT_1674	8.59e-65	201.0	COG1699@1|root,COG1699@2|Bacteria,1N9E7@1224|Proteobacteria,2VUC5@28216|Betaproteobacteria,2KRQK@206351|Neisseriales	Binds to the C-terminal region of flagellin, which is implicated in polymerization, and participates in the assembly of the flagellum	fliW	-	ko:K13626	-	ko00000,ko02035	FliW
915	KZE33849.1	279714.FuraDRAFT_1659	1.24e-99	293.0	COG2818@1|root,COG2818@2|Bacteria,1R9X5@1224|Proteobacteria,2VQC5@28216|Betaproteobacteria,2KQUT@206351|Neisseriales	DNA-3-methyladenine glycosylase I	tag	-	ko:K01246	ko03410,map03410	ko00000,ko00001,ko01000,ko03400	Adenine_glyco
915	KZE33850.1	279714.FuraDRAFT_1192	2.8e-125	361.0	COG0603@1|root,COG0603@2|Bacteria,1MU5V@1224|Proteobacteria,2VHY3@28216|Betaproteobacteria,2KQ1A@206351|Neisseriales	Catalyzes the ATP-dependent conversion of 7-carboxy-7- deazaguanine (CDG) to 7-cyano-7-deazaguanine (preQ(0))	queC	-	ko:K06920	ko00790,ko01100,map00790,map01100	ko00000,ko00001,ko01000,ko03016	QueC
915	KZE33851.1	557598.LHK_01124	1.03e-113	339.0	COG0720@1|root,COG0720@2|Bacteria,1RI4P@1224|Proteobacteria,2VPAX@28216|Betaproteobacteria,2KQ52@206351|Neisseriales	synthase	-	-	ko:K01737	ko00790,ko01100,map00790,map01100	ko00000,ko00001,ko00002,ko01000,ko03016	PTPS
915	KZE33852.1	279714.FuraDRAFT_1194	1.12e-113	330.0	COG0602@1|root,COG0602@2|Bacteria,1MUJ2@1224|Proteobacteria,2VGZ7@28216|Betaproteobacteria,2KQB7@206351|Neisseriales	Catalyzes the complex heterocyclic radical-mediated conversion of 6-carboxy-5,6,7,8-tetrahydropterin (CPH4) to 7- carboxy-7-deazaguanine (CDG), a step common to the biosynthetic pathways of all 7-deazapurine-containing compounds	queE	-	ko:K10026	ko00790,ko01100,map00790,map01100	ko00000,ko00001,ko01000,ko03016	Fer4_14,Radical_SAM
