key	query	seed_ortholog	evalue	score	eggNOG_OGs	description	preferred_name	GOs	KEGG_ko	KEGG_pathway	brite	PFAMs
962	GGN42166.1	1121381.JNIV01000113_gene4256	1.71e-150	430.0	COG0382@1|root,COG0382@2|Bacteria	Catalyzes the prenylation of para-hydroxybenzoate (PHB) with an all-trans polyprenyl group. Mediates the second step in the final reaction sequence of ubiquinone-8 (UQ-8) biosynthesis, which is the condensation of the polyisoprenoid side chain with PHB, generating the first membrane-bound Q intermediate 3- octaprenyl-4-hydroxybenzoate	ubiA	-	ko:K04040,ko:K20616	ko00860,ko01100,ko01110,map00860,map01100,map01110	ko00000,ko00001,ko01000,ko01006	UbiA
962	GGN42171.1	1121378.KB899696_gene2620	7.37e-112	334.0	COG5012@1|root,COG5012@2|Bacteria,1WI7R@1297|Deinococcus-Thermus	PFAM MerR family regulatory protein	-	-	ko:K22491	-	ko00000,ko03000	B12-binding,B12-binding_2,MerR,MerR_1
962	GGN42174.1	1121380.JNIW01000002_gene2371	5.9e-150	428.0	COG0702@1|root,COG0702@2|Bacteria,1WI5F@1297|Deinococcus-Thermus	PFAM NAD dependent epimerase dehydratase family	-	-	ko:K00329,ko:K00356	ko00190,map00190	ko00000,ko00001,ko01000	Epimerase,NAD_binding_10
962	GGN42177.1	546414.Deide_13870	4.15e-94	278.0	COG0503@1|root,COG0503@2|Bacteria,1WI2I@1297|Deinococcus-Thermus	COGs COG0503 Adenine guanine phosphoribosyltransferase and related PRPP-binding protein	-	-	ko:K00759	ko00230,ko01100,map00230,map01100	ko00000,ko00001,ko01000,ko04147	Pribosyltran
962	GGN42180.1	1540221.JQNI01000002_gene565	2.25e-104	303.0	COG0503@1|root,COG0503@2|Bacteria,1WJ7U@1297|Deinococcus-Thermus	COGs COG0503 Adenine guanine phosphoribosyltransferase and related PRPP-binding protein	-	-	ko:K00759	ko00230,ko01100,map00230,map01100	ko00000,ko00001,ko01000,ko04147	Pribosyltran
962	GGN42185.1	1121378.KB899696_gene2743	2.34e-119	353.0	COG1525@1|root,COG3291@1|root,COG1525@2|Bacteria,COG3291@2|Bacteria	metallopeptidase activity	-	-	ko:K01179,ko:K02238,ko:K04618	ko00052,ko00500,ko01100,map00052,map00500,map01100	ko00000,ko00001,ko00002,ko01000,ko02044	DUF1929,Excalibur,F5_F8_type_C,Glyco_hydro_64,Kelch_6,PKD
962	GGN42189.1	546414.Deide_13890	9.32e-64	199.0	2DMUR@1|root,32TTD@2|Bacteria	Domain of unknown function (DUF4395)	-	-	-	-	-	DUF4395
962	GGN42192.1	546414.Deide_13900	0.0	947.0	COG0155@1|root,COG0155@2|Bacteria,1WIU8@1297|Deinococcus-Thermus	Nitrite and sulphite reductase 4Fe-4S	-	-	ko:K00366,ko:K00381,ko:K00392	ko00910,ko00920,ko01100,ko01120,map00910,map00920,map01100,map01120	ko00000,ko00001,ko00002,ko01000	NIR_SIR,NIR_SIR_ferr
962	GGN42195.1	319795.Dgeo_1408	2.03e-99	291.0	COG0529@1|root,COG0529@2|Bacteria,1WK0X@1297|Deinococcus-Thermus	Catalyzes the synthesis of activated sulfate	cysC	-	ko:K00860	ko00230,ko00920,ko01100,ko01120,map00230,map00920,map01100,map01120	ko00000,ko00001,ko00002,ko01000	APS_kinase
962	GGN42203.1	1121377.KB906399_gene1824	9.07e-143	405.0	COG0175@1|root,COG0175@2|Bacteria,1WJU2@1297|Deinococcus-Thermus	Reduction of activated sulfate into sulfite	cysH	GO:0003674,GO:0003824,GO:0004604,GO:0005575,GO:0005622,GO:0005623,GO:0005737,GO:0008150,GO:0008152,GO:0016491,GO:0016667,GO:0016671,GO:0044424,GO:0044464,GO:0055114	ko:K00390	ko00920,ko01100,ko01120,map00920,map01100,map01120	ko00000,ko00001,ko00002,ko01000	PAPS_reduct
962	GGN42211.1	546414.Deide_13930	2.26e-239	662.0	COG2046@1|root,COG2046@2|Bacteria,1WI8H@1297|Deinococcus-Thermus	Belongs to the sulfate adenylyltransferase family	sat	-	ko:K00958	ko00230,ko00261,ko00450,ko00920,ko01100,ko01120,ko01130,map00230,map00261,map00450,map00920,map01100,map01120,map01130	ko00000,ko00001,ko00002,ko01000	ATP-sulfurylase,PUA_2
962	GGN42216.1	1121378.KB899695_gene3148	5.51e-173	489.0	COG0715@1|root,COG0715@2|Bacteria,1WIC3@1297|Deinococcus-Thermus	ABC transporter substrate-binding protein	-	-	ko:K02051	-	ko00000,ko00002,ko02000	NMT1_2
962	GGN42219.1	546414.Deide_13950	7.64e-148	422.0	COG0600@1|root,COG0600@2|Bacteria	ABC-type nitrate sulfonate bicarbonate transport system permease component	ssuC	-	ko:K02050	-	ko00000,ko00002,ko02000	BPD_transp_1
962	GGN42227.1	243230.DR_2198	3.33e-118	344.0	COG1116@1|root,COG1116@2|Bacteria,1WJMK@1297|Deinococcus-Thermus	ABC transporter	-	-	ko:K02049	-	ko00000,ko00002,ko02000	ABC_tran
962	GGN42231.1	684949.ATTJ01000001_gene2583	4.31e-126	380.0	COG2234@1|root,COG2234@2|Bacteria	aminopeptidase activity	ywaD	-	ko:K19701	-	ko00000,ko01000,ko01002	PA,Peptidase_M28
962	GGN42235.1	546414.Deide_14500	0.0	1093.0	COG0481@1|root,COG0481@2|Bacteria,1WIX4@1297|Deinococcus-Thermus	Required for accurate and efficient protein synthesis under certain stress conditions. May act as a fidelity factor of the translation reaction, by catalyzing a one-codon backward translocation of tRNAs on improperly translocated ribosomes. Back- translocation proceeds from a post-translocation (POST) complex to a pre-translocation (PRE) complex, thus giving elongation factor G a second chance to translocate the tRNAs correctly. Binds to ribosomes in a GTP-dependent manner	lepA	-	ko:K03596	ko05134,map05134	ko00000,ko00001	EFG_C,EFG_II,GTP_EFTU,GTP_EFTU_D2,LepA_C
962	GGN42238.1	1121380.JNIW01000041_gene804	7.62e-140	408.0	COG0642@1|root,COG0642@2|Bacteria,1WNE1@1297|Deinococcus-Thermus	Histidine kinase	-	-	-	-	-	HATPase_c,HisKA
962	GGN42243.1	1121380.JNIW01000041_gene805	4.16e-122	350.0	COG2197@1|root,COG2197@2|Bacteria,1WIZJ@1297|Deinococcus-Thermus	Response regulator containing a CheY-like receiver domain and an HTH DNA-binding domain	-	-	-	-	-	GerE,Response_reg
962	GGN42286.1	1540221.JQNI01000002_gene1661	4.39e-231	642.0	COG0436@1|root,COG0436@2|Bacteria,1WIMB@1297|Deinococcus-Thermus	aminotransferase class I and II	-	-	ko:K00812	ko00220,ko00250,ko00270,ko00330,ko00350,ko00360,ko00400,ko00401,ko00950,ko00960,ko01100,ko01110,ko01130,ko01210,ko01230,map00220,map00250,map00270,map00330,map00350,map00360,map00400,map00401,map00950,map00960,map01100,map01110,map01130,map01210,map01230	ko00000,ko00001,ko01000,ko01007	Aminotran_1_2
962	GGN42290.1	1254432.SCE1572_16015	0.0	1147.0	COG0178@1|root,COG0178@2|Bacteria,1MW0W@1224|Proteobacteria,42M4I@68525|delta/epsilon subdivisions,2WJHM@28221|Deltaproteobacteria,2YU81@29|Myxococcales	ABC transporter	-	-	-	-	-	ABC_tran
962	GGN42294.1	684949.ATTJ01000001_gene2576	3.68e-162	456.0	COG2013@1|root,COG2013@2|Bacteria	Mitochondrial biogenesis AIM24	-	-	-	-	-	AIM24
962	GGN42328.1	684949.ATTJ01000001_gene2575	2.05e-193	546.0	COG0707@1|root,COG0707@2|Bacteria,1WI43@1297|Deinococcus-Thermus	Cell wall formation. Catalyzes the transfer of a GlcNAc subunit on undecaprenyl-pyrophosphoryl-MurNAc-pentapeptide (lipid intermediate I) to form undecaprenyl-pyrophosphoryl-MurNAc- (pentapeptide)GlcNAc (lipid intermediate II)	murG	-	ko:K02563	ko00550,ko01100,ko01502,ko04112,map00550,map01100,map01502,map04112	ko00000,ko00001,ko01000,ko01011	Glyco_tran_28_C,Glyco_transf_28
962	GGN42332.1	1121381.JNIV01000069_gene1845	3.08e-254	705.0	COG0773@1|root,COG0773@2|Bacteria,1WHZZ@1297|Deinococcus-Thermus	Belongs to the MurCDEF family	murC	-	ko:K01924	ko00471,ko00550,ko01100,map00471,map00550,map01100	ko00000,ko00001,ko01000,ko01011	Mur_ligase,Mur_ligase_C,Mur_ligase_M
962	GGN42335.1	1540221.JQNI01000002_gene1667	1.6e-178	501.0	COG0812@1|root,COG0812@2|Bacteria,1WJ8X@1297|Deinococcus-Thermus	Cell wall formation	murB	-	ko:K00075	ko00520,ko00550,ko01100,map00520,map00550,map01100	ko00000,ko00001,ko01000,ko01011	FAD_binding_4,MurB_C
962	GGN42339.1	1489678.RDMS_01050	6.52e-85	260.0	COG1589@1|root,COG1589@2|Bacteria,1WJUK@1297|Deinococcus-Thermus	Cell division protein FtsQ	ftsQ	-	ko:K03589	ko04112,map04112	ko00000,ko00001,ko03036	POTRA_1
962	GGN42343.1	546414.Deide_14580	3.6e-245	682.0	COG0849@1|root,COG0849@2|Bacteria,1WJ8M@1297|Deinococcus-Thermus	Cell division protein that is involved in the assembly of the Z ring. May serve as a membrane anchor for the Z ring	ftsA	-	ko:K03590	ko04112,map04112	ko00000,ko00001,ko03036,ko04812	FtsA,SHS2_FTSA
962	GGN42345.1	1121378.KB899707_gene1451	6.72e-229	633.0	COG0206@1|root,COG0206@2|Bacteria,1WIS9@1297|Deinococcus-Thermus	Essential cell division protein that forms a contractile ring structure (Z ring) at the future cell division site. The regulation of the ring assembly controls the timing and the location of cell division. One of the functions of the FtsZ ring is to recruit other cell division proteins to the septum to produce a new cell wall between the dividing cells. Binds GTP and shows GTPase activity	ftsZ	-	ko:K03531	ko04112,map04112	ko00000,ko00001,ko02048,ko03036,ko04812	FtsZ_C,Tubulin
962	GGN42348.1	319795.Dgeo_1205	6.97e-174	497.0	COG0683@1|root,COG0683@2|Bacteria,1WI02@1297|Deinococcus-Thermus	ABC-type branched-chain amino acid transport	-	-	ko:K01999	ko02010,ko02024,map02010,map02024	ko00000,ko00001,ko00002,ko02000	Peripla_BP_6
962	GGN42351.1	1288484.APCS01000001_gene588	1.49e-150	436.0	COG1721@1|root,COG1721@2|Bacteria,1WIIV@1297|Deinococcus-Thermus	protein (some members contain a von Willebrand factor type A (vWA) domain)	-	-	-	-	-	DUF58
962	GGN42356.1	546414.Deide_14370	1.11e-172	488.0	COG0714@1|root,COG0714@2|Bacteria,1WJ11@1297|Deinococcus-Thermus	PFAM ATPase family associated with various cellular activities (AAA)	-	-	ko:K03924	-	ko00000,ko01000	AAA_3
962	GGN42359.1	1121380.JNIW01000005_gene337	1.03e-67	232.0	2EBSX@1|root,335SM@2|Bacteria,1WIKC@1297|Deinococcus-Thermus	Domain of unknown function (DUF4129)	-	-	-	-	-	DUF4129
962	GGN42362.1	546414.Deide_14380	2.46e-239	676.0	COG0568@1|root,COG0568@2|Bacteria,1WIS6@1297|Deinococcus-Thermus	Sigma factors are initiation factors that promote the attachment of RNA polymerase to specific initiation sites and are then released. This sigma factor is the primary sigma factor during exponential growth	sigA	-	ko:K03086	-	ko00000,ko03021	Sigma70_r1_1,Sigma70_r1_2,Sigma70_r2,Sigma70_r3,Sigma70_r4
962	GGN42369.1	1121377.KB906398_gene2410	2.41e-200	565.0	COG2813@1|root,COG2813@2|Bacteria,1WIPI@1297|Deinococcus-Thermus	16S RNA G1207 methylase RsmC	rsmC	-	ko:K00564	-	ko00000,ko01000,ko03009	MTS
962	GGN42376.1	243230.DR_2174	0.0	1466.0	COG0495@1|root,COG0495@2|Bacteria,1WIX9@1297|Deinococcus-Thermus	Belongs to the class-I aminoacyl-tRNA synthetase family	leuS	GO:0003674,GO:0003824,GO:0004812,GO:0004823,GO:0005575,GO:0005622,GO:0005623,GO:0005737,GO:0005829,GO:0006082,GO:0006139,GO:0006399,GO:0006412,GO:0006418,GO:0006429,GO:0006518,GO:0006520,GO:0006725,GO:0006807,GO:0008150,GO:0008152,GO:0009058,GO:0009059,GO:0009987,GO:0010467,GO:0016070,GO:0016874,GO:0016875,GO:0019538,GO:0019752,GO:0034641,GO:0034645,GO:0034660,GO:0043038,GO:0043039,GO:0043043,GO:0043170,GO:0043436,GO:0043603,GO:0043604,GO:0044237,GO:0044238,GO:0044249,GO:0044260,GO:0044267,GO:0044271,GO:0044281,GO:0044424,GO:0044444,GO:0044464,GO:0046483,GO:0071704,GO:0090304,GO:0140098,GO:0140101,GO:1901360,GO:1901564,GO:1901566,GO:1901576	ko:K01869	ko00970,map00970	ko00000,ko00001,ko00002,ko01000,ko01007,ko03016,ko03029	Anticodon_1,Leucyl-specific,tRNA-synt_1,tRNA-synt_1_2
962	GGN42379.1	684949.ATTJ01000001_gene2781	0.0	999.0	COG0018@1|root,COG0018@2|Bacteria,1WI72@1297|Deinococcus-Thermus	Arginyl-tRNA synthetase	argS	GO:0003674,GO:0003824,GO:0004812,GO:0004814,GO:0005575,GO:0005622,GO:0005623,GO:0005737,GO:0006082,GO:0006139,GO:0006399,GO:0006412,GO:0006418,GO:0006420,GO:0006518,GO:0006520,GO:0006725,GO:0006807,GO:0008150,GO:0008152,GO:0009058,GO:0009059,GO:0009987,GO:0010467,GO:0016070,GO:0016874,GO:0016875,GO:0019538,GO:0019752,GO:0034641,GO:0034645,GO:0034660,GO:0043038,GO:0043039,GO:0043043,GO:0043170,GO:0043436,GO:0043603,GO:0043604,GO:0044237,GO:0044238,GO:0044249,GO:0044260,GO:0044267,GO:0044271,GO:0044281,GO:0044424,GO:0044464,GO:0046483,GO:0071704,GO:0090304,GO:0140098,GO:0140101,GO:1901360,GO:1901564,GO:1901566,GO:1901576	ko:K01887	ko00970,map00970	ko00000,ko00001,ko00002,ko01000,ko01007,ko03016,ko03029	Arg_tRNA_synt_N,DALR_1,tRNA-synt_1d
962	GGN42383.1	1476583.DEIPH_ctg033orf0201	1.15e-178	502.0	COG1305@1|root,COG1305@2|Bacteria,1WMFC@1297|Deinococcus-Thermus	Transglutaminase/protease-like homologues	-	-	-	-	-	Transglut_core
962	GGN42387.1	1121380.JNIW01000029_gene887	0.0	1022.0	COG1331@1|root,COG1331@2|Bacteria,1WI7F@1297|Deinococcus-Thermus	Highly conserved protein containing a thioredoxin domain	-	-	ko:K06888	-	ko00000	GlcNAc_2-epim,Thioredox_DsbH
962	GGN42394.1	1476583.DEIPH_ctg025orf0107	9.3e-69	215.0	COG2059@1|root,COG2059@2|Bacteria,1WN3R@1297|Deinococcus-Thermus	Chromate transporter	-	-	ko:K07240	-	ko00000,ko02000	Chromate_transp
962	GGN42398.1	546414.Deide_10050	1.9e-69	215.0	COG2059@1|root,COG2059@2|Bacteria,1WN3X@1297|Deinococcus-Thermus	Chromate transporter	-	-	ko:K07240	-	ko00000,ko02000	Chromate_transp
962	GGN42401.1	546414.Deide_10040	8.91e-97	288.0	COG2519@1|root,COG2519@2|Bacteria	Catalyzes the S-adenosyl-L-methionine-dependent formation of N(1)-methyladenine at position 58 (m1A58) in tRNA	-	-	-	-	-	Methyltransf_25,SAM_MT,Spermine_synth
962	GGN42404.1	684949.ATTJ01000001_gene2763	5.77e-140	400.0	COG1073@1|root,COG1073@2|Bacteria	thiolester hydrolase activity	yfhR3	-	ko:K06889	-	ko00000	Abhydrolase_1,Hydrolase_4,Peptidase_S9
962	GGN42410.1	1122223.KB890696_gene280	3.44e-11	67.8	2BN1I@1|root,32GMQ@2|Bacteria,1WN4C@1297|Deinococcus-Thermus	-	-	-	-	-	-	-
962	GGN42413.1	243230.DR_1055	8.22e-286	784.0	COG0017@1|root,COG0017@2|Bacteria,1WJAX@1297|Deinococcus-Thermus	Aspartyl-tRNA synthetase with relaxed tRNA specificity since it is able to aspartylate not only its cognate tRNA(Asp) but also tRNA(Asn). Reaction proceeds in two steps L-aspartate is first activated by ATP to form Asp-AMP and then transferred to the acceptor end of tRNA(Asp Asn)	aspC	-	ko:K09759	ko00970,map00970	ko00000,ko00001,ko00002,ko01000,ko01007,ko03016	tRNA-synt_2,tRNA_anti-codon
962	GGN42416.1	546414.Deide_10010	2.99e-152	435.0	COG2301@1|root,COG2301@2|Bacteria	Belongs to the HpcH HpaI aldolase family	citE	GO:0000287,GO:0003674,GO:0005488,GO:0006082,GO:0006107,GO:0008150,GO:0008152,GO:0009987,GO:0019752,GO:0043167,GO:0043169,GO:0043436,GO:0043648,GO:0044237,GO:0044281,GO:0046872,GO:0071704	ko:K01644,ko:K18292	ko00660,ko01100,ko02020,map00660,map01100,map02020	ko00000,ko00001,ko01000	HpcH_HpaI
962	GGN42419.1	1121377.KB906399_gene1727	3.14e-96	281.0	COG2030@1|root,COG2030@2|Bacteria,1WJC4@1297|Deinococcus-Thermus	N-terminal half of MaoC dehydratase	-	-	-	-	-	MaoC_dehydratas
962	GGN42423.1	1121377.KB906411_gene493	7.08e-156	454.0	COG2379@1|root,COG2379@2|Bacteria,1WI14@1297|Deinococcus-Thermus	Hydroxypyruvate reductase	-	-	ko:K11529	ko00030,ko00260,ko00561,ko00630,ko00680,ko01100,ko01120,ko01130,ko01200,map00030,map00260,map00561,map00630,map00680,map01100,map01120,map01130,map01200	ko00000,ko00001,ko00002,ko01000	DUF4147,MOFRL
962	GGN42430.1	745776.DGo_CA0197	2.52e-26	109.0	COG2199@1|root,COG3706@2|Bacteria	GGDEF domain	-	-	-	-	-	GGDEF,TPR_12,TPR_7
962	GGN42458.1	745776.DGo_CA0197	5.92e-29	125.0	COG2199@1|root,COG3706@2|Bacteria	GGDEF domain	-	-	-	-	-	GGDEF,TPR_12,TPR_7
962	GGN42462.1	1489678.RDMS_00335	3.26e-163	465.0	COG0596@1|root,COG0596@2|Bacteria	hydrolase activity, acting on ester bonds	-	-	ko:K01563	ko00361,ko00625,ko01100,ko01120,map00361,map00625,map01100,map01120	ko00000,ko00001,ko01000	Abhydrolase_1,Abhydrolase_6
962	GGN42484.1	684949.ATTJ01000001_gene2966	1.45e-180	509.0	COG0142@1|root,COG0142@2|Bacteria,1WIQI@1297|Deinococcus-Thermus	Belongs to the FPP GGPP synthase family	-	-	ko:K13789	ko00900,ko01100,ko01110,ko01130,map00900,map01100,map01110,map01130	ko00000,ko00001,ko00002,ko01000,ko01006	polyprenyl_synt
962	GGN42489.1	684949.ATTJ01000001_gene2967	4.66e-113	332.0	COG3741@1|root,COG3741@2|Bacteria,1WMMJ@1297|Deinococcus-Thermus	N-formylglutamate amidohydrolase	-	-	-	-	-	FGase
962	GGN42493.1	546414.Deide_09770	6.46e-179	508.0	COG0739@1|root,COG1388@1|root,COG0739@2|Bacteria,COG1388@2|Bacteria,1WJ1A@1297|Deinococcus-Thermus	PFAM Peptidase family M23	-	-	-	-	-	LysM,Peptidase_M23
962	GGN42496.1	745776.DGo_CA1361	2.88e-79	238.0	COG1490@1|root,COG1490@2|Bacteria,1WJUX@1297|Deinococcus-Thermus	rejects L-amino acids rather than detecting D-amino acids in the active site. By recycling D-aminoacyl-tRNA to D-amino acids and free tRNA molecules, this enzyme counteracts the toxicity associated with the formation of D-aminoacyl-tRNA entities in vivo and helps enforce protein L-homochirality	dtd	GO:0002161,GO:0003674,GO:0003824,GO:0005575,GO:0005622,GO:0005623,GO:0005737,GO:0006139,GO:0006399,GO:0006450,GO:0006725,GO:0006807,GO:0008150,GO:0008152,GO:0009987,GO:0016070,GO:0016787,GO:0016788,GO:0034641,GO:0034660,GO:0043170,GO:0044237,GO:0044238,GO:0044424,GO:0044464,GO:0046483,GO:0051499,GO:0051500,GO:0052689,GO:0065007,GO:0065008,GO:0071704,GO:0090304,GO:0106074,GO:0140098,GO:0140101,GO:1901360	ko:K07560	-	ko00000,ko01000,ko03016	Tyr_Deacylase
962	GGN42500.1	684949.ATTJ01000001_gene2082	3.3e-41	137.0	294SY@1|root,2ZS64@2|Bacteria,1WN7N@1297|Deinococcus-Thermus	Domain of unknown function (DUF1844)	-	-	-	-	-	DUF1844
962	GGN42509.1	1121377.KB906399_gene1593	2.18e-67	206.0	2A432@1|root,30SN0@2|Bacteria,1WJTJ@1297|Deinococcus-Thermus	-	-	-	-	-	-	-
962	GGN42518.1	1121378.KB899762_gene3384	5.09e-95	282.0	COG0791@1|root,COG1388@1|root,COG0791@2|Bacteria,COG1388@2|Bacteria,1WJI4@1297|Deinococcus-Thermus	Cell wall-associated hydrolase (invasion-associated protein)	-	-	-	-	-	LysM,NLPC_P60
962	GGN42536.1	1540221.JQNI01000004_gene163	0.0	1144.0	COG2217@1|root,COG2217@2|Bacteria,1WI6R@1297|Deinococcus-Thermus	heavy metal translocating P-type ATPase	-	-	ko:K01533	-	ko00000,ko01000	E1-E2_ATPase,Hydrolase
962	GGN42539.1	1476583.DEIPH_ctg046orf0054	9.82e-43	142.0	COG1937@1|root,COG1937@2|Bacteria	negative regulation of transcription, DNA-templated	csoR	GO:0000976,GO:0001067,GO:0001130,GO:0001217,GO:0003674,GO:0003676,GO:0003677,GO:0003690,GO:0003700,GO:0005488,GO:0005507,GO:0005575,GO:0005623,GO:0005886,GO:0006355,GO:0008150,GO:0009889,GO:0009890,GO:0009892,GO:0010035,GO:0010038,GO:0010272,GO:0010468,GO:0010556,GO:0010558,GO:0010605,GO:0010629,GO:0016020,GO:0019219,GO:0019222,GO:0031323,GO:0031324,GO:0031326,GO:0031327,GO:0032991,GO:0032993,GO:0042221,GO:0043167,GO:0043169,GO:0043565,GO:0044212,GO:0044464,GO:0045892,GO:0045934,GO:0046688,GO:0046872,GO:0046914,GO:0048519,GO:0048523,GO:0050789,GO:0050794,GO:0050896,GO:0051171,GO:0051172,GO:0051252,GO:0051253,GO:0060255,GO:0065007,GO:0071944,GO:0080090,GO:0097077,GO:0097159,GO:0140110,GO:1901363,GO:1902679,GO:1903506,GO:1903507,GO:1990837,GO:2000112,GO:2000113,GO:2001141	ko:K21600	-	ko00000,ko03000	Trns_repr_metal
962	GGN42542.1	1476583.DEIPH_ctg046orf0053	1.35e-23	91.3	COG2608@1|root,COG2608@2|Bacteria,1WKNR@1297|Deinococcus-Thermus	Heavy metal transport detoxification protein	-	-	-	-	-	HMA
962	GGN42546.1	319795.Dgeo_2553	0.0	1304.0	COG2217@1|root,COG2217@2|Bacteria,1WJ55@1297|Deinococcus-Thermus	ATPase P-type (Transporting), HAD superfamily, subfamily IC	pacS	-	ko:K17686	ko01524,ko04016,map01524,map04016	ko00000,ko00001,ko01000	E1-E2_ATPase,HMA,Hydrolase
962	GGN42553.1	937777.Deipe_3272	9.43e-80	238.0	2F4XP@1|root,33XJP@2|Bacteria,1WMNC@1297|Deinococcus-Thermus	-	-	-	-	-	-	-
962	GGN42560.1	1476583.DEIPH_ctg069orf0011	1.07e-41	140.0	COG5642@1|root,COG5642@2|Bacteria	Protein of unknown function (DUF2384)	-	-	ko:K15359	ko00760,ko01120,map00760,map01120	ko00000,ko00001,ko00002,ko01000	DUF2384
962	GGN42573.1	684949.ATTJ01000002_gene233	6.78e-241	669.0	28HKD@1|root,2Z7V8@2|Bacteria	type ii restriction enzyme	-	-	ko:K01155	-	ko00000,ko01000,ko02048	-
962	GGN42577.1	745776.DGo_PC0172	1.91e-115	335.0	COG3544@1|root,COG3544@2|Bacteria	Domain of unknown function (DUF305)	-	-	-	-	-	DUF305
962	GGN42580.1	1540221.JQNI01000004_gene152	1.3e-46	154.0	COG1145@1|root,32SB1@2|Bacteria,1WN0M@1297|Deinococcus-Thermus	Ferredoxin	-	-	-	-	-	DUF326
962	GGN42586.1	35754.JNYJ01000071_gene4287	6.88e-39	137.0	COG1018@1|root,COG1018@2|Bacteria,2IN34@201174|Actinobacteria,4DGH1@85008|Micromonosporales	Is involved in NO detoxification in an aerobic process, termed nitric oxide dioxygenase (NOD) reaction that utilizes O(2) and NAD(P)H to convert NO to nitrate, which protects the bacterium from various noxious nitrogen compounds. Therefore, plays a central role in the inducible response to nitrosative stress	-	-	-	-	-	-
962	GGN42596.1	1476583.DEIPH_ctg139orf0183	1.82e-160	456.0	COG3271@1|root,COG3271@2|Bacteria	-	-	-	-	-	-	DUF3335,Peptidase_C39_2
962	GGN42599.1	1476583.DEIPH_ctg139orf0010	4.86e-92	279.0	COG3292@1|root,COG3292@2|Bacteria	-	-	-	-	-	-	HATPase_c,HisKA_3,Reg_prop,Y_Y_Y
962	GGN42603.1	1540221.JQNI01000004_gene77	4.85e-90	268.0	COG3544@1|root,COG3544@2|Bacteria,1WJVM@1297|Deinococcus-Thermus	Domain of unknown function (DUF4142)	-	-	-	-	-	DUF305
962	GGN42606.1	1540221.JQNI01000004_gene75	1.29e-120	348.0	COG0745@1|root,COG0745@2|Bacteria,1WJ0U@1297|Deinococcus-Thermus	COG0745 Response regulators consisting of a CheY-like receiver domain and a winged-helix DNA-binding domain	-	-	ko:K07658	ko02020,map02020	ko00000,ko00001,ko00002,ko02022	Response_reg,Trans_reg_C
962	GGN42609.1	1476583.DEIPH_ctg139orf0063	1.58e-160	461.0	COG5002@1|root,COG5002@2|Bacteria,1WJBW@1297|Deinococcus-Thermus	Histidine kinase-, DNA gyrase B-, and HSP90-like ATPase	phoR	-	ko:K10819	-	ko00000,ko01000	HAMP,HATPase_c,HisKA
962	GGN42613.1	684949.ATTJ01000002_gene249	2.7e-89	268.0	COG0739@1|root,COG0739@2|Bacteria	heme binding	-	-	-	-	-	DUF4124,LysM,Peptidase_M23,TraG_N
962	GGN42632.1	745776.DGo_CA0709	2.13e-104	305.0	COG3039@1|root,COG3039@2|Bacteria	Transposase	-	-	-	-	-	DDE_Tnp_1,DDE_Tnp_1_3
962	GGN42635.1	1121378.KB899743_gene3677	2.05e-81	256.0	COG0582@1|root,COG0582@2|Bacteria	DNA integration	-	-	-	-	-	Phage_int_SAM_1,Phage_int_SAM_5,Phage_integrase
962	GGN42641.1	929712.KI912613_gene203	8.27e-41	138.0	COG2337@1|root,COG2337@2|Bacteria,2IM6R@201174|Actinobacteria	Toxic component of a toxin-antitoxin (TA) module	-	GO:0003674,GO:0003824,GO:0004518,GO:0004519,GO:0004521,GO:0004540,GO:0006139,GO:0006401,GO:0006402,GO:0006725,GO:0006807,GO:0008150,GO:0008152,GO:0009056,GO:0009057,GO:0009892,GO:0009987,GO:0010468,GO:0010605,GO:0010629,GO:0016070,GO:0016071,GO:0016787,GO:0016788,GO:0019222,GO:0019439,GO:0034641,GO:0034655,GO:0040008,GO:0043170,GO:0044237,GO:0044238,GO:0044248,GO:0044260,GO:0044265,GO:0044270,GO:0045926,GO:0046483,GO:0046700,GO:0048519,GO:0050789,GO:0060255,GO:0065007,GO:0071704,GO:0090304,GO:0090305,GO:0090501,GO:0090502,GO:0140098,GO:1901360,GO:1901361,GO:1901575	ko:K07171	-	ko00000,ko01000,ko02048	PemK_toxin
962	GGN42645.1	649638.Trad_0998	2.19e-16	73.9	COG3609@1|root,COG3609@2|Bacteria	positive regulation of growth	-	GO:0003674,GO:0005488,GO:0005515,GO:0008150,GO:0040008,GO:0045927,GO:0048518,GO:0050789,GO:0065007,GO:0097351	ko:K07746	-	ko00000,ko02048	ParD_antitoxin,RHH_1
962	GGN42649.1	1121381.JNIV01000070_gene3490	4.06e-44	147.0	COG3311@1|root,COG3311@2|Bacteria,1WKDU@1297|Deinococcus-Thermus	Helix-turn-helix domain	-	-	-	-	-	HTH_17
962	GGN42652.1	637389.Acaty_c0091	9.17e-48	160.0	COG1569@1|root,COG1569@2|Bacteria,1RCZE@1224|Proteobacteria,1S52X@1236|Gammaproteobacteria,2NCNI@225057|Acidithiobacillales	PIN domain	-	-	-	-	-	PIN_3
962	GGN42659.1	1121380.JNIW01000108_gene854	1.15e-13	67.4	2BX5K@1|root,32R8G@2|Bacteria	HNH endonuclease	-	-	-	-	-	HNH_3
962	GGN42662.1	926554.KI912677_gene2465	2.82e-94	280.0	COG1192@1|root,COG1192@2|Bacteria	plasmid maintenance	yhjQ	-	ko:K03496	-	ko00000,ko03036,ko04812	AAA_31,CBP_BcsQ,CbiA
962	GGN42691.1	709986.Deima_2014	4.62e-118	373.0	COG2931@1|root,COG2931@2|Bacteria	calcium- and calmodulin-responsive adenylate cyclase activity	-	-	ko:K11904	ko03070,map03070	ko00000,ko00001,ko00002,ko02044	Fascin,Lipase_3,Phage_GPD,VCBS
962	GGN42703.1	684949.ATTJ01000005_gene3428	1.69e-185	526.0	COG4403@1|root,COG4403@2|Bacteria	Lanthionine synthetase C family protein	-	-	-	-	-	-
962	GGN42714.1	1121381.JNIV01000062_gene4356	7.35e-148	425.0	COG2333@1|root,COG3064@1|root,COG2333@2|Bacteria,COG3064@2|Bacteria	translation initiation factor activity	comEC	-	ko:K02238,ko:K03646	-	ko00000,ko00002,ko02000,ko02044	Competence,DUF1524,DUF4131,Excalibur,Lactamase_B
962	GGN42728.1	1120998.AUFC01000022_gene461	0.000489	42.4	COG1396@1|root,COG1396@2|Bacteria,1VDA0@1239|Firmicutes,24MUF@186801|Clostridia	helix-turn-helix	-	-	-	-	-	HTH_19,HTH_3,HTH_31
962	GGN42735.1	251229.Chro_0834	1.25e-127	375.0	COG0675@1|root,COG0675@2|Bacteria,1GD4Y@1117|Cyanobacteria,3VJF3@52604|Pleurocapsales	TIGRFAM transposase, IS605 OrfB family, central region	-	-	ko:K07496	-	ko00000	OrfB_IS605,OrfB_Zn_ribbon
962	GGN42738.1	251229.Chro_0834	4.46e-35	130.0	COG0675@1|root,COG0675@2|Bacteria,1GD4Y@1117|Cyanobacteria,3VJF3@52604|Pleurocapsales	TIGRFAM transposase, IS605 OrfB family, central region	-	-	ko:K07496	-	ko00000	OrfB_IS605,OrfB_Zn_ribbon
962	GGN42827.1	926559.JoomaDRAFT_0015	6.73e-60	201.0	2E0Y5@1|root,32WER@2|Bacteria,4NTNW@976|Bacteroidetes	-	-	-	-	-	-	-
962	GGN42845.1	319795.Dgeo_2791	2.48e-94	289.0	COG2197@1|root,COG2197@2|Bacteria,1WMVP@1297|Deinococcus-Thermus	PFAM Bacterial regulatory proteins, luxR family	-	-	-	-	-	GerE
962	GGN42866.1	1286171.EAL2_c03050	1.75e-06	56.2	COG4632@1|root,COG4632@2|Bacteria,1TQBV@1239|Firmicutes,24AWX@186801|Clostridia,25ZAB@186806|Eubacteriaceae	Phosphodiester glycosidase	-	-	-	-	-	Cu_amine_oxidN1,Metallophos,NAGPA,Pur_ac_phosph_N,SLH
962	GGN42874.1	1288484.APCS01000105_gene1075	0.0	1169.0	COG4644@1|root,COG4644@2|Bacteria	-	-	-	-	-	-	DDE_Tnp_Tn3,DUF4158
962	GGN42876.1	221288.JH992900_gene113	4.47e-108	318.0	COG0582@1|root,COG0582@2|Bacteria	DNA integration	xerC	-	ko:K04763	-	ko00000,ko03036	Phage_int_SAM_1,Phage_int_SAM_4,Phage_integrase
962	GGN42879.1	1540221.JQNI01000004_gene383	1.06e-97	304.0	COG1203@1|root,COG1203@2|Bacteria,1WIUC@1297|Deinococcus-Thermus	PFAM CRISPR-associated protein Cse1 (CRISPR_cse1)	-	-	ko:K19123	-	ko00000,ko02048	CRISPR_Cse1
962	GGN42883.1	1121377.KB906403_gene3163	7.66e-179	503.0	COG2378@1|root,COG2378@2|Bacteria,1WJ5J@1297|Deinococcus-Thermus	PFAM HTH domain	-	-	-	-	-	HTH_11,WYL
